username;date;retweets;favorites;text;geo;mentions;hashtags;id;permalink
	2014-06-16 22:32	0	0	"Surely ACA will cure this. #TheFive MT @thinkprogress US ranked LAST in health care (ind nat) http:// thkpr.gs/1qkjNZQ pic.twitter.com/IUpfx3s9IK"		@thinkprogress	#TheFive	"478666514963636224"	https://twitter.com/GuyWyer/status/478666514963636224
	2014-06-16 22:32	0	0	"Obamacare 's very good week http://www. dailykos.com/story/2014/06/ 13/1306811/-Obamacare-s-very-good-week … via @dailykos Affordable Healthcare for all is NOT a bad thing, we've been WAY behind here"		@dailykos		"478666485770903552"	https://twitter.com/linnyc2000/status/478666485770903552
	2014-06-16 22:32	0	0	"Hobby Lobby aims for Obamacare win, Christian nation via @POLITICO for iPad God bless them http:// politi.co/U1ACuY"		@POLITICO		"478666361846001664"	https://twitter.com/jeffpurcell50/status/478666361846001664
	2014-06-16 22:31	0	0	"NYT: Obamacare Could Be Paying Subsidies to Hundreds-of-Thousands Who Don't Qualify to Receive Them http:// townhall.com/t/1851987-5 via @townhallcom"		@townhallcom		"478666248155181057"	https://twitter.com/rachelfromohio/status/478666248155181057
	2014-06-16 22:31	0	1	"@Mattdemlein I love Biden. Hoping you saw the reference to his Obamacare quote. :D"		@Mattdemlein		"478666168983490560"	https://twitter.com/jodelld/status/478666168983490560
	2014-06-16 22:31	0	0	"Conoce a The Dollars. http:// wp.me/p4AL4d-4ax"				"478666132660830208"	https://twitter.com/Aca_Pasan_Cosas/status/478666132660830208
	2014-06-16 22:31	0	0	"Obamacare Anti-Conscience Mandate: Court Says Being Complicit in Sin Isn’t a Sin http:// dailysignal.com/2014/06/16/oba macare-anti-conscience-mandate-court-says-complicit-sin-isnt-sin/?utm_source=heritagefoundation&utm_medium=email&utm_content=DD140612&utm_campaign=dailydigest …"				"478666112012255233"	https://twitter.com/websquaw/status/478666112012255233
	2014-06-16 22:31	0	0	"#Election2014 #Obamacare #DEMS Don't run from it! Run with it!! We are winning the fight for America to get good affordable health care!!!"			#Election2014 #Obamacare #DEMS	"478666104655474688"	https://twitter.com/dennison337/status/478666104655474688
	2014-06-16 22:30	0	0	"#Obamacare can't and won't deliver good health & self respect http:// ow.ly/xAjV8"			#Obamacare	"478666042152337409"	https://twitter.com/KhannaOnHealth/status/478666042152337409
	2014-06-16 22:30	0	0	"Open Access @JHPPL : Wyden's #Waiver : State Innovation on Steroids #ACA #Obamacare #health http:// ow.ly/y58fX"		@JHPPL	#Waiver #ACA #Obamacare #health	"478665995398426624"	https://twitter.com/JHPPL/status/478665995398426624
	2014-06-16 22:30	0	0	"Obamacare 's very good week http://www. dailykos.com/story/2014/06/ 13/1306811/-Obamacare-s-very-good-week … via @dailykos"		@dailykos		"478665909888745472"	https://twitter.com/khcham/status/478665909888745472
	2014-06-16 22:30	0	0	""Please America wake up, while you're watching the FIFA World Cup, ObamaCare it's getting effective against MediCare""				"478665875600318464"	https://twitter.com/GNebiros/status/478665875600318464
	2014-06-16 22:30	0	0	"Sen. David Vitter Is Anti- Obamacare Subsidies, but Open to the Medicaid ... - The Wire http:// dlvr.it/61FpbD"				"478665856449122304"	https://twitter.com/TeaPartywatchs/status/478665856449122304
	2014-06-16 22:30	2	0	"NYT: Obamacare Could Be Paying Subsidies to Hundreds-of-Thousands Who Don't Qualify to Receive Them | http:// buff.ly/U3QIEF #NCPol #tcot"			#NCPol #tcot	"478665850376159232"	https://twitter.com/AFPNC/status/478665850376159232
	2014-06-16 22:30	0	0	"Joe Biden arrived late and hence missed the goal by the USA, I wonder if that will make Obamacare more unpopular"				"478665837457330177"	https://twitter.com/CocoLeCone/status/478665837457330177
	2014-06-16 22:29	0	0	"Still the same sucky situation here in dumbass red Texas...still, read about Obamacare 's very good week http://www. dailykos.com/story/2014/06/ 13/1306811/-Obamacare-s-very-good-week … via @dailykos"		@dailykos		"478665786278416384"	https://twitter.com/Cathey_Thomas/status/478665786278416384
	2014-06-16 22:29	0	0	"Meeting troops who have left part of Obamacare :"				"478665756155318275"	https://twitter.com/beckwith_ebooks/status/478665756155318275
	2014-06-16 22:29	0	0	"For the 5th time, US ranked LAST in review of industrialized nation’s health care systems http:// thkpr.gs/1qkjNZQ #Obamacare #fail"			#Obamacare #fail	"478665666212274176"	https://twitter.com/redgehomes/status/478665666212274176
	2014-06-16 22:29	0	0	"Altidore would have been better if Obama came with his " Obamacare ""				"478665598055231488"	https://twitter.com/Babs_diouf1/status/478665598055231488
	2014-06-16 22:29	0	0	"@dumblelorde same here"		@dumblelorde		"478665596599824384"	https://twitter.com/aca_sog/status/478665596599824384
	2014-06-16 22:29	1	1	"Many preventive services for women are free under the ACA - Learn more- ClearPath- Your Road Map to Health and Wealth http:// bit.ly/1o0Cgbj"				"478665590844846080"	https://twitter.com/TCHS/status/478665590844846080
	2014-06-16 22:28	1	1	"When #MomsDemand your private medical info becomes public record you know #obamacare & NSA were just the beginning #2A #NJ2AS #IndyGunSense"			#MomsDemand #obamacare #2A #NJ2AS #IndyGunSense	"478665421898670080"	https://twitter.com/kirbinster/status/478665421898670080
	2014-06-16 22:28	0	0	"GOP Sen. Says If Elected Governor, He Might Embrace Obamacare @TPM http:// talkingpointsmemo.com/livewire/vitte r-louisiana-medicaid-expansion-governor …"		@TPM		"478665405896982528"	https://twitter.com/giligetz/status/478665405896982528
	2014-06-16 22:28	0	0	"Republicans actually believe that taking away health-care aka Affordable Care Act aka Obamacare is something people want?!"				"478665352025751552"	https://twitter.com/Shirley10737630/status/478665352025751552
	2014-06-16 22:27	0	0	"@DannoCain @BarackObama *phew* i'm glad we're on the same page here #gunviolence #Obamacare"		@DannoCain @BarackObama	#gunviolence #Obamacare	"478665314511888384"	https://twitter.com/GourmetPoultry/status/478665314511888384
	2014-06-16 22:27	0	0	"IRS claims they lost 2 years of Lois Lerner's tax-exempt status emails. This is the same IRS that is responsible for enforcing #ObamaCare !"			#ObamaCare	"478665197968564224"	https://twitter.com/BobPaszko/status/478665197968564224
	2014-06-16 22:27	1	1	"GOP Sen. Says If Elected Governor, He Might Embrace Obamacare http:// ln.is/zite.to/lSkxE Someone needs to make sure Sen. Vitter is ok."				"478665085167362049"	https://twitter.com/blackorpheus251/status/478665085167362049
	2014-06-16 22:26	0	0	"Try swallowing this ObamaCare pill - Nightmares of Medicine - RETWEET http:// conservativescores.org/xao9 #conservatives #teaparty #teateams"			#conservatives #teaparty #teateams	"478665067660320768"	https://twitter.com/365Arizona/status/478665067660320768
	2014-06-16 22:26	0	0	"Thanks @BarackObama @obamacare . Member for 6 months & already looking for a rate increase. You. Are. Not. Helping. pic.twitter.com/JD7M56DDqQ"		@BarackObama @obamacare		"478665003919495169"	https://twitter.com/dubhbas/status/478665003919495169
	2014-06-16 22:26	0	0	"Rand Paul Suddenly Unsure If Obamacare Should Be Completely Repealed - Sen. Rand Paul (R-KY) has in suggesting... http:// rp16.me/1kWFJ9A"				"478664932758540288"	https://twitter.com/Rand2016/status/478664932758540288
	2014-06-16 22:26	0	0	"API's John Hill shares views on ACA & Alabama jobs with Fred @WTKITalk Tues at 7:08 am . Listen live: http://www. wtkiradio.com/listenlive.html"		@WTKITalk		"478664901699715074"	https://twitter.com/alabamapolicy/status/478664901699715074
	2014-06-16 22:26	0	0	"HHS Mandate: Only the Beginning of Obamacare ’s Conscience Problems http:// dailysign.al/1i5pJ6H"				"478664841792471040"	https://twitter.com/rachelfromohio/status/478664841792471040
	2014-06-16 22:26	0	0	"Landrieu Thinks Government Should 'Stay Out of the Doctor's Office,' Yet Pushes Obamacare http:// townhall.com/t/1852052-5 via @townhallcom"		@townhallcom		"478664840425140225"	https://twitter.com/jbmesser53/status/478664840425140225
	2014-06-16 22:25	0	0	"Obamacare 's very good week http://www. dailykos.com/story/2014/06/ 13/1306811/-Obamacare-s-very-good-week … via @dailykos TELL THIS TO THE PEOPLE WHO MAKE UP LIES ON FOX, WITH ALL OF THEIR BS."		@dailykos		"478664792685568000"	https://twitter.com/vpaulin2/status/478664792685568000
	2014-06-16 22:25	0	0	"@amyfeegarner Altidore is getting Obamacare"		@amyfeegarner		"478664736792252416"	https://twitter.com/BrittWhitmire/status/478664736792252416
	2014-06-16 22:25	0	0	"" @penthome : USA's Altidore pulls his hamstring while running for the ball. See what you get without ObamaCare . Witchcraft! Game on Ghana"lol"		@penthome		"478664720996892672"	https://twitter.com/push4ward_7/status/478664720996892672
	2014-06-16 22:25	0	1	""Scary" We already have "Dead Zones" in our FISH waters... Now [Poor] People are NEXT! Is Why NO #GOP 4 #ACA ! @IFLScience @OldManTalkinDog"		@IFLScience @OldManTalkinDog	#GOP #ACA	"478664648326385664"	https://twitter.com/Cachae7/status/478664648326385664
	2014-06-16 22:25	0	0	"Political insiders receive multi-million-dollar contract to promote ObamaCare in IL http:// goo.gl/QRT86q Corruption upon #corruption"			#corruption	"478664619003609088"	https://twitter.com/jackhauman/status/478664619003609088
	2014-06-16 22:25	0	0	"GOP senator opens the door to Obamacare http:// on.msnbc.com/1ltHO8M"				"478664598242209793"	https://twitter.com/ProudlyLiberal2/status/478664598242209793
	2014-06-16 22:25	0	0	"They've never heard of recovering data from a HDD crash?! Oh right, these are the ObamaCare idiots! (cont) http:// tl.gd/ndi9l8"				"478664574229434369"	https://twitter.com/a2zyxt/status/478664574229434369
	2014-06-16 22:24	0	0	"Altidore outta there.....dat hamstring is a serious injury"				"478664426631864320"	https://twitter.com/JERK_ACA/status/478664426631864320
	2014-06-16 22:24	0	2	"Obamacare better get Jozy back on the field by Portugal #ThanksObama"			#ThanksObama	"478664377554325505"	https://twitter.com/ztrillet/status/478664377554325505
	2014-06-16 22:23	4	3	"When #MomsDemand your private medical info becomes public record you know #obamacare & NSA were just the beginning #2A #NJ2AS #IndyGunSense"			#MomsDemand #obamacare #2A #NJ2AS #IndyGunSense	"478664248411705344"	https://twitter.com/LadyLibertyNJ/status/478664248411705344
	2014-06-16 22:23	0	0	"THANKS OBAMACARE"				"478664128429441025"	https://twitter.com/FMCervantez/status/478664128429441025
	2014-06-16 22:23	0	0	"MESS: Hundreds of Thousands to Be Questioned on Eligibility for Obamacare Subsidies http:// shar.es/PQWiN via @teapartyorg #AFFF76 #ORPUW"		@teapartyorg	#AFFF76 #ORPUW	"478664115829743617"	https://twitter.com/pjfahren/status/478664115829743617
	2014-06-16 22:22	1	0	"D.Mill & Aca going everywhere !"				"478664060527853568"	https://twitter.com/TWilliams24_/status/478664060527853568
	2014-06-16 22:22	1	0	"Of course this happens, thanks Obama. #Benghazi #Obamacare"			#Benghazi #Obamacare	"478664048582471680"	https://twitter.com/Dsto23/status/478664048582471680
	2014-06-16 22:22	0	0	"Oh, goody! Don't forget who's in charge of the IRS' Obamacare office http:// twitchy.com/2014/06/16/oh- goody-dont-forget-whos-in-charge-of-the-irs-obamacare-office/ …"				"478664041175343104"	https://twitter.com/roudebum/status/478664041175343104
	2014-06-16 22:22	0	0	"@AnnDaybreak Defund ObamaCare then dismantle the rest of the welfare state Make gov a PROTECTOR not a PROVIDER."		@AnnDaybreak		"478663996891860992"	https://twitter.com/huylerje/status/478663996891860992
	2014-06-16 22:22	0	0	"Cochrane: What to Do When ObamaCare Unravels http:// on.wsj.com/1a8A6fS #pjnet"			#pjnet	"478663961689063425"	https://twitter.com/HeleneAH/status/478663961689063425
	2014-06-16 22:22	0	0	"Woman double-billed by Medicare, Obamacare - WSMV Nashville http:// dlvr.it/61FhCG"				"478663860115611648"	https://twitter.com/InsuranceIssues/status/478663860115611648
	2014-06-16 22:21	0	0	"Who will win $250K? Top 10 Finalists AZ Innovation Challenge announced: The Arizona Commerce Authority ( ACA ) a... http:// bit.ly/1pa9zt2"				"478663791203192834"	https://twitter.com/onewayus/status/478663791203192834
	2014-06-16 22:21	0	0	"Obamacare a step in the right direction, but much more is required http:// wp.me/p14Qp-iKq"				"478663782814605312"	https://twitter.com/leisureguy/status/478663782814605312
	2014-06-16 22:21	0	0	"The Continuing Obamacare Nightmare - While President Obama diverts the nation’s attention with... http:// bit.ly/STsOKU #mainstreammedia"			#mainstreammedia	"478663769498058753"	https://twitter.com/Presstitution/status/478663769498058753
	2014-06-16 22:21	0	0	"Thousands to Be Questioned on Eligibility for Health Insurance Subsidies http:// nyti.ms/1q1Z0Yx #ACA #Mess"			#ACA #Mess	"478663623670132736"	https://twitter.com/fishbits/status/478663623670132736
	2014-06-16 22:20	0	0	"One Business Is Already Proving That #Obamacare Is Good 4 Employees http:// ow.ly/y3LTk #ACA #healthcare #Equality4All"			#Obamacare #ACA #healthcare #Equality4All	"478663361849470978"	https://twitter.com/dare2misbehave/status/478663361849470978
	2014-06-16 22:20	0	0	"Love sports? Learn to play like a pro during our Madison, Wisconsin #ACAsummer trip! Golf, tennis, weight... http:// fb.me/2Xssl2ttK"			#ACAsummer	"478663339829387265"	https://twitter.com/ACA_Summer/status/478663339829387265
	2014-06-16 22:20	0	0	"I saw an F-14 jet fly over a crying eagle. Thank you Landon Obamacare ."				"478663338541326336"	https://twitter.com/filmguitarist/status/478663338541326336
	2014-06-16 22:20	0	0	"MESS: Hundreds of Thousands to Be Questioned on Eligibility for Obamacare Subsidies http:// shar.es/PQWbI via @teapartyorg Obama's Gift"		@teapartyorg		"478663324809170944"	https://twitter.com/JeffJoh29171635/status/478663324809170944
	2014-06-16 22:20	1	0	"@CrazyChefette Defund ObamaCare then dismantle the rest of the welfare state Make gov a PROTECTOR not a PROVIDER."		@CrazyChefette		"478663306681405440"	https://twitter.com/huylerje/status/478663306681405440
	2014-06-16 22:19	0	0	"Meet Obamacare 's secret weapon in the war on exorbitant health-care costs http://www. vox.com/2014/5/17/5717 940/meet-obamacares-secret-weapon-in-the-war-on-exorbitant-health-care … via @voxdotcom"		@voxdotcom		"478663236372271105"	https://twitter.com/KristenKDinger/status/478663236372271105
	2014-06-16 22:19	0	0	"Obamacare Anti-Conscience Mandate: Court Says Being Complicit in Sin Isn’t a Sin http:// dailysign.al/1vsmhFn #PJNET #TGDN #NRA #Vet #Nobama #TCOT"			#PJNET #TGDN #NRA #Vet #Nobama #TCOT	"478663210422112256"	https://twitter.com/Ssmfarley777/status/478663210422112256
	2014-06-16 22:19	0	0	"Adverse Selection: Obamacare Exchange Enrollment Skews Much Older Than U.S. Population; Cost Increases Likely"				"478663176423493632"	https://twitter.com/JeffiGlb/status/478663176423493632
	2014-06-16 22:19	0	0	"In every state so far, more insurers are asking to participate in Obamacare | The Advisory Board Daily Briefing http://www. advisory.com/daily-briefing /blog/2014/06/insurers-jumping-in-year-2#.U59tZN5Nl1Q.twitter …"			#	"478663169322151936"	https://twitter.com/444sai/status/478663169322151936
	2014-06-16 22:19	1	0	"Insurers flocking to ObamaCare | TheHill http:// ln.is/thehill.com/po licy/h/mvfLk … via @TheHill"		@TheHill		"478663166520733696"	https://twitter.com/Jeanabella/status/478663166520733696
	2014-06-16 22:19	0	0	"Most intelligent voters, will not vote for you if your core campaign slogan is "we must stop Obamacare !""				"478663109045805056"	https://twitter.com/RBonner_/status/478663109045805056
	2014-06-16 22:18	0	0	"@scotthoying yaaaay its aca -in-freaking-credible!"		@scotthoying		"478662946705657856"	https://twitter.com/Lord_JoJo/status/478662946705657856
	2014-06-16 22:18	0	0	"Most Americans Remain Satisfied With Healthcare System - Gallup Polls at 66% high - #ACA is a big success http://www. gallup.com/poll/171680/am ericans-remain-satisfied-healthcare-system.aspx …"			#ACA	"478662941726609408"	https://twitter.com/lawrenceangbk/status/478662941726609408
	2014-06-16 22:18	0	0	"Obamacare Anti-Conscience Mandate: Court Says Being Complicit in Sin Isn’t a Sin http:// dailysign.al/1vsmhFn"				"478662918540492802"	https://twitter.com/reaganpal157/status/478662918540492802
	2014-06-16 22:18	0	0	""New York Times: Obamacare Could Be Paying Subsidies Those Who Don't Qualify to Receive Them" - Really? . . REALLY? . . Well, I'm shocked!"				"478662918347558912"	https://twitter.com/normancross/status/478662918347558912
	2014-06-16 22:18	1	1	"At the same time, the more disinformation people believe about Obamacare , the less likely they are to support it."				"478662911947051008"	https://twitter.com/KellyScaletta/status/478662911947051008
	2014-06-16 22:18	0	0	"Obamacare !"				"478662862173642752"	https://twitter.com/alixjr_/status/478662862173642752
	2014-06-16 22:17	0	0	"Activist LAWLESSNESS! Obamacare Anti-Conscience Mandate: Court Says Being Complicit in Sin Isn’t a Sin http:// dailysign.al/1vsmhFn"				"478662801091612673"	https://twitter.com/ospreylady/status/478662801091612673
	2014-06-16 22:17	0	0	"@Tom_Francois NSA, ObamaCare , Affirmative Action, Iraq SURRENDER, unlimited AMNESTY & Benghazi should SHOW you WHAT VETS ACTUALLY fought for"		@Tom_Francois		"478662798260445186"	https://twitter.com/incisivetruth/status/478662798260445186
	2014-06-16 22:17	0	0	"@RightCandidates Defund ObamaCare then dismantle the rest of the welfare state Make gov a PROTECTOR not a PROVIDER."		@RightCandidates		"478662768719970304"	https://twitter.com/huylerje/status/478662768719970304
	2014-06-16 22:17	0	0	"President Barack Obama To Address Obamacare Website Issues In The Rose Garden Monday #obamacare #glitch http:// goo.gl/q4CoqR"			#obamacare #glitch	"478662767021273088"	https://twitter.com/VirtualWorldLyn/status/478662767021273088
	2014-06-16 22:17	0	0	"@ariyadesai01 Defund ObamaCare then dismantle the rest of the welfare state Make gov a PROTECTOR not a PROVIDER."		@ariyadesai01		"478662739615694848"	https://twitter.com/huylerje/status/478662739615694848
	2014-06-16 22:17	1	4	"Interesting poll. The more people actually know about the ACA ( Obamacare ), the more likely they are to support it. … http://kaise rfamilyfoundation.files.wordpress.com/2013/01/8148.p df …"				"478662721584373760"	https://twitter.com/KellyScaletta/status/478662721584373760
	2014-06-16 22:17	0	0	"@TweepMeisterSE Defund ObamaCare then dismantle the rest of the welfare state Make gov a PROTECTOR not a PROVIDER."		@TweepMeisterSE		"478662707470544897"	https://twitter.com/huylerje/status/478662707470544897
	2014-06-16 22:17	1	0	"@MomRoadWarrior Defund ObamaCare then dismantle the rest of the welfare state Make gov a PROTECTOR not a PROVIDER."		@MomRoadWarrior		"478662682082410497"	https://twitter.com/huylerje/status/478662682082410497
	2014-06-16 22:17	0	0	"@AljazTurk Defund ObamaCare then dismantle the rest of the welfare state Make gov a PROTECTOR not a PROVIDER."		@AljazTurk		"478662655649906688"	https://twitter.com/huylerje/status/478662655649906688
	2014-06-16 22:17	0	0	"@DeniseGreen676 Defund ObamaCare then dismantle the rest of the welfare state Make gov a PROTECTOR not a PROVIDER."		@DeniseGreen676		"478662631985659905"	https://twitter.com/huylerje/status/478662631985659905
	2014-06-16 22:17	0	0	"Obamacare 's very good week http://www. dailykos.com/story/2014/06/ 13/1306811/-Obamacare-s-very-good-week … via @dailykos"		@dailykos		"478662604622012417"	https://twitter.com/Lezlie61/status/478662604622012417
	2014-06-16 22:17	0	0	"@kerry1945 Defund ObamaCare then dismantle the rest of the welfare state Make gov a PROTECTOR not a PROVIDER."		@kerry1945		"478662601862176768"	https://twitter.com/huylerje/status/478662601862176768
	2014-06-16 22:17	0	0	"Obamacare Anti-Conscience Mandate: Court Says Being Complicit in Sin Isn’t a Sin http:// dailysign.al/1vsmhFn"				"478662557582905345"	https://twitter.com/GQinNC/status/478662557582905345
	2014-06-16 22:17	0	0	"Obamacare scares: NY Times - The Obama administration is contacting hundreds of thousands of people with subsi... http:// bit.ly/1n64ptv"				"478662556756611072"	https://twitter.com/prorev/status/478662556756611072
	2014-06-16 22:16	0	0	"ITUP is hosting a series of educational trainings entitled ObamaCare 201: Essential Updates Before Open... http:// fb.me/6GN8Uaiuz"				"478662548456103936"	https://twitter.com/ITUP/status/478662548456103936
	2014-06-16 22:16	0	1	"@DavidVitter says he'd consider Medicaid Expansion. Really? After voting away millions Medicaid $ & trying to gut #ACA . Hypocrite! @LaDemos"		@DavidVitter @LaDemos	#ACA	"478662526213713920"	https://twitter.com/NegronDoc/status/478662526213713920
	2014-06-16 22:16	0	0	"Photo: One major thing the ACA got right.  h/t National Women’s Law Center http:// tmblr.co/ZLyT-r1IudM3X"				"478662457419104257"	https://twitter.com/YoungProgVoices/status/478662457419104257
	2014-06-16 22:16	0	0	"Everything's coming up aces for the ACA http:// on.msnbc.com/1xUX34E via @maddow"		@maddow		"478662337591664641"	https://twitter.com/444sai/status/478662337591664641
	2014-06-16 22:15	0	0	"Report: In Colorado, Taxpayer-Subsidized Obamacare Customers Opting For Pricier Plans http:// ift.tt/1oxOWZT #tcot #ccot #PJNET"			#tcot #ccot #PJNET	"478662295187623936"	https://twitter.com/STERLINGMHOLMES/status/478662295187623936
	2014-06-16 22:15	1	0	"@RWSurferGirl I was in the first waive of individual plan cancelations. Too expensive & quality doctors don't accept Obamacare . Nightmare!!"		@RWSurferGirl		"478662262203617280"	https://twitter.com/ConservativeGM/status/478662262203617280
	2014-06-16 22:15	0	0	"NYT: One quarter of those receiving Obamacare subsidies may not be eligible http:// michellemalkin.com/2014/06/16/nyt -one-quarter-of-those-receiving-obamacare-subsidies-may-not-actually-qualify/ …"				"478662261251125248"	https://twitter.com/vandefifer/status/478662261251125248
	2014-06-16 22:15	0	0	"Singing because I'm bored"				"478662248571744256"	https://twitter.com/Amari_ACA/status/478662248571744256
	2014-06-16 22:15	0	0	"We have no idea how much Obamacare costs | Human Events http://www. humanevents.com/2014/06/16/we- have-no-idea-how-much-obamacare-costs/ …"				"478662176387784705"	https://twitter.com/RTHTGakaRoland/status/478662176387784705
	2014-06-16 22:15	0	0	"Barack Obama and the Strategy of Manufactured Crisis http:// ht.ly/y3s1P #IllegalKids #IRS #EPA #Bergdahl #Benghazi #Obamacare #unitebleu"			#IllegalKids #IRS #EPA #Bergdahl #Benghazi #Obamacare #unitebleu	"478662125708382208"	https://twitter.com/betseyrossTGDN/status/478662125708382208
	2014-06-16 22:15	0	1	"Barack Obama and the Strategy of Manufactured Crisis http:// ht.ly/y3s1L #IllegalKids #IRS #EPA #Bergdahl #Benghazi #Obamacare #unitebleu"			#IllegalKids #IRS #EPA #Bergdahl #Benghazi #Obamacare #unitebleu	"478662125079257089"	https://twitter.com/betseyross/status/478662125079257089
	2014-06-16 22:15	0	0	"What #ACA lessons can we learn Washington's implementation process? http:// wapo.st/1p9yPQf via @washingtonpost"		@washingtonpost	#ACA	"478662117919182849"	https://twitter.com/HMPRG/status/478662117919182849
	2014-06-16 22:15	0	0	"RT @politico : Hobby Lobby aims for #Obamacare win, Christian nation http:// politi.co/U1ACuY"		@politico	#Obamacare	"478662090761461760"	https://twitter.com/CentennialCCU/status/478662090761461760
	2014-06-16 22:14	0	0	"MESS: Hundreds of Thousands to Be Questioned on Eligibility for Obamacare Subsidies http:// news1.teapartyinfo.org/HSM?a=ENX7CqkA Qd8k8SA9MKJfLGDnGHxKLJ3zzPcStGb5lw8W0bBhOG5mpqVsje_HhdDcblKB …"				"478662034968420352"	https://twitter.com/tfergie1953/status/478662034968420352
	2014-06-16 22:14	0	0	"Obamacare Credited For Big Drop In Minnesota’s Uninsured Rate http:// bit.ly/1ltN0ts"				"478662027838111744"	https://twitter.com/sagunrayamajhi/status/478662027838111744
	2014-06-16 22:14	0	0	"Obamacare 's very good week http://www. dailykos.com/story/2014/06/ 13/1306811/-Obamacare-s-very-good-week … via @dailykos"		@dailykos		"478662007596408833"	https://twitter.com/jp777rec/status/478662007596408833
	2014-06-16 22:14	0	0	"The fastest goal in the WORLD CHAMPION HISTORY - …: http:// youtu.be/jdO3dm-Fq7g . Aca te lo dejo, compadre @gusimusica . El gol de Hakan Sukur."		@gusimusica		"478661976667983873"	https://twitter.com/ticomariano/status/478661976667983873
	2014-06-16 22:14	1	0	"DEFUND ACA or DEFUND GOV. undo what you should have never done. #MakeDCListen #PJNET"			#MakeDCListen #PJNET	"478661958753730560"	https://twitter.com/CuringStupid/status/478661958753730560
	2014-06-16 22:14	0	4	"The USA Jersery sexy. #obamacare"			#obamacare	"478661944644075520"	https://twitter.com/Willothethrillo/status/478661944644075520
	2014-06-16 22:14	1	1	"Chicago Mayor Rahm E. offers #TheDonald a free Obamacare Penis Enlargement if he stops marking buildings like an impotent stud dog."			#TheDonald	"478661934284144640"	https://twitter.com/DAVIDCOMFORT/status/478661934284144640
	2014-06-16 22:14	1	0	"@dannykawzinski millions in Obamacare so that's not gonna help you. And oh yea, most Americans hate you. @divineem"		@dannykawzinski @divineem		"478661907809701888"	https://twitter.com/hoosierworld/status/478661907809701888
	2014-06-16 22:13	0	0	"Who died & coronated the Green family as savior? Hobby Lobby aims for Obamacare win, Christian nation http://www. politico.com/story/2014/06/ hobby-lobby-supreme-court-case-107877.html#.U59rgLG5ptM.twitter … via @POLITICO"		@POLITICO	#	"478661762632253441"	https://twitter.com/Barbie892/status/478661762632253441
	2014-06-16 22:13	0	0	"People talk bad about Obamacare . But I'm about to be really thankful for it because I'm about to have nothing else."				"478661757356216321"	https://twitter.com/TrevorSwear/status/478661757356216321
