username;date;retweets;favorites;text;geo;mentions;hashtags;id;permalink
	2014-01-13 23:31	0	0	"Young adults make up one-fourth of Obamacare enrollees http:// flip.it/P3kvv"				"422873486315761664"	https://twitter.com/UnanimousMusic/status/422873486315761664
	2014-01-13 23:31	0	0	"An escape hatch from ObamaCare for small business that @TheDemocrats are trying to close http:// nyp.st/1cOJpnR #ACA"		@TheDemocrats	#ACA	"422873485610741760"	https://twitter.com/TeaPartyEdu/status/422873485610741760
	2014-01-13 23:31	0	0	"#tcot US: ObamaCare Requires Taxpayers Bailout Failing Health Insurance Companies. http:// youtu.be/NbEvFFZd5Jk"			#tcot	"422873477561872385"	https://twitter.com/Thoreau_H_D/status/422873477561872385
	2014-01-13 23:31	2	1	"HOPE IT HURTS! “ @TwitchyTeam : 'This is insane': Staunch Obamacare supporter getting screwed by Anthem Blue Cross http:// bit.ly/1gBWZwU ”"		@TwitchyTeam		"422873472646520832"	https://twitter.com/SeldenGADawgs/status/422873472646520832
	2014-01-13 23:31	6	6	"A Republican who is in favor with #Obamacare pic.twitter.com/unFVDzqqFX ” @TheDemocrats @PaulBegala #UniteBlue #p2"		@TheDemocrats @PaulBegala	#Obamacare #UniteBlue #p2	"422873467155791872"	https://twitter.com/PIRATE1775/status/422873467155791872
	2014-01-13 23:31	0	0	"Congresswoman: No plan to fight Obamacare subsidies fraud, security breaches http:// bit.ly/1m3MjrS #dailycaller"			#dailycaller	"422873466011136000"	https://twitter.com/Patriot_Tribune/status/422873466011136000
	2014-01-13 23:31	0	0	"Via @Heritage : Young Adults Spurn Obamacare : Young adults just aren’t that into Obamacare .... http:// herit.ag/1iJYlXG #twisters #teaparty"		@Heritage	#twisters #teaparty	"422873461296349185"	https://twitter.com/farm_mom/status/422873461296349185
	2014-01-13 23:31	1	1	"I'm soooo anxious for ACA this weekend!"				"422873454895833088"	https://twitter.com/HBartholet/status/422873454895833088
	2014-01-13 23:31	0	0	"Obamacare Sign-Ups See December Boost http:// bit.ly/JWiZYE"				"422873454212173824"	https://twitter.com/knssradio/status/422873454212173824
	2014-01-13 23:31	0	0	"Administration lags on attracting young people to ObamaCare , stats show - Fox News http:// 757live.tk/KfObSc"				"422873448910950400"	https://twitter.com/757LiveBusiness/status/422873448910950400
	2014-01-13 23:31	0	0	"Young People Staying Away From Obamacare - Benghazi Update - Special Report 1st Segment http:// youtu.be/B09znEr7ZeQ?a"				"422873445647400960"	https://twitter.com/massteaparty/status/422873445647400960
	2014-01-13 23:30	0	0	"Millenials Not Drinking Obamacare Kool-Aid, Only 24% of Signups are Under 35 http:// b4in.info/hRqh via @BeforeItsNews"		@BeforeItsNews		"422873437200064512"	https://twitter.com/ANTI_OBAMA1/status/422873437200064512
	2014-01-13 23:30	0	0	"Spanish-language Obamacare website is written in 'Spanglish' - Washington Times: http:// wtim.es/1iKczrv via @washtimes B.O. Stinks!"		@washtimes		"422873433882365952"	https://twitter.com/Danfreeb/status/422873433882365952
	2014-01-13 23:30	0	0	"Claim that 4 Million Enrolled in Medicaid Under Obamacare is Extremely Misleading http:// wp.me/p43hnz-2oz"				"422873424818475009"	https://twitter.com/mbecker908/status/422873424818475009
	2014-01-13 23:30	0	0	"Claim that 4 Million Enrolled in Medicaid Under Obamacare is Extremely Misleading http:// wp.me/p43hnz-2oz"				"422873420590612480"	https://twitter.com/CrustyCurmudgn/status/422873420590612480
	2014-01-13 23:30	0	1	"I was all for Obamacare until my mom started making pay for my own health insurance."				"422873413254778881"	https://twitter.com/NotYourLeo1/status/422873413254778881
	2014-01-13 23:30	0	1	"DOJ, plaintiffs file arguments in #SupremeCourt #contraception case http:// ow.ly/sybQ2 @ConestogaWood #HobbyLobby #SCOTUS #ACA"		@ConestogaWood	#SupremeCourt #contraception #HobbyLobby #SCOTUS #ACA	"422873411988492288"	https://twitter.com/DailyWHPR/status/422873411988492288
	2014-01-13 23:30	1	1	"Chicago Tribune editorial: Protecting Obamacare exchange shoppers from data theft. http:// bit.ly/1iHY3AI"				"422873387724464129"	https://twitter.com/ColonelTribune/status/422873387724464129
	2014-01-13 23:30	0	0	"Out of control. ObamaCare : Older Workers Could Pay 25% Of Income http:// news.investors.com/politics-obama"				"422873372918157312"	https://twitter.com/MrBlog1/status/422873372918157312
	2014-01-13 23:30	0	0	"Dr. Ben Carson on Pelosi Refusing to Healthcare Law " Obamacare " - Neil C...: http:// youtu.be/8oMU-LP7b04 via @youtube"		@youtube		"422873358259064832"	https://twitter.com/cerrabella/status/422873358259064832
	2014-01-13 23:30	0	0	"#Oregon #Obamacare still broken after 3 months http:// buff.ly/1hjP4Fq"			#Oregon #Obamacare	"422873344791543808"	https://twitter.com/ConservateBcast/status/422873344791543808
	2014-01-13 23:30	0	0	"Reid: No ObamaCare amendments on unemployment bill | TheHill http:// thehill.com/blogs/floor-ac tion/senate/195269-reid-no-obamacare-amendments-on-unemployment-bill …"				"422873337002332160"	https://twitter.com/rodeodance/status/422873337002332160
	2014-01-13 23:30	0	0	"Affordable Care Act ( #ACA ) Information - More Information For You>> http:// budurl.com/u6wt"			#ACA	"422873319717629952"	https://twitter.com/RedDCash1/status/422873319717629952
	2014-01-13 23:30	2	0	"mT @MrBlog1 : Health care job losses for first time in decade" Wasn't #Obamacare supposed to create jobs? http:// cnnmon.ie/KaKQnh #nhpolitics"		@MrBlog1	#Obamacare #nhpolitics	"422873316282892288"	https://twitter.com/Conservativeind/status/422873316282892288
	2014-01-13 23:30	0	0	"How much incompetence is @BarackObama going to accept? Spanish-language Obamacare website is written in 'Spanglish' http:// wtim.es/1iKcfJz"		@BarackObama		"422873313350651904"	https://twitter.com/RedstateMan1/status/422873313350651904
	2014-01-13 23:30	0	0	"An ObamaCare progress report. Spoiler: it still stinks. #socialismatitsfinest http:// m.us.wsj.com/articles/SB100 01424052702304549504579318670295720710?ref=/news-opinion-commentary …"			#socialismatitsfinest	"422873303598911488"	https://twitter.com/cgraber/status/422873303598911488
	2014-01-13 23:30	0	1	"“ @SoquelCreek : TRruth behind #Obamacare 's "6 million covered" claim. Guess what? It's MISLEADING. Shocked? http:// money.cnn.com/2014/01/13/new s/economy/obamacare-coverage/ … ” HE LIES!"		@SoquelCreek	#Obamacare	"422873301845671936"	https://twitter.com/POTUS7/status/422873301845671936
	2014-01-13 23:30	3	0	"Good news: 1.8 million Americans enrolled in health coverage through the #ACA exchanges in December. #GetCovered"			#ACA #GetCovered	"422873301162000384"	https://twitter.com/RepCuellar/status/422873301162000384
	2014-01-13 23:30	0	0	"Small businesses begin to struggle under the weight of #Obamacare . http:// bit.ly/1iJu4Zb"			#Obamacare	"422873301094920192"	https://twitter.com/RepBillFlores/status/422873301094920192
	2014-01-13 23:30	0	0	"Dr. Russell Blaylock & The Obamacare Debacle http://www. createmoremiracles.com/forum/discussi on/2666/dr-russell-blaylock-the-obamacare-debacle/p1 …"				"422873289686401025"	https://twitter.com/tweetAmiracle/status/422873289686401025
	2014-01-13 23:30	0	1	"RT @meglanker : Photo: I have bronchitis. Thanks to the ACA , I was able to get medicine for $0. #ThanksObama http:// tmblr.co/ZzdTEy14DOApK"		@meglanker	#ThanksObama	"422873289422147584"	https://twitter.com/JamiaStarheart/status/422873289422147584
	2014-01-13 23:30	0	0	"Larry The Cable Guy- Takes Down OBAMACARE | CLICK through to watch! http:// fb.me/2Cc96GhdC"				"422873286754975744"	https://twitter.com/MarkHarrup1/status/422873286754975744
	2014-01-13 23:30	0	0	"Bailing Out Health Insurers and Helping Obamacare http:// shar.es/9Mx7J via @sharethis"		@sharethis		"422873263736246272"	https://twitter.com/homeless140/status/422873263736246272
	2014-01-13 23:30	0	0	"Bailing Out Health Insurers and Helping Obamacare http:// shar.es/9Mxry via @sharethis B.O. Stinks!"		@sharethis		"422873260238192640"	https://twitter.com/Danfreeb/status/422873260238192640
	2014-01-13 23:30	0	0	"The truth behind Obamacare 6 million figure http://www. youtube.com/watch?v=x8BPBg OiTkM … #YouTube #News"			#YouTube #News	"422873250461274112"	https://twitter.com/victoryplayer/status/422873250461274112
	2014-01-13 23:30	2	0	"RT @fuller_derek : President Obama must know everything about NSA, IRS, ACA , DoJ, DHS... but Christie's ignorance of acts by his "circle of …"		@fuller_derek		"422873242098229248"	https://twitter.com/justoneblackman/status/422873242098229248
	2014-01-13 23:30	2	3	"@KingIvan @michaelterry337 A conservative woman tried 2 tell me that the #ACA shldn't cover contraception bc she is going 2 adopt someday."		@KingIvan @michaelterry337	#ACA	"422873232480272384"	https://twitter.com/Spiggitzfan/status/422873232480272384
	2014-01-13 23:30	0	0	"The influx of new #patients due to the #ACA may cause #physician shortages. How can this problem be tackled? http:// bit.ly/1cU2EOI #HCLDR"			#patients #ACA #physician #HCLDR	"422873215732822016"	https://twitter.com/FalconHCA/status/422873215732822016
	2014-01-13 23:30	0	0	"House votes to manufacture Obamacare security scandal http://www. dailykos.com/story/2014/01/ 10/1268693/-House-votes-to-manufacture-Obamacare-security-scandal … via @dailykos"		@dailykos		"422873192206594048"	https://twitter.com/PWSB/status/422873192206594048
	2014-01-13 23:29	0	0	"Congress’s Obamacare Waiver would b nice 4 Liberterian's 2 start giving us a legit alternative http:// natl.re/16Z3kx0 via @NRO @CAExchange"		@NRO @CAExchange		"422873175169323008"	https://twitter.com/trent_bryson/status/422873175169323008
	2014-01-13 23:29	0	0	"Young Adults Spurn Obamacare http:// herit.ag/1cXx81z#.UtR26 XqCy4g.twitter … via @Heritage"		@Heritage	#	"422873174682767360"	https://twitter.com/Jim_Peoples_/status/422873174682767360
	2014-01-13 23:29	0	0	"Tweet of the Day: White House touts misleading low youth Obamacare sign-up numbers as a victory… http:// b4in.info/dQSX via @BeforeItsNews"		@BeforeItsNews		"422873172606586882"	https://twitter.com/ANTI_OBAMA1/status/422873172606586882
	2014-01-13 23:29	0	0	"Obama Regime To Reimburse Insurance Companies For Obamacare Losses Up To TRILLION… http:// shar.es/9MxqW"				"422873170665021440"	https://twitter.com/SeraphicSecret/status/422873170665021440
	2014-01-13 23:29	0	0	"These companies are loving the ACA ...just saw an ad for varicose veins..."your ACA provider may pay for it" ACA good for America?"				"422873160241803264"	https://twitter.com/momness1/status/422873160241803264
	2014-01-13 23:29	0	0	"Spook Central: Bailing Out Health Insurers and Helping Obamacare http:// spookcenter.blogspot.com/2014/01/bailin g-out-health-insurers-and-helping.html?spref=tw …"				"422873130936193024"	https://twitter.com/timothykendrick/status/422873130936193024
	2014-01-13 23:29	0	0	"HA! This is already turning out to be a bad week for @GOP . #Obamacare enrollment exploding&FBI isn't not charging in their fake IRS scandal."		@GOP	#Obamacare	"422873092659376129"	https://twitter.com/cfreelakers24/status/422873092659376129
	2014-01-13 23:29	0	0	"You better go get you this free obamacare if u don't got insurance. Shittttttttt"				"422873066235244545"	https://twitter.com/KeithAnthony_JR/status/422873066235244545
	2014-01-13 23:29	0	0	"Exactly! RT @GenRachel So 2.2 million sign up for obamacare .. 24% between 18-34 ..stop rationalizing #epicfail"		@GenRachel	#epicfail	"422873048409071616"	https://twitter.com/_archristiansen/status/422873048409071616
	2014-01-13 23:29	1	0	"RT @WhiteHouse : FACT: 30% of Americans who signed up for health coverage through #Obamacare marketplaces are under age 35. | #KYsen #iLsen"		@WhiteHouse	#Obamacare #KYsen #iLsen	"422873024417640449"	https://twitter.com/WillySkyKing/status/422873024417640449
	2014-01-13 23:29	0	1	"Half-full? Part empty? Or all complicated? Obamacare numbers look better, but they're still far from good http://www. bizjournals.com/sacramento/new s/news-wire/2014/01/13/obamacare-numbers-are-getting-better.html?ana=twt … via @Sacbiz"		@Sacbiz		"422873006474412033"	https://twitter.com/SFBTAntoinette/status/422873006474412033
	2014-01-13 23:29	1	0	"@breakingstlnews How many Missourians lost their coverage because of the ACA ?"		@breakingstlnews		"422873000120025088"	https://twitter.com/mgoers6/status/422873000120025088
	2014-01-13 23:29	0	4	"Great news today on the health care front: 30% of people who have signed up for #Obamacare thus far are younger than 35. #GetCovered"			#Obamacare #GetCovered	"422872999717388289"	https://twitter.com/ChristmanBowers/status/422872999717388289
	2014-01-13 23:29	0	0	"REVEALED: Top Medicare Advantage insurer knew Obamacare would cause devastation for seniors http:// dailycaller.com/2014/01/13/rev ealed-top-medicare-advantage-insurer-knew-obamacare-would-cause-devastation-for-seniors/ … via @dailycaller"		@dailycaller		"422872994378035200"	https://twitter.com/flatwalk/status/422872994378035200
	2014-01-13 23:29	0	0	"@BarackObama Hey "Truth Team", how many people have PAID for an #Obamacare / #ACA plan?"		@BarackObama	#Obamacare #ACA	"422872975717576704"	https://twitter.com/ITTRP/status/422872975717576704
	2014-01-13 23:29	0	0	"158,000 Illinoisans signed up for Obamacare in first 3 months http:// ift.tt/1hk3vJD"				"422872962065522688"	https://twitter.com/MediaTracker10/status/422872962065522688
	2014-01-13 23:29	13	5	"ICYMI: Nearly 1/4 of Americans who signed up for #Obamacare were between the ages of 18 and 24! #GetCovered #ACA pic.twitter.com/I8EZM0fyGY"			#Obamacare #GetCovered #ACA	"422872950375608320"	https://twitter.com/CollegeDems/status/422872950375608320
	2014-01-13 23:29	0	0	"22) All of which raises another question: If Obamacare is so great, why do so many people want to get out from under it?"				"422872941957619712"	https://twitter.com/nextamericanpr/status/422872941957619712
	2014-01-13 23:28	0	0	"You should not be forced to get Obamacare but if you resent being FORCED to do it, why aren't you willing to sign... http:// fb.me/1QMbDE6Y0"				"422872929421254657"	https://twitter.com/sandrabooker/status/422872929421254657
	2014-01-13 23:28	0	0	"Obamacare ’s narrow networks are going to make people furious — but they might control costs http:// wapo.st/1dqCh4S"				"422872928653701120"	https://twitter.com/diggindirt/status/422872928653701120
	2014-01-13 23:28	0	0	"HHS Says Just 24% of Obamacare Sign Ups Are Young Adults, Far Below 39% WH. Says Are Needed To Make Law Sustainable… http:// shar.es/9MwPf"				"422872918477901824"	https://twitter.com/rightwingertoo/status/422872918477901824
	2014-01-13 23:28	0	0	"Obamacare ’s Many Loopholes: Forcing Individuals and Taxpayers to Fund Elective Abortion Coverage http:// q.gs/5Nqpa"				"422872905811103744"	https://twitter.com/zobowyqumy/status/422872905811103744
	2014-01-13 23:28	0	0	"Obamacare enrollment gains traction in Florida http:// q.gs/5NqpZ"				"422872905089699841"	https://twitter.com/zobowyqumy/status/422872905089699841
	2014-01-13 23:28	0	0	"Obamacare sign-ups among young adults off to slow start http:// q.gs/5NqpX"				"422872904280190977"	https://twitter.com/zobowyqumy/status/422872904280190977
	2014-01-13 23:28	0	0	"Maine now at sixty percent of 2014 Obamacare goal http:// q.gs/5NqpU"				"422872903562977280"	https://twitter.com/zobowyqumy/status/422872903562977280
	2014-01-13 23:28	0	0	"Obamacare Young Adult Outreach Now Has Its Own Day http:// q.gs/5NqpS"				"422872901499367424"	https://twitter.com/zobowyqumy/status/422872901499367424
	2014-01-13 23:28	0	0	"Everyone wants to bailout of Obamacare except the American people because Congress won't bail them out except themselves!"				"422872899200876544"	https://twitter.com/ButchJocson/status/422872899200876544
	2014-01-13 23:28	0	0	"@TakeMe2UrLueder Well, if it makes you feel better, most of Congress doesn't know how to pay for Obamacare either."		@TakeMe2UrLueder		"422872879600898048"	https://twitter.com/Tim_Beedle/status/422872879600898048
	2014-01-13 23:28	0	0	"Even Staples:: A new policy of limiting ALL part-time workers to 25 hours a week. Thanks dems #Obamacare ACA"			#Obamacare	"422872874743918592"	https://twitter.com/MrBlog1/status/422872874743918592
	2014-01-13 23:28	0	0	"HHS reports that 498,794 Californians selected a @CoveredCA health plan through Dec 31, for coverage to start Jan 1. #ACA #HCR #Obamacare"		@CoveredCA	#ACA #HCR #Obamacare	"422872865243795456"	https://twitter.com/healthaccess/status/422872865243795456
	2014-01-13 23:28	1	0	"Check out who is buying #Obamacare , via @bloomberg http:// buff.ly/1a34pe6 pic.twitter.com/j9Pe0TbFfp"		@bloomberg	#Obamacare	"422872852032139265"	https://twitter.com/staance/status/422872852032139265
	2014-01-13 23:28	0	0	"@olsonpressshop #pjnet #noamnesty #securetheborder #nosharialaw #orpuw a vote for amnesty is a vote for obamacare . reagan regretted amnesty"		@olsonpressshop	#pjnet #noamnesty #securetheborder #nosharialaw #orpuw	"422872841302732800"	https://twitter.com/chickenman246/status/422872841302732800
	2014-01-13 23:28	0	0	"Congresswoman: No plan to fight Obamacare subsidies fraud, security breaches http:// dailycaller.com/2014/01/13/con gresswoman-no-plan-to-fight-obamacare-subsidies-fraud-security-breaches/ … via @dailycaller"		@dailycaller		"422872829869047808"	https://twitter.com/flatwalk/status/422872829869047808
	2014-01-13 23:28	2	0	"Obamacare signups in Michigan spike in December; see demographic breakdown: http:// ift.tt/1lX0XUJ"				"422872822323879936"	https://twitter.com/MLivePolitics/status/422872822323879936
	2014-01-13 23:28	2	1	"What if we had to buy coffee like we now have to buy health insurance? http://www. youtube.com/watch?v=pCb9g8 plGF8 … #ObamaCare"			#ObamaCare	"422872814774124544"	https://twitter.com/RonFutrell/status/422872814774124544
	2014-01-13 23:28	0	0	"Who's Getting Obamacare ? These Three Charts Give Some Big Clues http:// zite.to/1dL2Dtk"				"422872803763699712"	https://twitter.com/PublicityCunt/status/422872803763699712
	2014-01-13 23:28	0	0	"ACA marketplace enrollment nears 2.2 million http:// bit.ly/KWZnDK"				"422872802622861312"	https://twitter.com/EmergeMedicine/status/422872802622861312
	2014-01-13 23:28	0	0	"#ACA enrollment reaches 2.2 million http:// on.msnbc.com/1ePn7mG via @maddow"		@maddow	#ACA	"422872793621872640"	https://twitter.com/juvenjacob/status/422872793621872640
	2014-01-13 23:28	0	0	"Less Than A Third Of Enrollees In Obamacare Under Age 34: Americans signing up for health care co... http:// onforb.es/1iKbT5D @brucejapsen"		@brucejapsen		"422872779998760960"	https://twitter.com/katievukas/status/422872779998760960
	2014-01-13 23:28	0	0	"House votes to manufacture Obamacare security scandal http://www. dailykos.com/story/2014/01/ 10/1268693/-House-votes-to-manufacture-Obamacare-security-scandal … via @dailykos"		@dailykos		"422872778174246913"	https://twitter.com/loladavid2/status/422872778174246913
	2014-01-13 23:28	10	5	"#ACA is already saving lives. Just ask Don, in Texas. Fight the Negativity. #GetCovered #Obamacare #GetTalking pic.twitter.com/BaZVNz5FY5"			#ACA #GetCovered #Obamacare #GetTalking	"422872772659146752"	https://twitter.com/ACASuccessStory/status/422872772659146752
	2014-01-13 23:28	0	0	"Share One of These to Let the President Know You Haven't Forgotten http:// herit.ag/1avDbKU#.UtR1c jvU45U.twitter … #obamacare"			# #obamacare	"422872763397730306"	https://twitter.com/BigJimDanoon/status/422872763397730306
	2014-01-13 23:28	0	0	"Obamacare Isn't Attracting Enough Young, Healthy Americans http:// huff.to/1cXfNWr via @HuffPostBiz"		@HuffPostBiz		"422872741830602752"	https://twitter.com/duckmanwv/status/422872741830602752
	2014-01-13 23:28	0	0	"90 Percent of Top Hill Aides Worried About Their Benefits Under Obamacare - Heather Ginsberg http:// townhall.com/tipsheet/heath erginsberg/2014/01/13/90-percent-of-top-hill-aides-worried-about-their-benefits-under-obamacare-n1778238?utm_source=thdailypm&utm_medium=email&utm_campaign=nl_pm …"				"422872738777153536"	https://twitter.com/sokeijarhead/status/422872738777153536
	2014-01-13 23:28	0	1	"Debunking Latest Obamacare Myth: 'Insurance Company Bailout' | ThinkProgress http:// thinkprogress.org/health/2014/01 /13/3155631/debunking-obamacare-myth-insurance-company-bailout/ … @SenMarcoRubio Not everyone is #Stupid !"		@SenMarcoRubio	#Stupid	"422872728702443521"	https://twitter.com/jolie_rene/status/422872728702443521
	2014-01-13 23:28	1	1	"Only 1/4 of #Obamacare enrollees are young people, government says http:// cin.ci/1hR5acz via @bernardkuhn #dailydose"		@bernardkuhn	#Obamacare #dailydose	"422872705931567105"	https://twitter.com/Enquirer/status/422872705931567105
	2014-01-13 23:28	0	0	"Obamacare Signups Surge - 1.8M enrolled in December http:// htl.li/2CUJaM"				"422872697522368513"	https://twitter.com/Advertisingtags/status/422872697522368513
	2014-01-13 23:27	0	1	"@PaulSchlake "Health care job losses for first time in decade" Wasn't #Obamacare supposed to create jobs? http:// cnnmon.ie/KaKQnh #nhpolitics"		@PaulSchlake	#Obamacare #nhpolitics	"422872682804154369"	https://twitter.com/MrBlog1/status/422872682804154369
	2014-01-13 23:27	0	0	"Another Lie from Obama? That Falsifies the Entire Rationale of Obamacare ? Really? http:// po.st/vuKl6j via @po_st #PJNET"		@po_st	#PJNET	"422872669470486528"	https://twitter.com/vmpcott/status/422872669470486528
	2014-01-13 23:27	0	0	"Online event to promote O-Care with millenials - ObamaCare 's state-based marketplaces are partnering with an enrol... http:// ow.ly/2CUJjj"				"422872667780571136"	https://twitter.com/DrHubaEvaluator/status/422872667780571136
	2014-01-13 23:27	0	0	". @krauthammer said ACA has a hidden bailout. There's some merit but lots of differences with the bailouts we've seen http:// bit.ly/1fsM7ot"		@krauthammer		"422872655360839680"	https://twitter.com/JonZGreenberg/status/422872655360839680
	2014-01-13 23:27	0	0	"Obamacare Signups Surge - 1.8M enrolled in December http:// ow.ly/2CUJpZ"				"422872651393417216"	https://twitter.com/ijokomo/status/422872651393417216
	2014-01-13 23:27	0	0	"#BestoftheWebToday All Your Health Are Belong to Us: An #ObamaCare progress report. Well, a report, by @jamestaranto http:// on.wsj.com/1eDWlzy"		@jamestaranto	#BestoftheWebToday #ObamaCare	"422872650256359424"	https://twitter.com/KarenSibertMD/status/422872650256359424
	2014-01-13 23:27	0	0	"@BarackObama TPP WILL DESTROY OBAMACARE , SS/MEDICARE, MILLIONS OF LIVES, MILLIONS OF JOBS! NOTHING TO BRAG ABOUT MR OBAMA!"		@BarackObama		"422872646515056640"	https://twitter.com/GOPonziconz/status/422872646515056640
	2014-01-13 23:27	2	0	"Help! I can't use my #Obamacare benefits http:// cnnmon.ie/1dfNaoA via @CNNMoney"		@CNNMoney	#Obamacare	"422872625589665792"	https://twitter.com/BigJimDanoon/status/422872625589665792
	2014-01-13 23:27	0	0	"Obamacare Sign-Ups See December Boost, but Youth Sign-Ups Lag http:// htl.li/2CUJxN"				"422872619982262273"	https://twitter.com/2012ElectionDay/status/422872619982262273
	2014-01-13 23:27	0	0	"@kikobrown A lady friend was paying $600+ before ACA , but this past summer Ins Co. reduced her rate to $364 w/ more coverage. @righteyeguy"		@kikobrown @righteyeguy		"422872594266603520"	https://twitter.com/Beechbum/status/422872594266603520
	2014-01-13 23:27	0	0	"Young Adults Spurn Obamacare - Young adults just aren’t that into Obamacare . Only 24 percent of enrollees i... http:// ht.ly/2CUJFw"				"422872592610246656"	https://twitter.com/bitslaw/status/422872592610246656
	2014-01-13 23:27	1	0	"Uh oh: Just 24% of ObamaCare sign-ups so far are young adults http:// ht.ly/2CUJFx"				"422872592476045312"	https://twitter.com/bitslaw/status/422872592476045312
	2014-01-13 23:27	0	0	"Sen. Barbara Mikulski, D-Md. says proposed spending bill contains no provisions that would block Obamacare ; bil... http:// ift.tt/1azn67f"				"422872591754625024"	https://twitter.com/antiinertia/status/422872591754625024
	2014-01-13 23:27	0	0	"Obamacare To Be Hot Topic As Midterm Elections Near - Source: http://www. huffingtonpost.com - Monday, January 13, 2014 Jo... http:// ow.ly/2CUJGR"				"422872588613083138"	https://twitter.com/SmileAlways143/status/422872588613083138
	2014-01-13 23:27	0	0	"Check out this video from @FoxNews . Should Congress take an ObamaCare bailout off the table?: http:// fxn.ws/1lW8i6U"		@FoxNews		"422872587035623424"	https://twitter.com/davidjones720/status/422872587035623424
	2014-01-13 23:27	0	0	"The truth behind Obamacare 6 million figure http:// cnnmon.ie/KV9ysA via @CNNMoney"		@CNNMoney		"422872585865404416"	https://twitter.com/FunFoodsyt/status/422872585865404416
	2014-01-13 23:27	0	0	"What The Self Employed Don�t Know About Obamacare Subsidies http:// buswk.co/10xwH4A"				"422872583902887936"	https://twitter.com/CoopCapitalists/status/422872583902887936
	2014-01-13 23:27	0	0	"Youth participation low in early Obamacare enrollment - By David Morgan WASHINGTON (Reuters) - The new private hea... http:// ow.ly/2CUJKe"				"422872581528903680"	https://twitter.com/thenews_/status/422872581528903680
	2014-01-13 23:27	0	0	"Youth participation low in early Obamacare enrollment - By David Morgan WASHINGTON (Reuters) - The new private hea... http:// ow.ly/2CUJKj"				"422872581268856832"	https://twitter.com/politastic/status/422872581268856832
	2014-01-13 23:27	0	0	"Obamacare Is A Self Incrimination Surveillance Program - http://www. createmoremiracles.com/forum/discussi on/2665/obamacare-is-a-self-incrimination-surveillance-program/p1 …"				"422872564445093888"	https://twitter.com/tweetAmiracle/status/422872564445093888
	2014-01-13 23:27	0	0	"“ @BarackObama : Big #Obamacare news: pic.twitter.com/8kAKzRZAdo ”"		@BarackObama	#Obamacare	"422872524268261376"	https://twitter.com/danieltaito/status/422872524268261376
