username;date;retweets;favorites;text;geo;mentions;hashtags;id;permalink
	2014-01-13 23:43	0	0	"Every Democrat Voted to Bailout Insurance Companies Under ObamaCare : Zero Republicans Voted for ObamaCare Bailout http://www. maggiesnotebook.com/2014/01/every- democrat-voted-to-bailout-insurance-companies-under-obamacare-zero-republicans-voted-for-obamacare-bailout/ …"				"422876688670662656"	https://twitter.com/retiredfirecapt/status/422876688670662656
	2014-01-13 23:43	0	0	"#Obamacare "death spiral"--will it also be a song? A dance? Video? #tcot"			#Obamacare #tcot	"422876676675371008"	https://twitter.com/nooil4pacifists/status/422876676675371008
	2014-01-13 23:43	0	0	"ICYMI, here's the article @GLawNPRI is discussing live on air with @KevinWallKXNT right now: http://www. npri.org/issues/publica tion/aca-unlikely-to-reduce-emergency-care … #Obamacare"		@GLawNPRI @KevinWallKXNT	#Obamacare	"422876674670075904"	https://twitter.com/NevadaPolicyRI/status/422876674670075904
	2014-01-13 23:43	0	0	"The insurance company must protect us regardless of pre causes. the pay back, a fine if we don't have insurance #Obamacare reasonable"			#Obamacare	"422876672384184320"	https://twitter.com/PRINCEGUZIGAR/status/422876672384184320
	2014-01-13 23:43	1	0	"Yikes! White House Says 79% of New Obamacare Enrollees Are Getting Subsidies To Buy Coverage… http:// bit.ly/1d1Trje via @weaselzippers"		@weaselzippers		"422876666294460416"	https://twitter.com/ophidianpilot/status/422876666294460416
	2014-01-13 23:43	0	0	"Debunking The Latest Obamacare Myth: The���Insurance Company Bailout��� http:// thinkprogress.org/health/2014/01 /13/3155631/debunking-obamacare-myth-insurance-company-bailout/ …"				"422876658605883392"	https://twitter.com/paijwar/status/422876658605883392
	2014-01-13 23:43	0	0	"@WhiteHouse We all know that Obamacare is a life changer, the real question is what kind of change is it-good or bad."		@WhiteHouse		"422876642600837120"	https://twitter.com/KenDerow/status/422876642600837120
	2014-01-13 23:43	0	0	"Who's Buying Obamacare , in Three Charts: More than 2.1 million people have signed up for private insurance thr... http:// buswk.co/1gBKDES"				"422876627438034944"	https://twitter.com/PayrollJedi/status/422876627438034944
	2014-01-13 23:43	0	0	"Boom! Some news - Who's Buying Obamacare , in Three Charts http:// j.mp/1iKfKzt"				"422876623973531648"	https://twitter.com/tyamdm/status/422876623973531648
	2014-01-13 23:43	0	0	"Who's Buying Obamacare , in Three Charts http:// buswk.co/1iKfIHV"				"422876622291619840"	https://twitter.com/swishbusiness/status/422876622291619840
	2014-01-13 23:43	0	1	"@ThanksObamacare They need to teach those 3 #Millennials about the benefits of the A word (anal). #obamacare"		@ThanksObamacare	#Millennials #obamacare	"422876614125694976"	https://twitter.com/RandomDCguy/status/422876614125694976
	2014-01-13 23:43	4	1	"#Obamacare doesn't work in any language http:// abcn.ws/1m3dMdr #BrokenPromises"			#Obamacare #BrokenPromises	"422876612493733888"	https://twitter.com/SenatorWicker/status/422876612493733888
	2014-01-13 23:43	0	0	"@StarCoreOne02 @SenTedCruz We in #Minnesota call #ObamaCare a #ShitSandwich ( #MNsure #ACA )"		@StarCoreOne02 @SenTedCruz	#Minnesota #ObamaCare #ShitSandwich #MNsure #ACA	"422876591853551616"	https://twitter.com/KandiRider/status/422876591853551616
	2014-01-13 23:43	0	0	"Who's Buying #Obamacare , in Three Charts http:// ht.ly/sygFF #healthcare #business #smallbusiness"			#Obamacare #healthcare #business #smallbusiness	"422876591283511297"	https://twitter.com/helpbusinesses/status/422876591283511297
	2014-01-13 23:43	0	0	"Youth participation low in early Obamacare enrollment http:// ift.tt/1aiBGiR"				"422876580537724928"	https://twitter.com/bmw_free/status/422876580537724928
	2014-01-13 23:43	0	0	"Bailing Out Health Insurers and Helping Obamacare http:// fb.me/6zCtEhctX"				"422876574514700288"	https://twitter.com/albany46/status/422876574514700288
	2014-01-13 23:43	1	0	"@DylanSheridan13 @SkySportsNews just hearing the pre game handshake between ACA and Dromin has been canceled for Gk Dylan Sheridans safety!"		@DylanSheridan13 @SkySportsNews		"422876560056926208"	https://twitter.com/BinghamStephen/status/422876560056926208
	2014-01-13 23:43	0	0	"UPDATE 2-Youth participation low in early Obamacare enrollment - Reuters: Economic TimesUPDATE 2-Youth partici... http:// bit.ly/1gC8kNq"				"422876559628709888"	https://twitter.com/bizwal/status/422876559628709888
	2014-01-13 23:43	0	0	"Girls hoops @CIFSS ratings 4A 15. Loma Linda; 5AA 5 Aquinas; 5AA 11 ACA ; D6: 1. Hesperia Christian, 16 Upland Christian"		@CIFSS		"422876559507079169"	https://twitter.com/LouBrewsterSpts/status/422876559507079169
	2014-01-13 23:43	0	0	"Yet @Crossfire is seriously going to talk about "Obama's Hillary problem"??? How about the new ACA numbers? #Crossfire"		@Crossfire	#Crossfire	"422876548115361792"	https://twitter.com/mike_S_will/status/422876548115361792
	2014-01-13 23:43	0	0	"Healthcare 2014 VITRINE: ObamaCare : Quality Coverage or No? http:// lenaizvitrine.blogspot.com/2014/01/obamac are-quality-coverage-or-no.html?spref=tw …"				"422876525029883904"	https://twitter.com/says_lena/status/422876525029883904
	2014-01-13 23:43	0	0	"@CSteven Just make ACA better 4 America Open the options up 4 everyone. http:// davideplante.com the man with the most options is the happiest"		@CSteven		"422876518285471744"	https://twitter.com/davideplante/status/422876518285471744
	2014-01-13 23:43	0	0	"The Rise Of The Anti- Obamacare Rebellion? - The Ulsterman Report http:// theulstermanreport.com/2014/01/13/the -rise-of-the-anti-obamacare-rebellion/ …"				"422876518058967040"	https://twitter.com/temi227/status/422876518058967040
	2014-01-13 23:43	0	0	"Bailing Out Health Insurers and Helping Obamacare http:// shar.es/9MkcK via @sharethis"		@sharethis		"422876514091167744"	https://twitter.com/albany46/status/422876514091167744
	2014-01-13 23:43	0	0	"Liberalism: making your life worse in order to not make any difference since #Obamacare was proclaimed law: http:// thehill.com/blogs/healthwa tch/health-reform-implementation/195131-gallup-obamacare-approval-declines …"			#Obamacare	"422876497557192704"	https://twitter.com/DrollNDry/status/422876497557192704
	2014-01-13 23:43	0	0	"Obamacare Bailout Planned for Insurance Companies | Conservative ByteConservative Byte http:// conservativebyte.com/2014/01/obamac are-bailout-planned-insurance-companies/ …"				"422876495262928896"	https://twitter.com/sokeijarhead/status/422876495262928896
	2014-01-13 23:43	4	2	"Things are heating up on @CNN @Crossfire Ben and @SenJohnBarrasso are talking #ACA , #UI the #economy and more. Tune in now"		@CNN @Crossfire @SenJohnBarrasso	#ACA #UI #economy	"422876468717170688"	https://twitter.com/SenatorCardin/status/422876468717170688
	2014-01-13 23:42	0	0	"#CNN #NEWS ! #Vikings Stadium BONDS on HOLD #NFL #aca UNCONSTITUTIONAL! http:// goo.gl/XSuUjA #teaparty #obama #whitehouse #mnleg #snowden"			#CNN #NEWS #Vikings #NFL #aca #teaparty #obama #whitehouse #mnleg #snowden	"422876448387391488"	https://twitter.com/WatchPickWin/status/422876448387391488
	2014-01-13 23:42	0	0	"Follow-up on Taxpayer Bailout of ObamaCare Insurers: Without Bailout Single Payer is Birthed http:// fb.me/2fPqCw4ae"				"422876431547252736"	https://twitter.com/cgbrocksmith/status/422876431547252736
	2014-01-13 23:42	6	1	"Washington Post: Obamacare 's Limits on Doctors Will 'Make People Furious' http:// bit.ly/KX2ifL"				"422876412698046464"	https://twitter.com/BigJournalism/status/422876412698046464
	2014-01-13 23:42	0	0	"Administration fires Obamacare website contractor http:// dailycaller.com/2014/01/10/adm inistration-fires-obamacare-website-contractor/ … via @dailycaller"		@dailycaller		"422876406201081856"	https://twitter.com/baldit/status/422876406201081856
	2014-01-13 23:42	0	0	"@robertjohn810 to HillaryCare was the ACA , aka ObamaCare ...the ACA IS the compromise. Liberals want single-payer, and Obama...(cont)"		@robertjohn810		"422876398655533056"	https://twitter.com/CultureHitMan/status/422876398655533056
	2014-01-13 23:42	0	0	"@OFA_TN #Obamacare : an archived, visionary delivery: that rolls on! With "Global knock-on effects that support the quality of life!""		@OFA_TN	#Obamacare	"422876367873933312"	https://twitter.com/Ajidsok/status/422876367873933312
	2014-01-13 23:42	1	0	"Businesses Threatened By Raft Of New ObamaCare Taxes http:// news.investors.com/ibd-editorials -viewpoint/011314-686156-businesses-face-new-obamacare-taxes-as-2014-begins.htm … #IBDEditorials via @IBDinvestors"		@IBDinvestors	#IBDEditorials	"422876357903650816"	https://twitter.com/rightwingertoo/status/422876357903650816
	2014-01-13 23:42	0	0	"@Soldierjohn don't follow me... this RN loves Obama, #aca women's right to choose higher taxes on rich and most of all ~ GUN/AMMO LAWS"		@Soldierjohn	#aca	"422876344423550976"	https://twitter.com/glasscity08/status/422876344423550976
	2014-01-13 23:42	0	1	"REVEALED: No Obamacare plan to fight fraud, security breaches (via @DailyCaller ) #DCapp http:// dailycaller.com/2014/01/13/con gresswoman-no-plan-to-fight-obamacare-subsidies-fraud-security-breaches/ …"		@DailyCaller	#DCapp	"422876340011147264"	https://twitter.com/Kimbagirl4u/status/422876340011147264
	2014-01-13 23:42	0	0	"Obamacare enrollments spike in Iowa, Illinois http:// bit.ly/KX1A2g"				"422876313347559424"	https://twitter.com/QCThealth/status/422876313347559424
	2014-01-13 23:42	0	0	"@laliespos hey rubia sos TT aca en Brasil con : Watch A Bailar On Youtube ! @LaliMusica pic.twitter.com/dyUIMudtSE"		@laliespos @LaliMusica		"422876299405692928"	https://twitter.com/johnsonftolsen/status/422876299405692928
	2014-01-13 23:42	0	0	"@itsme_austin for sure, when can we do this?!"		@itsme_austin		"422876291205853186"	https://twitter.com/aca_ollie/status/422876291205853186
	2014-01-13 23:42	0	0	"CBS: ObamaCare Hiking Costs For Employers, Forcing Them To Drop Coverage...: http:// youtu.be/BQjvbCo13vE"				"422876281529569281"	https://twitter.com/MrBlog1/status/422876281529569281
	2014-01-13 23:42	0	0	"What a day of news! New official ACA sign-up figures from Dec. released, Christie's administration imploding, Iran nuclear deal, and more."				"422876279105273856"	https://twitter.com/mike_S_will/status/422876279105273856
	2014-01-13 23:42	2	0	".00700% of Americans signed up for #Obamacare . Is my math off?"			#Obamacare	"422876252664381440"	https://twitter.com/jerrygabra/status/422876252664381440
	2014-01-13 23:42	0	0	"Obamacare And The Battle On Individual Liberty http:// bit.ly/1ePv9ff"				"422876224818774016"	https://twitter.com/VoteNoCon/status/422876224818774016
	2014-01-13 23:42	0	0	"Update x3: ACA Signups: HHS releases report: CURRENT total at least 2.34M! http://www. dailykos.com/story/2014/01/ 13/1269402/-ACA-Signups-HHS-releases-official-Dec-ACA-Report-thru-12-28 … via @dailykos"		@dailykos		"422876220838014976"	https://twitter.com/BarbaraWright7/status/422876220838014976
	2014-01-13 23:41	0	1	"“ @ChuckNellis : Big Brother is a big pain. #NSA #IRS #Obamacare #EPA #ETCETC ” we are getting close to living out George Orwell's 1984. Scary."		@ChuckNellis	#NSA #IRS #Obamacare #EPA #ETCETC	"422876206233436161"	https://twitter.com/Treynolds903/status/422876206233436161
	2014-01-13 23:41	0	0	"This is horrible news for Obamacare . Only way this system is economically viable is if people 20s and 30s sign up http:// in.reuters.com/article/2014/0 1/13/usa-healthcare-idINL2N0KN18G20140113 …"				"422876203565862912"	https://twitter.com/JosephHorner/status/422876203565862912
	2014-01-13 23:41	1	0	"Rep. John Carter: Boehner Pushing Amnesty Distracts from Obamacare http://www. breitbart.com/Big-Government /2014/01/13/Key-House-Republican-Boehner-pushing-amnesty-distracts-from-Obamacare … #wiunion"			#wiunion	"422876201779085312"	https://twitter.com/AIIAmericanGirI/status/422876201779085312
	2014-01-13 23:41	0	0	"Walmart Introduces '666 Obamacare RFID Chip Machine': http:// youtu.be/rlazQYHodX0 via @youtube #RedNationRising"		@youtube	#RedNationRising	"422876198339756032"	https://twitter.com/DocKozlowski/status/422876198339756032
	2014-01-13 23:41	0	0	"Obamacare enrollment gains traction in Florida http:// adf.ly/c4QZl"				"422876198213914624"	https://twitter.com/ubygysoroj/status/422876198213914624
	2014-01-13 23:41	1	0	"Only a quarter of #Obamacare enrollees are young people, U.S. says #ACAfacts http:// cincinnati.com/blogs/dailydos e/2014/01/13/only-a-quarter-of-obamacare-enrollees-are-young-people-u-s-says/ … via @Enquirer"		@Enquirer	#Obamacare #ACAfacts	"422876195709927424"	https://twitter.com/mwert/status/422876195709927424
	2014-01-13 23:41	0	0	"There aren't enough young people signing up for ObamaCare in order for them to subsidize all the old, sickly ones (I wonder why)."				"422876178400428032"	https://twitter.com/noratheexpIorer/status/422876178400428032
	2014-01-13 23:41	0	1	"MUST SEE: The "Arch Nemesis of ObamaCare " CRUSHES #ObamaCare in 17 seconds: http:// youtu.be/E9IwV9r3hwE #MakeDCListen"			#ObamaCare #MakeDCListen	"422876175006830593"	https://twitter.com/MiltonWolfMD/status/422876175006830593
	2014-01-13 23:41	0	0	"Get Ready for the Obamacare Bailout of Insurance Corporations: Kurt Nimmo | Taxpayers will pay 78 percent of a... http:// bit.ly/1gC86WL"				"422876171718512640"	https://twitter.com/njslea/status/422876171718512640
	2014-01-13 23:41	0	0	"Obama Regime To Reimburse Insurance Companies For Obamacare Losses Up To TRILLION… http:// shar.es/9MkXL via @sharethis"		@sharethis		"422876169952702465"	https://twitter.com/4chunat1/status/422876169952702465
	2014-01-13 23:41	0	0	"The Grey Lady tries to spin horrid #Obamacare demo data to make HHS look grand http:// buff.ly/1ak9hWB"			#Obamacare	"422876146838286336"	https://twitter.com/rrothfeldt/status/422876146838286336
	2014-01-13 23:41	0	0	"#Americans Obamacare Isn't Attracting Enough Young, Healthy Americans http:// q.gs/5NpHP"			#Americans	"422876087060688896"	https://twitter.com/pudyvetu/status/422876087060688896
	2014-01-13 23:41	0	0	"Tenet CEO on profiting from Obamacare http:// fb.me/38QWh8oJD"				"422876082816417792"	https://twitter.com/RGorlick/status/422876082816417792
	2014-01-13 23:41	0	0	"Obamacare Isn't Attracting Enough Young, Healthy Americans http:// adf.ly/c4Gl9"				"422876082627301378"	https://twitter.com/ubygysoroj/status/422876082627301378
	2014-01-13 23:41	0	0	"GOP rep still quoting widely debunked "but Obamacare will transfer $700 billion out of the system" myth."				"422876064512094208"	https://twitter.com/bevymart/status/422876064512094208
	2014-01-13 23:41	0	1	"@PIRATE1775 @TheDemocrats @PaulBegala Not enough Shrinks in the Country willing to accept Obamacare insurance to help all those Idiots!"		@PIRATE1775 @TheDemocrats @PaulBegala		"422876045331537920"	https://twitter.com/uppitynap/status/422876045331537920
	2014-01-13 23:41	1	1	"“I'm working to repeal & replace [ Obamacare ]. Until that time comes, I want to make sure (website) works http:// tinyurl.com/oqp3gsq #BROWSEAct"			#BROWSEAct	"422876044631105536"	https://twitter.com/RepSeanDuffy/status/422876044631105536
	2014-01-13 23:41	0	0	"@ThanksObamacare @sarahkliff #PlanB cupcakes or the guy wearing army boots are cheaper alternatives #obamacare"		@ThanksObamacare @sarahkliff	#PlanB #obamacare	"422876038109331456"	https://twitter.com/RandomDCguy/status/422876038109331456
	2014-01-13 23:41	0	0	"We need single payer ala civilized countries. That being said, Obamacare lies on corporate media exposed| http://www. dailykos.com/story/2014/01/ 12/1269110/-This-blogger-smoked-out-Obamacare-lies-by-another-traditional-media-newspaper … via @dailykos"		@dailykos		"422876023667974145"	https://twitter.com/scarletjinn/status/422876023667974145
	2014-01-13 23:41	0	0	"House votes to manufacture Obamacare security scandal http://www. dailykos.com/story/2014/01/ 10/1268693/-House-votes-to-manufacture-Obamacare-security-scandal … via @dailykos"		@dailykos		"422876015329697792"	https://twitter.com/JaneQFactor/status/422876015329697792
	2014-01-13 23:41	0	0	"Obamacare Signups Surge http:// dlvr.it/4hjhDY"				"422875999622017024"	https://twitter.com/1ucasriver/status/422875999622017024
	2014-01-13 23:41	0	0	"RT @NolteNC : USA Today Blasts ObamaCare 's War Against Little Sisters of the Poor http:// shar.es/9MpV4 via @BreitbartNews"		@NolteNC @BreitbartNews		"422875979376099328"	https://twitter.com/AsHarshAsTruth/status/422875979376099328
	2014-01-13 23:41	1	0	"In 2013, insurance paid out close to $500,000 in medical claims & prescriptions,as usual #Obamacare more than doubled our OOP costs"			#Obamacare	"422875975286677504"	https://twitter.com/PattieCurran/status/422875975286677504
	2014-01-13 23:41	0	0	"Administration lags on attracting young people to ObamaCare , stats show - Fox News http:// news.google.com/news/url?sa=t& fd=R&usg=AFQjCNGNd-W7u98rcJ81PT7bm_pslRPcpg&url=http://www.foxnews.com/politics/2014/01/13/numbers-key-obamacare-demographic-group-come-in-well-below-estimates/ …"				"422875973127012352"	https://twitter.com/Pipsheet/status/422875973127012352
	2014-01-13 23:41	0	0	"Obamacare ’s narrow networks are going to make people furious — but they might control costs http:// wapo.st/1ahJvVX"				"422875960816328704"	https://twitter.com/Rxbun/status/422875960816328704
	2014-01-13 23:40	0	0	"Baraso, come speak with me about how HC in America was a train wreck before #ACA I almost died due to it #crossfire"			#ACA #crossfire	"422875955250466816"	https://twitter.com/GeeOhPees2/status/422875955250466816
	2014-01-13 23:40	0	0	"Washington Post: Obamacare 's Limits on Doctors Will 'Make People Furious': Washington Post health care reporte... http:// bit.ly/1dkBuAZ"				"422875936946548736"	https://twitter.com/Yunito_Papi/status/422875936946548736
	2014-01-13 23:40	0	0	"Sen. Thad Cochran: We should go back to the drawing board on Obamacare | Washington Examiner Video - http:// m.washingtonexaminer.com/sen-thad-cochr an-we-should-go-back-to-drawing-board-on-obamacare/video/bc-3044787969001?utm_source=Washington%20Examiner:%20Politics%20Today%20Reoccurring%20-%2001/13/2014&utm_medium=email&utm_campaign=Washington%20Examiner:%20Politics%20Today …"				"422875931300999168"	https://twitter.com/grampa194235/status/422875931300999168
	2014-01-13 23:40	1	0	"Washington Post: Obamacare 's Limits on Doctors Will 'Make People Furious' http:// tinyurl.com/k7zl2mq #news"			#news	"422875920844595201"	https://twitter.com/dailyrapid/status/422875920844595201
	2014-01-13 23:40	0	0	"Check out this article from @FOXNews . OBAMACARE LAGGING White House behind on getting under-34s to sign up: http:// fxn.ws/1ajVaQZ"		@FOXNews		"422875909620629504"	https://twitter.com/meces29/status/422875909620629504
	2014-01-13 23:40	2	0	"Washington Post: Obamacare 's Limits on Doctors Will 'Make People Furious' http:// bit.ly/1dkBqRO @breitbartnews"		@breitbartnews		"422875909104746496"	https://twitter.com/Ramtoad/status/422875909104746496
	2014-01-13 23:40	1	0	"NewsBusters: WSJ, NYTimes, USA Today All Note ObamaCare Signups Mostly Older, Sicker; WashPost Hypes 23% Who A... http:// bit.ly/1iKeGvH"				"422875908601442304"	https://twitter.com/EJM421/status/422875908601442304
	2014-01-13 23:40	0	0	"Quarter of Obamacare sign-ups are young adults, short of target http:// washex.am/1kyiEvM#.UtR5Z 1hNeeI.twitter … via @DCExaminer"		@DCExaminer	#	"422875907645128704"	https://twitter.com/donidoll/status/422875907645128704
	2014-01-13 23:40	0	1	"Obamacare : Democrats' Stealth Weapon in the Poverty Debate: http://www. thepeoplesview.net/2014/01/obamac are-democrats-stealth-weapon-in.html#.UtR5V3dA_eI.twitter … #pleaseproceed , @GOP"		@GOP	# #pleaseproceed	"422875906697199616"	https://twitter.com/thepeoplesview/status/422875906697199616
	2014-01-13 23:40	0	0	"Youth participation low in early Obamacare enrollment http:// reut.rs/1iJr3b9 via @reuters"		@reuters		"422875906252611584"	https://twitter.com/DebtFreeBuddy/status/422875906252611584
	2014-01-13 23:40	0	0	"WSJ, NYTimes, USA Today All Note ObamaCare Signups Mostly Older, Sicker; WashPost Hypes 23% Who Are 18-34: ... http:// bit.ly/1iKeGvH"				"422875905719951362"	https://twitter.com/Lora_tx_Reynold/status/422875905719951362
	2014-01-13 23:40	0	0	"NewsBusters- WSJ, NYTimes, USA Today All Note ObamaCare Signups Mostly Older, Sicker; WashPost Hypes 23% Who A... http:// bit.ly/1iKeGvH"				"422875903446638593"	https://twitter.com/BreakingNewz/status/422875903446638593
	2014-01-13 23:40	0	0	"#tcot WSJ, NYTimes, USA Today All Note ObamaCare Signups Mostly Older, Sicker; WashPost Hy... http:// bit.ly/1iKeGvH #teaparty #sgp #gop"			#tcot #teaparty #sgp #gop	"422875901647282176"	https://twitter.com/Mr_Lexington/status/422875901647282176
	2014-01-13 23:40	1	0	"WSJ, NYTimes, USA Today All Note ObamaCare Signups Mostly Older, Sicker; WashPost Hypes 23% Who Are 18-34: ... http:// bit.ly/1iKf2Cv"				"422875900175077376"	https://twitter.com/Erudite_Enigma/status/422875900175077376
	2014-01-13 23:40	0	0	"WSJ, NYTimes, USA Today All Note ObamaCare Signups Mostly Older, Sicker; WashPost Hypes 23% Who Are 18-34 http:// bit.ly/1iKf2Cv #tcot"			#tcot	"422875899466248192"	https://twitter.com/SavageNews/status/422875899466248192
	2014-01-13 23:40	0	1	"Typical Post Obama cheerleading: WashPost Hypes 23% of #obamacare enrollees aged 18-34 | http:// ow.ly/sygdh"			#obamacare	"422875858513432576"	https://twitter.com/KenShepherd/status/422875858513432576
	2014-01-13 23:40	0	0	"Washington Post: Obamacare 's Limits on Doctors Will 'Make People Furious': Washington Post health care reporte... http:// bit.ly/1dkBqRO"				"422875844210470912"	https://twitter.com/WHScandal/status/422875844210470912
	2014-01-13 23:40	0	0	"Obamacare 's Insurance Cancellations: A Feature, Not a Bug http:// ow.ly/qzlxL #ACA"			#ACA	"422875844004954112"	https://twitter.com/TeaPartyEdu/status/422875844004954112
	2014-01-13 23:40	0	0	"Vote Republican to gain control of the Senate. Vote Obamacare out & send a message to Pres. Obama to get out of businesses way. Think smart"				"422875825323536384"	https://twitter.com/SteKat711/status/422875825323536384
	2014-01-13 23:40	0	0	"So 58 Million hurt by #ACA , and 2.2 million helped....was that the campaign promise?"			#ACA	"422875782600343552"	https://twitter.com/MegfromCT/status/422875782600343552
	2014-01-13 23:40	0	0	"Obamacare tax guide for individuals"				"422875758139572224"	https://twitter.com/orgad_gimblet/status/422875758139572224
	2014-01-13 23:40	0	0	"Love this girl Julie HHS ObamaCare Video Contest Submission: http:// youtu.be/vbC8tkF-Guw via @youtube"		@youtube		"422875746269290496"	https://twitter.com/PaulGouldUSA/status/422875746269290496
	2014-01-13 23:40	0	0	"Federal Government Runs December Surplus of $53.2 Billion http://www. moneynews.com/StreetTalk/bud get-deficit-spending-taxes/2014/01/13/id/546813#ixzz2qKCwnEMT … Urgent: Should Obamacare Be Repealed? Vote Here Now!"			#ixzz2qKCwnEMT	"422875732692324352"	https://twitter.com/SimonMahan/status/422875732692324352
	2014-01-13 23:40	1	1	"ACA is going to be a battle to the death this weekend! WHOO!"				"422875722542096384"	https://twitter.com/TisSarahBarah/status/422875722542096384
	2014-01-13 23:40	11	6	"Unlike @BarackObama promised, Obamacare = not more choice, not more competition pic.twitter.com/72ZUUnZ3HX via @heritage"		@BarackObama @heritage		"422875709665583104"	https://twitter.com/timwcornelius/status/422875709665583104
	2014-01-13 23:39	1	0	"Yeah, this Christie scandal is really about Benghazi, Obamacare , the IRS and feminism. #politicsnation ##inners #maddow"			#politicsnation # #inners #maddow	"422875673091665920"	https://twitter.com/MrColdheart/status/422875673091665920
	2014-01-13 23:39	0	0	"Hail to the Sheople! They voted for this guy and his "signature legislation" Obamacare is projected by the... http:// fb.me/2KrsbcG68"				"422875672193687553"	https://twitter.com/cptfreedm/status/422875672193687553
	2014-01-13 23:39	0	0	"@SpeakerBoehner , @SenTedCruz , and others are not happy about this. MSNBC: Obamacare reaches 2.2 million enrolled: http://www. msnbc.com/rachel-maddow- show/aca-enrollment-reaches-22-million …"		@SpeakerBoehner @SenTedCruz		"422875668548829184"	https://twitter.com/pgapparel_gifts/status/422875668548829184
	2014-01-13 23:39	0	0	"No plan to fight Obamacare subsidies fraud, security breaches http:// dailycaller.com/2014/01/13/con gresswoman-no-plan-to-fight-obamacare-subsidies-fraud-security-breaches/ … via @dailycaller"		@dailycaller		"422875664492941312"	https://twitter.com/clasicaliberal/status/422875664492941312
	2014-01-13 23:39	0	0	"According to CBS, majority #Obamacare enrollments to date have been single women btw 45-65. Enrollees >30 have been few #tcot #p2 #uniteblue"			#Obamacare #tcot #p2 #uniteblue	"422875664241266689"	https://twitter.com/DeTroyes1/status/422875664241266689
	2014-01-13 23:39	17	10	"We agree! #Obamacare pic.twitter.com/0LdOARLRvg"			#Obamacare	"422875654699229184"	https://twitter.com/OFA_TN/status/422875654699229184
	2014-01-13 23:39	0	0	"Obamacare enrollments spike in Iowa, Illinois http:// bit.ly/KX1A2g"				"422875616078069760"	https://twitter.com/QCTpolitics/status/422875616078069760
	2014-01-13 23:39	0	0	". @SenatorCardin middle class families now have to sacrifice college education for ridiculously high obamacare premiums and deductibles."		@SenatorCardin		"422875613964554240"	https://twitter.com/attymaddog/status/422875613964554240
	2014-01-13 23:39	0	1	"yeah I don't believe these Obamacare numbers. probably major bullshit."				"422875611946692608"	https://twitter.com/realhinton/status/422875611946692608
	2014-01-13 23:39	0	0	"ObamaCare has been around 3 yrs, the 2nd Amendment 200. We should repeal the law that's been working! #ThingsALiberalMightSay"			#ThingsALiberalMightSay	"422875601293160448"	https://twitter.com/PrncssZryzl/status/422875601293160448
