username;date;retweets;favorites;text;geo;mentions;hashtags;id;permalink
	2014-09-29 22:20	0	0	"Shouldn't it be 100%? MT @SpudLovr : #ACA leads to 30-40% drop clients at La Crosse free health care clinic #wiunion #wiright"		@SpudLovr	#ACA #wiunion #wiright	"516714156141985792"	https://twitter.com/teeocee/status/516714156141985792
	2014-09-29 22:20	1	0	"“Free" got expensive @SpudLovr : #ACA leads to 30-40% drop clients at La Crosse free health care clinic @lacrossetribune #wiunion #wiright"		@SpudLovr @lacrossetribune	#ACA #wiunion #wiright	"516714096742264833"	https://twitter.com/jrios68/status/516714096742264833
	2014-09-29 22:20	0	0	"Hey @BruceBraley other incumbent Democrats also say they owe nothing to Obama but vote with him over 94% of the time. #ObamaCare ruins lives"		@BruceBraley	#ObamaCare	"516714076140232704"	https://twitter.com/NeverTrumpTeam/status/516714076140232704
	2014-09-29 22:20	0	0	"More health plans to choose from means even more affordable care for Americans. That's what's happening: http:// ofa.bo/h10j #Obamacare"			#Obamacare	"516714037623541760"	https://twitter.com/OFA_UT/status/516714037623541760
	2014-09-29 22:20	0	0	"In Missouri, insurers know #Obamacare is working—that's why more are joining the marketplaces because of it. http:// ofa.bo/e12c"			#Obamacare	"516714035538952192"	https://twitter.com/OFA_MO/status/516714035538952192
	2014-09-29 22:18	3	2	"Why does #TedCruz keep saying 'I will repeal every word of #Obamacare ' when he has no real intent or ability to do so?! For RWNJ applause!!!"			#TedCruz #Obamacare	"516713779984216065"	https://twitter.com/mterr337/status/516713779984216065
	2014-09-29 22:18	0	0	"@carloslcurbelo wants to dismantle #ACA , which ensures women don't pay more for insurance than men #WrongForWomen http://www. politifact.com/florida/statem ents/2014/jul/31/ed-macdougall/carlos-curbelo-opposes-repeal-obamacare-says-attac/ …"		@carloslcurbelo	#ACA #WrongForWomen	"516713714599219200"	https://twitter.com/RickyJunquera/status/516713714599219200
	2014-09-29 22:18	0	0	"@BillKintner and decide to Keep the model we now call Obamacare ."		@BillKintner		"516713659519627264"	https://twitter.com/clambo3/status/516713659519627264
	2014-09-29 22:18	0	0	"ObamaCare insurance navigator with rocky history gets even more taxpayer money | http:// fxn.ws/1taXzGl"				"516713611059011586"	https://twitter.com/1216BJ/status/516713611059011586
	2014-09-29 22:18	0	0	"The Final Lap: MY obamacare DREAM SCHEME http:// lemuellam.blogspot.com/2013/11/my-oba macare-dream.html?spref=tw …"				"516713558587883520"	https://twitter.com/lemuellam/status/516713558587883520
	2014-09-29 22:18	0	0	"@thehill @JudyKurtz The right-wing nuts no longer can complain about Obamacare . This is what they're left to complain about. Pathetic."		@thehill @JudyKurtz		"516713550782681090"	https://twitter.com/davner717/status/516713550782681090
	2014-09-29 22:18	1	0	"Obama: Expanding Medicaid Under Obamacare ‘Doesn’t Cost You a Dime’ | CNS News http:// bit.ly/1ronqyW #tcot #teaparty #obama #sgp #tgdn"			#tcot #teaparty #obama #sgp #tgdn	"516713528942944256"	https://twitter.com/michaelemlong/status/516713528942944256
	2014-09-29 22:17	1	0	"#retirement Employers Report Strategies to Mitigate ACA Cost Increases http:// ow.ly/2OpjBr"			#retirement	"516713465768312833"	https://twitter.com/nevinesq/status/516713465768312833
	2014-09-29 22:17	0	0	"#retirement IRS Adds ACA Guidance for Measuring Full-Time Employees http:// ow.ly/2OpjBp"			#retirement	"516713465030148096"	https://twitter.com/nevinesq/status/516713465030148096
	2014-09-29 22:17	1	0	"Change of Senate Rules by Nuclear Option May Come Around to Save ObamaCare Subsidies http://www. friendlydb.com/item/3650070/f reedom-works-change-of-senate-rules-by-nuclear-option-may-come-around-to-save-obamacare-subsidies …"				"516713433446629376"	https://twitter.com/MarkHigbee/status/516713433446629376
	2014-09-29 22:17	0	0	"Oh oh oh! no he didnt! “ @cnsnews : Obama: Expanding Medicaid Under Obamacare ‘Doesn’t Cost You a Dime’ http:// ow.ly/2Opeqx ”"		@cnsnews		"516713411691167746"	https://twitter.com/sweetnspicy66/status/516713411691167746
	2014-09-29 22:17	7	5	"CIVIL DISOBEDIENCE: I will not sign up for #Obamacare and I will not pay an imposed penalty or tax for not doing so. RU IN? #PJNET"			#Obamacare #PJNET	"516713352974712832"	https://twitter.com/M0L0NL4BE/status/516713352974712832
	2014-09-29 22:17	0	0	"ObamaCare insurance navigator with rocky history gets even more taxpayer ... - Fox News... http:// bit.ly/1nBw3pi http:// bit.ly/2pwEhS"				"516713304396279808"	https://twitter.com/MyInsuranceGuru/status/516713304396279808
	2014-09-29 22:17	1	0	"Insurers know #Obamacare is working—and more are joining the marketplaces because of it. http:// ofa.bo/r12u"			#Obamacare	"516713282216796161"	https://twitter.com/OFA_NV/status/516713282216796161
	2014-09-29 22:16	1	1	"@RightWingWatch @ohiomail Ben Carson - " Obamacare is socialism ". & hair transplants are neurosurgery. Each example has 1 thing in common"		@RightWingWatch @ohiomail		"516713238017630208"	https://twitter.com/Michcarian/status/516713238017630208
	2014-09-29 22:16	0	0	"New Client Alert! Anchin Alert: The Affordable Care Act ( ACA ) Reporting Requirements for Business Clients http:// ow.ly/2OpiAg"				"516713233617801216"	https://twitter.com/AnchinCPA/status/516713233617801216
	2014-09-29 22:16	1	3	"Congratulations to Adam Rachubinski of @AlphaBicycle . You are the @BRAC_ ACA @OnYourSide Athlete of the Month! http:// 303cycling.com/Nationwide-Ath lete-of-the-Month-Adam-Rachubinski-Alpha-Bicycle-Co …"		@AlphaBicycle @BRAC_ @OnYourSide		"516713214659149824"	https://twitter.com/303cycling/status/516713214659149824
	2014-09-29 22:16	0	0	"#tcot #teaparty #fyi VIDEO: SNEAKY ON OBAMACARE ... - VIDEO: SNEAKY ON OBAMACARE ...(Third column, 2nd story, link)R... http:// ow.ly/2OpiuC"			#tcot #teaparty #fyi	"516713214055567360"	https://twitter.com/angelfleming/status/516713214055567360
	2014-09-29 22:16	0	0	". @ryanjreilly Hmmm. Sebelius presided over Obamacare , and Shinseki presided over the left's poster child for Obamacare . It's working!"		@ryanjreilly		"516713191163043841"	https://twitter.com/back_ttys/status/516713191163043841
	2014-09-29 22:16	0	0	"ROCKY HISTORY ObamaCare firm beset with problems gets more tax $$ http://www. foxnews.com/politics/2014/ 09/29/obamacare-insurance-navigator-with-rocky-history-gets-even-more-taxpayer-money/ …"				"516713126507450369"	https://twitter.com/HotBitFusion/status/516713126507450369
	2014-09-29 22:16	0	0	"@juanjo_jara you have already graded A for #obamacare . Please reply with the word 'yes' if you want to replace it with B."		@juanjo_jara	#obamacare	"516713120463478784"	https://twitter.com/josaldev/status/516713120463478784
	2014-09-29 22:16	7	4	"Shared decision making and driving people to get preventive care will be great outcomes of #obamacare . -K. Mullen, @Humana #AHATech14"		@Humana	#obamacare #AHATech14	"516713094052331520"	https://twitter.com/American_Heart/status/516713094052331520
	2014-09-29 22:16	1	1	"@Sha1De @shirazme56 @edshow thank u!I am alright and able to get medical care -Xray & medication thanx to #obama & #ACA #insurance #voteblue"		@Sha1De @shirazme56 @edshow	#obama #ACA #insurance #voteblue	"516713029766225920"	https://twitter.com/slavenamehere/status/516713029766225920
	2014-09-29 22:15	2	0	"#ACA leads to 30-40% drop clients at La Crosse free health care clinic: http:// bit.ly/1ruJiay via @lacrossetribune #wiunion #wiright"		@lacrossetribune	#ACA #wiunion #wiright	"516712972514000896"	https://twitter.com/SpudLovr/status/516712972514000896
	2014-09-29 22:15	0	0	"Politifact Virginia Helps Mark Warner By Denying Obamacare Lie"				"516712923410857984"	https://twitter.com/zendisy/status/516712923410857984
	2014-09-29 22:15	0	0	"How Obamacare Funds the Nation's Largest Abortion Provider - http:// kollmancatholicdigest.com/how-obamacare- funds-the-nations-largest-abortion-provider/ …"				"516712847230124032"	https://twitter.com/SACRED_COMBAT/status/516712847230124032
	2014-09-29 22:15	0	0	"Access Shock: California's Shrinking Obamacare Coverage Networks - Guy Benson http:// bit.ly/1pmKGYy"				"516712821208674306"	https://twitter.com/davidjones720/status/516712821208674306
	2014-09-29 22:14	0	0	"Health insurance costs are skyrocketing under Obamacare , Republican Party says http:// zite.to/1oqWzMX"				"516712710428307456"	https://twitter.com/StephenAmsden/status/516712710428307456
	2014-09-29 22:14	1	1	"@simplie_ashleyy @Aca _Diniz Uhmm hello there"		@simplie_ashleyy @Aca		"516712596976975873"	https://twitter.com/Darcydarcc/status/516712596976975873
	2014-09-29 22:14	0	0	"Pay up front: Is Obamacare second-rate insurance? http:// cnnmon.ie/Pbm61u via @CNNMoney mt"		@CNNMoney		"516712568816406528"	https://twitter.com/marymac41/status/516712568816406528
	2014-09-29 22:13	0	1	"@souzi54 @FrankLuntz Has anyone moved away from allowing you personal freedoms, such as freedom of choice? Actually, obama has (e.g. ACA )"		@souzi54 @FrankLuntz		"516712495621222401"	https://twitter.com/kem451_/status/516712495621222401
	2014-09-29 22:13	1	0	"We are ready for the fashion segment of this week, here I am with Emmy's winner Leslie Montoya :) Acá estamos... http:// fb.me/3D2HntxaQ"				"516712423714463744"	https://twitter.com/LeoDalmagro/status/516712423714463744
	2014-09-29 22:13	0	0	"@CPensioner When he ran for office. Before he voted for Obamacare and stripped desired health insurance from many Virginians."		@CPensioner		"516712407616741377"	https://twitter.com/GroverNorquist/status/516712407616741377
	2014-09-29 22:13	0	1	"Insurers know #Obamacare is working—and more are joining the marketplaces because of it. http:// ofa.bo/q11b"			#Obamacare	"516712274593972224"	https://twitter.com/OFA_MO/status/516712274593972224
	2014-09-29 22:12	0	0	"Obama: Expanding Medicaid Under Obamacare ‘Doesn’t Cost You a Dime’ http:// cnsnews.com/news/article/a li-meyer/obama-expanding-medicaid-under-obamacare-doesn-t-cost-you-dime#.VCnZWZ6jb90.twitter …"			#	"516712206918897664"	https://twitter.com/glezee81/status/516712206918897664
	2014-09-29 22:12	1	2	"VIDEO: SNEAKY ON OBAMACARE ... http:// ow.ly/2Opfl6"				"516712165064327168"	https://twitter.com/SavageNation/status/516712165064327168
	2014-09-29 22:12	8	1	"Obamacare will cause the destruction of the US economy and a good but not perfect healthcare system. You can help stop it with your RTs."				"516712143987945472"	https://twitter.com/RickCo01/status/516712143987945472
	2014-09-29 22:12	0	0	"VIDEO: SNEAKY ON OBAMACARE ... http:// ow.ly/2OpfcA"				"516712097326301184"	https://twitter.com/TimothyJStreet/status/516712097326301184
	2014-09-29 22:11	11	5	"Obama: Expanding Medicaid Under Obamacare ‘Doesn’t Cost You a Dime’ http:// ow.ly/2Opeqx"				"516711867264557056"	https://twitter.com/cnsnews/status/516711867264557056
	2014-09-29 22:11	0	0	"" @MotherJones : John Oliver Obama's drone policy will b as chracteristic of presidency as Obamacare http:// bit.ly/1ywUqsz ": & it's not good"		@MotherJones		"516711786322878464"	https://twitter.com/cykelly1718/status/516711786322878464
	2014-09-29 22:10	0	0	"@WhiteHouse : 7.3M enrolled in #ObamaCare and paying premiums http:// ow.ly/BQoUD"		@WhiteHouse	#ObamaCare	"516711685001056256"	https://twitter.com/Stone_Writer/status/516711685001056256
	2014-09-29 22:10	26	27	"My sweet,lively Dad at 89 -14 yrs past his expiration date, according to Obamacare Architect E Emanuel @greggutfeld pic.twitter.com/3ee4N6lH5C"		@greggutfeld		"516711680337010688"	https://twitter.com/linda_kling/status/516711680337010688
	2014-09-29 22:10	0	0	"@MarkSoveign @tohajilee @elmergooch obamacare in itself is a failure Mark.only 7mil signed up do far.what?sucsess"		@MarkSoveign @tohajilee @elmergooch		"516711668743548928"	https://twitter.com/garciadadloves/status/516711668743548928
	2014-09-29 22:10	1	0	"@carloslcurbelo wants to dismantle #ACA , which ensures women don't pay more for insurance than men #WrongForWomen http://www. politifact.com/florida/statem ents/2014/jul/31/ed-macdougall/carlos-curbelo-opposes-repeal-obamacare-says-attac/ …"		@carloslcurbelo	#ACA #WrongForWomen	"516711654692646912"	https://twitter.com/JuanPenalosa/status/516711654692646912
	2014-09-29 22:10	0	0	"#ObamaCare insurance navigator with rocky history gets even more taxpayer money | http:// fxn.ws/1taXzGl #ACA"			#ObamaCare #ACA	"516711625374441472"	https://twitter.com/ARMNoel/status/516711625374441472
	2014-09-29 22:10	4	2	"Checkmate, #ObamaCare . President Redistribution has reached the end of his political rope. http:// wp.me/p2Obej-v1 #pjnet #tcot #media #gop"			#ObamaCare #pjnet #tcot #media #gop	"516711615282958336"	https://twitter.com/Rob_Cunningham/status/516711615282958336
	2014-09-29 22:10	0	0	"I'm voting to fire @MarkUdall on Nov 4th because he voted for ObamaCare !"		@MarkUdall		"516711601169113089"	https://twitter.com/ZachDoesRadio/status/516711601169113089
	2014-09-29 22:10	0	0	"Links & Quotes: powerful #quote from A.W. Tozer; #Creation news; how #Obamacare funds murder & more … http:// wp.me/pmy10-3dl"			#quote #Creation #Obamacare	"516711552872108032"	https://twitter.com/craigtowens/status/516711552872108032
	2014-09-29 22:09	0	0	"#ToniSays Dept HHS says that Affordable Care Act ( #ACA ) has saved #Medicare Part D $8.3 billion since 2010. http:// dld.bz/tonisays"			#ToniSays #ACA #Medicare	"516711391009718273"	https://twitter.com/Medicare2014/status/516711391009718273
	2014-09-29 22:09	1	0	"MORE THAN RIGHT: Obamacare - Americans should volunteer to die at 75 on Blog Talk Radio http:// ow.ly/2OpdfM"				"516711311192113152"	https://twitter.com/CommDigiNews/status/516711311192113152
	2014-09-29 22:09	0	0	"@BarackObama Re TAXES: $1+ Billion on ObamaCare Website. Postal Service $22+ Billion in the Red in Recent Years. ETC"		@BarackObama		"516711298185166848"	https://twitter.com/tradethecycles/status/516711298185166848
	2014-09-29 22:08	1	0	"Paul Ryan Wants to Kill Obamacare , and That Could Kill You - http:// tinyurl.com/nmj6kjd via @BlueNationRev"		@BlueNationRev		"516711262458114048"	https://twitter.com/dvpensenti/status/516711262458114048
	2014-09-29 22:08	0	0	"#ACA required reporting for companies with 50 FTE and up begins Jan 1, 2015 http:// goo.gl/95mwlE"			#ACA	"516711218711523328"	https://twitter.com/SalarFindLaw/status/516711218711523328
	2014-09-29 22:08	0	0	"PresiDebt OBAMA's Wreckovery: Massive Fed Intervention Due to the CRAP OBAMA Economy/ ObamaCare ETC."				"516711142937206784"	https://twitter.com/tradethecycles/status/516711142937206784
	2014-09-29 22:08	0	0	"Politifact Virginia Helps Mark Warner By Denying Obamacare Lie http:// goo.gl/fb/gR1i6h"				"516711104488026112"	https://twitter.com/kTiNoJ/status/516711104488026112
	2014-09-29 22:08	0	0	"@BarackObama ObamaCare 30 Hour FULL TIME Workweek. Part Time Jobs Economy!!!!!!!!!!!!!!!!!!!!!"		@BarackObama		"516711082627317762"	https://twitter.com/tradethecycles/status/516711082627317762
	2014-09-29 22:08	1	0	"ROCKY HISTORY ObamaCare firm beset with problems gets more tax $$ via @FoxNews http:// fxn.ws/1wS6Zdp"		@FoxNews		"516711081574957056"	https://twitter.com/Chris_1791/status/516711081574957056
	2014-09-29 22:08	0	0	"New on What If: What does it mean that 7.3 million are enrolled in Obamacare plans? Depends… http:// goo.gl/fb/VNd2F1"				"516711027526742019"	https://twitter.com/whatifpost/status/516711027526742019
	2014-09-29 22:07	1	0	"I told @senatorhagan in 2010 that #Obamacare would harm my sick kids.I was right.See how the #ACA hurts sick kids: http:// youtu.be/9RAhCDzs-hY"		@senatorhagan	#Obamacare #ACA	"516710944689254400"	https://twitter.com/PattieCurran/status/516710944689254400
	2014-09-29 22:07	0	0	"ObamaCare is the Substandard Second Rate Insurance That BARACK OBAMA Warned Us About!!!!!!!!!!!!!!!!!!!!!!!!!!!!!!!!!!!!!!!!! OMG!!!!!!!!"				"516710918378356736"	https://twitter.com/tradethecycles/status/516710918378356736
	2014-09-29 22:07	0	0	"Was there any doubt? How Obamacare Funds the Nation’s Largest Abortion Provider http:// dailysign.al/1vm7uvh @sarahtorre @DailySignal #tcot #tlot"		@sarahtorre @DailySignal	#tcot #tlot	"516710890284912640"	https://twitter.com/pageian/status/516710890284912640
	2014-09-29 22:07	0	0	"The lie the #GOP wants you to believe: Get rid of #ObamaCare & you'll be happy with no health care! Like before. BAWHAHAHA"			#GOP #ObamaCare	"516710818226786304"	https://twitter.com/starZship/status/516710818226786304
	2014-09-29 22:07	3	0	"Hospitals ask patients to pay upfront since ObamaCare can't be trusted. http:// is.gd/qT3P2m"				"516710778578018304"	https://twitter.com/capflowwatch/status/516710778578018304
	2014-09-29 22:06	0	0	"@garciadadloves @tohajilee @elmergooch How do you define "failure" getting Obamacare passed into law?"		@garciadadloves @tohajilee @elmergooch		"516710714548170752"	https://twitter.com/MarkSoveign/status/516710714548170752
	2014-09-29 22:06	6	1	"Remember: Tomorrow is the deadline for nearly 100k #CoveredCA families to submit documents verifying immigration status. #Obamacare"			#CoveredCA #Obamacare	"516710608780005376"	https://twitter.com/emilybazar/status/516710608780005376
	2014-09-29 22:06	1	4	"Obamacare Architect: why it's good idea to die at 75 -discussed on 9/26 #TheFive http://www. theatlantic.com/features/archi ve/2014/09/why-i-hope-to-die-at-75/379329/ … @greggutfeld"		@greggutfeld	#TheFive	"516710590740717568"	https://twitter.com/linda_kling/status/516710590740717568
	2014-09-29 22:06	1	0	"Quit spending my money on this! #ObamaCare #insurance navigator with rocky history gets even more taxpayer money http://www. foxnews.com/politics/2014/ 09/29/obamacare-insurance-navigator-with-rocky-history-gets-even-more-taxpayer-money/ …"			#ObamaCare #insurance	"516710517105496064"	https://twitter.com/Haamrtime/status/516710517105496064
	2014-09-29 22:05	0	0	"Almost All Obamacare Enrollees Are Paying For Coverage http:// ow.ly/BTcNB Are you surprised?"				"516710467272998912"	https://twitter.com/GeldinInsurance/status/516710467272998912
	2014-09-29 22:05	0	0	"RT @WSCP1 : Obummer! Obama Touted Her As An Obamacare Success, Turns Out She Cant Qualify For ANY Subsidy! http:// goo.gl/miirhn #TeaParty …"		@WSCP1	#TeaParty	"516710444133015552"	https://twitter.com/HowardRoper/status/516710444133015552
	2014-09-29 22:05	0	0	"ACA could see second wave of Medicaid expansion http:// ow.ly/BYDsD via @reuters"		@reuters		"516710398192812032"	https://twitter.com/NPAF_tweets/status/516710398192812032
	2014-09-29 22:05	0	1	"#ObamaCare insurance navigator with rocky history gets even more #taxpayer money | http:// fxn.ws/1taXzGl"			#ObamaCare #taxpayer	"516710395768078337"	https://twitter.com/minac74/status/516710395768078337
	2014-09-29 22:05	0	0	"Almost All Obamacare Enrollees Are Paying For Coverage Are you surprised? http:// fb.me/2sqMVsUrH"				"516710350142840832"	https://twitter.com/GeldinInsurance/status/516710350142840832
	2014-09-29 22:04	0	0	"ROCKY HISTORY ObamaCare firm beset with problems gets more tax $$ http://www. foxnews.com/politics/2014/ 09/29/obamacare-insurance-navigator-with-rocky-history-gets-even-more-taxpayer-money/ …"				"516710174774403073"	https://twitter.com/ZabcoProduction/status/516710174774403073
	2014-09-29 22:04	0	0	"@HouseGOP @washingtonpost Many of "US", including myself lost jobs directly due to his "signature" accomplishment- Obamacare ."		@HouseGOP @washingtonpost		"516710167337922561"	https://twitter.com/JAhuman2/status/516710167337922561
	2014-09-29 22:04	0	0	"ACA To Bring $5.7B Drop In Uncompensated Costs http:// lnkd.in/bg4VzT6"				"516710084655595521"	https://twitter.com/Antonio_Muniz/status/516710084655595521
	2014-09-29 22:04	0	0	"@MattMulcahy @thedailybeast So the White House, the most Transparent Administration ever, lied before an election? ObamaCare , al Qaida etc."		@MattMulcahy @thedailybeast		"516710045665726465"	https://twitter.com/GKevinBarrett/status/516710045665726465
	2014-09-29 22:04	0	0	"Dutch League, Brainwave, ACA and Jobava! http:// bit.ly/1nBt8gh"				"516710027403735040"	https://twitter.com/BoardGames4All/status/516710027403735040
	2014-09-29 22:03	0	0	"iOS 8 is a lot like obamacare . It costs too much (memory; money), it has too many glitches, it's no better than its predecessor..."				"516709987549478912"	https://twitter.com/Phillip_Boss/status/516709987549478912
	2014-09-29 22:03	0	0	"ROCKY HISTORY ObamaCare firm beset with problems gets more tax $$ via @FoxNews http:// goo.gl/W3W7Fw"		@FoxNews		"516709880640851970"	https://twitter.com/Chris_Haney/status/516709880640851970
	2014-09-29 22:03	0	0	"aca escuchando Someone Like You https://www. youtube.com/watch?v=hLQl3W QQoQ0 …"				"516709800919318528"	https://twitter.com/GabrieleAbril/status/516709800919318528
	2014-09-29 22:03	0	0	"The best part of Obamacare that you've never heard of... http:// fb.me/3mHA4Npzg @CRNHealthcare #UniteBlue"		@CRNHealthcare	#UniteBlue	"516709783198781440"	https://twitter.com/feathersnpaws/status/516709783198781440
	2014-09-29 22:03	1	1	"@Sha1De @shirazme56 @edshow im in urgent care right now using my ACA insurance and i thank god for it! #ACA #insurance #voteblue"		@Sha1De @shirazme56 @edshow	#ACA #insurance #voteblue	"516709772457160704"	https://twitter.com/slavenamehere/status/516709772457160704
	2014-09-29 22:03	0	0	"The OBAMACARE page has been trending for 1h http:// tweetzup.com/affordablecare act?interval=37197665 … #Tweetzup"			#Tweetzup	"516709767440781312"	https://twitter.com/USPOLITICSZUP/status/516709767440781312
	2014-09-29 22:03	2	0	"So ridiculous that Rick Scott keeps running anti- Obamacare ads in Flordia. Get over it! Can't wait to vote this fool out."				"516709756140920832"	https://twitter.com/ImRightYerWrong/status/516709756140920832
	2014-09-29 22:02	0	0	"ObamaCare insurance navigator with rocky history gets even more taxpayer money via the @FoxNews iPhone app #funny $ http://www. foxnews.com/politics/2014/ 09/29/obamacare-insurance-navigator-with-rocky-history-gets-even-more-taxpayer-money/ …"		@FoxNews	#funny	"516709746792222720"	https://twitter.com/AlGrossnickle/status/516709746792222720
	2014-09-29 22:02	0	0	"If ur medications have been costing u up the ying yang or u haven't seen a doc 4 years cuz u couldn't afford it - Sign up 4 ObamaCare ! #ACA"			#ACA	"516709674713120769"	https://twitter.com/FluffySays/status/516709674713120769
	2014-09-29 22:02	0	0	"Doctors Survey: only 31% give ACA an "A" or "B": http:// ow.ly/BW8xB"				"516709581104640000"	https://twitter.com/RylanKlaseen/status/516709581104640000
	2014-09-29 22:02	1	0	"The best part of Obamacare that you've never heard of... http:// fb.me/3mHA4Npzg"				"516709563249074176"	https://twitter.com/CRNHealthcare/status/516709563249074176
	2014-09-29 22:02	1	1	"Obummer! Obama Touted Her As An Obamacare Success, Turns Out She Cant Qualify For ANY Subsidy! http:// is.gd/hy38Il #TeaParty #tcot #PJNet"			#TeaParty #tcot #PJNet	"516709546203430912"	https://twitter.com/WSCP1/status/516709546203430912
	2014-09-29 22:01	0	0	"ObamaCare insurance navigator with rocky history gets even more taxpayer money http://www. foxnews.com/politics/2014/ 09/29/obamacare-insurance-navigator-with-rocky-history-gets-even-more-taxpayer-money/ … via the @FoxNews Android app"		@FoxNews		"516709485596119041"	https://twitter.com/kfrenchsr/status/516709485596119041
	2014-09-29 22:01	1	1	"ObamaCare insurance navigator with rocky history gets even more taxpayer money http://www. foxnews.com/politics/2014/ 09/29/obamacare-insurance-navigator-with-rocky-history-gets-even-more-taxpayer-money/ … Fraud gets more money? ! Seriously?"				"516709447788691458"	https://twitter.com/GloriaMitchell6/status/516709447788691458
	2014-09-29 22:01	2	0	"Rove would of supported Saruman as a moderate. Rove has no desire to repeal Obamacare . Wants to fix it. #crushrove #teaparty"			#crushrove #teaparty	"516709443770134528"	https://twitter.com/willstauff/status/516709443770134528
	2014-09-29 22:01	2	0	"Joe Garcia voted against the Save American Workers Act to remove the #ObamaCare mandated 30-hour work week http:// clerk.house.gov/evs/2014/roll1 56.xml … #FL26"			#ObamaCare #FL26	"516709409503059970"	https://twitter.com/mpvollen/status/516709409503059970
	2014-09-29 22:01	4	2	"I'm voting to fire @MaryLandrieu on Nov 4th because she voted for ObamaCare !"		@MaryLandrieu		"516709339126456320"	https://twitter.com/bobdavis122003/status/516709339126456320
	2014-09-29 22:01	0	0	""Drone strikes are as much a mark of the Obama administration as Obamacare ." - @iamjohnoliver"		@iamjohnoliver		"516709335880462336"	https://twitter.com/Ethantaylor/status/516709335880462336
	2014-09-29 22:01	0	0	"Uninsured rates among Hispanic groups drop under ACA , study finds http:// sbne.ws/r/qqcq"				"516709292687106048"	https://twitter.com/diabetesconcep1/status/516709292687106048
	2014-09-29 22:01	7	1	"These OFA volunteers are already planning another historic #Obamacare enrollment period. You can take #OFAction too: http:// ofa.bo/g10Y"			#Obamacare #OFAction	"516709254627987456"	https://twitter.com/OFA_TX/status/516709254627987456
	2014-09-29 22:00	0	0	"ObamaCare insurance navigator with rocky history gets even more taxpayer money http:// fb.me/2rSQJx2IL"				"516709181999841280"	https://twitter.com/frankpresents/status/516709181999841280
	2014-09-29 22:00	0	0	"ObamaCare insurance navigator with rocky history gets even more taxpayer money via the @FoxNews iPhone app http://www. foxnews.com/politics/2014/ 09/29/obamacare-insurance-navigator-with-rocky-history-gets-even-more-taxpayer-money/ …"		@FoxNews		"516709144200761344"	https://twitter.com/Kimbagirl4u/status/516709144200761344
	2014-09-29 22:00	0	0	"@2ANow @AARP how old is the creator of* ACA ?"		@2ANow @AARP		"516709144024211456"	https://twitter.com/GlendaKitchel/status/516709144024211456
