username;date;retweets;favorites;text;geo;mentions;hashtags;id;permalink
	2014-09-29 21:24	0	0	"Swiss reject more socialization of health care, but is what they have similar to Obamacare ? http:// news.yahoo.com/public-versus- private-swiss-mull-health-system-shift-073917245.html …"				"516700124492218369"	https://twitter.com/Chafuen/status/516700124492218369
	2014-09-29 21:24	0	0	"YOU NEED ME I DONT NEED YOU ME PILLO ACA"				"516700071082360832"	https://twitter.com/jiminattor/status/516700071082360832
	2014-09-29 21:24	0	0	"Obamacare Funds Nation’s Largest Abortion Provider http:// cnsnews.com/commentary/sar ah-torre/obamacare-funds-nation-s-largest-abortion-provider#.VCnN4siwctU.twitterI.G … . Farben is alive and well, as WW II GI's turn in their graves."			#	"516700049137356800"	https://twitter.com/junkbuster50/status/516700049137356800
	2014-09-29 21:24	0	0	"Say no to @BruceBraley on Nov 4th! As a congressman he voted for ObamaCare !"		@BruceBraley		"516700011258589184"	https://twitter.com/marbajer/status/516700011258589184
	2014-09-29 21:24	0	0	"Vietnamese Translators Affordable Care Act ( ACA ) (USA Only) http:// bit.ly/1DSHjCa #t9njobs"			#t9njobs	"516699995076968449"	https://twitter.com/Translate_Jobs/status/516699995076968449
	2014-09-29 21:23	2	0	"New York owes #taxpayers $15BILLION in #Obamacare overpayments of course our #incompetent gov is doing NOTHING to collect that $$! #ncsen"			#taxpayers #Obamacare #incompetent #ncsen	"516699855893176320"	https://twitter.com/Gatorgirl4vr/status/516699855893176320
	2014-09-29 21:23	0	0	"Aca con SHAKESPEARE @damianmarano2"		@damianmarano2		"516699787975204864"	https://twitter.com/ezecarrera2/status/516699787975204864
	2014-09-29 21:22	101	0	"Keep ur star family covered w/free or low-cost health coverage. Let #AlexAt3059745774 @ABSIACCTANDTAX #EnrollYou #ObamaCare Call now"		@ABSIACCTANDTAX	#AlexAt3059745774 #EnrollYou #ObamaCare	"516699588728987649"	https://twitter.com/NeVaeh_Skyy/status/516699588728987649
	2014-09-29 21:22	105	0	"#Protect ur family & #Finances 2day. #ImmunizationShots covered under the #ObamaCare #Health Let #Alex3059745774 @ABSIACCTANDTAX #EnrollYou"		@ABSIACCTANDTAX	#Protect #Finances #ImmunizationShots #ObamaCare #Health #Alex3059745774 #EnrollYou	"516699555023552512"	https://twitter.com/NeVaeh_Skyy/status/516699555023552512
	2014-09-29 21:22	103	0	"Got a letter in the mail about sending more docs 4 #HealthCare #ObamaCare 2day is the day 2 learn more about it with Alex @ABSIACCTANDTAX"		@ABSIACCTANDTAX	#HealthCare #ObamaCare	"516699478183923712"	https://twitter.com/NeVaeh_Skyy/status/516699478183923712
	2014-09-29 21:22	0	0	"#Obamacare Funds Nation’s Largest #Abortion Provider http:// cnsnews.com/commentary/sar ah-torre/obamacare-funds-nation-s-largest-abortion-provider#.VCnNX6nzefM.twitter … More inconvenient truth for people like Steve Driehaus. #p2"			#Obamacare #Abortion # #p2	"516699462425526272"	https://twitter.com/ORConservative/status/516699462425526272
	2014-09-29 21:21	0	0	"Preplanning gives u & your loved ones peace of mind. #ObamaCare #HealthCare Let Alex at @ABSIACCTANDTAX provide your the best services"		@ABSIACCTANDTAX	#ObamaCare #HealthCare	"516699381521989632"	https://twitter.com/NeVaeh_Skyy/status/516699381521989632
	2014-09-29 21:21	1	1	"Truth. Anybody w/ a basic understanding of econ knew #Obamacare was bad...so everyone but a lib. RT @CaptianCarry who knew? Almost everybody"		@CaptianCarry	#Obamacare	"516699340375457792"	https://twitter.com/lybr3/status/516699340375457792
	2014-09-29 21:21	0	0	"@SpeakerBoehner just secure the border & stop funding Obamacare . Then GOP will stand for something.Now you stand for nothing"		@SpeakerBoehner		"516699251783786498"	https://twitter.com/thephoebe/status/516699251783786498
	2014-09-29 21:20	0	0	"@TedOkonCOA tragic (yea even evil) view from one of the masterminds of ACA ."		@TedOkonCOA		"516699153909297153"	https://twitter.com/stevecoplon/status/516699153909297153
	2014-09-29 21:20	14	2	"What does this word mean "Dhimmitude" & why is it part of #ObamaCare ? It's all part of the bigger #Obama Plan.. pic.twitter.com/XJHp3CbeEL"			#ObamaCare #Obama	"516699112540884992"	https://twitter.com/Boazziz/status/516699112540884992
	2014-09-29 21:20	5	3	"The logical endpoint of Obamacare is IRS Gulags for anyone who refuses to be part of communist healthcare. Resist! http://www. futurnamics.com/gulag.php"				"516698952083582976"	https://twitter.com/daxtonbrown/status/516698952083582976
	2014-09-29 21:20	1	0	"John Barrow’s lies about Repealing Obamacare #ga12 http:// ln.is/www.redstate.c om/dia/8xt4i … via @willstauff"		@willstauff	#ga12	"516698945914163201"	https://twitter.com/LIBERTYSWF/status/516698945914163201
	2014-09-29 21:20	3	0	"Looking for a job in construction in #yeg the Alberta Employment and Career Fair Oct 3rd and 4th @Expo Centre http://www. albertaemploymentandcareerfair.com /"		@Expo	#yeg	"516698941090308096"	https://twitter.com/ACA_social/status/516698941090308096
	2014-09-29 21:19	0	0	"ObamaCare : The Topic Of The Day: http:// youtu.be/gnajOOE00Es via @YouTube"		@YouTube		"516698841915981824"	https://twitter.com/PoliticalAdvo/status/516698841915981824
	2014-09-29 21:19	1	0	"The CMS reports in a new study that health care costs are escalating much more slowly...a slam to #GOP claims to the contrary!!! #Obamacare"			#GOP #Obamacare	"516698838640238592"	https://twitter.com/mterr337/status/516698838640238592
	2014-09-29 21:19	0	0	"@Heritage @KimberlyCopus @sarahtorre why does anyone need planned parenthood when they have obamacare ?"		@Heritage @KimberlyCopus @sarahtorre		"516698758277779456"	https://twitter.com/pamela12632553/status/516698758277779456
	2014-09-29 21:19	0	0	"@SpeakerBoehner can't fuckin believe you. There's a fuckin war going on. You won't come to vote and all you can do is bash ACA .FUCKIN #IDIOT"		@SpeakerBoehner	#IDIOT	"516698750962499584"	https://twitter.com/cocoabeaux/status/516698750962499584
	2014-09-29 21:18	0	0	"@owillis Benghazi, Fast & Furious, birth certificate, the salute, Obamacare , ugh, AP History is the latest boogeyman for GOP tribe to fear"		@owillis		"516698640459771904"	https://twitter.com/joke2power/status/516698640459771904
	2014-09-29 21:18	0	0	"ObamaCare insurance navigator with rocky history gets even more taxpayer money via the @FoxNews iPhone app http://www. foxnews.com/politics/2014/ 09/29/obamacare-insurance-navigator-with-rocky-history-gets-even-more-taxpayer-money/ …"		@FoxNews		"516698598135050240"	https://twitter.com/Teresa1125/status/516698598135050240
	2014-09-29 21:18	0	0	"Understanding How States Access the ACA Enhanced Medicaid Match Rates http:// dlvr.it/73MXXW"				"516698569537892352"	https://twitter.com/philcsolomon/status/516698569537892352
	2014-09-29 21:18	0	0	"@oversplayer @edshow Obamacare , Obama himself is proving incompetent."		@oversplayer @edshow		"516698535333347328"	https://twitter.com/sinkspur/status/516698535333347328
	2014-09-29 21:18	0	0	"Interesting read on Auto-Renewing your Health Plan in the @nytimes today - http:// nyti.ms/YGvgXN via @UpshotNYT #healthinsurance #ACA"		@nytimes @UpshotNYT	#healthinsurance #ACA	"516698459127046144"	https://twitter.com/MAXIMUS_news/status/516698459127046144
	2014-09-29 21:17	0	0	"Charlie Stevens to present "Patient Protection & Affordable Care Act Update" Nov 7. Sign up now! http:// ow.ly/C5pth @WisconsinMC #ACA"		@WisconsinMC	#ACA	"516698395747287040"	https://twitter.com/MichaelBestLaw/status/516698395747287040
	2014-09-29 21:17	0	0	"Democrats bad management wasting Tax $$ ROCKY HISTORY ObamaCare firm beset with problems gets more tax $$: http:// fxn.ws/1taXzGl"				"516698353112186880"	https://twitter.com/JennyLewis23/status/516698353112186880
	2014-09-29 21:17	1	1	"Tipsheet: Access Shock: California's Shrinking Obamacare Coverage Networks http:// bit.ly/1mHRRyI"				"516698347474649088"	https://twitter.com/NahBabyNah/status/516698347474649088
	2014-09-29 21:17	0	0	"@Aca _Diniz follow back please"		@Aca		"516698281062449152"	https://twitter.com/BeautysGift__/status/516698281062449152
	2014-09-29 21:17	0	0	"Access Shock: California's Shrinking Obamacare Coverage Networks - Guy Benson #tcot #tlot #ccot #teaparty http:// townhall.com/tipsheet/guybe nson/2014/09/29/access-shock-californias-shrinking-obamacare-coverage-networks-n1898293 …"			#tcot #tlot #ccot #teaparty	"516698253338095617"	https://twitter.com/fredtkennedy/status/516698253338095617
	2014-09-29 21:17	0	0	"@RepFincherTN08 @SpeakerBoehner @AshleyMNolan you have options! Before Obamacare ...not so much"		@RepFincherTN08 @SpeakerBoehner @AshleyMNolan		"516698205506240513"	https://twitter.com/houseboatbob65/status/516698205506240513
	2014-09-29 21:16	0	0	"Obamacare Just Closed A Major Tax Loophole And Almost Nobody ... http:// bit.ly/1u6Hzcx | https:// twibble.io pic.twitter.com/KR7L0kDvR8"				"516698114544373760"	https://twitter.com/smoothie_foryou/status/516698114544373760
	2014-09-29 21:16	0	0	"For those with ACA health coverage, documents verifying income are due 9/30/14. Log into account & upload docs if not previously submitted."				"516698085016084481"	https://twitter.com/beatsjournal/status/516698085016084481
	2014-09-29 21:16	1	1	"Mostly #FALSE MT @thedahlimmama " @kharyp #Obamacare health ins costs skyrocketing, #FLGOP sz http://www. politifact.com/florida/statem ents/2014/sep/29/republican-party-florida/health-insurance-costs-are-skyrocketing-under-obam/ … pic.twitter.com/bcW69qtKcK ""		@thedahlimmama @kharyp	#FALSE #Obamacare #FLGOP	"516698074333204480"	https://twitter.com/WaldenE/status/516698074333204480
	2014-09-29 21:16	0	0	"DUMP AMNESTY! & Obamacare ! REMOVE ALL DEMOCRATS in November! RETWEET http:// conscores.org/i6uk #NoAmnesty #MakeDClisten #TCOT #CCOT"			#NoAmnesty #MakeDClisten #TCOT #CCOT	"516698042033250305"	https://twitter.com/Conscores/status/516698042033250305
	2014-09-29 21:16	4	1	"The number of uninsured Americans fell 8% during the first 3 mos of 2014 thanks to #Obamacare !!! #ExpandMedicaid #UniteBlue"			#Obamacare #ExpandMedicaid #UniteBlue	"516698005060067328"	https://twitter.com/mterr337/status/516698005060067328
	2014-09-29 21:15	0	0	"2 people followed me and 4 people unfollowed me in the last day. Thank you http:// uapp.ly app"				"516697871828008960"	https://twitter.com/_una_mas_aca/status/516697871828008960
	2014-09-29 21:15	2	2	"Obamacare 'sunlight' provisions: 4 years of lessons learned about drugmakers' payments to doctors. http:// n.pr/1DSnawd"				"516697865100357633"	https://twitter.com/LRussellWolpe/status/516697865100357633
	2014-09-29 21:15	0	0	"Access Shock: California's Shrinking Obamacare Coverage Networks (Sent from CNR) http:// townhall.com/tipsheet/GuyBe nson/2014/09/29/access-shock-californias-shrinking-obamacare-coverage-networks-n1898293 …"				"516697826630582272"	https://twitter.com/wvconservative/status/516697826630582272
	2014-09-29 21:15	0	0	"http:// ow.ly/BZN7C Our #Healthcare Hot Topics of the Week @larlegal #blog . Please subscribe. #fraud #ObamaCare #patient #safety"		@larlegal	#Healthcare #blog #fraud #ObamaCare #patient #safety	"516697824982224896"	https://twitter.com/larlegal/status/516697824982224896
	2014-09-29 21:15	0	0	"A #healthcare success story via @nytimes http:// nyti.ms/1uZVJMF #ACA"		@nytimes	#healthcare #ACA	"516697735009796098"	https://twitter.com/WorkSmartPEO/status/516697735009796098
	2014-09-29 21:14	0	0	"I know a federal government employee in DC whose job it is to sign up Somali "refugees" for Obamacare and taxpayer goodies. @DCClothesline"		@DCClothesline		"516697668559863809"	https://twitter.com/Michael_Zak/status/516697668559863809
	2014-09-29 21:14	0	0	"@Aca _Diniz omg you're beautiful!! :D"		@Aca		"516697525831487488"	https://twitter.com/AudreyW97/status/516697525831487488
	2014-09-29 21:14	0	0	"#FLGov #RickScott knows #ACA / #obamacare is Bad for #Floridians ~Healthcare, Points Of Conversation http:// wp.me/p4Zebn-7K via @WiFiLeaders"		@WiFiLeaders	#FLGov #RickScott #ACA #obamacare #Floridians	"516697496056123392"	https://twitter.com/FLMajorityVote/status/516697496056123392
	2014-09-29 21:14	0	0	"It is that time again. This health insurance thing is important. Obamacare open enrollment is coming http:// t.money.msn.com/saving-money-t ips/obamacare-open-enrollment-is-coming#tscptmt …"			#tscptmt	"516697434911559680"	https://twitter.com/RChamb52/status/516697434911559680
	2014-09-29 21:14	0	0	"Thanks to #Obamacare , your health can be your priority—not your wallet. http:// ofa.bo/q10q #BetterCare pic.twitter.com/Sqh9qgB10R"			#Obamacare #BetterCare	"516697429219880961"	https://twitter.com/OFA_UT/status/516697429219880961
	2014-09-29 21:14	0	0	"@MikeyBurdett @charleswolff1 @little1_em OMG I'm requesting the Aca songs and we can do the dance routine on Saturday!!!!!"		@MikeyBurdett @charleswolff1 @little1_em		"516697424396824576"	https://twitter.com/Miss_Asciara/status/516697424396824576
	2014-09-29 21:13	0	0	"@JoJoMclain Don’t let Obamacare threaten our liberty & financial future Joanne. Draft Ben Carson for solutions: http:// bit.ly/RunBenPetition"		@JoJoMclain		"516697363025383424"	https://twitter.com/DraftRunBenRun/status/516697363025383424
	2014-09-29 21:13	0	0	"PODCAST: Extolling the ACA ’s virtues http:// bit.ly/YI4lLi"				"516697350614425600"	https://twitter.com/EmergeMedicine/status/516697350614425600
	2014-09-29 21:13	0	0	"#NEWS Cotton Campaign Ad Spotlights Pryor's Vote for Obamacare http:// goo.gl/fb/JTjQgl"			#NEWS	"516697344176181249"	https://twitter.com/RightOfCenterNC/status/516697344176181249
	2014-09-29 21:13	1	0	"How #Obamacare Discourages Work and Marriage http:// herit.ag/IlzIDQ #PJNET"			#Obamacare #PJNET	"516697316627984384"	https://twitter.com/Lileensvf1/status/516697316627984384
	2014-09-29 21:13	0	0	"LA Times: Doctor Shortages, Buyer’s Remorse Plague California Obamacare http:// po.st/9jhpAH via @po_st"		@po_st		"516697264023019520"	https://twitter.com/toreilly/status/516697264023019520
	2014-09-29 21:13	2	0	"November 15 starts the 2nd #Obamacare enrollment period–and OFA volunteers are ready to make history again. http:// ofa.bo/b14g #OFAction"			#Obamacare #OFAction	"516697175816814594"	https://twitter.com/OFA_NV/status/516697175816814594
	2014-09-29 21:12	0	0	"How much longer until the American people can have #Obamacare repealed? #tcot http:// fxn.ws/1taXzGl"			#Obamacare #tcot	"516697149338574848"	https://twitter.com/Lewispontifex/status/516697149338574848
	2014-09-29 21:12	3	1	"IMAGE: Throw Out Obamacare ! http:// rightwingart.com/1afe5b1b-d836- 4cdd-9b92-4e755b371fbe/artupload.aspx … #tcot #tea #obamacare #socialism #resist44 #fail #fullrepeal"			#tcot #tea #obamacare #socialism #resist44 #fail #fullrepeal	"516697070774673409"	https://twitter.com/RightWingArt/status/516697070774673409
	2014-09-29 21:12	3	1	"I’m one follower away from 500! Follow me for news and links about #vtpoli #ACA #healthcare #singlepayer and occasional #Seahawks tweets."			#vtpoli #ACA #healthcare #singlepayer #Seahawks	"516697064034824192"	https://twitter.com/true_morgan/status/516697064034824192
	2014-09-29 21:12	2	0	"Democrats Damn the USA, Will Never Fix Obamacare . #MakeDCListen #VoteGOP http:// townhall.com/t/1897284-1 via @townhallcom"		@townhallcom	#MakeDCListen #VoteGOP	"516697040307253248"	https://twitter.com/GOCTRO/status/516697040307253248
	2014-09-29 21:12	0	0	"Obama Lied To Get Obamacare Passed! http:// nws.mx/1a4mx3r #TeaPartyToldYouSo #RedNationRising #MakeDCListen #tcot #PJNet"			#TeaPartyToldYouSo #RedNationRising #MakeDCListen #tcot #PJNet	"516697011249102848"	https://twitter.com/WSCP2/status/516697011249102848
	2014-09-29 21:12	0	0	"Obamacare will be open for enrollment soon, but only for 3 months. What do you need to think about to make the... http:// fb.me/1k5BEwAj2"				"516697005679456256"	https://twitter.com/Prudentmoney/status/516697005679456256
	2014-09-29 21:11	0	1	"@BarackObama my healthcare was affordable through my job #Obamacare took over I lost my insurance and hours at my job"		@BarackObama	#Obamacare	"516696749344571393"	https://twitter.com/Crystaleddy3/status/516696749344571393
	2014-09-29 21:10	0	0	"Clock ticking for Illinois to form state-run Obamacare exchange http:// wp.me/p4JP3c-5Yi"				"516696654473216000"	https://twitter.com/AHCExchange/status/516696654473216000
	2014-09-29 21:10	0	0	"@Aca _Diniz mmmmmm u izz too cute follow back ;)"		@Aca		"516696586206707712"	https://twitter.com/MarisaSmoKes/status/516696586206707712
	2014-09-29 21:10	0	0	"Why benefit administration systems are crucial for ACA compliance - Articles - Employee Benefit Adviser http:// eba.benefitnews.com/news/eba_advis er_summit/why-benefit-administration-systems-are-crucial-for-aca-compliance-2744095-1.html …"				"516696523472519168"	https://twitter.com/MitchOFInc/status/516696523472519168
	2014-09-29 21:10	0	0	"Access Shock: California's Shrinking Obamacare Coverage Networks http:// townhall.com/t/1898293-5 via @townhallcom Crooks and thieves on the loose."		@townhallcom		"516696454161653760"	https://twitter.com/junkbuster50/status/516696454161653760
	2014-09-29 21:09	0	0	"Deadline Looms For ACA Enrollees To Verify US Citizenship http:// cbsloc.al/1DSEIIE"				"516696385257607168"	https://twitter.com/Today_LA/status/516696385257607168
	2014-09-29 21:09	9	2	"" @kharyp : Health insurance costs are skyrocketing under #Obamacare , #FLGOP says http://www. politifact.com/florida/statem ents/2014/sep/29/republican-party-florida/health-insurance-costs-are-skyrocketing-under-obam/ … pic.twitter.com/GMoPvDBmQp " #UniteBlue"		@kharyp	#Obamacare #FLGOP #UniteBlue	"516696311274676225"	https://twitter.com/LiberalMmama/status/516696311274676225
	2014-09-29 21:09	1	3	"Shaheen Sold Us Out. #Obamacare Will Reduce Incomes of 80% of Americans Says Dems Liberal ThinkTank #nhpolitics #nhsen #nh"			#Obamacare #nhpolitics #nhsen #nh	"516696253938540545"	https://twitter.com/MrBlog1/status/516696253938540545
	2014-09-29 21:09	0	0	"ROCKY HISTORY ObamaCare firm beset with problems gets more tax $$, http:// fxn.ws/1taXzGl - Sent via the FOX News Android App."				"516696252374069248"	https://twitter.com/Lynxie63/status/516696252374069248
	2014-09-29 21:09	0	0	"I'm voting to fire @SenMarkPryor on Nov 4th because he voted for ObamaCare !"		@SenMarkPryor		"516696174623875073"	https://twitter.com/kayo1025/status/516696174623875073
	2014-09-29 21:08	0	2	"Re @philipaklein 's criticism, it also applies to GOP Senate candidates. They're not actually debating Obamacare : http://www. washingtonpost.com/blogs/plum-lin e/wp/2014/09/04/yes-the-politics-of-obamacare-are-shifting-heres-how/ …"		@philipaklein		"516696153594011648"	https://twitter.com/ThePlumLineGS/status/516696153594011648
	2014-09-29 21:08	0	0	"#BirthControl Is Free Under #Obamacare , But Not Everyone Got The Memo http:// ow.ly/3rYxbn #aca #healthcare #contraception"			#BirthControl #Obamacare #aca #healthcare #contraception	"516696125420470272"	https://twitter.com/UniteWomenNV/status/516696125420470272
	2014-09-29 21:08	0	0	"News Update: "Medicaid sprawling under Obamacare , but some states ill-equipped: report - Washington Times" http:// ift.tt/YDqESz"				"516696106496192512"	https://twitter.com/CoverOregonPlan/status/516696106496192512
	2014-09-29 21:08	3	1	"VA Scandal; Why arent Republicans linking the failures to Obamacare ? http:// is.gd/xfEzsm @SpeakerBoehner #MakeDCListen #TeaParty #PJNET"		@SpeakerBoehner	#MakeDCListen #TeaParty #PJNET	"516696069426528256"	https://twitter.com/WSCP1/status/516696069426528256
	2014-09-29 21:08	0	0	"I'm voting to fire @SenMarkPryor on Nov 4th because he voted for ObamaCare !"		@SenMarkPryor		"516696059146297345"	https://twitter.com/dawg1947/status/516696059146297345
	2014-09-29 21:08	2	1	"I'm voting to fire . @MarkUdall on Nov 4th because he's weirdly obsessed with #abortion , he voted for #ObamaCare , and his eyebrows scare me."		@MarkUdall	#abortion #ObamaCare	"516696043111473152"	https://twitter.com/Reagan_Girl/status/516696043111473152
	2014-09-29 21:08	0	0	"ObamaCare insurance navigator with rocky history gets even more taxpayer money | http:// fxn.ws/1taXzGl"				"516696000648732672"	https://twitter.com/1everydaywoman/status/516696000648732672
	2014-09-29 21:08	0	0	"@Cosmopolitan_es aca en el hemisferio sur It's spring! How we do it?"		@Cosmopolitan_es		"516695940863107072"	https://twitter.com/MirtusMorato/status/516695940863107072
	2014-09-29 21:07	0	0	"IRS, DOL and HHS issue Final joint regs on excepted benefits under ACA : http:// lnkd.in/btAK_Xn"				"516695897657208832"	https://twitter.com/mtaibleson/status/516695897657208832
	2014-09-29 21:07	1	1	"“ @Aca _Diniz : https://twitter.com/Aca_Diniz/status/509122496810221569/photo/1 pic.twitter.com/QFHtqrM1tr ” woaaah"		@Aca		"516695859401334785"	https://twitter.com/Alej_Ave/status/516695859401334785
	2014-09-29 21:07	0	1	"#edshow House of Reps takes 53 votes to defund a law already passed, Obamacare , but won't take one vote to send troops in harms way. #Weak"			#edshow #Weak	"516695720372338688"	https://twitter.com/ten24get/status/516695720372338688
	2014-09-29 21:06	0	0	"Korean Translators Affordable Care Act ( ACA ) (USA Only) http:// bit.ly/1rwP7TV #t9njobs"			#t9njobs	"516695647911563264"	https://twitter.com/Translate_Jobs/status/516695647911563264
	2014-09-29 21:06	0	0	"Chinese Translators for Affordable Care Act ( ACA ) (USA Only) http:// bit.ly/1rwP8XJ #t9njobs"			#t9njobs	"516695645088796672"	https://twitter.com/Translate_Jobs/status/516695645088796672
	2014-09-29 21:06	0	0	"Portuguese Translators for the Affordable Care Act ( ACA ) (USA Only) http:// bit.ly/1rwP7Dm #t9njobs"			#t9njobs	"516695642228264960"	https://twitter.com/Translate_Jobs/status/516695642228264960
	2014-09-29 21:06	0	0	"About Obamacare : "If you can't explain it to a six-year-old, you don't understand it yourself." - Albert Einstein"				"516695641758519296"	https://twitter.com/BraxtonDeGarmo/status/516695641758519296
	2014-09-29 21:06	0	0	"French Creole Translators for the Affordable Care Act ( ACA ) (USA Only) http:// bit.ly/1DSE51D #t9njobs"			#t9njobs	"516695639493591041"	https://twitter.com/Translate_Jobs/status/516695639493591041
	2014-09-29 21:06	0	0	"Tagalog Translators for the Affordable Care Act ( ACA ) (USA Only) http:// bit.ly/1rwP7mT #t9njobs"			#t9njobs	"516695636448538624"	https://twitter.com/Translate_Jobs/status/516695636448538624
	2014-09-29 21:06	0	0	"Russian Translators for the Affordable Care Act ( ACA ) (USA Only) http:// bit.ly/1DSE6m7 #t9njobs"			#t9njobs	"516695633718030337"	https://twitter.com/Translate_Jobs/status/516695633718030337
	2014-09-29 21:06	0	0	"I'm voting to fire @MarkUdall on Nov 4th because he voted for ObamaCare !"		@MarkUdall		"516695471562428417"	https://twitter.com/DerekEasdon/status/516695471562428417
	2014-09-29 21:06	3	2	"@GloriaMitchell6 @WillisShepherd @davis_IA @netanyahu Mitt supported gun control and obamacare . He never stood tall we pay the price."		@GloriaMitchell6 @WillisShepherd @davis_IA @netanyahu		"516695424334581760"	https://twitter.com/BillWrh1970/status/516695424334581760
	2014-09-29 21:05	0	0	"ObamaCare insurance navigator with rocky history gets even more taxpayer money via the @FoxNews iPhone app http://www. foxnews.com/politics/2014/ 09/29/obamacare-insurance-navigator-with-rocky-history-gets-even-more-taxpayer-money/ …"		@FoxNews		"516695360983818241"	https://twitter.com/CarlisleMia/status/516695360983818241
	2014-09-29 21:05	0	0	""Have you had trouble finding a doctor under Obamacare ? Don't expect narrow networks to grow much in 2015 LA Times" - http:// fw.to/88V116h"				"516695304754581504"	https://twitter.com/BenjaminHodge/status/516695304754581504
	2014-09-29 21:04	1	0	"Study: Obamacare ’s employer exchanges lower costs http:// wapo.st/1uo6o52 via @washingtonpost"		@washingtonpost		"516695151767719936"	https://twitter.com/JHPPL/status/516695151767719936
	2014-09-29 21:04	0	0	"The second sign-up season of #Obamacare has several challenges ahead, @jenhab has the story. http:// politico.pro/1rFSgCi"		@jenhab	#Obamacare	"516695136383012864"	https://twitter.com/POLITICOPro/status/516695136383012864
	2014-09-29 21:04	0	0	"#ACASignups MICHIGAN: Off-Topic: A Personal Request: Please Support Mary Belden! http:// ow.ly/C5nwo #ACA #Obamacare @LOLGOP @Eclectablog"		@LOLGOP @Eclectablog	#ACASignups #ACA #Obamacare	"516695110906810368"	https://twitter.com/charles_gaba/status/516695110906810368
	2014-09-29 21:04	0	0	"#ACASignups MICHIGAN: Off-Topic: A Personal Request: Please Support Mary Belden! http:// ow.ly/C5nwo #ACA #Obamacare @LOLGOP @Eclectablog"		@LOLGOP @Eclectablog	#ACASignups #ACA #Obamacare	"516695109317193728"	https://twitter.com/acasignups/status/516695109317193728
	2014-09-29 21:04	0	0	"Obamacare Website Costs Exceed $2 Billion, Study Finds http:// bloom.bg/1rkAoey via @BloombergNews"		@BloombergNews		"516695100122857472"	https://twitter.com/SEPALabs/status/516695100122857472
	2014-09-29 21:04	0	0	"#KSSen #ObamaCare RT @Timodc : America Rising Orman vid RT @DRUDGE_REPORT : VIDEO: SNEAKY ON OBAMACARE ...” http:// youtu.be/Oes1ASJcFj8"		@Timodc @DRUDGE_REPORT	#KSSen #ObamaCare	"516694978899501056"	https://twitter.com/ByronKoay/status/516694978899501056
	2014-09-29 21:04	0	0	"Switzerland rejects single-payer in landslide, keeps its version of Obamacare http://www. vox.com/2014/9/29/6864 201/single-payer-switzerland-failed?utm_medium=social&utm_source=twitter&utm_campaign=vox&utm_content=article-share-top … via @voxdotcom"		@voxdotcom		"516694931570585600"	https://twitter.com/marleise_/status/516694931570585600
	2014-09-29 21:04	0	0	"@LilaGraceRose @sarahtorre @DailySignal You idiot ! Obamacare PREVENTS abortions !"		@LilaGraceRose @sarahtorre @DailySignal		"516694914877648896"	https://twitter.com/mrclassicalmusi/status/516694914877648896
