username;date;retweets;favorites;text;geo;mentions;hashtags;id;permalink
	2016-09-26 20:48	0	0	"Sure, but the ACA was a smaller expansion of govt than Medicare Part D under Bush II."				"780509494661025792"	https://twitter.com/suvyboy/status/780509494661025792
	2016-09-26 20:48	0	0	"How?...RT @Khanoisseur : This was Trump's response when asked how he plans to replace Obamacare Unfu*^%#%believable pic.twitter.com/h0j4OYA3OG"		@Khanoisseur	#	"780509479255281664"	https://twitter.com/StevenHammal/status/780509479255281664
	2016-09-26 20:48	0	0	"Aye this ain't Obamacare nigga"				"780509288632496128"	https://twitter.com/WillyBlanka/status/780509288632496128
	2016-09-26 20:47	0	0	"Should your insurer have to pay for sex-change operation? Lawsuit in Ohio says yes, under Obamacare and other laws. http:// s.cleveland.com/a3l1pub"				"780509225881600000"	https://twitter.com/SteveKoff/status/780509225881600000
	2016-09-26 20:47	0	0	"The HMS Titanic and USS Obamacare suffered similar fates."				"780509219128680448"	https://twitter.com/Beorn2000/status/780509219128680448
	2016-09-26 20:47	0	0	"Chief Justice Roberts decided Supreme Court agenda is to make LAWS. Remember when he allowed OBAMACARE TAX? pic.twitter.com/Zgfqz95KBR"				"780509191140245504"	https://twitter.com/daynutrition/status/780509191140245504
	2016-09-26 20:47	0	0	"I agree! Just playing on his comment when Obama was signing obamacare . Good guy"				"780509174119538688"	https://twitter.com/garubin1/status/780509174119538688
	2016-09-26 20:47	0	1	"If someone had a chronic condition the couldn't even obtain healthcare pre obamacare"				"780509172064477184"	https://twitter.com/MotownDR/status/780509172064477184
	2016-09-26 20:46	0	0	"8.1 Million Taxpayers Paid $1.7 Billion in Obamacare Penalties in 2014 http:// freebeacon.com/issues/8-1-mil lion-taxpayers-paid-1-7-billion-obamacare-penalties-2014/ …"				"780508954120097792"	https://twitter.com/ezduzit63/status/780508954120097792
	2016-09-26 20:46	1	1	"8.1 Million Taxpayers Paid $1.7 Billion in Obamacare Penalties in 2014 http:// ift.tt/2dmUgAI #WashFreeBeacon #tcot"			#WashFreeBeacon #tcot	"780508836067237888"	https://twitter.com/Onelifetogive/status/780508836067237888
	2016-09-26 20:46	1	0	"What the #ACA marketplaces have in common with a struggling buffet via @HealthPayer http:// bit.ly/2dmMTcz pic.twitter.com/bQS8hbLGOi"		@HealthPayer	#ACA	"780508829612118016"	https://twitter.com/vickiefrieling/status/780508829612118016
	2016-09-26 20:46	0	0	"Was happy to share mine with you"				"780508803888545792"	https://twitter.com/aca_fan1980/status/780508803888545792
	2016-09-26 20:46	0	0	"Obamacare "falling apart": Chairman http:// washex.am/2dwWCfe #REPEAL"			#REPEAL	"780508790852558848"	https://twitter.com/TrumpCritic/status/780508790852558848
	2016-09-26 20:46	0	0	"Washington (DC) Examiner: Obamacare key issue in Nevada Senate race . More #Obama #news - http:// tinyurl.com/ltvgvk"			#Obama #news	"780508747164635136"	https://twitter.com/ObamaInTheNews/status/780508747164635136
	2016-09-26 20:45	0	0	"@realDonaldTrump gets 4 Pinocchios for claim Obama is trying to delay Obamacare enrollment until after election http:// wapo.st/2dn1v7e"		@realDonaldTrump		"780508707369222144"	https://twitter.com/EyeOnInsurance/status/780508707369222144
	2016-09-26 20:45	0	0	"@realDonaldTrump my hubby is concerned he will lose his med ins as he is part time if obamacare gone"		@realDonaldTrump		"780508681003728896"	https://twitter.com/druz33/status/780508681003728896
	2016-09-26 20:45	0	0	"8.1 Million Taxpayers Paid $1.7 Billion in Obamacare Penalties in 2014 http:// ift.tt/2dmUgAI"				"780508580067835907"	https://twitter.com/RightnewsNews/status/780508580067835907
	2016-09-26 20:45	0	0	"Tell CMS Make Copays More Affordable Under Under ACA ... http:// fb.me/Ti8s2o4Z"				"780508511918780416"	https://twitter.com/paspeech/status/780508511918780416
	2016-09-26 20:45	0	0	"lol you are confusing schip with the aca . Unsurprising. Trump loves the poorly educated."				"780508500451471360"	https://twitter.com/warybear/status/780508500451471360
	2016-09-26 20:44	14	11	"How Obamacare Fleeces Millennials: http:// on.wsj.com/2dkESVD . I've been saying this for years: https:// ari.aynrand.org/issues/governm ent-and-business/health-care/Obamacare-creates-a-new-class-of-free-riders#filter-bar … w/ @yaronbrook"		@yaronbrook	#filter	"780508477114507264"	https://twitter.com/basurituparna/status/780508477114507264
	2016-09-26 20:44	0	1	"Empty promises with no results, just like Obamacare , my insurance is way more expensive now! @MotownDR @LilahWoodsMusic @DrJillStein"		@MotownDR @LilahWoodsMusic @DrJillStein		"780508476518731777"	https://twitter.com/gardencatlady/status/780508476518731777
	2016-09-26 20:44	6	2	"Won't be the last time Congress is asked to clean up the messes left by Obamacare . https:// twitter.com/JoshMBlackman/ status/780507618955632640 …"				"780508432063397888"	https://twitter.com/baseballcrank/status/780508432063397888
	2016-09-26 20:44	0	0	"Evan Bayh is a coward who resigned his senate seat instead of owning his vote for Obamacare to the Indiana electorate."				"780508409187577857"	https://twitter.com/Hot_take_king/status/780508409187577857
	2016-09-26 20:44	0	0	"THR: Obamacare key issue in Nevada Senate race http:// ift.tt/2dmUxnq (WASHEX)"				"780508406490759168"	https://twitter.com/HWDRepublican/status/780508406490759168
	2016-09-26 20:44	1	2	"And of course, #Obamacare is in peril. Via @KaleighRogers http:// motherboard.vice.com/read/grading-t he-2016-presidential-candidates-on-health … #debatenight pic.twitter.com/Y3FWLEGstu"		@KaleighRogers	#Obamacare #debatenight	"780508299322089472"	https://twitter.com/anrao/status/780508299322089472
	2016-09-26 20:44	1	3	"Imagine Rubio replying to HRC with an actual plan to replace the ACA with a far more effective plan which increases free market competition."				"780508285862412288"	https://twitter.com/MWPolitics/status/780508285862412288
	2016-09-26 20:44	26	9	"Chairman: " Obamacare falling apart," another 131,000 lose coverage http:// washex.am/2dwWCfe pic.twitter.com/QhicDVFGXO"				"780508256699572224"	https://twitter.com/dcexaminer/status/780508256699572224
	2016-09-26 20:43	0	0	"A. Trump has no plan. B. If Big Pharma isn't in charge of drug pricing, costs go way down. C. States must fund Medicaid/ ACA . #Complicated https:// twitter.com/victoriarcoley /status/780504057094017024 …"			#Complicated	"780508189301219328"	https://twitter.com/mrs_rainey1970/status/780508189301219328
	2016-09-26 20:43	0	0	"It’s Easy for Obamacare Critics to Overlook the Merits of Medicaid Expansion http:// nyti.ms/2d3fbVU"				"780508078747881473"	https://twitter.com/AmidonChris/status/780508078747881473
	2016-09-26 20:42	0	0	"#Obamacare installs new scrutiny, fines for #charitable hospitals that treat uninsured people http:// dailycaller.com/2013/08/08/oba macare-installs-new-scrutiny-fines-for-charitable-hospitals-that-treat-uninsured-people/#ixzz2iHHXyIPt … #tcot #pjnet"			#Obamacare #charitable #ixzz2iHHXyIPt #tcot #pjnet	"780507974213120000"	https://twitter.com/DefundTheGOP101/status/780507974213120000
	2016-09-26 20:42	0	0	"Yeah, I had a sinus head ache this morning, sleep got rid of it but yeah"				"780507847360704512"	https://twitter.com/aca_fan1980/status/780507847360704512
	2016-09-26 20:42	0	0	"Failing Obamacare nonprofit co-ops add to ‘Death Spiral’ fears http://www. benefitspro.com/2016/09/23/fai ling-obamacare-nonprofit-co-ops-add-to-death-sp?kw=Failing+Obamacare+nonprofit+co-ops+add+to+%E2%80%98Death+Spiral%E2%80%99+fears&cn=20160926&pt=Daily&src=EMC-Email_editorial&et=editorial&bu=BenefitsPRO&page_all=1 …"				"780507827613802496"	https://twitter.com/ControlMyCare/status/780507827613802496
	2016-09-26 20:42	0	0	"Burr says North Carolinians facing Obamacare price jumps: Based on rate increases proposed to North Carolina’s… http:// m.tbnn.it/MLKxrs"				"780507772223795200"	https://twitter.com/POLSSacramento/status/780507772223795200
	2016-09-26 20:41	3	6	"Its working, and better than expected. Obamacare fail: My family plan canceled again, again, again."				"780507721070018561"	https://twitter.com/phillyrich1/status/780507721070018561
	2016-09-26 20:41	0	1	"terry ask good question get pie in sky bout new idea. why repeal good parts of obamacare ? #answerTerry"			#answerTerry	"780507713339928576"	https://twitter.com/ChuckDrocam/status/780507713339928576
	2016-09-26 20:41	0	5	"#DearWashington universal healthcare please! The ACA is still obscenely expensive for most."			#DearWashington	"780507657887035392"	https://twitter.com/vonkoz/status/780507657887035392
	2016-09-26 20:41	0	0	""I'll take 'What's Obamacare , Alex?" for $500, please."				"780507620415188992"	https://twitter.com/jp_in_nj/status/780507620415188992
	2016-09-26 20:41	1	1	"House to vote on ObamaCare mandate exemption Tuesday http:// thehill.com/policy/healthc are/297851-house-to-vote-on-obamacare-mandate-exemption-tuesday … #unraveled"			#unraveled	"780507618955632640"	https://twitter.com/JoshMBlackman/status/780507618955632640
	2016-09-26 20:41	0	0	"Call your reps. let them know we support government shutdown over the ACA . We have their six. They need to hear from us now. #PJNET"			#PJNET	"780507579222859776"	https://twitter.com/CuringStupid/status/780507579222859776
	2016-09-26 20:41	0	0	"Hope you feel better. Hugs"				"780507503801106432"	https://twitter.com/aca_fan1980/status/780507503801106432
	2016-09-26 20:40	0	0	"How subscription food delivery companies are catering to time-starved Canadians, via @StrategyOnline http:// ow.ly/45RX304ztYb pic.twitter.com/e5QCi5AENf"		@StrategyOnline		"780507308665208832"	https://twitter.com/ACA_tweets/status/780507308665208832
	2016-09-26 20:40	0	0	"Patrick can stick it! #Obamacare rocks! Repeal so Millions don't have Healthcare while Patrick laps up free insurance? #fail"			#Obamacare #fail	"780507264532774913"	https://twitter.com/JolenesTrailer/status/780507264532774913
	2016-09-26 20:39	1	0	"8.1 Million Taxpayers Paid $1.7 Billion in Obamacare Penalties in 2014 http:// freebeacon.com/issues/8-1-mil lion-taxpayers-paid-1-7-billion-obamacare-penalties-2014/ …"				"780507089336688644"	https://twitter.com/MOTT7/status/780507089336688644
	2016-09-26 20:39	0	0	"What’s wrong w/ health insurance and how to fix it. #OpenEnrollment #ACA http:// ctt.ec/ubbV1+ pic.twitter.com/Gw0FLny6CO"			#OpenEnrollment #ACA	"780507079857545220"	https://twitter.com/GregoryPings/status/780507079857545220
	2016-09-26 20:39	0	0	"This was Trump's response when asked how he plans to replace Obamacare Unfuckingbelievable pic.twitter.com/afCBwB7CHS"				"780507019757309952"	https://twitter.com/Kestin/status/780507019757309952
	2016-09-26 20:38	0	0	"Before #ACA , insurance premiums rose 15%/year except that decade it was 20%/year. We haven't see 15% since #ACA enacted. @RifleRun"		@RifleRun	#ACA #ACA	"780506914283151360"	https://twitter.com/EdDarrell/status/780506914283151360
	2016-09-26 20:38	0	0	"I don't know too many people who would call alergies friends, so I'd say you're in the majority there"				"780506908612497408"	https://twitter.com/aca_fan1980/status/780506908612497408
	2016-09-26 20:38	0	0	"DEMOCRATS' OBAMACARE was never about HEALTH CARE it was about a takover of the health system. pic.twitter.com/4cNPTi6Nv1"				"780506896637779968"	https://twitter.com/daynutrition/status/780506896637779968
	2016-09-26 20:38	11	29	"ObamaCare has been nothing but trouble for patients in Texas, raising costs and limiting options. https://www. texastribune.org/2016/08/24/hea lth-insurers-exit-spells-trouble-obamacare-texa/ …"				"780506750558490624"	https://twitter.com/georgepbush/status/780506750558490624
	2016-09-26 20:37	0	0	"As Clinton-Trump Debate Looms, It's Drug Prices, Not Obamacare , Taking Stage via @forbes http://www. forbes.com/sites/brucejap sen/2016/09/25/as-clinton-trump-debate-looms-its-drug-prices-not-obamacare-taking-stage/#35d6d20477f1 … #hadm3322"		@forbes	#35d6d20477f1 #hadm3322	"780506553392648193"	https://twitter.com/m_guzman16/status/780506553392648193
	2016-09-26 20:36	3	1	"USA: 'A Bunch of Crap' That Obamacare Can't Be Undone! #RT http:// conscores.org/eel4 #TCOT #CCOT #MakeDCListen #TeaParty #Conservatives"			#RT #TCOT #CCOT #MakeDCListen #TeaParty #Conservatives	"780506368444739585"	https://twitter.com/bobfox321/status/780506368444739585
	2016-09-26 20:36	0	0	"Tenn. Blues withdrawing from ACA exchanges in Nashville, Memphis and Knoxville: BlueCross BlueShi... http:// bit.ly/2dux67x #healthcare"			#healthcare	"780506233941864448"	https://twitter.com/ChrisHartman/status/780506233941864448
	2016-09-26 20:36	0	0	"Tenn. Blues withdrawing from ACA exchanges in Nashville, Memphis and Knoxville: BlueCross BlueShield of Tenne... http:// bit.ly/2d4pGJX"				"780506229500055552"	https://twitter.com/csphealthcare/status/780506229500055552
	2016-09-26 20:36	0	0	"Tenn. Blues withdrawing from ACA exchanges in Nashville, Memphis and Knoxville http:// bit.ly/2dux67x"				"780506227474255872"	https://twitter.com/dchealer/status/780506227474255872
	2016-09-26 20:36	0	1	"Tenn. Blues withdrawing from ACA exchanges in Nashville, Memphis and Knoxville http:// bit.ly/2dux67x"				"780506227163828224"	https://twitter.com/DrZemella/status/780506227163828224
	2016-09-26 20:35	0	0	"Tenn. Blues withdrawing from ACA exchanges in Nashville, Memphis and Knoxville: BlueCross BlueShield of Tenne... http:// bit.ly/2d4pzyj"				"780506224181727232"	https://twitter.com/SuiteRx/status/780506224181727232
	2016-09-26 20:35	0	0	"@modrnhealthcr Tenn. Blues withdrawing from ACA exchanges in Nashville, Memphis and Knoxville: BlueCross Blue... http:// bit.ly/2d4pzyj"		@modrnhealthcr		"780506222197825536"	https://twitter.com/TaxTechGuru/status/780506222197825536
	2016-09-26 20:35	0	0	"Tenn. Blues withdrawing from ACA exchanges in Nashville, Memphis and Knoxville: BlueCross BlueShield of Tenne... http:// bit.ly/2dux67x"				"780506218141880320"	https://twitter.com/shelbylaneMD/status/780506218141880320
	2016-09-26 20:35	0	0	"Tenn. Blues withdrawing from ACA exchanges in Nashville, Memphis and Knoxville: BlueCross ... http:// bit.ly/2dux67x via @modrnhealthcr"		@modrnhealthcr		"780506198088962048"	https://twitter.com/HITpol/status/780506198088962048
	2016-09-26 20:35	0	0	"dcexaminer: Obamacare becomes a key issue in the Nevada Senate race http:// washex.am/2cQBA7q pic.twitter.com/CiPyre98lO"				"780506040961990656"	https://twitter.com/AliEesq/status/780506040961990656
	2016-09-26 20:35	0	0	"Are you ready for #ACA changes? Avoid the common errors and become knowledgeable. http:// gag.gl/60SNaL pic.twitter.com/3UGC4UAMws"			#ACA	"780506004031234048"	https://twitter.com/randycl75006219/status/780506004031234048
	2016-09-26 20:34	0	2	"@GOPLeader @CraigCaplan #Obamacare has been great for me! Saved my life! If you spent more time trying to help..."		@GOPLeader @CraigCaplan	#Obamacare	"780505958560702465"	https://twitter.com/JolenesTrailer/status/780505958560702465
	2016-09-26 20:34	0	0	"Guy in Nazi uniform shooting folks in my hometown on same day my health insurance company cancels ACA coverage? I think that's a bingo!"				"780505791774101504"	https://twitter.com/whittlz/status/780505791774101504
	2016-09-26 20:34	0	0	"Forget tech, look into #HealthCare after Obamacare goes. [9RsV]"			#HealthCare	"780505741387898880"	https://twitter.com/kapo32712/status/780505741387898880
	2016-09-26 20:34	0	1	"@32Advisors I don't know what planet your living on. I work 1 on 1 with businesses and indivduals in 100's each year no one likes obamacare ."		@32Advisors		"780505739815182337"	https://twitter.com/dahtcom/status/780505739815182337
	2016-09-26 20:34	0	0	"Forget tech, look into #HealthCare after Obamacare goes. [9RsV]"			#HealthCare	"780505738439368704"	https://twitter.com/melb32936/status/780505738439368704
	2016-09-26 20:33	1	9	"Tired of the lies,like Obamacare was going to fix our health insurance crisis. It's worse now! @LilahWoodsMusic @MotownDR @DrJillStein"		@LilahWoodsMusic @MotownDR @DrJillStein		"780505664103735296"	https://twitter.com/gardencatlady/status/780505664103735296
	2016-09-26 20:32	0	0	"@SpeakerRyan @NancyPelosi With all due respect, Republicans have been a disaster relative to ACA . Eight yrs of obst"		@SpeakerRyan @NancyPelosi		"780505461430755328"	https://twitter.com/LeonLSutton/status/780505461430755328
	2016-09-26 20:32	0	1	"Do, on the whole, #ACA performing much better than before ACA , on your standard.?@RifleRun"		@RifleRun	#ACA	"780505435690242048"	https://twitter.com/EdDarrell/status/780505435690242048
	2016-09-26 20:32	0	0	"@HofstraU ..Lets hear:How will they create more jobs? How will they improve Obamacare ? How can we get people off of welfare?"		@HofstraU		"780505423652806657"	https://twitter.com/gracie0102/status/780505423652806657
	2016-09-26 20:32	0	0	"Are you ready for #ACA changes? Avoid the common errors and become knowledgeable. http:// gag.gl/60SNaL pic.twitter.com/RRj4ZbbgT5"			#ACA	"780505402605707264"	https://twitter.com/sgately45/status/780505402605707264
	2016-09-26 20:31	0	0	"WORLD HEALTH MEDICAL ALERT! I URGE AMERICANS IMPACTED BY H1N1RISERVIRUS SYMPTOMS CAN VARY & KILL OBAMACARE ENROLLUSA pic.twitter.com/l2u5FwimJm"				"780505185776959488"	https://twitter.com/EleanorjwaltonG/status/780505185776959488
	2016-09-26 20:31	0	0	"Tenn. Blues withdrawing from ACA exchanges in Nashville, Memphis and Knoxville http:// ow.ly/N2GK504RFPG"				"780505169222131713"	https://twitter.com/MRIGlobalHCF/status/780505169222131713
	2016-09-26 20:31	0	0	"Blue Cross Blue Shield TN leaving affordable care ( ACA ) markets in TN – http:// ift.tt/2cyN2sf https:// nashvilleins.wordpress.com/2016/09/26/blu e-cross-blue-shield-tn-leaving-affordable-care-aca-markets-in-tn-httpift-tt2cyn2sf …"				"780505119762677760"	https://twitter.com/midtninsurance/status/780505119762677760
	2016-09-26 20:31	0	0	"@TeamCavuto That doink Wolf you had on is clueless as far as O-care. Have him produce some of the newly insured who are happy with ACA ."		@TeamCavuto		"780505104474529792"	https://twitter.com/rvrrat520/status/780505104474529792
	2016-09-26 20:31	0	0	"Koenig on insurers/ Obamacare bailouts. He's right and you should be concerned https:// twitter.com/freedompartner s/status/780489398454513664 …"				"780505100787847168"	https://twitter.com/N_A_Nascimento/status/780505100787847168
	2016-09-26 20:31	0	0	"On the road to acquire the notorious ACA certification. #WhatsYourNextAdventure https://www. instagram.com/p/BK1ScW2BgAF/"			#WhatsYourNextAdventure	"780505011369365504"	https://twitter.com/KedynSierra/status/780505011369365504
	2016-09-26 20:30	0	0	"Hillary is going to be smacked down on email, Benghazi, Syria, foundation, crime bill, TPP, trade, ACA , bribery...."				"780504954595311617"	https://twitter.com/szym_rob/status/780504954595311617
	2016-09-26 20:30	0	1	"Trumps response on replacing Obamacare . What a world. #tcnt pic.twitter.com/FvxipkeTG0"			#tcnt	"780504941358002176"	https://twitter.com/AndrewLeeTCNT/status/780504941358002176
	2016-09-26 20:30	4	2	"Obamacare becomes a key issue in the Nevada Senate race http:// washex.am/2cQBA7q pic.twitter.com/w9dMguljKj"				"780504931144990720"	https://twitter.com/dcexaminer/status/780504931144990720
	2016-09-26 20:30	2	0	"Blue Cross to stop selling individual ACA policies http:// ow.ly/uX1P304zAK7"				"780504870218559488"	https://twitter.com/AlanVernon/status/780504870218559488
	2016-09-26 20:30	0	0	"Burr says North Carolinians facing Obamacare price jumps http://www. mcclatchydc.com/news/nation-wo rld/national/article104250326.html … pic.twitter.com/KTi0ZGg7xN"				"780504817781268480"	https://twitter.com/McClatchyDC/status/780504817781268480
	2016-09-26 20:30	0	0	"and rerunning on cspan 3, 9/14 Energy & Commerce Committee bitching about ACA and trying to take our healthcare. You assholes better vote."				"780504723459805189"	https://twitter.com/LaPajamas/status/780504723459805189
	2016-09-26 20:29	2	1	"@TeamCavuto Hillary /Obama equate part time burger flipping jobs with cutting 6k NASA rocket scientists, ACA insured 20M put 32M off at same"		@TeamCavuto		"780504663460163584"	https://twitter.com/JustKate038/status/780504663460163584
	2016-09-26 20:29	1	1	"@TeamCavuto @realDonaldTrump i'm sick and tired of the Democrats applauding 20 million people on Obamacare , but I'm tired of paying for it!"		@TeamCavuto @realDonaldTrump		"780504653268221952"	https://twitter.com/JayChar15376136/status/780504653268221952
	2016-09-26 20:29	0	0	"got insurance via ACA when I know for a FACT cause I am 1 in 5 households out of work Due to ACA , EPA, etc.. #goaway"			#goaway	"780504649841405952"	https://twitter.com/NaNaGsFunkyJunk/status/780504649841405952
	2016-09-26 20:29	0	1	"And yet this guy forgets that more people lost their coverage because of Obamacare then those who got it. #YourWorld"			#YourWorld	"780504560691515396"	https://twitter.com/Politcswatch/status/780504560691515396
	2016-09-26 20:29	2	7	"I'm not I am voting against crony capitalism, lying & crookedness, Obamacare & poor foreign policy decisions. I'm voting DT"				"780504513518206980"	https://twitter.com/AMiddleClassGuy/status/780504513518206980
	2016-09-26 20:28	0	0	"Thats not true. It's documented that major Repubs swore 2 oppose every single thing Obama proposed. Obamacare was repub idea"				"780504398023659520"	https://twitter.com/prolepac/status/780504398023659520
	2016-09-26 20:28	3	1	"Obamacare "mixed blessing" at best & Clinton welfare reform caused massive cuts based on racist stereotype of Reagan's admin. https:// twitter.com/YeaYouRite/sta tus/780488867497414656 …"				"780504357230014465"	https://twitter.com/HipGnosis23/status/780504357230014465
	2016-09-26 20:28	0	0	"@potus #healthyadulting scam needs #millennials to subsidize us old people #ACA is a failure @WSJhealth #Debates2016 https:// twitter.com/unitedwaychi/s tatus/780486867972161536 …"		@potus @WSJhealth	#healthyadulting #millennials #ACA #Debates2016	"780504317295939585"	https://twitter.com/MarkSeely2/status/780504317295939585
	2016-09-26 20:28	0	0	".BCBSNC said it will remain in NC's ACA exchange, but another Blues plan announced its exit... http:// ow.ly/a71N304AmZP"				"780504287776501761"	https://twitter.com/docprogrammer/status/780504287776501761
	2016-09-26 20:28	0	0	"ColumbiaMed: RT CU_Nursing: #ACA has dominated most healthcare conversations this election cycle says Amy Carnevale #CUHealthDebate"			#ACA #CUHealthDebate	"780504243149139968"	https://twitter.com/IvyScience/status/780504243149139968
	2016-09-26 20:28	0	0	"Are you ready for #ACA changes? Avoid the common errors and become knowledgeable. http:// gag.gl/60SNaL pic.twitter.com/yNz2lCbswc"			#ACA	"780504223431716864"	https://twitter.com/EWILSON76/status/780504223431716864
	2016-09-26 20:27	7	16	"ALPINE CANADA LAUNCHES NEW FAN LOYALTY PROGRAM: CLUB ACA http:// bit.ly/2cyMyCs pic.twitter.com/xDkStlqy8M"				"780504095626964992"	https://twitter.com/Alpine_Canada/status/780504095626964992
	2016-09-26 20:27	0	1	"How's that Nazi shit going for you #GOP ?? Keep trying to repeal #aca but do NOTHING ABOUT WEAPONS and candidates who spew hate! #RipGop https:// twitter.com/slate/status/7 80496855293624320 …"			#GOP #aca #RipGop	"780504033689600000"	https://twitter.com/DebGoBlue/status/780504033689600000
	2016-09-26 20:26	0	0	"Fact Checker: Trump falsely claims that Obama is trying to ‘delay’ Obamacare enrollment until https://www. washingtonpost.com/news/fact-chec ker/wp/2016/09/26/trumps-claim-that-obama-is-trying-to-delay-obamacare-enrollment-until-after-the-election/ … pic.twitter.com/VRCUjmw7K9"				"780503742089158656"	https://twitter.com/ZAKOOLISA/status/780503742089158656
	2016-09-26 20:26	0	0	"Biloxi (MS) Sun Herald: Burr says North Carolinians facing Obamacare price jumps . More #Obama #news - http:// tinyurl.com/ltvgvk"			#Obama #news	"780503712536129536"	https://twitter.com/ObamaInTheNews/status/780503712536129536
	2016-09-26 20:25	0	0	"All you need to know about #ACA Employee Subsidy Notifications http://www. nisbenefits.com/your-guide-to- aca-employee-subsidy-notifications/ …"			#ACA	"780503706139709440"	https://twitter.com/NISErikKass/status/780503706139709440
	2016-09-26 20:25	0	1	"More an more providers are dropping out of the support of the ACA program."				"780503700166942720"	https://twitter.com/davidn4138/status/780503700166942720
	2016-09-26 20:25	2	2	"Well Obamacare does it again.premiums went up 60% today. Anyone reading this thats voting for Hillary, could you dumb-ass please explain why"				"780503674732810241"	https://twitter.com/GODBLESSUSA88/status/780503674732810241
	2016-09-26 20:25	0	0	"More Hispanics Treated at Breast Cancer Center After Obamacare http://www. philly.com/philly/health/ topics/HealthDay715140_20160926_More_Hispanics_Treated_at_Breast_Cancer_Center_After_Obamacare.html … via @phillyhealthsci #BCSM #cancer #obamacare"		@phillyhealthsci	#BCSM #cancer #obamacare	"780503626355707904"	https://twitter.com/SusanDFCI/status/780503626355707904
	2016-09-26 20:25	0	0	"Trump wants to take away Obamacare . That will limit the jobs I can get to temp gigs or working for a"				"780503575554383872"	https://twitter.com/MenaB719/status/780503575554383872
	2016-09-26 20:25	0	0	"individual household. Having insurance from Obamacare means I am already insured so it puts me on equal"				"780503570907103232"	https://twitter.com/MenaB719/status/780503570907103232
	2016-09-26 20:25	0	0	"Are you ready for #ACA changes? Avoid the common errors and become knowledgeable. http:// gag.gl/60SNaL pic.twitter.com/Yi3EzLDlEC"			#ACA	"780503512182579205"	https://twitter.com/ryhooper12/status/780503512182579205
	2016-09-26 20:24	0	0	". @BCBSNC said it will remain in NC's ACA exchange, but another Blues plan announced its exit... http:// ow.ly/a71N304AmZP"		@BCBSNC		"780503449314013184"	https://twitter.com/PracticeMgt/status/780503449314013184
