username;date;retweets;favorites;text;geo;mentions;hashtags;id;permalink
	2016-08-29 22:24	0	0	"#NoBama #IsHeGoneYet ? ObamaCare coverage options disappearing across country, report finds | Fox News | http:// fxn.ws/2c9BmeT"			#NoBama #IsHeGoneYet	"770386654456578048"	https://twitter.com/TRUTH_USA_2016/status/770386654456578048
	2016-08-29 22:24	0	0	"@SpeakerRyan @HouseGOP How many were uninsured before Obamacare ? Fox News just listed $3 bil+ lost by ins co's. How many $/per???"		@SpeakerRyan @HouseGOP		"770386624521854980"	https://twitter.com/sbknudsen1/status/770386624521854980
	2016-08-29 22:24	0	0	"What Aetna’s Withdrawal Means for Obamacare http:// ln.is/www.newyorker. com/ma/S5GnD … via @newyorker"		@newyorker		"770386593123274753"	https://twitter.com/moddem40/status/770386593123274753
	2016-08-29 22:24	0	0	"And thanks to Obamacare many more will continue to do so!"				"770386584826814465"	https://twitter.com/cchamberlinfis/status/770386584826814465
	2016-08-29 22:24	0	0	"ObamaCare coverage options disappearing across country, report finds via the @FoxNews App http://www. foxnews.com/politics/2016/ 08/29/obamacare-coverage-options-disappearing-across-country-report-finds.html …"		@FoxNews		"770386567961546752"	https://twitter.com/MredfromEP/status/770386567961546752
	2016-08-29 22:24	0	0	"Don't see how Josh Earnest keeps a straight face claiming Obamacare is working! #StraightfaceEarnest"			#StraightfaceEarnest	"770386550399963136"	https://twitter.com/FrOnTiEr5150/status/770386550399963136
	2016-08-29 22:23	0	0	"#Obamacare lets demand the government employees sign on to Obamacare & follow the laws they impose on us starting with them"			#Obamacare	"770386541843587072"	https://twitter.com/LHICKS123/status/770386541843587072
	2016-08-29 22:23	0	1	"lmao will dooo bahaha"				"770386521538965505"	https://twitter.com/aca_aikae/status/770386521538965505
	2016-08-29 22:23	0	0	"Every Forecastor Liberal & Conservative say #Obamacare is in a Death Spiral! I just know my Fucking Gov Lied to me! https:// twitter.com/gop/status/770 381522108944384 …"			#Obamacare	"770386490824101888"	https://twitter.com/SatiricalMuse/status/770386490824101888
	2016-08-29 22:23	1	1	"Kaiser Foundation says 1/3 of US served by 1 #OBAMACARE Insurer in 2017, +7% Y/Y, due to low enrollment & high costs pic.twitter.com/rurUofjuZI"			#OBAMACARE	"770386455684190209"	https://twitter.com/wjboynton/status/770386455684190209
	2016-08-29 22:23	1	1	"Nah you didn't. Text Mai so we can have a quick sesh"				"770386437434781696"	https://twitter.com/ceemfcknkay/status/770386437434781696
	2016-08-29 22:23	0	0	"Bad timing for Obamacare unravelling cc: Clinton campaign"				"770386425212796929"	https://twitter.com/investwonk/status/770386425212796929
	2016-08-29 22:23	0	0	"@AndreaTantaros obamacare another dem. failure ! They never know what they are doing! Big promises , no positive results ! The usual !"		@AndreaTantaros		"770386381323591681"	https://twitter.com/whithorn20/status/770386381323591681
	2016-08-29 22:23	0	0	"(FOX NEWS) - " ObamaCare Coverage Options Disappearing Across Country, Report Finds." Nearly ONE THIRD of U.S. counti… https:// lnkd.in/emG3taP"				"770386371886198784"	https://twitter.com/Healthinsurane4/status/770386371886198784
	2016-08-29 22:23	1	1	"oh and Obamacare is as big of failure as the rest of Obama's presidency! He is a failure and so are you!"				"770386355121639424"	https://twitter.com/AndrewLouis7/status/770386355121639424
	2016-08-29 22:23	4	4	"Obama says: Even if Obamacare is repealed, it does not matter, as you can keep it anyway. pic.twitter.com/nvoVvkiH8A"				"770386330010255360"	https://twitter.com/JoeFreedomLove/status/770386330010255360
	2016-08-29 22:22	1	1	"@CeeMuthafcknKay did I ever tell u Gloria unfollowed bahahaha"		@CeeMuthafcknKay		"770386292345483265"	https://twitter.com/aca_aikae/status/770386292345483265
	2016-08-29 22:22	3	5	"ObamaCare coverage options disappearing across country, report finds http://www. foxnews.com/politics/2016/ 08/29/obamacare-coverage-options-disappearing-across-country-report-finds.html … via the @FoxNews Android app"		@FoxNews		"770386286213378048"	https://twitter.com/holdem00/status/770386286213378048
	2016-08-29 22:22	1	1	"Trump shares startling Obamacare statistics http:// redstatewatcher.com/article.asp?id =35031 … GET RID OF IT! iT'S A DISASTER!"				"770386281574653953"	https://twitter.com/anny4462/status/770386281574653953
	2016-08-29 22:22	0	0	"Veterans Healthcare a failure. ObamaCare a failure. No integrity at FBI & Justice Dept. what a rat bastard you are @POTUS - Vote Trump"		@POTUS		"770386258199736320"	https://twitter.com/TussahawTess/status/770386258199736320
	2016-08-29 22:22	0	0	"DEMS and health insurance equal 0 As Obamacare choices dwindle, feds face consumer, political backlash http:// usat.ly/2bMvtAE via @USATODAY"		@USATODAY		"770386211768832000"	https://twitter.com/thebull_is/status/770386211768832000
	2016-08-29 22:22	2	1	"Obamacare Scheme Imploding Ahead of Schedule! http:// goo.gl/0Fvnhh via @theipatriot"		@theipatriot		"770386209633886208"	https://twitter.com/Scrufey21/status/770386209633886208
	2016-08-29 22:22	0	0	"No you won't Donald. You have absolutely no clue about the benefits &complexity of the ACA . 9M have health insurance https:// twitter.com/realDonaldTrum p/status/770381482229657602 …"				"770386205552873472"	https://twitter.com/CarlsbadDreamin/status/770386205552873472
	2016-08-29 22:22	0	0	"Obama says: My deal in supporting Hillary: she promised to keep the Obamacare name even if a Hillarycare is done. pic.twitter.com/fNRUHGrbe8"				"770386180646969344"	https://twitter.com/JoeFreedomLove/status/770386180646969344
	2016-08-29 22:22	0	0	"Obamacare Marketplaces Are in Trouble. What Can Be Done? - New York Times http:// ift.tt/2c5r0cX"				"770386161298771968"	https://twitter.com/DavidThinkr/status/770386161298771968
	2016-08-29 22:22	0	0	"Obviously Muslim Obama & all his "Demwits" have again lied to "We The People" regarding Obamacare ! The Dems to change their party to LIARS."				"770386154864513024"	https://twitter.com/JudyIngram36/status/770386154864513024
	2016-08-29 22:22	0	0	". @realDonaldTrump Premiums were spiking long before ACA ."		@realDonaldTrump		"770386147893649409"	https://twitter.com/TruthCopy/status/770386147893649409
	2016-08-29 22:22	0	0	"Obamacare Marketplaces Are in Trouble. What Can Be Done? - New York Times http:// bit.ly/2c0KWyG"				"770386122321039360"	https://twitter.com/luciedefaux523/status/770386122321039360
	2016-08-29 22:22	1	10	"ACA also eliminated pre-existing conditions. Trump has no clue what he's talking about...as usual!"				"770386117170302976"	https://twitter.com/pokie3154/status/770386117170302976
	2016-08-29 22:22	1	1	"@WinnaWinna2016 @BreitbartNews Remember Obamacare"		@WinnaWinna2016 @BreitbartNews		"770386115136253956"	https://twitter.com/martinjj1807/status/770386115136253956
	2016-08-29 22:22	0	0	"What you mean is you will get rid of Obamacare . Don't bullshit the people of US by saying you will replace it."				"770386070689153024"	https://twitter.com/James_Wood78/status/770386070689153024
	2016-08-29 22:22	0	0	"Just think -- when you lose in November and have a breakdown, you can get good mental health care under Obamacare ..."				"770386041899474945"	https://twitter.com/Ohnjaye4/status/770386041899474945
	2016-08-29 22:21	2	2	"Q:Who could possibly have predicted that #Obamacare would Collapse?? A:Any Thinking Person & Remember~It was Sold to the People w/LIES"			#Obamacare	"770386023473905665"	https://twitter.com/LAGraham64/status/770386023473905665
	2016-08-29 22:21	0	0	"ObamaCare , employers pull plug millions of health plans, CBO report | Fox News | http:// fxn.ws/1UxpFi2 -We can't afford 4 more Dem Years."				"770386003815239680"	https://twitter.com/Hrley/status/770386003815239680
	2016-08-29 22:21	0	0	"big words in the news today: Apple/Ireland, Kaepernick, Mondelez/Hershey, EpiPen, Wilder, Obamacare"				"770385968977309698"	https://twitter.com/honnoldMP/status/770385968977309698
	2016-08-29 22:21	1	1	"Aww, thanks Bm. One of these days I will. Haha"				"770385938811789312"	https://twitter.com/ceemfcknkay/status/770385938811789312
	2016-08-29 22:21	0	0	"And so Obamacare medical weed for his daughter while enjoying rock festival!"				"770385938325262336"	https://twitter.com/AliciaDede/status/770385938325262336
	2016-08-29 22:21	604	574	"ObamaCare coverage options disappearing across country, report finds via the @FoxNews App http://www. foxnews.com/politics/2016/ 08/29/obamacare-coverage-options-disappearing-across-country-report-finds.html …"		@FoxNews		"770385935665987584"	https://twitter.com/RealJamesWoods/status/770385935665987584
	2016-08-29 22:21	0	0	"ObamaCare coverage options disappearing across country, report finds via the @FoxNews App http://www. foxnews.com/politics/2016/ 08/29/obamacare-coverage-options-disappearing-across-country-report-finds.html …"		@FoxNews		"770385893177888768"	https://twitter.com/mariososa1238/status/770385893177888768
	2016-08-29 22:21	6	11	"Clinton also talked David Duke (a "despicable man"), ACA news ("costs are going up") & Nov 8 ("[I want] to win as resoundingly as possible")"				"770385854867107841"	https://twitter.com/rubycramer/status/770385854867107841
	2016-08-29 22:21	0	0	"Won't be fast enough!! Obamacare on the backs of folks like me on Medicare.We are bearing the cost"				"770385815616704512"	https://twitter.com/DeplorableCarol/status/770385815616704512
	2016-08-29 22:21	3	2	"Obama says: The Leftist MSM media is ignoring the collapse of Obamacare because I have been plugging up the holes. pic.twitter.com/9ohnlPzV2k"				"770385802815676421"	https://twitter.com/JoeFreedomLove/status/770385802815676421
	2016-08-29 22:21	0	0	"ObamaCare coverage options disappearing across country, report finds http://www. foxnews.com/politics/2016/ 08/29/obamacare-coverage-options-disappearing-across-country-report-finds.html … via the @FoxNews Android app"		@FoxNews		"770385802488446977"	https://twitter.com/crzybilly74/status/770385802488446977
	2016-08-29 22:21	0	0	"So you're going to make all people insured under Obamacare uninsured again? -- that will cost the country more money ..."				"770385800743772160"	https://twitter.com/Ohnjaye4/status/770385800743772160
	2016-08-29 22:20	0	1	"Those premium spikes are with or without ACA . What will congress do without ACA ? DonTheCon will not be close to White House"				"770385777964351489"	https://twitter.com/pokie3154/status/770385777964351489
	2016-08-29 22:20	23	25	"@kevincorke I am a nurse & Obamacare has been a failure from the word go.High deductibles & lack of choice of doctors. NO tweaking will help"		@kevincorke		"770385775603122178"	https://twitter.com/dblozik/status/770385775603122178
	2016-08-29 22:20	0	0	"Obamacare Marketplaces Are in Trouble. What Can Be Done? - New York Times http:// bit.ly/2ca0ke2"				"770385775485747202"	https://twitter.com/bitznews/status/770385775485747202
	2016-08-29 22:20	0	0	"#MP Obamacare Marketplaces Are in Trouble. What Can Be Done? - New York Times"			#MP	"770385773199757314"	https://twitter.com/MinutePost/status/770385773199757314
	2016-08-29 22:20	0	1	":Unspeakable! And we would replace Obamacare w smthng business owners like better?"				"770385772138602496"	https://twitter.com/EverettTheda/status/770385772138602496
	2016-08-29 22:20	0	0	"ObamaCare coverage options disappearing across country, report finds | Fox News http://www. foxnews.com/politics/2016/ 08/29/obamacare-coverage-options-disappearing-across-country-report-finds.html …"				"770385761795465216"	https://twitter.com/carlislecockato/status/770385761795465216
	2016-08-29 22:20	0	0	"wht is DT going2replace Obamacare w/ Wht happens 2the 20m ppl on it wht happens2folks w/ pre-existing illness"				"770385745211117569"	https://twitter.com/Baldyphx/status/770385745211117569
	2016-08-29 22:20	0	0	"#Obamacare FAIL https:// twitter.com/chicagotribune /status/770385595055104000 …"			#Obamacare	"770385736398991360"	https://twitter.com/MaggioMatt/status/770385736398991360
	2016-08-29 22:20	0	0	"Really, really upset media has not adequately connected Global Warming to Obamacare enrolling <50% of projected #'s"			#	"770385736226971648"	https://twitter.com/mcbob/status/770385736226971648
	2016-08-29 22:20	0	0	"Flashback #ObamaShutDown : Dems reject GOP proposal, would cut 75% Obamacare subsidy for Congress http:// is.gd/dPMLaD #UniteBlue #PJNet"			#ObamaShutDown #UniteBlue #PJNet	"770385732255027200"	https://twitter.com/WSCP2/status/770385732255027200
	2016-08-29 22:20	0	0	"Obamacare Marketplaces Are in Trouble. What Can Be Done? - New York Times http:// ift.tt/2c0L94S #obamacare #obamacaresucks"			#obamacare #obamacaresucks	"770385722968772610"	https://twitter.com/obamacarebites/status/770385722968772610
	2016-08-29 22:20	2	1	"#Obamacare created environment for monopolies to expand.across country; some states/areas no competition #tcot #medicalnews #medicalbilling"			#Obamacare #tcot #medicalnews #medicalbilling	"770385722029191169"	https://twitter.com/YellowstoneDJ/status/770385722029191169
	2016-08-29 22:20	0	0	"- Biggest Obamacare Failure Links Clinton/ Obamacare http:// donrobbins.typepad.com/blog/2016/08/a fter-all-this-time-clinton-has-finally-brought-up-the-issue-of-mental-healthcare-and-how-the-obamacare-plan-didnt-recogni.html#sthash.z35JwgsI.uxfs … via @sharethis"		@sharethis	#sthash	"770385715339358208"	https://twitter.com/myown1959/status/770385715339358208
	2016-08-29 22:20	0	0	"Kaiser: 20 percent of ACA users may have only one insurer choice in 2017: In 2016, just 2 percent faced havin... http:// bit.ly/2bzDtV1"				"770385676160204801"	https://twitter.com/insuringincome/status/770385676160204801
	2016-08-29 22:20	4	3	"@realDonaldTrump this is very important. Think ACA for retirement planning. https://www. whitehouse.gov/the-press-offi ce/2016/08/25/fact-sheet-middle-class-economics-making-it-easier-save-retirement …"		@realDonaldTrump		"770385662319140864"	https://twitter.com/phillyrich1/status/770385662319140864
	2016-08-29 22:20	0	0	"@FoxNews #MSM They all think we will sign up for that #Obamacare bullshit we will not comply with a tyrannical Govt. Molon Laube"		@FoxNews	#MSM #Obamacare	"770385640210964480"	https://twitter.com/OathKeeper101st/status/770385640210964480
	2016-08-29 22:20	0	0	"ICYMI: The ACA still has the potential to surprise (and terrify): http:// trib.al/7cV9FKG @AccountingToday"		@AccountingToday		"770385625849749504"	https://twitter.com/MACPA/status/770385625849749504
	2016-08-29 22:20	1	1	"#Obamacare Soooo, POTUS you've screwed healthcare for everyone except those who get it almost free...NICE GOING...you just DON'T GET IT!!!"			#Obamacare	"770385620652875779"	https://twitter.com/cathlametgirl/status/770385620652875779
	2016-08-29 22:20	1	1	"Healthcare company 'losses' are bogus so far. They had Gov guaranteed profits through 2016. Dropping Obamacare w/o guarantees"				"770385614013341696"	https://twitter.com/HostetterGmail/status/770385614013341696
	2016-08-29 22:20	12	7	"Visits to Illinois emergency rooms spiked 5.7% since Obamacare , study finds http:// trib.in/2bEk86I pic.twitter.com/PHdl0vS01i"				"770385595055104000"	https://twitter.com/chicagotribune/status/770385595055104000
	2016-08-29 22:20	0	0	"Obamacare Marketplaces Are in Trouble. What Can Be Done? - New York Times http:// ift.tt/2c5p4l1"				"770385572074512385"	https://twitter.com/ggnewsus/status/770385572074512385
	2016-08-29 22:20	1	1	"44% of Donald Trump organisation are recipients of Obamacare .Will DT be providing them with private insurance instead . @nytimes @FlipItDem"		@nytimes @FlipItDem		"770385542303408128"	https://twitter.com/USA2016Elect/status/770385542303408128
	2016-08-29 22:19	0	0	"Drawing more uninsured into Obamacare is critical to its survival http:// cnnmon.ie/2c57pcT : C.. http:// dld.bz/eRyDG"				"770385525203148800"	https://twitter.com/FINANCEPartners/status/770385525203148800
	2016-08-29 22:19	0	0	"We all knew this would happen! #Obamacare https:// twitter.com/realDonaldTrum p/status/770381482229657602 …"			#Obamacare	"770385474565308416"	https://twitter.com/SuzanneKnows/status/770385474565308416
	2016-08-29 22:19	0	0	"realDonaldTrump: We will repeal and replace the horrible disaster known as #Obamacare ! pic.twitter.com/EXQXwIP8pc"			#Obamacare	"770385423893950464"	https://twitter.com/realconserv1/status/770385423893950464
	2016-08-29 22:19	0	0	"Hello wonderful you! your presentation skills are fascinating!"				"770385394038734849"	https://twitter.com/aca_affirmation/status/770385394038734849
	2016-08-29 22:19	0	1	"Obamacare premium? Even Obamacare is Pay to win these days smh"				"770385358127325184"	https://twitter.com/Anon_Goose/status/770385358127325184
	2016-08-29 22:19	0	0	"I work w/ ins. Everyday, WTF DON'T THEY GET PPL CAN NOT AFFORD OBAMACARE & it's still GOING UP, THIS IS DEMOCRATS HELP, keep it lying thugs"				"770385330084143104"	https://twitter.com/francinediaz3/status/770385330084143104
	2016-08-29 22:19	1	3	"#ObamaCare Fewer choices and higher rates - #ThanksObama http://www. forbes.com/sites/sallypip es/2015/11/30/obamacares-exchanges-begin-to-implode/#517fb44835ef …"			#ObamaCare #ThanksObama #517fb44835ef	"770385325604601856"	https://twitter.com/lgmaterna/status/770385325604601856
	2016-08-29 22:19	0	0	"Study finds a sharp drop in choices on the Obamacare exchanges in 2017 #louis https:// dragplus.com/post/id/375990 94 …"			#louis	"770385325306830848"	https://twitter.com/stlouismo_agent/status/770385325306830848
	2016-08-29 22:19	0	0	"Study finds a sharp drop in choices on the Obamacare exchanges in 2017 #louis https:// dragplus.com/post/id/375990 93 …"			#louis	"770385323197140992"	https://twitter.com/stlouismo_agent/status/770385323197140992
	2016-08-29 22:19	0	0	"PBS GETS CAUGHT CUTTING CRITICISM OF HILLARY, TTP AND OBAMACARE FROM JILL STEIN INTERVIEW. STOP PUBLIC AND PRIVATE FUNDING TO PBS!"				"770385320017817600"	https://twitter.com/skyfall20007/status/770385320017817600
	2016-08-29 22:19	0	1	"It is ridiculously stupid to double-down and say that your signature legislation works when it is OBVIOUSLY NOT WORKING! #Obamacare"			#Obamacare	"770385289797861376"	https://twitter.com/ChuckKittrell/status/770385289797861376
	2016-08-29 22:18	0	0	"Obamacare 's faltering for one simple reason: profit http:// interc.pt/2bWtWJO by @tinyrevolution"		@tinyrevolution		"770385203705544705"	https://twitter.com/King_Pyrrhus/status/770385203705544705
	2016-08-29 22:18	0	0	"NEWSFLASH!!! Obamacare has lost BILLIONS.. No where close to enrollment numbers so massive losses & YUGE increases."				"770385149150113792"	https://twitter.com/trackerem/status/770385149150113792
	2016-08-29 22:18	0	1	"Insurers have lost billions of dollars but the #AffordableHealthcareAct is working. Humm. #ACA #Obamacare"			#AffordableHealthcareAct #ACA #Obamacare	"770385148105732096"	https://twitter.com/BobbyM62/status/770385148105732096
	2016-08-29 22:18	0	1	"The government just announced some big changes to try and fix Obamacare - Business Insider http:// dlvr.it/M852f9 pic.twitter.com/YqI11WKJFS"				"770385142716084225"	https://twitter.com/YourPlanExpert/status/770385142716084225
	2016-08-29 22:18	0	1	"Not seeing the "affordable" in this and the ACA . Sigh....people will not have care and no where to go."				"770385141910925313"	https://twitter.com/twittmanda/status/770385141910925313
	2016-08-29 22:18	0	0	"New York Times Obamacare Marketplaces Are in Trouble. What Can Be Done?New York TimesIt has been a hard couple of weeks for Obamacare . The…"				"770385100081131520"	https://twitter.com/ClaudioWeissman/status/770385100081131520
	2016-08-29 22:18	0	0	"Obamacare Marketplaces Are in Trouble. What Can Be Done? - New York Times http:// ift.tt/2bzDx7l"				"770385099015741440"	https://twitter.com/NewsNeedNow/status/770385099015741440
	2016-08-29 22:18	0	0	"Obamacare is costing unhealthy people more money. I'll let them have cake instead. @realDonaldTrump"		@realDonaldTrump		"770385095886798848"	https://twitter.com/reaIDanoldTrump/status/770385095886798848
	2016-08-29 22:18	0	0	"Yes, Obamacare was all smoke and mirrors and it was obvious from the start. Pay attention people. https:// twitter.com/trumpwallnow/s tatus/770384481073201153 …"				"770385090337583104"	https://twitter.com/dynohouston/status/770385090337583104
	2016-08-29 22:18	0	0	"#America has failed in transforming it's #healthcare system #Obamacare is just #Medicaid now http://www. vox.com/2016/8/29/1269 2546/obamacare-whats-wrong?utm_campaign=vox&utm_content=entry&utm_medium=social&utm_source=twitter … via @voxdotcom"		@voxdotcom	#America #healthcare #Obamacare #Medicaid	"770385081538076673"	https://twitter.com/nima_rasekh/status/770385081538076673
	2016-08-29 22:18	0	1	"@CNNSitRoom obamacare is collapsing in Tennessee"		@CNNSitRoom		"770385061967462400"	https://twitter.com/TnTrumpTrain/status/770385061967462400
	2016-08-29 22:18	0	0	"Obama is still saying Obamacare is working do you believe that!! pic.twitter.com/p6Vy9hGMBk"				"770385043898241025"	https://twitter.com/tojekema/status/770385043898241025
	2016-08-29 22:17	2	2	"The failure of #Obamacare is being treated as if it were news, when in fact the whole thing was predicted before it was signed into law."			#Obamacare	"770385031818776576"	https://twitter.com/dlb703/status/770385031818776576
	2016-08-29 22:17	0	1	"OBAMA'S BROKEN PROMISES: ObamaCare coverage options disappearing, report finds... http://www. foxnews.com/politics/2016/ 08/29/obamacare-coverage-options-disappearing-across-country-report-finds.html …"				"770385024029954048"	https://twitter.com/TuzaraPost/status/770385024029954048
	2016-08-29 22:17	0	0	"@obamacare Stop blaming POTUS - no point (he's lame duck); start saying "Democrats promised ..." to assign accountability"		@obamacare		"770385019835736064"	https://twitter.com/mikeince13/status/770385019835736064
	2016-08-29 22:17	0	0	"Obamacare now faces a huge new problem in many states #epicfail http:// for.tn/2clJQkh?xid=fo r_tw_sh …"			#epicfail	"770385001741479936"	https://twitter.com/pixzen/status/770385001741479936
	2016-08-29 22:17	0	0	"Obama says #ObamaCare is working despite HUGE costs. When a KNOWN LIAR lies over & over, only STUPID still believe. #tcot #uniteblue"			#ObamaCare #tcot #uniteblue	"770384994636181504"	https://twitter.com/GetsGreased/status/770384994636181504
	2016-08-29 22:17	0	0	"Health insurance companies losing billions and dropping Obamacare but the WH says it is working. Lol. It's insanity folks. Pure madness"				"770384982263132160"	https://twitter.com/meanharri/status/770384982263132160
	2016-08-29 22:17	0	1	"$4 billion is losses for several insurance carriers due to the failure of Obamacare across the nation. Big Surprise? No it was predicted."				"770384976080674817"	https://twitter.com/2Molinari/status/770384976080674817
	2016-08-29 22:17	4	3	"Obamacare ; forced on us by #Obama ; should be replaced! Open up sales across state lines! No HIGH deductibles! #ScamCityUSA"			#Obama #ScamCityUSA	"770384973043871744"	https://twitter.com/thetoyman1/status/770384973043871744
	2016-08-29 22:17	0	0	"The Sociopath.Replace the ACA with what? You haven't offered any option except it will be YUGE and SUPER. Not believing it!"				"770384951711633408"	https://twitter.com/Gr8Lewis/status/770384951711633408
	2016-08-29 22:17	0	0	"@cnnpolitics With 20Trillion in debt, why isn't media chastising Obama for refugee costs, Obamacare costs, while Congress spends on itself"		@cnnpolitics		"770384915758284800"	https://twitter.com/jjpaldad/status/770384915758284800
	2016-08-29 22:17	0	0	"Hey Josh Earnest: Choice is not expanding. It is contracting. #Obamacare"			#Obamacare	"770384906866323456"	https://twitter.com/JaimeVelo/status/770384906866323456
	2016-08-29 22:17	0	0	"The government just announced some big changes to try and fix Obamacare : The government is of... http:// bit.ly/2bzDAjh via @josephjett"		@josephjett		"770384893494702081"	https://twitter.com/LeonoraInterssa/status/770384893494702081
	2016-08-29 22:17	1	0	"ObamaCare coverage options disappearing across country, report finds http://www. foxnews.com/politics/2016/ 08/29/obamacare-coverage-options-disappearing-across-country-report-finds.html …"				"770384888092655617"	https://twitter.com/borderfox116/status/770384888092655617
	2016-08-29 22:17	1	0	"The Obamacare Scheme May Be Imploding Ahead of Schedule http:// goo.gl/LuWSn8 via @MinuteMenNews"		@MinuteMenNews		"770384886884659200"	https://twitter.com/Scrufey21/status/770384886884659200
	2016-08-29 22:17	0	0	"Remember ObamaCare ? | Fox News | http:// fxn.ws/2c9j6Cw"				"770384881142595584"	https://twitter.com/Barry_Gibbs/status/770384881142595584
	2016-08-29 22:17	0	3	"#specialreport the "clear" part Josh Ernest is that the rest of us forced into ACA are paying for the 34 million indigent."			#specialreport	"770384871403450368"	https://twitter.com/damseldanger/status/770384871403450368
	2016-08-29 22:17	0	0	"You can't argue with the numbers and the numbers are saying to bet against the ACA . pic.twitter.com/jqRE5wwT2V"				"770384857142693888"	https://twitter.com/c_rwest/status/770384857142693888
	2016-08-29 22:17	0	0	"As Obamacare choices dwindle, feds face consumer, political backlash http:// a.msn.com/r/2/AAidryH pic.twitter.com/lSIAckiUtT"				"770384844383776768"	https://twitter.com/CheyenneCopper/status/770384844383776768
	2016-08-29 22:17	0	0	"Obamacare Marketplaces Are in Trouble. What Can Be Done? - New York Times http:// ift.tt/2bzDx7l"				"770384828588056578"	https://twitter.com/today_global/status/770384828588056578
	2016-08-29 22:17	0	0	"the ONE Thing i absolutely 100% agree with you on! i hate obamacare ! useless! but still not voting for u. #sorrynotsorry"			#sorrynotsorry	"770384816877469696"	https://twitter.com/BroCrush36/status/770384816877469696
