username;date;retweets;favorites;text;geo;mentions;hashtags;id;permalink
	2016-08-29 22:54	0	0	"maybe because its a failure? #Obamacare"			#Obamacare	"770394342477340672"	https://twitter.com/IBeam97/status/770394342477340672
	2016-08-29 22:54	0	0	"#Obamacare Costs Skyrocket; When Does It Stop? Government is the problem, not the solution. @MishGEA https:// mishtalk.com/2016/08/29/dea th-panel-discussion/ …"		@MishGEA	#Obamacare	"770394340548050944"	https://twitter.com/EconomicsJunkie/status/770394340548050944
	2016-08-29 22:54	0	0	"As Obamacare choices dwindle, feds face consumer, political backlash - USA TODAY http:// goo.gl/5ipfp6 #News #topstories"			#News #topstories	"770394321468043264"	https://twitter.com/NewsGoogleUSA/status/770394321468043264
	2016-08-29 22:54	0	1	"ACA is turning out characteristics just like the education syst:NO 1 likes it, pays attention to it, doesn't improve anything & costs a lot!"				"770394289117495296"	https://twitter.com/davebarnes0201/status/770394289117495296
	2016-08-29 22:54	0	4	"I will always remember Anthony Weiner as the weak-willed asshole ready to give up on Obamacare at the first hurdle. https:// twitter.com/JenSeniorNY/st atus/770384475494707200 …"				"770394175749718016"	https://twitter.com/RonHogan/status/770394175749718016
	2016-08-29 22:54	0	0	"The ACA : Still a Moving Target @accountingtoday http:// bit.ly/2c5w4hw pic.twitter.com/Utjp2mzsNR"		@accountingtoday		"770394169709764608"	https://twitter.com/jdbrakeyIntuit/status/770394169709764608
	2016-08-29 22:54	0	0	"I bet pres/congress can remove obamacare or at very least amend dangerous law aimed@enslaving masses if they really wanted to"		@enslaving		"770394154685915137"	https://twitter.com/OLGAOLGA32575/status/770394154685915137
	2016-08-29 22:54	0	0	"Socialism = Obamacare ! xo"				"770394148037812224"	https://twitter.com/bova_janet/status/770394148037812224
	2016-08-29 22:54	0	1	"He wants Obamacare on STEROIDS -- government controlled and FORCED on everyone. https:// twitter.com/sunergone/stat us/770378706044858368 …"				"770394094539575296"	https://twitter.com/jstines3/status/770394094539575296
	2016-08-29 22:53	0	0	"#MedicalStudy Illinois emergency room visits increased after Obamacare , study says: The emergency ... http:// bit.ly/2bzKFR2 #AfyaKenya"			#MedicalStudy #AfyaKenya	"770394087727861761"	https://twitter.com/afya_kenya/status/770394087727861761
	2016-08-29 22:53	0	0	"My kid sister died at the age of 45. One year b4 ACA . 3 of my loved ones now have NO cost insur."				"770394076977827840"	https://twitter.com/hippiegrandmom/status/770394076977827840
	2016-08-29 22:53	0	0	"The government just announced some big changes to try and fix Obamacare http:// read.bi/2bwwkHX via @themoneygame"		@themoneygame		"770394011144118273"	https://twitter.com/EnFuegoInc/status/770394011144118273
	2016-08-29 22:53	0	0	"YOU SAY OBAMACARE IS A DISASTER. PRICE HIKES TO CONSUMERS NOW OBAMA MEETING W/HHS LOSING BILLIONS!"				"770394006979162112"	https://twitter.com/SuzieBCarter/status/770394006979162112
	2016-08-29 22:53	0	0	"Drawing more uninsured into Obamacare is critical to its... https:// twitter.com/CNNMoney/statu s/770374220031361025 … via @AskAdella pic.twitter.com/vKmEkgF7x6"		@AskAdella		"770393976633331712"	https://twitter.com/adellapasos/status/770393976633331712
	2016-08-29 22:53	0	0	"Did Aetna's CEO predict Obamacare 's problems? - http:// bit.ly/2bakw0C #Atlanta #SalusConsulting #BusinessAdviceYouCanTrust"			#Atlanta #SalusConsulting #BusinessAdviceYouCanTrust	"770393968181911552"	https://twitter.com/SalusCPA/status/770393968181911552
	2016-08-29 22:53	0	0	"Looks like Obamacare is punishing three very red states."				"770393950444199940"	https://twitter.com/PositiveInt/status/770393950444199940
	2016-08-29 22:53	0	0	"Only 4 Americans died, that's an accomplishment- ObamaCare gov't controlled healthcare that's national disaster!"				"770393888238342146"	https://twitter.com/Dlw20161950/status/770393888238342146
	2016-08-29 22:53	0	1	"Abandon @GOP Romneycare. Time 4 Medicare 4 all As Obamacare choices dwindle, feds face consumer, political backlash https:// news.google.com/news/ampviewer ?caurl=http%3A%2F%2Famp.usatoday.com%2Fstory%2F89403698%2F#pt0-63204 …"		@GOP	#pt0	"770393887261265920"	https://twitter.com/OGOPer/status/770393887261265920
	2016-08-29 22:53	0	0	"No. Reps who voted for it (without reading) and our president who pushed it are to blame. ACA is a mess."				"770393875022315520"	https://twitter.com/Mi_Astronauta/status/770393875022315520
	2016-08-29 22:52	0	0	"ObamaCare coverage options disappearing across country, report finds http://www. foxnews.com/politics/2016/ 08/29/obamacare-coverage-options-disappearing-across-country-report-finds.html … via the @FoxNews Android app"		@FoxNews		"770393835763437570"	https://twitter.com/jperaza0430/status/770393835763437570
	2016-08-29 22:52	0	1	"@SebGorka @ReutersUS Can't! Falsified Obamacare #, job#, VA status, IRS targets, Iran ransom, golf score, debt,votes 2012, etc"		@SebGorka @ReutersUS	# #	"770393807644831744"	https://twitter.com/rovendetti/status/770393807644831744
	2016-08-29 22:52	0	0	"The government just announced some big changes to try and fix Obamacare : The government is… http:// goo.gl/fb/u3fWYg"				"770393721439342593"	https://twitter.com/buyerscloud/status/770393721439342593
	2016-08-29 22:52	0	0	"Illinois emergency room visits increased after Obamacare , study says: Hospital emergency department visits in... http:// sh.st/VJXG0"				"770393697284349957"	https://twitter.com/_SoundAround_/status/770393697284349957
	2016-08-29 22:52	0	0	"#FFRNN #CLASSROOM GUEST LECTURER Neil Cavuto; Apple vs.Government (A Company that Cares vs #Obamacare ) http://www. youtube.com/watch?v=mqyVye wQ0lQ …"			#FFRNN #CLASSROOM #Obamacare	"770393697087217664"	https://twitter.com/FFRNNU/status/770393697087217664
	2016-08-29 22:52	1	0	"Hillary’s selfinflicted wound, Trump passes on ObamaCare , and other notable commentary http:// goo.gl/x9t6Fo pic.twitter.com/0vGVeI6OKz"				"770393690347040768"	https://twitter.com/TheTruth24US/status/770393690347040768
	2016-08-29 22:52	0	0	"Illinois emergency room visits increased after Obamacare , study says http:// trib.in/2bzJwsF #chicago"			#chicago	"770393673351606272"	https://twitter.com/chicagolink/status/770393673351606272
	2016-08-29 22:52	0	0	"Obamacare going bankrupt. Hillary will replace with http:// Govt.run socialized medicine paid for w/higher taxes. #PJNT#maga#tcot"			#PJNT #maga #tcot	"770393649129500672"	https://twitter.com/weizbad/status/770393649129500672
	2016-08-29 22:52	7	0	"The Donald has tweeted RT @realDonaldTrump : We will repeal and replace the horrible disaster known as #Obamacare ! pic.twitter.com/cMRlaqfvU1"		@realDonaldTrump	#Obamacare	"770393642431283200"	https://twitter.com/wittier/status/770393642431283200
	2016-08-29 22:51	0	0	"Illinois emergency room visits increased after Obamacare , study says http:// ift.tt/2bwDWdp"				"770393547434590208"	https://twitter.com/jerrymascato/status/770393547434590208
	2016-08-29 22:51	0	1	"The government just announced some big changes to try and fix Obamacare http:// ift.tt/2bxB0tA #Business"			#Business	"770393523606654976"	https://twitter.com/Selim_BHY/status/770393523606654976
	2016-08-29 22:51	0	0	"Nice piece by @instapundit on why #healthcare 's contentious. #Obamacare 's disastrous but many just "feel" it's right http://www. usatoday.com/story/opinion/ 2016/08/29/cavemen-politics-healthcare-evolution-instinct-mammoth-socialism-glenn-reynolds/89508852/ …"		@instapundit	#healthcare #Obamacare	"770393485212016644"	https://twitter.com/anukasan1977/status/770393485212016644
	2016-08-29 22:51	0	0	"NEW POST ON RED NATION RISING: Another Failed Obamacare Promise: The Continuing "Job Lock" Problem- http:// rednationrising.us/another-failed -obamacare-promise-continuing-job-lock-problem/ … #RedNationRising"			#RedNationRising	"770393475774816256"	https://twitter.com/DrRhondaMoorman/status/770393475774816256
	2016-08-29 22:51	0	1	"Before Obamacare my premiums went up 700 percent in 10 years."				"770393472692019200"	https://twitter.com/Nancy62112120/status/770393472692019200
	2016-08-29 22:51	0	0	"As Obamacare choices dwindle, feds face consumer, political backlash http:// a.msn.com/01/en-us/AAidr yH?ocid=st …"				"770393462709465088"	https://twitter.com/MUMedopp/status/770393462709465088
	2016-08-29 22:51	0	0	"ObamaCare coverage options disappearing across country, report finds via the @FoxNews App http://www. foxnews.com/politics/2016/ 08/29/obamacare-coverage-options-disappearing-across-country-report-finds.html …"		@FoxNews		"770393399975415813"	https://twitter.com/IrieHarold/status/770393399975415813
	2016-08-29 22:51	1	0	"That's not true. Uninsured is down from 30% to 10%. Your state did not implement ACA . Call Scott Walker & complain https:// twitter.com/baugustson1/st atus/770392822956511232 …"				"770393396976422912"	https://twitter.com/Montgomery_bjm/status/770393396976422912
	2016-08-29 22:51	0	0	""after i fix obamacare , i'm going to push for a constitutional amendment requiring the burning of confederate flags" pic.twitter.com/889x6yq8H1"				"770393392006201347"	https://twitter.com/lumazur/status/770393392006201347
	2016-08-29 22:51	0	0	"How Government Quality Guidelines Hurt Transplant Patients via @forbes http://www. forbes.com/sites/paulhsie h/2016/08/29/how-government-quality-guidelines-hurt-transplant-patients/#435d91886b9a … #obamacare #socialism #capitalism"		@forbes	#435d91886b9a #obamacare #socialism #capitalism	"770393368174010368"	https://twitter.com/athenamike/status/770393368174010368
	2016-08-29 22:50	0	0	"How much Obamacare matters to 2016 voters http:// youtube.com/watch?v=E8IWxn GArVM&feature=youtu.be … http:// hisword.co.za/2016/08/29/how -much-obamacare-matters-to-2016-voters/ …"				"770393333667540992"	https://twitter.com/Hiswordza/status/770393333667540992
	2016-08-29 22:50	3	4	"DEMOCRAT LIES ObamaCare coverage options disappearing across country, report finds http://www. foxnews.com/politics/2016/ 08/29/obamacare-coverage-options-disappearing-across-country-report-finds.html … via the @FoxNews Android app"		@FoxNews		"770393290361278464"	https://twitter.com/royalistajoe/status/770393290361278464
	2016-08-29 22:50	0	0	"The Right Lessons from Obamacare 's Meltdown http:// freedomoutpost.com/the-right-less ons-from-obamacares-meltdown/ … via @FreedomOutpost"		@FreedomOutpost		"770393286922035200"	https://twitter.com/Scrufey21/status/770393286922035200
	2016-08-29 22:50	0	0	"We will repeal and replace the horrible disaster known as #Obamacare ! pic.twitter.com/5SX6fMUEJD via http:// ift.tt/1Px9BY8"			#Obamacare	"770393249697628160"	https://twitter.com/DTrumpReviews/status/770393249697628160
	2016-08-29 22:50	0	0	"It's a congressional law. Obamacare requires fixes by congress. Our constitutional law prof should KNOW THAT https:// twitter.com/CSTearlyoften/ status/770392574809010176 …"				"770393239715127296"	https://twitter.com/stormchase3/status/770393239715127296
	2016-08-29 22:50	0	0	"bc of obamacare . he had pain for years smfh but they would just try and give him pills instead of treating him"				"770393190402633729"	https://twitter.com/BootsMcGuinness/status/770393190402633729
	2016-08-29 22:50	0	0	"New video added: How much Obamacare matters to 2016 voters - https://www. xaniatube.com/how-much-obama care-matters-to-2016-voters_83d12dfce.html … #XaniaTube"			#XaniaTube	"770393139001565185"	https://twitter.com/Xaniatube/status/770393139001565185
	2016-08-29 22:50	0	0	"Just IRS carrying out orders dictated by #ACA passed 100% by Dems and crammed down our throats! https:// twitter.com/macbreck/statu s/770390380751691777 …"			#ACA	"770393123243438080"	https://twitter.com/kljaggie/status/770393123243438080
	2016-08-29 22:49	0	0	"Gerhart Screws Iowans/questions WellMark Solvency #obamacare http:// businessrecord.com/Content/Health -Wellness/Health-Wellness/Article/Costs-for-individual-health-policies-jump-steeply/174/836/74519 …"			#obamacare	"770393059443871744"	https://twitter.com/KickEnterprises/status/770393059443871744
	2016-08-29 22:49	0	0	"Drawing more uninsured into Obamacare is critical to its survival http:// dld.bz/eRyFc pic.twitter.com/x1ExUAYsxb"				"770393041748299776"	https://twitter.com/SocialInABQ/status/770393041748299776
	2016-08-29 22:49	0	0	"The problem isn't Obamacare , it's greedy private insurers. We need universal health care. Now! #NeverTrump #DirtyDonald"			#NeverTrump #DirtyDonald	"770393037755129856"	https://twitter.com/RealDocHolliday/status/770393037755129856
	2016-08-29 22:49	0	0	"@JJManring @mcspocky Job growth at mostly minimum wage, Gas lower AIR POLLUTION MUCH GREATER, ObamaCare a sellout to Pharma,Insu"		@JJManring @mcspocky		"770393032214519812"	https://twitter.com/MayaNewb/status/770393032214519812
	2016-08-29 22:49	0	0	"ObamaCare coverage options disappearing across country, report finds via the @FoxNews App http://www. foxnews.com/politics/2016/ 08/29/obamacare-coverage-options-disappearing-across-country-report-finds.html …"		@FoxNews		"770392978024046592"	https://twitter.com/debra_bonanno/status/770392978024046592
	2016-08-29 22:49	0	0	"I feel sorry for those who depend on Obamacare"				"770392964904484865"	https://twitter.com/Hopeisalive66/status/770392964904484865
	2016-08-29 22:49	0	0	"Hi wonderful writer, your work-in-progress is absolutely perfectly fine"				"770392944826200064"	https://twitter.com/aca_affirmation/status/770392944826200064
	2016-08-29 22:49	0	0	"Wonka is Dead!! who's going to take care of the oompa loompas? They need a 401k plan & Obamacare #RIPGeneWilder pic.twitter.com/uZphzbfPzj"			#RIPGeneWilder	"770392895459254272"	https://twitter.com/avmonkey/status/770392895459254272
	2016-08-29 22:49	0	0	"Republican Bill Would Suspend #Obamacare Mandate Amid Premium Hikes http:// freebeacon.com/issues/republi can-bill-would-suspend-obamacare-mandate-amid-premium-hikes/ …"			#Obamacare	"770392882473738240"	https://twitter.com/yeminkus/status/770392882473738240
	2016-08-29 22:49	0	0	"ObamaCare exchange enrollments fall short of projections: Kevin Corke explains http:// sh.st/VJZjQ"				"770392852064903168"	https://twitter.com/_SoundAround_/status/770392852064903168
	2016-08-29 22:49	0	0	"ObamaCare exchange enrollments fall short of projections http:// bit.ly/2bNc7hm @foxnews #video"		@foxnews	#video	"770392851347668992"	https://twitter.com/Ramtoad/status/770392851347668992
	2016-08-29 22:48	0	0	"If WI had implemented ACA you would be eligible for tax subsidy and be able to afford a better plan. @mccosha @baugustson1 @realDonaldTrump"		@mccosha @baugustson1 @realDonaldTrump		"770392831236116480"	https://twitter.com/Montgomery_bjm/status/770392831236116480
	2016-08-29 22:48	0	0	"#Obamacare is a big BS, waste tax money. Vote @realDonaldTrump fix rigged system. https:// twitter.com/realdonaldtrum p/status/770381482229657602 …"		@realDonaldTrump	#Obamacare	"770392829252210688"	https://twitter.com/bestforamerican/status/770392829252210688
	2016-08-29 22:48	0	0	"#cosmetics #beauty ObamaCare exchange enrollments fall short of projections: Kevin Corke explains http:// bit.ly/2c5v90F"			#cosmetics #beauty	"770392825821143040"	https://twitter.com/RssCosmetics/status/770392825821143040
	2016-08-29 22:48	163	2	"I will never give up on us. #Obamacare #LiamsBirthday #Deals #RoboTwity #MafiaSdvParaTodos #SweetCHERRYPops"			#Obamacare #LiamsBirthday #Deals #RoboTwity #MafiaSdvParaTodos #SweetCHERRYPops	"770392814836391936"	https://twitter.com/aaasss11739/status/770392814836391936
	2016-08-29 22:48	2	0	"Fox News Video ObamaCare exchange enrollments fall short of projections http:// ln.is/video.foxnews. com/v/4ArOM …"				"770392796905758721"	https://twitter.com/patriots928/status/770392796905758721
	2016-08-29 22:48	2	0	"This Top Official Just Said Obamacare is 'Very Near Collapse' in Her State http:// townhall.com/tipsheet/guybe nson/2016/08/29/obamacare-another-major-insurer-in-the-red-consumers-face-fewer-choices-n2211285 …"				"770392717637537794"	https://twitter.com/rednett/status/770392717637537794
	2016-08-29 22:48	0	0	"ObamaCare coverage option disappearing across country, report finds http://www. foxnews.com/politics/2016/ 08/29/obamacare … . IT IS SO WRONG That PPL GET PENALIZED ON TAXES"				"770392597172981760"	https://twitter.com/khunter_karen/status/770392597172981760
	2016-08-29 22:47	0	0	"@a2ztube @jobs4mind RT @infowars : The Right Lessons from #Obamacare ’s Meltdown - http://www. infowars.com/the-right-less ons-from-obamacares-meltdown/ … #health #infowars"		@a2ztube @jobs4mind @infowars	#Obamacare #health #infowars	"770392557108862976"	https://twitter.com/a2ztube/status/770392557108862976
	2016-08-29 22:47	0	1	"ObamaCare coverage options disappearing across country, report finds http://www. foxnews.com/politics/2016/ 08/29/obamacare-coverage-options-disappearing-across-country-report-finds.html …"				"770392488154505216"	https://twitter.com/eddiecarl4468/status/770392488154505216
	2016-08-29 22:47	0	0	"ObamaCare coverage options disappearing across country, report finds http://www. foxnews.com/politics/2016/ 08/29/obamacare-coverage-options-disappearing-across-country-report-finds.html … via the @FoxNews Android app"		@FoxNews		"770392413797953536"	https://twitter.com/shawk1947/status/770392413797953536
	2016-08-29 22:47	0	0	"WI did not implement Obamacare . That's why you can't afford ins. Blame Governor Walker-it was his decision. @baugustson1 @realDonaldTrump"		@baugustson1 @realDonaldTrump		"770392350216581120"	https://twitter.com/Montgomery_bjm/status/770392350216581120
	2016-08-29 22:46	0	0	"Blue Cross asking for 60 percent rate hike for Obamacare plans in Texas in 2017 via @dallasnews http:// bizbeatblog.dallasnews.com/2016/06/blue-c ross-asking-for-60-percent-rate-hike-for-obamacare-plans-in-texas-in-2017.html/ … #MAGA #TrumpTrain"		@dallasnews	#MAGA #TrumpTrain	"770392317660237826"	https://twitter.com/jewelagave/status/770392317660237826
	2016-08-29 22:46	0	0	"ACA eliminated pre-existing. Abolish it & pre-existing is back. Be careful what u ask for!"				"770392289021530112"	https://twitter.com/pokie3154/status/770392289021530112
	2016-08-29 22:46	0	0	"NPR & HARVARD SAY: OBAMACARE IS A COMPLETE FAILURE They say Obamacare has been worse than a complete waste of money. pic.twitter.com/4o46jKTPsQ"				"770392239474413568"	https://twitter.com/hoke_thomas/status/770392239474413568
	2016-08-29 22:46	0	0	"Don't be a Hippocrate"				"770392238895403008"	https://twitter.com/aca_aikae/status/770392238895403008
	2016-08-29 22:45	0	0	"The government just announced some big changes to try and fix Obamacare http://www. businessinsider.com/obamacare-chan ges-cms-insurance-markets-2016-8?utm_source=dlvr.it&utm_medium=twitter …"				"770392003016167424"	https://twitter.com/resilient_ent/status/770392003016167424
	2016-08-29 22:45	0	0	"Illinois emergency room visits increased after Obamacare , study says http:// dlvr.it/M85NGP pic.twitter.com/F3sgt121hI"				"770391992404586496"	https://twitter.com/asdfgeeeee2/status/770391992404586496
	2016-08-29 22:45	0	0	"ObamaCare coverage options disappearing across country, report finds via the @FoxNews App http://www. foxnews.com/politics/2016/ 08/29/obamacare-coverage-options-disappearing-across-country-report-finds.html …"		@FoxNews		"770391991280467968"	https://twitter.com/meces29/status/770391991280467968
	2016-08-29 22:45	0	0	"Good.. because I sure can't afford ObamaCare anymore.Pay a monthly premium,BUT SURE CAN'T USE IT."				"770391968614641664"	https://twitter.com/peasler1/status/770391968614641664
	2016-08-29 22:45	0	0	"I WISH. I COULD USE THE MONEY. MY OBAMACARE PREMIUM IS GOING UP 40%. BY THE WAY TULSI GABBARD WILL BE THE FIRST FEMALE PRESIDENT"				"770391966634872832"	https://twitter.com/2001scuba/status/770391966634872832
	2016-08-29 22:45	0	0	"Dodd-Frank, Obamacare And The Erosion Of The Rule Of Law http:// onforb.es/15vVsEK via @forbes Ted Cruz #TeaParty #RedNationRising #PJNET"		@forbes	#TeaParty #RedNationRising #PJNET	"770391906685554688"	https://twitter.com/WSCP2/status/770391906685554688
	2016-08-29 22:44	3	0	"Broken promises: ObamaCare coverage options disappearing across country, report finds via the @FoxNews App http://www. foxnews.com/politics/2016/ 08/29/obamacare-coverage-options-disappearing-across-country-report-finds.html …"		@FoxNews		"770391825462861829"	https://twitter.com/LJSpagnoli/status/770391825462861829
	2016-08-29 22:44	0	1	"According to my macro professor the wealthy aren't taxed enough and obamacare is great for this country."				"770391752763203584"	https://twitter.com/ayye_doyle/status/770391752763203584
	2016-08-29 22:44	0	0	"ObamaCare coverage options disappearing across country, report finds | Fox News http://www. foxnews.com/politics/2016/ 08/29/obamacare-coverage-options-disappearing-across-country-report-finds.html …"				"770391727333007360"	https://twitter.com/wburke20/status/770391727333007360
	2016-08-29 22:44	0	0	"obamacare if passed as presented you would have been able to keep doc"				"770391721704206336"	https://twitter.com/BadgerRedHead/status/770391721704206336
	2016-08-29 22:44	0	1	"@jheil Did you notice the noun game Conway played? "Senator...I mean president Obama" "Mrs...I mean Secretary Clinton" " Obamacare ... ACA ""		@jheil		"770391654008107008"	https://twitter.com/Aaron_Svoboda/status/770391654008107008
	2016-08-29 22:44	0	1	"The government just announced some big changes to try and fix Obamacare http:// goo.gl/02ltjJ pic.twitter.com/ZdtALo7NRm"				"770391630704742400"	https://twitter.com/EconomyWrld/status/770391630704742400
	2016-08-29 22:44	1	2	"I see, Wisconsin. Gov. Scott Walker did not implement the ACA . That's why you can't afford coverage. @baugustson1 @realDonaldTrump"		@baugustson1 @realDonaldTrump		"770391623557603328"	https://twitter.com/Montgomery_bjm/status/770391623557603328
	2016-08-29 22:44	1	0	"The latest word used to describe Obamacare ...imploding. And so too, his legacy. #FullRepeal #Trump2016"			#FullRepeal #Trump2016	"770391623553409026"	https://twitter.com/hadmyphil/status/770391623553409026
	2016-08-29 22:44	0	0	"@SpecialReport Don't see how Josh Earnest keeps a straight face claiming Obamacare is working! #StraightfaceEarnest"		@SpecialReport	#StraightfaceEarnest	"770391618679484416"	https://twitter.com/FrOnTiEr5150/status/770391618679484416
	2016-08-29 22:44	11	4	"After Obamacare , emergency room visits in IL increased 5.7%, or by more than 14,000 visits a month. http:// fw.to/udbgHnb"				"770391590254682112"	https://twitter.com/AAPSonline/status/770391590254682112
	2016-08-29 22:44	0	0	"@GazetteInsights @tdorman IA oks 38% inc for Wellmark. What Republicans failed dozens of times to do, ins cos will kill ACA . Not AFFORDABLE"		@GazetteInsights @tdorman		"770391582881226752"	https://twitter.com/UnnamedHarald/status/770391582881226752
	2016-08-29 22:43	0	0	"ObamaCare coverage options disappearing across country, report finds | Fox News | http:// fxn.ws/2c9BmeT"				"770391573729275904"	https://twitter.com/TinmanTinin/status/770391573729275904
	2016-08-29 22:43	0	0	"The real lessons from Obamacare ’s meltdown http:// disq.us/t/2ceorxt"				"770391552392921088"	https://twitter.com/PWilliamsD/status/770391552392921088
	2016-08-29 22:43	0	0	"I Was Just Commenting 4 Myself Wasn't Sure Since I Never Mentioned ObamaCare ."				"770391499339030528"	https://twitter.com/isavega2017/status/770391499339030528
	2016-08-29 22:43	0	0	"Obamacare is the Edsel of the healthcare industry"				"770391498764406784"	https://twitter.com/kathie138/status/770391498764406784
	2016-08-29 22:43	0	0	"How much would the premiums have spiked WITHOUT Obamacare ? The context is essential."				"770391454896103424"	https://twitter.com/tweyna/status/770391454896103424
	2016-08-29 22:43	0	0	"@CNN @washingtonpost @FoxNews @nytimes @Reuters @ABC Obamacare and its high double digit price increases are bankrupting America fast."		@CNN @washingtonpost @FoxNews @nytimes @Reuters @ABC		"770391364110422016"	https://twitter.com/smrichman/status/770391364110422016
	2016-08-29 22:43	0	0	"#Chicago #News Illinois emergency room visits increased after Obamacare , study says: Hospital emergency depar... http:// tinyurl.com/jznwe6r"			#Chicago #News	"770391359173734400"	https://twitter.com/_ChicagoNews_/status/770391359173734400
	2016-08-29 22:43	0	0	"with what Donny? #ACA Is already a compromise to satisfy GOP obstructionists. #panderexpress #SinglePayer"			#ACA #panderexpress #SinglePayer	"770391354283143169"	https://twitter.com/warrenjaay/status/770391354283143169
	2016-08-29 22:43	0	0	"Illinois emergency room visits increased after Obamacare , study says: Hospital emergency department visits in... http:// trib.in/2c5ulZK"				"770391345743532032"	https://twitter.com/jamesnews242/status/770391345743532032
	2016-08-29 22:43	0	0	"Tribune: Illinois emergency room visits increased after Obamacare , study says http:// trib.in/2c5ulZK"				"770391335362625537"	https://twitter.com/ChicagoAlive/status/770391335362625537
	2016-08-29 22:43	0	0	"Gerhart Screws Iowans-Questions Wellmark Solvency http:// dmreg.co/2bMmkI7 via @DMRegister @desmoinesdem @IowaInsDiv #Obamacare @IowaSenate"		@DMRegister @desmoinesdem @IowaInsDiv @IowaSenate	#Obamacare	"770391329582878720"	https://twitter.com/KickEnterprises/status/770391329582878720
	2016-08-29 22:42	0	0	"#KevinFrezhx3 Illinois emergency room visits increased after Obamacare , study says: Hospital emergency depart... http:// trib.in/2c5v0dx"			#KevinFrezhx3	"770391325816397824"	https://twitter.com/Esmarlin1994/status/770391325816397824
