username;date;retweets;favorites;text;geo;mentions;hashtags;id;permalink
	2016-12-19 23:13	0	0	"GOP lawmaker’s Obamacare alternative: Make kids sleep on broken arms to avoid costly ER visits http://www. rawstory.com/2016/12/gop-la wmakers-obamacare-alternative-make-kids-sleep-on-broken-arms-to-avoid-costly-er-visits/#.WFhpm7OJKkY.twitter …"			#	"810986504159772672"	https://twitter.com/Outwest123/status/810986504159772672
	2016-12-19 23:13	0	0	"@MOJwJ it is a failed system. Everyone knows it. Quit playing partisan politics and fix the broken system created by Obamacare"		@MOJwJ		"810986438867173377"	https://twitter.com/nictindall/status/810986438867173377
	2016-12-19 23:12	0	0	"Obamacare demand so high, administration extends the deadline to meet it http://www. dailykos.com/story/2016/12/ 16/1611717/-Obamacare-demand-so-high-administration-extends-the-deadline-to-meet-it …"				"810986309888208896"	https://twitter.com/YvonneKirlew/status/810986309888208896
	2016-12-19 23:12	1	2	"Two carpenters walk into a gay bar. One got hammered, the other got nailed"				"810986236760518657"	https://twitter.com/aca_fan1980/status/810986236760518657
	2016-12-19 23:12	0	0	"And my doctor just called to remind me I need to schedule my cancer screening appointment again. Hooray for soon-to-be-gutted Obamacare"				"810986219588833280"	https://twitter.com/slyborg/status/810986219588833280
	2016-12-19 23:12	0	0	"so do I, but the burden is uneven. Obamacare is a penalty for success."				"810986160910729216"	https://twitter.com/BiffCocoa/status/810986160910729216
	2016-12-19 23:12	0	0	"Post #ACA health-care! https:// twitter.com/VeryShortStory /status/810878116725919744 …"			#ACA	"810986121165410305"	https://twitter.com/klein5079/status/810986121165410305
	2016-12-19 23:12	0	0	"Republicans can defund Obamacare ."				"810986098939674628"	https://twitter.com/jeffznikekb27/status/810986098939674628
	2016-12-19 23:12	1	0	"Healthcare CEOs are absolutely the best beneficiaries of Obamacare . Singing Jingle Bells and laughing all the way.. pic.twitter.com/8imiRYJsgw"				"810986087908638720"	https://twitter.com/Arrobed/status/810986087908638720
	2016-12-19 23:11	3	2	"Colorado is exploring how to keep its Obamacare marketplace after Obamacare repeal http://www. vox.com/policy-and-pol itics/2016/12/17/13982016/colorado-obamacare-repeal … via @voxdotcom #cohealth"		@voxdotcom	#cohealth	"810986052831838208"	https://twitter.com/One_Colorado/status/810986052831838208
	2016-12-19 23:11	1	1	"The people most likely to lose in Obamacare repeal live in Trump country http://www. dailykos.com/story/2016/12/ 19/1612698/-The-people-most-likely-to-lose-in-Obamacare-repeal-live-in-Trump-country …"				"810985993453047808"	https://twitter.com/GStuedler/status/810985993453047808
	2016-12-19 23:11	0	0	"Obamacare is socialist."				"810985965032325120"	https://twitter.com/jeffznikekb27/status/810985965032325120
	2016-12-19 23:11	0	0	"Obamacare isn't just saying u have to buy a product (e.g. a clock) it's also saying the clock must have this&that (which makes it cost $5K)"				"810985947143794688"	https://twitter.com/Dark_Red_Hair/status/810985947143794688
	2016-12-19 23:11	1	1	"postponing Obamacare for 3 years A lie that means theres no viable alternative distraction to cut Ocare B4 next election"				"810985920010690560"	https://twitter.com/apolloxxxx/status/810985920010690560
	2016-12-19 23:11	0	0	"NOT looking fwd to spending MORE time on #Obamacare phone hold, but they CANCELLED my #BCBSNC ins. I'm pretty fucking pissed off. Hate this!"			#Obamacare #BCBSNC	"810985888381595648"	https://twitter.com/wxmel/status/810985888381595648
	2016-12-19 23:11	0	1	"Update: I DID get auto-enrolled in a 2017 Obamacare plan but I CANNOT cancel it today. That makes sense /s https:// twitter.com/texasspoonie/s tatus/810978074888179712 …"				"810985869528207360"	https://twitter.com/texasspoonie/status/810985869528207360
	2016-12-19 23:11	0	0	"As President, I plan on fixing Obamacare so that all people have the right to affordable healthcare depending on their income"				"810985813676793856"	https://twitter.com/buck_mccorkle/status/810985813676793856
	2016-12-19 23:10	0	0	"Obamacare May Soon Be Over. Here’s What Americans Have Thought of the Law Since 2010. http:// dailysign.al/2gWMDxT @DailySignal"		@DailySignal		"810985741685813248"	https://twitter.com/jid722/status/810985741685813248
	2016-12-19 23:10	0	1	"if don't like #Obamacare then pass #medicare4all"			#Obamacare #medicare4all	"810985690586644480"	https://twitter.com/justicenojustus/status/810985690586644480
	2016-12-19 23:10	0	0	"Obamacare is a dying beast. Time to go back to laissez faire liberalism."				"810985686845231105"	https://twitter.com/LIBERTYSWF/status/810985686845231105
	2016-12-19 23:10	0	0	"ACA INACCESSIBLE for many due to pre-existing condition -AGE. May as well SHUT IT DOWN! http:// x.co/Repeal #Obamacare"			#Obamacare	"810985608956891137"	https://twitter.com/NormandeauNewsw/status/810985608956891137
	2016-12-19 23:10	1	1	"Repealing the ACA 's tax on high income households and hospitals would exhaust the Medicare Trust fund by 2024 http:// brook.gs/2hSsObR pic.twitter.com/KNDsfTbtgu"				"810985570524680196"	https://twitter.com/BrookingsEcon/status/810985570524680196
	2016-12-19 23:10	0	0	"nah ...EC would take constitutional amendment ? ACA /Dodd frank / abortion/ medicare etc ahead in cue?"				"810985565248245760"	https://twitter.com/petermcteague/status/810985565248245760
	2016-12-19 23:09	0	0	"Dem Governors Make 11th-Hour Plea To Save Obamacare http://www. huffingtonpost.com/entry/democrat s-obamacare-repeal_us_58582dfce4b08debb78a4f40 …"				"810985544817713153"	https://twitter.com/monicasloves/status/810985544817713153
	2016-12-19 23:09	0	0	"I hope she has coverage in OBAMACARE shes going to need some mental health care ASAP"				"810985487569534977"	https://twitter.com/GaryBean15/status/810985487569534977
	2016-12-19 23:09	0	0	"You said ACA saved you money. That means you must be subsidized. If so, you get taxpayer money. https:// twitter.com/js069643/statu s/810983190961614849 …"				"810985450823241728"	https://twitter.com/js069643/status/810985450823241728
	2016-12-19 23:09	0	0	"The liberal healthcare is universal, single payer, obamacare has always been a right wing plan. Private ins."				"810985445068705792"	https://twitter.com/GreenLigase/status/810985445068705792
	2016-12-19 23:09	0	0	"@RepBillFlores wants to repeal health care for more than 1 million Texans and 30 million US citizens. Leave ACA alone."		@RepBillFlores		"810985441960882176"	https://twitter.com/rhlowe/status/810985441960882176
	2016-12-19 23:09	0	0	"Most of those idiots can't even feed or care for themselves #Obamacare #welfare @JasonAIsrael @Ducks_N_Bucks19 @Brick_04 @AOTR_Host"		@JasonAIsrael @Ducks_N_Bucks19 @Brick_04 @AOTR_Host	#Obamacare #welfare	"810985415347994625"	https://twitter.com/NotOne2bPC/status/810985415347994625
	2016-12-19 23:08	0	0	"The people most likely to lose in Obamacare repeal live in Trump country http://www. dailykos.com/story/2016/12/ 19/1612698/-The-people-most-likely-to-lose-in-Obamacare-repeal-live-in-Trump-country …"				"810985288134787072"	https://twitter.com/creeper6548/status/810985288134787072
	2016-12-19 23:08	0	0	"@SpeakerRyan please look at this strategy to repeal Obamacare http:// heritageaction.com/2016/12/herita ge-action-memo-repeal-obamacare-inauguration/ … https:// twitter.com/SpeakerRyan/st atus/809433233586868224 …"		@SpeakerRyan		"810985250880913408"	https://twitter.com/Cindi1Shorty/status/810985250880913408
	2016-12-19 23:08	0	0	"Anti trade message works raise taxes 4 free college won't. Medicare for all won't work. Dems got destroyed over Obamacare 4/x"				"810985243301871616"	https://twitter.com/dbrathod/status/810985243301871616
	2016-12-19 23:07	0	0	"Another shoutout to @BarackObama for my health insurance. #Obamacare #savedmybutt #ThanksObama"		@BarackObama	#Obamacare #savedmybutt #ThanksObama	"810985038133202944"	https://twitter.com/AnnePopolizio/status/810985038133202944
	2016-12-19 23:07	0	0	"The American people have always opposed Obamacare ."				"810985031288193026"	https://twitter.com/LIBERTYSWF/status/810985031288193026
	2016-12-19 23:07	0	1	"For those of who you are super procrastinators, you have about 9 more hours to sign up for ACA healthcare... http:// fb.me/5veNS3lNm"				"810985022169743360"	https://twitter.com/900amWURD/status/810985022169743360
	2016-12-19 23:07	0	0	"repaired relations with Israel, keep carrier jobs in America, laid out his plan to replaced a failed Obamacare , just to name few"				"810984996223729665"	https://twitter.com/Toby_Cam/status/810984996223729665
	2016-12-19 23:07	0	1	"After #congress removes the yoke of #Obamacare , @RepHuizenga outlines the future #healthcare paradise. #MakeAmericaGreatAgain #MAGA pic.twitter.com/eink3UfeqP"		@RepHuizenga	#congress #Obamacare #healthcare #MakeAmericaGreatAgain #MAGA	"810984931262230528"	https://twitter.com/Art_Mofo/status/810984931262230528
	2016-12-19 23:07	0	2	"Expect health care cost to skyrocket after the end of Obamacare to make up for the new millions of uninsured. https:// twitter.com/TheSoundDefens e/status/810983887006470151 …"				"810984919983865856"	https://twitter.com/Lawsonbulk/status/810984919983865856
	2016-12-19 23:07	0	0	"if a disabled person has insurance through the ACA rather than Medicaid, how has system failed them?"				"810984882675609600"	https://twitter.com/sanbrunamo/status/810984882675609600
	2016-12-19 23:07	14	4	"Majority of new enrollments via Obamacare came by putting people on Medicaid - a program that was already failing: http:// bit.ly/2hFpuRi"				"810984810755846144"	https://twitter.com/Heritage_Action/status/810984810755846144
	2016-12-19 23:06	0	0	". @mattyglesias @UES_Lady And they sell it to racist whites who think Obamacare only helps po' black folk."		@mattyglesias @UES_Lady		"810984662298456065"	https://twitter.com/dcpetterson/status/810984662298456065
	2016-12-19 23:06	0	0	"@RepMikeBishop Please take a look @the stradegy to repeal Obamacare http:// heritageaction.com/2016/12/herita ge-action-memo-repeal-obamacare-inauguration/ …"		@RepMikeBishop @the		"810984630136504320"	https://twitter.com/Cindi1Shorty/status/810984630136504320
	2016-12-19 23:06	0	0	"how split we are, taxes, Obamacare , VA,... for starters"				"810984562595627010"	https://twitter.com/Colombiana_Gal/status/810984562595627010
	2016-12-19 23:06	8	7	"Most of the growth in #Medicaid enrollment under the #ACA was in expansion states and the West http:// kaiserf.am/2hMRJy7 pic.twitter.com/IKAqLV63Mf"			#Medicaid #ACA	"810984561106624512"	https://twitter.com/KaiserFamFound/status/810984561106624512
	2016-12-19 23:05	1	4	""deadline to sign up for obamacare extended due to the large amount of people signing up" who's signing up for obamacare ??? lmk"				"810984493335117824"	https://twitter.com/acmyers1_/status/810984493335117824
	2016-12-19 23:05	0	0	"U woiuldn't have voted T (a biz man) if he had wanted to keep & expand Obamacare , & make govt bigger & increase taxes (IOW, do what H said) https:// twitter.com/cherie3jonesE/ status/810981649718669317 …"				"810984468760510468"	https://twitter.com/Dark_Red_Hair/status/810984468760510468
	2016-12-19 23:05	0	0	"#MSM has been publishing #fakenews about #Obamacare #ACA coverage for years! https:// twitter.com/Heritage/statu s/810918422120976386 …"			#MSM #fakenews #Obamacare #ACA	"810984450687455232"	https://twitter.com/JeffjjJohnston/status/810984450687455232
	2016-12-19 23:05	0	0	"If you have employer health insurance, an Obamacare repeal will affect you too! http:// fw.to/ij5HYGj"				"810984415337725952"	https://twitter.com/EnFuegoInc/status/810984415337725952
	2016-12-19 23:05	0	0	"Trump's conservative pick for budget director will help guide ACA repeal https:// lnkd.in/egDjBnN"				"810984379031941120"	https://twitter.com/MidAmHealth/status/810984379031941120
	2016-12-19 23:05	0	0	". @htrnews shares 3 big health care ideas there are on the horizon http:// ow.ly/iCxy307gmjK #healthcare #ACA #healthinsurance"		@htrnews	#healthcare #ACA #healthinsurance	"810984361562636288"	https://twitter.com/VeritasHR/status/810984361562636288
	2016-12-19 23:04	0	0	"I happen to agree with this opinion. Republicans have been wanting to repeal Obamacare from day one, but they... http:// fb.me/8v9uy8hYf"				"810984292776050688"	https://twitter.com/JohnBBranney/status/810984292776050688
	2016-12-19 23:04	0	0	"I think Obamacare needs to include our pet children in our premiums. Not only would it save $. Look at the PR! https:// twitter.com/hardpec/status /810571105052151808 …"				"810984289202360321"	https://twitter.com/Cindyl541/status/810984289202360321
	2016-12-19 23:04	0	0	"They're going to ensure 36,000 people die next year when they gut the ACA . @billhuizenga"		@billhuizenga		"810984286417539072"	https://twitter.com/AnarchyArachnid/status/810984286417539072
	2016-12-19 23:04	0	1	"Why Obamacare enrollees voted for Trump - Vox "...and those other people did not deserve the help." #sigh http://www. vox.com/science-and-he alth/2016/12/13/13848794/kentucky-obamacare-trump …"			#sigh	"810984279220035584"	https://twitter.com/adinaINdc/status/810984279220035584
	2016-12-19 23:04	0	0	"Who, exactly, in Wyoming will benefit from the repeal of Obamacare ? And what will that benefit look like?"				"810984243618861056"	https://twitter.com/izzaboo/status/810984243618861056
	2016-12-19 23:04	4	1	"He has lied to his illiterate constituents. He told them Obamacare was bad; he has lied about Medicare/Social Security, they believed him! pic.twitter.com/2NwniwJ4eS"				"810984183409639424"	https://twitter.com/RodDavis/status/810984183409639424
	2016-12-19 23:04	0	0	"by Sam Stein: Democratic Governors Make 11th-Hour Plea To Save #Obamacare http:// huff.to/2gVm2QZ #p2b #NoKXL"			#Obamacare #p2b #NoKXL	"810984168230305792"	https://twitter.com/da3frog/status/810984168230305792
	2016-12-19 23:04	0	0	"I added a video to a @YouTube playlist http:// youtu.be/u1z6QGgR1YQ?a Aca Lukas - Licna karta - (Audio 1998)"		@YouTube		"810984129336578048"	https://twitter.com/ItsHDMinecraft/status/810984129336578048
	2016-12-19 23:04	0	1	"I have decent medial insurance. Overpriced, but decent. Goddamn Obamacare ."				"810984121086443520"	https://twitter.com/TheBesteban/status/810984121086443520
	2016-12-19 23:04	5	4	"The people most likely to lose in Obamacare repeal live in Trump country http:// buff.ly/2hBpeVO ~ @dailykos #ncpol pic.twitter.com/2USCPIDBQB"		@dailykos	#ncpol	"810984102933528576"	https://twitter.com/jmsexton_/status/810984102933528576
	2016-12-19 23:04	0	0	"17. While GOP is busy tear down ACA , Medicare and Social Security we must not let @realDonaldTrump or Republicans forget that fact."		@realDonaldTrump		"810984084948353024"	https://twitter.com/ChrisRoy78/status/810984084948353024
	2016-12-19 23:03	1	2	"@michaelkeyes he should be happy. Viagra will probably be cheaper under Trump and Obamacare repeal"		@michaelkeyes		"810984005076140032"	https://twitter.com/LeighWells15/status/810984005076140032
	2016-12-19 23:03	0	0	"CMS aims at stabilizing risk pool with 2018 ACA exchange rule | from @anitamulero @healthcaredive http:// bit.ly/2h3Pibm pic.twitter.com/JqPp13Zvx7"		@anitamulero @healthcaredive		"810983970758336514"	https://twitter.com/EyeOnInsurance/status/810983970758336514
	2016-12-19 23:03	9	7	"Did you realise that ... "Healthcare benefits will become taxable" #ushealthcare #obamacare #spdc #healthnews pic.twitter.com/wl4mKjx2dk"			#ushealthcare #obamacare #spdc #healthnews	"810983945609289729"	https://twitter.com/_mindawilson/status/810983945609289729
	2016-12-19 23:03	0	0	"@Avi_Kaplan should I audition for aca next year"		@Avi_Kaplan		"810983910846906368"	https://twitter.com/PTXplease/status/810983910846906368
	2016-12-19 23:03	4	2	"If you're afraid you may lose your health coverage if Obamacare is repealed/replaced, we'd like to hear from you. @ASlavitt #ACA #CMS"		@ASlavitt	#ACA #CMS	"810983909760507904"	https://twitter.com/THCBstaff/status/810983909760507904
	2016-12-19 23:03	0	1	"Ur response (that obamacare isn't socialism) to my tweet doesn't make sense https:// twitter.com/SiessChris/sta tus/810982531981930496 …"				"810983867263881216"	https://twitter.com/Dark_Red_Hair/status/810983867263881216
	2016-12-19 23:03	0	1	"4 the elderly Trump voters who r going to get screwed in a year after they yank ACA privatize medicare and screw them royally"				"810983849530376193"	https://twitter.com/iamchefapple/status/810983849530376193
	2016-12-19 23:03	0	0	"I hope Obamacare can support the mental health issues for all of the Democrats"				"810983810493878276"	https://twitter.com/GaryBean15/status/810983810493878276
	2016-12-19 23:02	5	5	"Healthcare for 22 million Americans is more important than Trump's campaign promises, retain the ACA because #ACAWorks https:// twitter.com/MOJwJ/status/8 10982295402414080 …"			#ACAWorks	"810983595854745600"	https://twitter.com/LacyClayMO1/status/810983595854745600
	2016-12-19 23:01	0	0	"Hey, Paul Ryan and Congressional Republicans: these people do *not* need "relief" from the ACA https:// twitter.com/ASlavitt/statu s/810930700073500672 …"				"810983536006168576"	https://twitter.com/JanF_Blogs/status/810983536006168576
	2016-12-19 23:01	0	0	"Get a free quote! Come and get the best Price! #simplyinsurance #health #obamacare #auto #liability #home #commercial pic.twitter.com/r7EKSV79WW"			#simplyinsurance #health #obamacare #auto #liability #home #commercial	"810983475507580928"	https://twitter.com/Simplyinsfl/status/810983475507580928
	2016-12-19 23:01	0	1	"Not touch ACA ? I guess you weren't listening. Hell, he's gonna drop kick it into the stratosphere. First thing."				"810983474974916610"	https://twitter.com/katiejsheridan/status/810983474974916610
	2016-12-19 23:01	0	0	"Dems stop begging Repubs not to kill ACA . Dare them to kick 20 mil off insurance after election they won by 100k votes. #resist #obamacare"			#resist #obamacare	"810983444591284225"	https://twitter.com/leftleadingblog/status/810983444591284225
	2016-12-19 23:01	0	0	"How Republicans, Democrats can together fix Obamacare http:// ow.ly/ffjK307aQio http:// fb.me/12ohqnhaL"				"810983434533343232"	https://twitter.com/LKNBenefits/status/810983434533343232
	2016-12-19 23:01	0	0	"Yes, I'm with you on that! And Obama's comin after the guns and don't cut my gummint benefits or my Obamacare because I voted 4 you to do so https:// twitter.com/MPeazey/status /810944937504243712 …"				"810983389515972612"	https://twitter.com/jbaby56/status/810983389515972612
	2016-12-19 23:01	0	2	"Dem's held all the power and gave us Obamacare . What will GOP do? Wall Street can't wait!! The rest us better brace for turbulence."				"810983347350622209"	https://twitter.com/Pat_495258/status/810983347350622209
	2016-12-19 23:00	135	259	"Many counties that went for Trump depend heavily on Obamacare . They better hope Trumpcare covers cutting off your nose to spite your face."				"810983253607936000"	https://twitter.com/Impolitics/status/810983253607936000
	2016-12-19 23:00	9	8	"Counties that saw big gains in insurance coverage under Obamacare were more likely to vote for Trump http:// blogs.wsj.com/washwire/2016/ 12/19/trump-counties-would-see-big-impact-from-obamacare-repeal/ … pic.twitter.com/i1LmzUA0f4"				"810983198721277952"	https://twitter.com/NickTimiraos/status/810983198721277952
	2016-12-19 23:00	0	0	"ACA Repeal Will Affect Privately Insured via @chicagotribune http:// ow.ly/y26U307h51d"		@chicagotribune		"810983189070155777"	https://twitter.com/HIDAorg/status/810983189070155777
	2016-12-19 23:00	0	0	"14. Dems will have to work fast. GOP planning to gut ACA , Medicare and Social Security. 2018 is vitally important."				"810983099911835648"	https://twitter.com/ChrisRoy78/status/810983099911835648
	2016-12-19 23:00	0	1	". @seiu_uhw members headed to Washington, D.C. to urge congress members to protect the ACA and improve healthcare for all. #healthcarejustice pic.twitter.com/oeMFF5JV7u"		@seiu_uhw	#healthcarejustice	"810983087895171072"	https://twitter.com/seiu_uhw/status/810983087895171072
	2016-12-19 23:00	1	1	"#Obamacare repeal is coming -- piece by piece, and in the worst possible way http:// bit.ly/2hvLkXv #HealthCare #RealStories pic.twitter.com/FspHwB70zM"			#Obamacare #HealthCare #RealStories	"810983072401420289"	https://twitter.com/healtheo360/status/810983072401420289
	2016-12-19 23:00	0	0	"I added a video to a @YouTube playlist http:// youtu.be/ljXDVeiu_fM?a Ivana Selakov i Aca Lukas - Omaklo mi se - (Official Video 2014 ) HD"		@YouTube		"810983066277711872"	https://twitter.com/ItsHDMinecraft/status/810983066277711872
	2016-12-19 23:00	0	0	"I pay 940.00 a month for Obamacare . =( #jiujitsu #teamrhinobjj #grappling #idaho #pedrosauer #boise #boisestate #meridian #nampaidaho"			#jiujitsu #teamrhinobjj #grappling #idaho #pedrosauer #boise #boisestate #meridian #nampaidaho	"810983060241928192"	https://twitter.com/KeithOwen/status/810983060241928192
	2016-12-19 23:00	1	1	"Should Congress decide to repeal the #ACA , "the ripple effects are going to be enormous." http:// bit.ly/2hwba0J #txlege #txhealth"			#ACA #txlege #txhealth	"810983057008295936"	https://twitter.com/CPPP_TX/status/810983057008295936
	2016-12-19 22:59	0	0	"We officially lost the #ColdWar today because GOP didn't want to work on Obamacare compromise & wanted to be racists #SadDay"			#ColdWar #SadDay	"810983036506488833"	https://twitter.com/ArchieTex/status/810983036506488833
	2016-12-19 22:59	0	0	"Obamacare : An “Antisocial” Form of Socialized Medicine - Townhall http:// dlvr.it/MwT9wv"				"810982942088409089"	https://twitter.com/MedicinePlaza/status/810982942088409089
	2016-12-19 22:58	0	0	"Doesn't ObamaCare pay for therapy? https:// twitter.com/CraigRBrittain /status/810966155250667520 …"				"810982718892896256"	https://twitter.com/misstozak/status/810982718892896256
	2016-12-19 22:58	0	0	"Today is the last day to enroll in Obamacare"				"810982682960269312"	https://twitter.com/prettybosslayde/status/810982682960269312
	2016-12-19 22:58	1	0	"Love yourself enough to dream of better #health and go get it! If you need #ACA #insurance , today is the last day... http:// fb.me/57VDdTFz4"			#health #ACA #insurance	"810982595882270720"	https://twitter.com/UrbanHousecall/status/810982595882270720
	2016-12-19 22:58	0	0	"I know. She's due for her six month check up. Make sure her thyroid levels are still good."				"810982582674452481"	https://twitter.com/LyricalSunset7/status/810982582674452481
	2016-12-19 22:58	0	0	"It is NOT immaterial.His presidency was illegitimate. It was fraudulent. Every executive order and regulation he signed is invalid: Obamacare https:// twitter.com/mitchellvii/st atus/810535097963315200 …"				"810982554505449473"	https://twitter.com/diane_preciado/status/810982554505449473
	2016-12-19 22:57	0	1	"If you have employer-provided #health #insurance , an #Obamacare repeal would affect you too via http://www. latimes.com/business/la-fi -obamacare-employer-insurance-20161219-story.html … pic.twitter.com/PHay7mfgBJ"			#health #insurance #Obamacare	"810982525711454212"	https://twitter.com/taxbuzzonline/status/810982525711454212
	2016-12-19 22:57	0	0	"**ALONG THE LINES OF THE IRANIAN PARTIES--**OBAMA DESTROYED THE DEMOCRAT PARTY NOW KNOWN AS DEMRATS=WITH OBAMACARE -COMMON CORE-"				"810982440176975873"	https://twitter.com/JJJFLYER/status/810982440176975873
	2016-12-19 22:57	0	1	"Does that mean I do not have to pay the extortion fee for not enrolling in Obamacare ?"				"810982424519708672"	https://twitter.com/carlos_dangerou/status/810982424519708672
	2016-12-19 22:57	0	0	"OR try 2 live after u learn. Tough to do w/o Healthcare. They love there state exchange but hate Obamacare . #ElectoralCollege"			#ElectoralCollege	"810982407222558724"	https://twitter.com/GalvCountyDems/status/810982407222558724
	2016-12-19 22:57	0	0	"Millions lost coverage because of ACA ! You never had all details of that plan , also many lies. Better is possible !"				"810982395059011584"	https://twitter.com/rita_ricks/status/810982395059011584
	2016-12-19 22:57	0	0	"Obamacare demand so high, administration extends the deadline to meet it http:// click.actionnetwork.org/mpss/c/6AA/ni0 YAA/t.239/mgu12yrtQgKyOwIXDnTlxw/h17/zR1J7iRW-2BzS6i1Q9SLTfwQLBXCJvFBgJf2nBWmAh4cVm8C3uiAx6-2Ff5J7lhlZ9De7Qki5KcozEfa1mt4fiUon3xmAta-2Fu-2FNmZiAcQ-2BitA3bqNq3SRs1rIlMHjUPViSHZM1-2FHxffltPhPASgiLa5gm1ZL19IbkuVzX-2Fs94OBprt6DF56fps3rb-2FLLGB7rZLPOjGKx2TS-2BGBMJz8MhTAkqzfLD1Oya6PANc5xFWGblGuqtoG-2BYsmZyz34DT30isZ3-2Bc7l-2BUbQjYrDAozED5MP-2FQIuYTjwDRQ0VE-2FK-2B4hXlYkb5RNC9j8XmP5PNMTmZfjWQyoPPWSU-2Bz4PqyZeIBSFLaPXd1jJdKPMAYgQ-2FiOBPchlGKkKP3L-2BTrg3PT4RLr6g40NAxbgq09rL9j5vj9F2Qgv8QMu7TqdNLhNYYzRtUOzlpdwCSDVstlUijs5gotPC-2BCV-2FbEPSXb-2FoG0VOfgcgu4yDvzRWcWze1UixBG2ATjCdjaEmrKrzkLMmsEM3TV8cJRoXGx6gVI3jCIJYLyeSxQmET2rIjBw7SvRdRAY9z5JX8TuGzY0fC1K3lwka-2B2tq-2FO958-2B2jkMUrZijyqLVFELdKrCgSBeTT2EgLbZf2pnWujrSXed-2F4voujnfnjAfAEajd1Vg6RzvS1v379ZenroRQ-3D-3D …"				"810982393679118336"	https://twitter.com/redhed67/status/810982393679118336
	2016-12-19 22:57	0	0	"yes, but before that: He won't repeal Obamacare w/no replacement He won't dismantle EPA He won't cause internat'l crisis & war"				"810982363953889284"	https://twitter.com/protanope/status/810982363953889284
	2016-12-19 22:57	0	0	"If you have employer-provided health insurance, an Obamacare repeal would affect you too http:// fw.to/QsacNhR"				"810982361403781121"	https://twitter.com/annak3333/status/810982361403781121
	2016-12-19 22:57	0	1	"Republicans Plan On Repealing ObamaCare “Within Weeks”"				"810982339857842176"	https://twitter.com/PWilliamsD/status/810982339857842176
	2016-12-19 22:57	0	0	"Well they want you to own a healthy kitty too"				"810982304956948483"	https://twitter.com/aca_fan1980/status/810982304956948483
