username;date;retweets;favorites;text;geo;mentions;hashtags;id;permalink
	2016-07-04 14:17	0	0	"BREAKING: Woman Who Ran Obamacare Defects, Reveals Obama’s Sick Next Step - World News Politics http:// fb.me/5pA1NswBk"				"749970300524081152"	https://twitter.com/DennisClarke_0/status/749970300524081152
	2016-07-04 14:16	0	0	"Heard this point years ago before ACA - since elites can get round the system pressure to change reduced https:// twitter.com/doc4aged/statu s/749968504305049600 …"				"749970216881385472"	https://twitter.com/calangst/status/749970216881385472
	2016-07-04 14:16	0	0	"#MemeoRandum The GOP's pointless ObamaCare war (Juan Williams/The Hill): Juan Williams / T... http:// bit.ly/29eDkW7 #UniteBlue #Tcot"			#MemeoRandum #UniteBlue #Tcot	"749970196807290880"	https://twitter.com/WomenWorldNews1/status/749970196807290880
	2016-07-04 14:16	0	0	"This State May Ditch Obamacare for Single-Payer Healthcare This November http://www. fool.com/investing/2016 /07/03/this-state-may-ditch-obamacare-for-single-payer-he.aspx?source=yahoo-2&utm_campaign=article&utm_medium=feed&utm_source=yahoo-2&yptr=yahoo …"				"749970169586331648"	https://twitter.com/Mista_Craw4ed/status/749970169586331648
	2016-07-04 14:15	1	1	"Newly updated #IRS ACA webinars for #employers & #HealthCare coverage providers. http:// go.usa.gov/cuUHk #tax"			#IRS #employers #HealthCare #tax	"749969888886816769"	https://twitter.com/IRSnews/status/749969888886816769
	2016-07-04 14:15	0	0	"CPAs Performing ACA Reporting … Pay Attention to HIPAA Compliance | ACA Reporting Service http:// buff.ly/1OTydIy"				"749969771786043392"	https://twitter.com/RobinBenton/status/749969771786043392
	2016-07-04 14:12	0	0	"#jobs #finance Management Accountant: HC-Woking, Newly qualified ( ACA /ACCA or equivalent) from practi... http:// bit.ly/29l1alY #london"			#jobs #finance #london	"749969133937102848"	https://twitter.com/JobsLDNFin/status/749969133937102848
	2016-07-04 14:10	0	0	"#Obamacare Insurers Are Looking for a Taxpayer Bailout | The Fiscal Times http:// ow.ly/GdhY301UjfY #tcot #TeaParty #tlot #p2 #uniteblue"			#Obamacare #tcot #TeaParty #tlot #p2 #uniteblue	"749968661746708480"	https://twitter.com/dsparker001/status/749968661746708480
	2016-07-04 14:10	0	0	"Rate hikes for ACA in Oregon, what happens next and might follow them? http:// ow.ly/4VOr301Ugvb #limitedchoices #ACA #Increaseforcoverage"			#limitedchoices #ACA #Increaseforcoverage	"749968549549076481"	https://twitter.com/duvosolutions/status/749968549549076481
	2016-07-04 14:09	0	0	"#acaiyou @alternatively_healthy having a cheeky bowl in @wholefoodsmarketuk #acai #aca … http:// ift.tt/29hfCLr pic.twitter.com/v8w8149eDR"		@alternatively_healthy @wholefoodsmarketuk	#acaiyou #acai #aca	"749968381994995712"	https://twitter.com/sambazonuk/status/749968381994995712
	2016-07-04 14:08	0	0	"Also bear in mind Forbes is against Obamacare"				"749968191535796224"	https://twitter.com/ReliFrend/status/749968191535796224
	2016-07-04 14:07	0	0	"McAfee Drops Obamacare BOMBSHELL, Hackers Will Be Able To Empty Bank Accounts http:// b4in.info/iKm0 #MakeDCListen #TeaParty #tcot #PJNet"			#MakeDCListen #TeaParty #tcot #PJNet	"749967952447873024"	https://twitter.com/WSCP2/status/749967952447873024
	2016-07-04 14:06	0	0	"This State May Ditch Obamacare for Single-Payer Healthcare This November -- The Motley Fool http://www. fool.com/investing/2016 /07/03/this-state-may-ditch-obamacare-for-single-payer-he.aspx#.V3ptWjE-rQk.twitter …"			#	"749967584670289921"	https://twitter.com/denis4help/status/749967584670289921
	2016-07-04 14:06	0	0	"Colorado could ditch Obamacare for a single-payer system via /r/politics @WildAnimus http:// ift.tt/29qXLUH pic.twitter.com/Y5r5mmB17V"		@WildAnimus		"749967524662538240"	https://twitter.com/philusb/status/749967524662538240
	2016-07-04 14:05	0	0	"With the new ACA Syllabus, they are the same. https:// twitter.com/ViCktorr_/stat us/749948106708516864 …"				"749967488792858628"	https://twitter.com/vanboyosky/status/749967488792858628
	2016-07-04 14:04	0	0	"New article by Juan Williams: "The #GOP 's pointless war on #Obamacare " is on http://www. obamacarereporter.com ! #ACA #HHS #POTUS #BigDough #DOH !"			#GOP #Obamacare #ACA #HHS #POTUS #BigDough #DOH	"749967230134353920"	https://twitter.com/OCareReporter/status/749967230134353920
	2016-07-04 14:03	0	0	". @SpeakerRyan - Please get specific on “replacement” plan for health. My son has cystic fibrosis. Compare to ACA . Need proof not platitudes."		@SpeakerRyan		"749966923262144513"	https://twitter.com/MickieMcMahon/status/749966923262144513
	2016-07-04 14:03	0	0	"Many Wont Be Able To Keep Their Doctors Under Obamacare http:// bit.ly/1b5bkmc @DCExaminer #TeaPartyToldYouSo #RedNationRising #tcot #PJNet"		@DCExaminer	#TeaPartyToldYouSo #RedNationRising #tcot #PJNet	"749966818085707776"	https://twitter.com/WSCP1/status/749966818085707776
	2016-07-04 14:03	0	0	"The rest of you on Obamacare and actually pay, will be getting even better news come the Nov release of the new 2017 rates"				"749966747348836352"	https://twitter.com/don17571/status/749966747348836352
	2016-07-04 14:02	2	0	"Declare Your Freedom from Obamacare | Listen to today's HFM Audio on CCHF homepage: http:// cchfreedom.org pic.twitter.com/7S2suR5Pbf"				"749966658807136256"	https://twitter.com/CCHFreedom/status/749966658807136256
	2016-07-04 14:01	0	0	"Leader-Guide Rendezvous... Photo from ACA Canyoneering meetup, 26 September 2015. Photo credits: Running R. More... http:// fb.me/1hgc74xUl"				"749966405416595461"	https://twitter.com/ACAcanyoneering/status/749966405416595461
	2016-07-04 14:01	1	0	"Why Companies are Managing ACA Compliance with Technology http://www. zanebenefits.com/blog/why-compa nies-are-managing-aca-compliance-with-technology … pic.twitter.com/fPBBTh5JxA"				"749966274395078657"	https://twitter.com/zbenefits/status/749966274395078657
	2016-07-04 14:01	0	0	"JEFF SESSIONS ISSUES FINAL CRITICAL ALERT: OBAMATRADE JUST LIKE AMNESTY, OBAMACARE http:// 3tags.org/l/xa0v via @3tags_org #PJNET"		@3tags_org	#PJNET	"749966272448856064"	https://twitter.com/Leonidas_Galt/status/749966272448856064
	2016-07-04 14:00	0	0	"ObamaCare was really Hillary's baby. She wouldn't get rid of it only sink more bailout money to a dying system. It's has cost us billions!"				"749966233613770752"	https://twitter.com/jrarvelo/status/749966233613770752
	2016-07-04 13:59	1	1	"If Obamacare is so great, how come Congress doesn't have it?"				"749965823096213504"	https://twitter.com/SoFineMammy26/status/749965823096213504
	2016-07-04 13:58	0	0	"@manifestive @sarkodie dem bi Accra aca boys. Sark in talk bi like u dey do funfair way u invite enter-pee frm oda skuul"		@manifestive @sarkodie		"749965520837939200"	https://twitter.com/MCmikayGh/status/749965520837939200
	2016-07-04 13:55	0	0	"COMPANY ACCOUNTANT for varied hands on role. #ACCA #ACA or #CIMA qualified with #manufacturing experience preferred http:// goo.gl/i2zLTb"			#ACCA #ACA #CIMA #manufacturing	"749964781923233792"	https://twitter.com/KingstonRecLtd/status/749964781923233792
	2016-07-04 13:55	0	0	"THANKS OBAMA! New Study Shows Obamacare Saves America $2.6 Trillion (STATS) http:// fb.me/7YDUsvHpK"				"749964768807641088"	https://twitter.com/ALKoide/status/749964768807641088
	2016-07-04 13:54	0	0	"#job Solutions - Business Analyst / Project Manager - ACA IT-Solutions - Olen, Hasselt, Gent:... http:// tinyurl.com/gvml8mr #IT #jobs #Gent"			#job #IT #jobs #Gent	"749964569372528640"	https://twitter.com/ictjob_9/status/749964569372528640
	2016-07-04 13:54	1	1	"Checking out " Obamacare -Causing Insurers To Beg For Bailouts" on Tea Party Command Center: http:// teapartyorg.ning.com/forum/topic/sh ow?id=4301673%3ATopic%3A4258090&xgs=1&xg_source=msg_share_topic …"				"749964498027450368"	https://twitter.com/SpaceWeasel/status/749964498027450368
	2016-07-04 13:53	0	0	"Juan Williams: The GOP's pointless ObamaCare war: Trump, about to be crowned as the Republican presidential n... http:// bit.ly/29bs0cM"				"749964347888111617"	https://twitter.com/WATC/status/749964347888111617
	2016-07-04 13:51	0	0	"#finance #jobs Commercial Finance Manager: To apply for this role you will be fully ACA , ACCA o... http:// bit.ly/29jwXSE #Peterborough"			#finance #jobs #Peterborough	"749963835008626689"	https://twitter.com/uktemps/status/749963835008626689
	2016-07-04 13:51	0	0	"wouldn't it be funny if her name was drawn? #nfb16"			#nfb16	"749963799382417408"	https://twitter.com/maryann08/status/749963799382417408
	2016-07-04 13:50	0	0	"aca _itmatch: How to Live Stream Your Events to the World? http://www. hwswworld.com/index.php?rout e=product/category&path=1403m … Way Innovation Balancing People: http://www. amazon.com/gp/product/477 0024762/ref=as_li_tf_tl?ie=UTF8&camp=1789&creative=9325&creativeASIN=4770024762&linkCode=as2&tag=hardwaresoftw-20 …"				"749963555328458752"	https://twitter.com/ClouDatAI/status/749963555328458752
	2016-07-04 13:50	0	0	"Juan Williams: The GOP's pointless ObamaCare war http:// thehill.com/opinion/juan-w illiams/286425-juan-williams-the-gops-pointless-obamacare-war#.V3pplwxlY0A.twitter …"			#	"749963550383173632"	https://twitter.com/benignopf/status/749963550383173632
	2016-07-04 13:50	0	0	"Trainee Chartered Accounts Assistant ACA - Summer 2016: Employer: Bishop Fleming Application closing… http:// dlvr.it/LjxPlR #gradjobsUSW"			#gradjobsUSW	"749963485954486272"	https://twitter.com/USWcareers/status/749963485954486272
	2016-07-04 13:49	0	0	"Take a look at the winning routine! Well done ' ACA Moonlight'!! http:// fb.me/2gcuwqqgR"				"749963434888925184"	https://twitter.com/AltrinchamCOA/status/749963434888925184
	2016-07-04 13:49	0	0	"Hi marvellous researcher, your abstract is"				"749963327158169600"	https://twitter.com/aca_affirmation/status/749963327158169600
	2016-07-04 13:45	0	0	"Where's Door Prize Dianne? @NFB_voice #nfb16"		@NFB_voice	#nfb16	"749962380856131584"	https://twitter.com/aca_fan1980/status/749962380856131584
	2016-07-04 13:43	0	0	"How Obamacare Went South In Mississippi http:// fb.me/5buMhBwcL"				"749961805791764480"	https://twitter.com/asalhmemphis/status/749961805791764480
	2016-07-04 13:42	0	3	"Obamacare has taken away 1 1/2 pay on Sundays for small business`s again the working people are the ones that pay."				"749961625977913344"	https://twitter.com/littlebit156/status/749961625977913344
	2016-07-04 13:42	0	0	"#job Solutions - Atlassian Solution Engineer - ACA IT-Solutions - Hasselt - Westerlo - Bru... http:// tinyurl.com/hhz3nx5 #IT #jobs #Belgium"			#job #IT #jobs #Belgium	"749961488324894721"	https://twitter.com/ictjob_be/status/749961488324894721
	2016-07-04 13:42	0	0	"#job Solutions - Business Analyst / Project Manager - ACA IT-Solutions - Olen, Hasselt, Ge... http:// tinyurl.com/gvml8mr #IT #jobs #Belgium"			#job #IT #jobs #Belgium	"749961487511277568"	https://twitter.com/ictjob_be/status/749961487511277568
	2016-07-04 13:38	0	0	"The D.C. Circuit boots another ACA lawsuit. (as they should) http:// theincidentaleconomist.com/wordpress/the- d-c-circuit-boots-another-aca-lawsuit/ …"				"749960578442137600"	https://twitter.com/JHeath_/status/749960578442137600
	2016-07-04 13:33	0	1	"Obamacare is unsustainable. #DumpsterFire"			#DumpsterFire	"749959279369650176"	https://twitter.com/pinecohen/status/749959279369650176
	2016-07-04 13:33	0	1	"We need to know how much of taxpayers money is being used to keep Obamacare afloat & how much of that money will go to him."				"749959240626864128"	https://twitter.com/plkarter/status/749959240626864128
	2016-07-04 13:33	0	0	"The Republican Party's Pointless Obamacare War http:// bit.ly/29HMZ8G #vanepolitics #vane"			#vanepolitics #vane	"749959236352823301"	https://twitter.com/vanepolitics/status/749959236352823301
	2016-07-04 13:32	0	1	"Juan Williams: The GOP's pointless ObamaCare war http:// thehill.com/opinion/juan-w illiams/286425-juan-williams-the-gops-pointless-obamacare-war …"				"749959125413625856"	https://twitter.com/csiemaszko/status/749959125413625856
	2016-07-04 13:31	0	2	"Juan Williams: The GOP's pointless ObamaCare war http:// thehill.com/opinion/juan-w illiams/286425-juan-williams-the-gops-pointless-obamacare-war …"				"749958804687638528"	https://twitter.com/KevinCokley1/status/749958804687638528
	2016-07-04 13:31	0	0	"With Obamacare they'll take away your "guns" don't want you hurting yourself. Incremental communism!"				"749958786450763781"	https://twitter.com/railrd/status/749958786450763781
	2016-07-04 13:31	33	22	""The GOP's pointless ObamaCare war" http:// hill.cm/B8dUJqy pic.twitter.com/hWBmpr2bLq"				"749958710269734912"	https://twitter.com/thehill/status/749958710269734912
	2016-07-04 13:29	0	0	"Juan Williams: The GOP's pointless ObamaCare war http:// thehill.com/opinion/juan-w illiams/286425-juan-williams-the-gops-pointless-obamacare-war …"				"749958421810548736"	https://twitter.com/SchoharieBuzz/status/749958421810548736
	2016-07-04 13:28	0	0	"A Detailed Look At House Republicans’ First Official Plan To Replace Obamacare And Reform Health Care http://www. forbes.com/sites/theapoth ecary/2016/06/22/a-detailed-look-at-house-republicans-first-official-plan-to-replace-obamacare-and-reform-entitlements …"				"749957939071361027"	https://twitter.com/DispatchesJB/status/749957939071361027
	2016-07-04 13:26	0	0	"@USATODAY @AndyMarlette America is doomed economically. Obamacare hyperinflated premiums are USA's fall. pic.twitter.com/ZDnTmi9dCV"		@USATODAY @AndyMarlette		"749957512481345536"	https://twitter.com/Panzram12/status/749957512481345536
	2016-07-04 13:24	0	1	"My brother in law, who previously was priced out of ins market, literally had his life saved by ACA ."				"749957164349984768"	https://twitter.com/Anumbr1/status/749957164349984768
	2016-07-04 13:23	0	0	"Apparently this report is boring a crying baby at #nfb16 general session lol"			#nfb16	"749956863488393216"	https://twitter.com/aca_fan1980/status/749956863488393216
	2016-07-04 13:22	0	0	"I'm still amazed that so many conservative voters fall in line behind tired GOP platitude that ACA is bad 4 them @marcylauren"		@marcylauren		"749956531630800897"	https://twitter.com/jeanthorpe/status/749956531630800897
	2016-07-04 13:22	0	1	"Insurance companies don't run anything - if they did obamacare wouldn't exist https:// twitter.com/kbayquoi/statu s/749955743621808128 …"				"749956516212596736"	https://twitter.com/thatbillokeefe/status/749956516212596736
	2016-07-04 13:21	0	0	". @SCrowder talks Socialized Obamacare with Neil Cavuto. #Tcot #PJNet #TeaParty https://www. youtube.com/watch?v=CQx_Jt _U5h0 …"		@SCrowder	#Tcot #PJNet #TeaParty	"749956293998153728"	https://twitter.com/PJTVVideo/status/749956293998153728
	2016-07-04 13:19	0	0	"We don't want no stinking #obamacare #PJNET #pardonmygrammer"			#obamacare #PJNET #pardonmygrammer	"749955870096695296"	https://twitter.com/US_P8triot/status/749955870096695296
	2016-07-04 13:19	0	0	"Keep at it lovely human, your scribbles are worth way more than any grade"				"749955776475635712"	https://twitter.com/aca_affirmation/status/749955776475635712
	2016-07-04 13:17	0	1	"Colorado May Ditch Obamacare for Single-Payer Healthcare This November. Would be great if the nation set up a single-payer system."				"749955402842996737"	https://twitter.com/bobmunoz/status/749955402842996737
	2016-07-04 13:17	0	0	"Juan Williams: The GOP's pointless ObamaCare war http:// thehill.com/opinion/juan-w illiams/286425-juan-williams-the-gops-pointless-obamacare-war#.V3phycZbE8F.twitter …"			#	"749955168465133568"	https://twitter.com/Rokbehappy1234/status/749955168465133568
	2016-07-04 13:16	0	0	"#Obamacare Isn’t Stopping #Doctors ’ Incomes From Soaring via @FortuneMagazine http:// for.tn/1ti78Lx?xid=fo r_tw_sh …"		@FortuneMagazine	#Obamacare #Doctors	"749954918224715776"	https://twitter.com/HealthITmHealth/status/749954918224715776
	2016-07-04 13:15	0	0	"#Obamacare command/control vision turns Americans in2 perpetual patients. Turn the tide. #PJNET http:// yourpersonalaffordablecareact.com /"			#Obamacare #PJNET	"749954806551228417"	https://twitter.com/KhannaOnHealth/status/749954806551228417
	2016-07-04 13:15	0	0	"1 out of 13 Americans has an #AutoImmune disease #health #lupus #science #Obamacare #USA http:// arzillion.com/S/ZminUF pic.twitter.com/APfh3o9hIs"			#AutoImmune #health #lupus #science #Obamacare #USA	"749954774343176192"	https://twitter.com/arzillion/status/749954774343176192
	2016-07-04 13:15	0	0	"Obamacare enrollment at 11.1M, as some drop off after premium bills come due http:// ow.ly/OIgM301TiAR"				"749954759793270784"	https://twitter.com/EOTPROTrading/status/749954759793270784
	2016-07-04 13:15	0	0	"Obamacare enrollment at 11.1M, as some drop off after premium bills come due http:// ow.ly/OIgM301TiAR"				"749954759755530240"	https://twitter.com/EOTPROGlen/status/749954759755530240
	2016-07-04 13:15	0	0	"Obamacare enrollment at 11.1M, as some drop off after premium bills come due http:// ow.ly/OIgM301TiAR"				"749954759529029632"	https://twitter.com/EOTPROBill/status/749954759529029632
	2016-07-04 13:15	0	0	"Obamacare enrollment at 11.1M, as some drop off after premium bills come due http:// ow.ly/OIgM301TiAR"				"749954759172485120"	https://twitter.com/ShellyDennis2/status/749954759172485120
	2016-07-04 13:15	0	0	"Truthful, excellent observation!! Hell, maybe they can vote 50+ more times to kill Obamacare !"				"749954735948660736"	https://twitter.com/klucygoosey/status/749954735948660736
	2016-07-04 13:13	0	0	"Affordable Care Act #ACA Health Insurance Marketplace Notices Are Coming http:// bit.ly/29blVgk pic.twitter.com/G2xJjBU9xt"			#ACA	"749954221630304256"	https://twitter.com/Mike_Smith1/status/749954221630304256
	2016-07-04 13:12	0	0	"Colorodo May Replace ObamaCare with Single Payer http:// fb.me/Iaasy0tP"				"749953913571332096"	https://twitter.com/OccupyBangor/status/749953913571332096
	2016-07-04 13:11	0	0	"ACA must be repealed No alternative Join #USFreedomArmy to help accomplish this mission http:// usfreedomarmy.com pic.twitter.com/QZgBb4VNZe K"			#USFreedomArmy	"749953770604204032"	https://twitter.com/Taking_Back_USA/status/749953770604204032
	2016-07-04 13:11	0	0	"Nearly 1.6 Million People Dropped Out Of Obamacare This Year http:// klou.tt/1iyj4r8nrhxfq . #notworking Out of pocket a burden for most"			#notworking	"749953768154763264"	https://twitter.com/MadonnaWarwick/status/749953768154763264
	2016-07-04 13:10	0	0	"#ACA Broadly Prohibits #Sex #Discrimination http:// blog.epspros.com/2016/06/aca-br oadly-prohibits-sex-discrimination.html?spref=tw …"			#ACA #Sex #Discrimination	"749953611011096576"	https://twitter.com/epspros/status/749953611011096576
	2016-07-04 13:10	0	1	"The GOP's pointless ObamaCare war (Juan Williams / The Hill) http:// thehill.com/opinion/juan-w illiams/286425-juan-williams-the-gops-pointless-obamacare-war … http://www. memeorandum.com/160704/p20#a16 0704p20 …"			#a16	"749953552966037505"	https://twitter.com/memeorandum/status/749953552966037505
	2016-07-04 13:09	0	0	"@amuses The real enemy is Trump, asshole. Hillary is for Obamacare , Trump against."		@amuses		"749953384258699268"	https://twitter.com/chicfire45/status/749953384258699268
	2016-07-04 13:09	0	0	"House subpoenas documents on $3.5 billion in Obamacare payments http:// klou.tt/4c967id2uga5"				"749953264171388929"	https://twitter.com/MadonnaWarwick/status/749953264171388929
	2016-07-04 13:09	0	0	"@mamaduck9370 Why not have an Affordable private health insurance like Obamacare in the USA?"		@mamaduck9370		"749953204079644673"	https://twitter.com/j1m1v/status/749953204079644673
	2016-07-04 13:08	11	2	"Blue Cross & Blue Shield of MN decided to stop selling health plans to individuals & families in Minnesota starting next year. Obamacare ."				"749953016183164928"	https://twitter.com/Daggy1/status/749953016183164928
	2016-07-04 13:06	0	0	"thanks Obamacare .... https:// twitter.com/ICITorg/status /749952243114340352 …"				"749952517669154816"	https://twitter.com/Kan7sas/status/749952517669154816
	2016-07-04 13:05	0	0	"Is #Obamacare constitutional? http:// ow.ly/2iAp301LHuJ"			#Obamacare	"749952290543529984"	https://twitter.com/AgentRobSchwab/status/749952290543529984
	2016-07-04 13:05	15	11	"Obama releases terrorists from Gitmo He surrendered Iraq He lied to America about Obamacare , IRS, illegal imm, & terrorist attacks in the US"				"749952251175661568"	https://twitter.com/CapitalismLover/status/749952251175661568
	2016-07-04 13:04	0	0	"HabibRahmanLive: tmj_chi_it : #IT #Job in #Chicago , IL: Information Technology Inside Sales Representative at ACA … https:// twitter.com/tmj_chi_it/sta tus/749951176070737920 … )"			#IT #Job #Chicago	"749951991611293696"	https://twitter.com/TheSumanBiswas/status/749951991611293696
	2016-07-04 13:03	1	0	"#jobs #accountancyjobs Technical Advisor ACA #londonjobs #surreyjobs #hampshirejobs http://ntxj.me?axr=118641 ntxj.me/?axr=118641"			#jobs #accountancyjobs #londonjobs #surreyjobs #hampshirejobs	"749951788409839616"	https://twitter.com/networx_recruit/status/749951788409839616
	2016-07-04 13:03	0	1	"RT @AHLAlerts "Younger US residents are slow to enroll in #exchange plans, and one expert says #ACA is to blame: " http:// ow.ly/MEsf301woeY"		@AHLAlerts	#exchange #ACA	"749951703500353536"	https://twitter.com/Mike_Jones38/status/749951703500353536
	2016-07-04 13:02	0	0	"July’s exams are 2 weeks away. Get the most out of your revision with our tips #ACA https://www. caba.org.uk/help-and-guide s/information/study-smart-your-plan-get-most-out-revising … pic.twitter.com/zG5XWF1Mqy"			#ACA	"749951469638520832"	https://twitter.com/cabacharity/status/749951469638520832
	2016-07-04 13:01	50	48	"SAVE USA: Close Border; Stop Islamic Immigr; Force Illegals to Self Deport; Welfare Ref; Rebuild DOD; Harden Power Grid; Kill ACA /TPP #tcot"			#tcot	"749951324163305472"	https://twitter.com/JohnFromCranber/status/749951324163305472
	2016-07-04 13:01	0	0	"#ACA Insurers premium expand revenues but privat market losses high pic.twitter.com/CO0myuWZNe"			#ACA	"749951277476478976"	https://twitter.com/SpinePainBegone/status/749951277476478976
	2016-07-04 13:00	0	0	"#Obamacare tax hike scheduled to hit retirees next year http:// bit.ly/29avMsJ via @clevelanddotcom #hcr #aca #healthcare"		@clevelanddotcom	#Obamacare #hcr #aca #healthcare	"749950892602847232"	https://twitter.com/RepealPledge/status/749950892602847232
	2016-07-04 12:56	0	0	"THE OBAMACARE DOZEN ~ VOTE THEM OUT IN 2014!!! pic.twitter.com/fl9TMbaPCU #pjnet"			#pjnet	"749949986926895105"	https://twitter.com/Rowanes/status/749949986926895105
	2016-07-04 12:56	5	1	"Who did that? Oh yea..Obama took $500Bil from peoples Medicare to pay 4 ACA cuz illegals need more care than elderly https:// twitter.com/foothands/stat us/749847268187136000 …"				"749949956606177281"	https://twitter.com/Fairfax51/status/749949956606177281
	2016-07-04 12:55	0	0	"I want to wish @NFB_voice and the rest of the nfb family and those at #nfb16 a happy 4th! Long live freedom!"		@NFB_voice	#nfb16	"749949835768373248"	https://twitter.com/aca_fan1980/status/749949835768373248
	2016-07-04 12:55	4	0	"Paul Ryan’s Sickening Obamacare Replacement - http:// goo.gl/ISRY2d #seniors #retirement #Wisconsin #Milwaukee"			#seniors #retirement #Wisconsin #Milwaukee	"749949636845068290"	https://twitter.com/ed_hooley/status/749949636845068290
	2016-07-04 12:50	0	0	"ulol hahhaha"				"749948549010300930"	https://twitter.com/RobeTabasa/status/749948549010300930
	2016-07-04 12:49	0	2	".. and other #Democrat #Democrats leadership BS lies. Look at the last eight years. Obamacare crashing down. Jobs = crap pay"			#Democrat #Democrats	"749948320894840832"	https://twitter.com/atlaswon/status/749948320894840832
	2016-07-04 12:49	0	0	"Go go go excellent you! your teaching is super-detailed!"				"749948225914679296"	https://twitter.com/aca_affirmation/status/749948225914679296
	2016-07-04 12:48	0	0	"This argument though, an acca will never agree an Aca is better than he is sha https:// twitter.com/Temmytii/statu s/749938409251172352 …"				"749948106708516864"	https://twitter.com/ViCktorr_/status/749948106708516864
	2016-07-04 12:47	0	1	"abetter way, NO - obama, ryan, mcconnell, mccain, obamacare , gun restrictions... Yeah a better way pic.twitter.com/LhBJmjm0n7"				"749947724338851841"	https://twitter.com/chyjack/status/749947724338851841
	2016-07-04 12:43	0	0	"Obamacare -Causing Insurers To Beg For Bailouts http:// dailycaller.com/2016/07/01/oba macare-causing-insurers-to-beg-for-bailouts/ … via @dailycaller"		@dailycaller		"749946750262124544"	https://twitter.com/dee3620/status/749946750262124544
	2016-07-04 12:41	0	0	"hahaha"				"749946311013576705"	https://twitter.com/RobeTabasa/status/749946311013576705
	2016-07-04 12:41	0	0	"are you for Obamacare ?"				"749946244164947968"	https://twitter.com/soulsister27/status/749946244164947968
	2016-07-04 12:41	0	0	"HOLY SHIT VENIS ACA SOLO PARA STREAMER AND GAIMERS?"				"749946194600792064"	https://twitter.com/pablee13/status/749946194600792064
	2016-07-04 12:41	0	0	"KirkleesJobs: Job vacancy: Catering Assistant/Cash Handling - St John Fisher Catholic Voluntary Aca ... … https:// twibble.io"				"749946150824869888"	https://twitter.com/KirkleesLibDems/status/749946150824869888
	2016-07-04 12:40	0	0	"Aca re crazy"				"749946102212923392"	https://twitter.com/gonzalopez123/status/749946102212923392
	2016-07-04 12:40	0	1	"The Republican Party's Pointless Obamacare War http://www. realclearpolitics.com/2016/07/04/the _republican_party039s_pointless_obamacare_war_386170.html … #TrumpTrain"			#TrumpTrain	"749946018029006848"	https://twitter.com/Right_Smarts/status/749946018029006848
