username;date;retweets;favorites;text;geo;mentions;hashtags;id;permalink
	2016-07-04 17:57	0	1	"On Independence Day, we celebrate the anniversary of the Founders first attempt to repeal #Obamacare ."			#Obamacare	"750025812615757824"	https://twitter.com/MissingPundit/status/750025812615757824
	2016-07-04 17:57	0	0	"The show will start at 7:30PM and yoiu can listen at http:// kjscradio.com/classic/radio. php …"				"750025786523000832"	https://twitter.com/aca_fan1980/status/750025786523000832
	2016-07-04 17:57	0	0	"It's going to be streamed live as of now, providing that the nfb mixing board doesn't blow up like it did for nabs"				"750025709008150528"	https://twitter.com/aca_fan1980/status/750025709008150528
	2016-07-04 17:56	0	0	""Keep Obamacare " sounds way better than "repeal Obamacare !" but way worse than "make health a right and move to singlepayer!""				"750025383278419969"	https://twitter.com/petercoffin/status/750025383278419969
	2016-07-04 17:55	1	22	"Framing the utter sh*t sandwich that is ObamaCare as his own personal 'victory' is a real troll move, I"d disallow it."				"750025305469820928"	https://twitter.com/drawandstrike/status/750025305469820928
	2016-07-04 17:53	0	0	"Stonewalled on repealing Obamacare ? Stonewalled on adding trillions to deficit? Stonewalled on ANYTHING? NOPE! https:// twitter.com/don_dcr4462/st atus/749810070599430144 …"				"750024861112627200"	https://twitter.com/kansasbabe/status/750024861112627200
	2016-07-04 17:53	0	1	"Well the navy killed obl so Obama had nothing to do with that and obamacare is a proven failure so basically just what Ben said."				"750024820587372544"	https://twitter.com/jarradjames12/status/750024820587372544
	2016-07-04 17:53	0	0	"FirstIntuition in Bristol I think it's called. Unsure, my new employer wants me to do ACA but I can do whichever 'best suits me'!"				"750024635396259841"	https://twitter.com/j0shwhite_/status/750024635396259841
	2016-07-04 17:52	0	0	"It's only a matter of time before these vets sign on to play for Golden State for pocket lint & Obamacare ."				"750024558053249024"	https://twitter.com/theintlfiles/status/750024558053249024
	2016-07-04 17:52	0	0	"They want a 'safe space'. Most mental health hospitals provide that. But not under obamacare . https:// twitter.com/andieiamwhoiam /status/750012304889184256 …"				"750024427161710592"	https://twitter.com/justinpgdr/status/750024427161710592
	2016-07-04 17:51	0	0	"Yeah, if white we'd not have Obamacare , $30 trillion deficit, bad trade deals w/China,Japan, Mexico... oh, wait... https:// twitter.com/don_dcr4462/st atus/749717699698290692 …"				"750024145908314112"	https://twitter.com/kansasbabe/status/750024145908314112
	2016-07-04 17:50	0	0	"can't say ObamaCare helped much to improve that situation apparently you get/got taxed for not having health insurance??"				"750024023006994432"	https://twitter.com/moist_apple/status/750024023006994432
	2016-07-04 17:50	0	0	"#ACA , Why You Need a Trusted Insurance Agent to Guide You #article 205887 @netdatabiz @1winword"		@netdatabiz @1winword	#ACA #article	"750024005869076480"	https://twitter.com/Myartsubmit/status/750024005869076480
	2016-07-04 17:50	0	0	"Obamacare : The Gazillion-Dollar Startup Machine http:// sco.lt/5PZlLt pic.twitter.com/MYrXX55uEh"				"750023921882238976"	https://twitter.com/acme_insurance/status/750023921882238976
	2016-07-04 17:49	0	2	"Go go go beautiful human, your writing style is"				"750023724598833152"	https://twitter.com/aca_affirmation/status/750023724598833152
	2016-07-04 17:49	6	4	"Checker at the store said her HC deductible went from $1500 to $8000. Now she can't afford to have needed surgery. #Obamacare #lies"			#Obamacare #lies	"750023666285490176"	https://twitter.com/oldhickory49/status/750023666285490176
	2016-07-04 17:47	0	4	"No other reference needed for an EH... Great job Whisper! https:// twitter.com/F3_Whisper/sta tus/750017736302956544 …"				"750023230497357824"	https://twitter.com/F3_ACA/status/750023230497357824
	2016-07-04 17:44	0	0	". @HillaryClinton Pledges to forgive student loans, but supports and wants expansion of Obamacare which runs student loan program."		@HillaryClinton		"750022572159401984"	https://twitter.com/JohnCooper0610/status/750022572159401984
	2016-07-04 17:44	0	0	"Democrats' Platform Pushes Hillary Clinton Toward #Singlepayer Healthcare http://www. forbes.com/sites/brucejap sen/2016/07/03/democrats-platform-pushes-hillary-closer-to-single-payer-healthcare/#51fff0ed439e … #healthinsurance #ACA #universalhealth"			#Singlepayer #51fff0ed439e #healthinsurance #ACA #universalhealth	"750022458686734337"	https://twitter.com/SiftWisdom/status/750022458686734337
	2016-07-04 17:42	0	2	"Recipe for Republican tears: 1 oz Reagan hate 2 oz Obamacare praise 4 oz kissing your partner"				"750021858930688000"	https://twitter.com/mgianni731/status/750021858930688000
	2016-07-04 17:40	2	2	"@crazylary51 @crooksandliars I guess next he'll add all the rest constant illness this is why we have the ACA to cover everyone"		@crazylary51 @crooksandliars		"750021579619209216"	https://twitter.com/Marjee123/status/750021579619209216
	2016-07-04 17:38	0	0	"Work Disabled/Job Lost/Insurance Lost/ ObamaCare Denied. Will have to Pay Fines, Cannot See Dr or go to hospital - F HRC- 62/Screwed"				"750021051615248384"	https://twitter.com/Dal_Schnur/status/750021051615248384
	2016-07-04 17:37	0	0	"Checking out " Obamacare -Causing Insurers To Beg For Bailouts" on Tea Party Command Center: http:// teapartyorg.ning.com/forum/topic/sh ow?id=4301673%3ATopic%3A4258090&xgs=1&xg_source=msg_share_topic …"				"750020842147291136"	https://twitter.com/FranMontgomery1/status/750020842147291136
	2016-07-04 17:35	0	0	"Health Costs, But Not Obamacare , Dominate The Future Of Federal Spending http:// healthaffairs.org/blog/2016/06/2 7/health-costs-but-not-obamacare-dominate-the-future-of-federal-spending/ …"				"750020317511319554"	https://twitter.com/DGANewYork/status/750020317511319554
	2016-07-04 17:35	0	1	"Obamacare . No question. Though "victory" isn't the word *I* would choose to describe it. https:// twitter.com/amandacarpente r/status/750017287365664768 …"				"750020274364481536"	https://twitter.com/bloodless_coup/status/750020274364481536
	2016-07-04 17:35	0	0	"Obamacare is complete disaster, and The efforts started by Bush led to killing of OBL."				"750020117036138497"	https://twitter.com/shoelessjoe255/status/750020117036138497
	2016-07-04 17:34	4	3	"#ITrustHillary to not do a fricking thing to fix Obamacare . Which sucks."			#ITrustHillary	"750020019719774208"	https://twitter.com/FakeLobbyist/status/750020019719774208
	2016-07-04 17:33	0	0	"So any ObamaCare insr plan sold in CA covers abortion AND qualifies for ObamaCare subsidy. So much 4 Hyde @PoliticalLaughs"		@PoliticalLaughs		"750019826630860802"	https://twitter.com/Rebecca_Throck2/status/750019826630860802
	2016-07-04 17:33	0	0	"We got obamacare with the votes of the criminal party only. Wait until they disarm us"				"750019815557832704"	https://twitter.com/rdcrisp/status/750019815557832704
	2016-07-04 17:32	0	1	"Yes, even though the Hyde AM forbids fed funding of abortion, ObamaCare reqs all insr cover maternity. 1/2 @PoliticalLaughs"		@PoliticalLaughs		"750019372215742464"	https://twitter.com/Rebecca_Throck2/status/750019372215742464
	2016-07-04 17:31	1	1	"Obamacare is unconstitutional. He didn't kill OBL Obama would say, people like you who trash Trump. https:// twitter.com/amandacarpente r/status/750017287365664768 …"				"750019265537900545"	https://twitter.com/FoundingFodder/status/750019265537900545
	2016-07-04 17:30	0	2	"biggest wins outside of Obamacare and OBL are Kagan and Sotomayor."				"750018885143785473"	https://twitter.com/mcguirejohnj/status/750018885143785473
	2016-07-04 17:26	0	1	"didn't like Obamacare rammed down your throat. Imagine what they do when you have no armaments to resist."				"750018074812624897"	https://twitter.com/rdcrisp/status/750018074812624897
	2016-07-04 17:25	0	0	"Go ahead. Convince me that the republican desire of doing away with obamacare , reinstating preexistant conditions and lifetime caps is good."				"750017673795244032"	https://twitter.com/BrewtBlacklist/status/750017673795244032
	2016-07-04 17:24	0	0	"Got Health Insurance? Get covered thru ObamaCare to avoid penalty. Get the Government to pay some of your premium. http:// us.emob.io/M0bcwM"				"750017509529493504"	https://twitter.com/kwheeler5linx/status/750017509529493504
	2016-07-04 17:23	17	33	"Family debate today .What's the biggest victory of Obama's presidency--aside from Obamacare and killing OBL?"				"750017287365664768"	https://twitter.com/amandacarpenter/status/750017287365664768
	2016-07-04 17:23	2	3	"@truthglow Democrats ARE tools of the insurance industry - many still believe ACA was "healthcare," not a blowjob to insurance."		@truthglow		"750017218398736385"	https://twitter.com/BigMouth1122/status/750017218398736385
	2016-07-04 17:23	0	0	"Colorado could ditch Obamacare for a single-payer system http://www. fool.com/investing/2016 /07/03/this-state-may-ditch-obamacare-for-single-payer-he.aspx …"				"750017148198748160"	https://twitter.com/dalewood/status/750017148198748160
	2016-07-04 17:23	0	0	"ok look up Obamacare 2017microchip American.Hillary is planning to follow thru w/Obama's Policies take a way free speech"				"750017110454173696"	https://twitter.com/SharonM67714628/status/750017110454173696
	2016-07-04 17:21	1	2	"Our daughter in her 30's #StageIV !Guidelines ridiculous misleading! #obamacare #affordable ?!?! GOVCuttingcorners https:// twitter.com/kksheld/status /749970660156248065 …"			#StageIV #obamacare #affordable	"750016590184263680"	https://twitter.com/NanaPatty/status/750016590184263680
	2016-07-04 17:20	0	0	"Obama regime hits a new low: Obamacare penalizing 200,000 of Americas most needy http:// shar.es/PGzFf #TeaPartyToldYouSo #tcot #PJNet"			#TeaPartyToldYouSo #tcot #PJNet	"750016419392135168"	https://twitter.com/WSCP2/status/750016419392135168
	2016-07-04 17:19	0	0	"Hey there excellent you, your draft is gonna be great! trust me!"				"750016179071168512"	https://twitter.com/aca_affirmation/status/750016179071168512
	2016-07-04 17:19	1	0	"GoHealth answers Google’s top 3 Obamacare questions: http:// bit.ly/1meoDrv pic.twitter.com/2xtkvKyQpF"				"750016117524008960"	https://twitter.com/GoHealthDotCom/status/750016117524008960
	2016-07-04 17:18	0	0	"ObamaCare Just Killed Its Lowest-Cost Insurers; Premiums To Rise Further http://www. investors.com/news/obamacare -just-killed-its-lowest-cost-insurers/ …"				"750016021612810240"	https://twitter.com/mdufay/status/750016021612810240
	2016-07-04 17:18	2	2	". @Harlan needs to push student loans being run by Obamacare . Hillary will NEVER forgive that debt. https:// twitter.com/Harlan/status/ 749990534958178304 …"		@Harlan		"750016007993978881"	https://twitter.com/JohnCooper0610/status/750016007993978881
	2016-07-04 17:17	0	0	"#FFRNN #CLASSROOM #Obamacare Website Ad #HUMOR BASED ON #TRUTH IS #FUNNIEST #VIRAL http://www. nbc.com/saturday-night -live/video/obamacare-website-ad-cold-open/n42305 …"			#FFRNN #CLASSROOM #Obamacare #HUMOR #TRUTH #FUNNIEST #VIRAL	"750015783015624704"	https://twitter.com/FFRNNU/status/750015783015624704
	2016-07-04 17:17	0	0	"Extra! Extra! Read about transportation in ACA News Summer 2016! http:// buff.ly/29bSIBZ"				"750015579281625089"	https://twitter.com/ACAging/status/750015579281625089
	2016-07-04 17:15	0	0	"#Excercise - Closest thing to wonder #drugs #health #science #obamacare #healthcare #vc http:// arzillion.com/S/GeNd9k pic.twitter.com/GMbdf8H3uY"			#Excercise #drugs #health #science #obamacare #healthcare #vc	"750015170932404224"	https://twitter.com/arzillion/status/750015170932404224
	2016-07-04 17:13	0	1	""We keep our youth in debt." Nobody forces you to buy anything, except of course Obama forcing Obamacare on everyone. @crystallcorr"		@crystallcorr		"750014796947333120"	https://twitter.com/mikeliberation/status/750014796947333120
	2016-07-04 17:13	1	0	"It's a disease when you support civilian massacres from the left b/c you hate HRC. Luckily, it's covered under the ACA !"				"750014708770570240"	https://twitter.com/AstoriaTom/status/750014708770570240
	2016-07-04 17:10	0	0	"@AskAnshul Wish you a very happy birthday. May God bless you with lots of wisdom, wealth & healthiest future."		@AskAnshul		"750014026294235138"	https://twitter.com/Kamal_ACA/status/750014026294235138
	2016-07-04 17:10	0	0	"You've finished ACA reporting... so what's next? http:// bit.ly/29bUO4C"				"750013834643935232"	https://twitter.com/TaxCreditCo1/status/750013834643935232
	2016-07-04 17:09	0	0	"do y'all like Obamacare"				"750013794445778945"	https://twitter.com/pandaexpresskid/status/750013794445778945
	2016-07-04 17:07	0	0	"My dog Russ got to be pissed!!! https://www. instagram.com/p/BHcoabNBJZb/"				"750013280517627904"	https://twitter.com/DEESTATE_ACA/status/750013280517627904
	2016-07-04 17:07	0	2	"In case you missed it! http:// fb.me/7zlCVwN1J"				"750013258556375041"	https://twitter.com/BRAC_ACA/status/750013258556375041
	2016-07-04 17:06	0	0	"CNN is a 'fact-free zone' on everything from Obamacare to vaccines and even Trump - http:// NaturalNews.com http://www. naturalnews.com/054542_CNN_med ia_bias_political_slant.html …"				"750013038472880128"	https://twitter.com/RebootBill/status/750013038472880128
	2016-07-04 17:06	0	0	"ACA is working, but it needs work. Its the logical next steps towards Single Payer. It took France 20 years to get there pal."				"750012928393261056"	https://twitter.com/GenX4Hill/status/750012928393261056
	2016-07-04 17:05	0	0	"Yes and they would have no choice, just like Obamacare . They can say no to Obamacare too."				"750012786931937280"	https://twitter.com/FisherBurton/status/750012786931937280
	2016-07-04 17:05	1	0	"3 things #WH doesn't want you to know abt #ObamaCare coming in 2015 you aint gonna like #ccot #tcot #pjnet http:// ln.is/benybs.blogspo t.com/Cn9x2 …"			#WH #ObamaCare #ccot #tcot #pjnet	"750012687539638272"	https://twitter.com/beny_benson/status/750012687539638272
	2016-07-04 17:05	39	37	"#July4th #MoreThanBBQ #DemocratLiesMatter #ObamaCare Stop #Crooked Hillary #DontGetFooledAgain #VoteGOP @afbranco pic.twitter.com/R7GP6b8ZOP"		@afbranco	#July4th #MoreThanBBQ #DemocratLiesMatter #ObamaCare #Crooked #DontGetFooledAgain #VoteGOP	"750012670871502848"	https://twitter.com/PolToons/status/750012670871502848
	2016-07-04 17:04	0	0	"ACA must be repealed No alternative Join #USFreedomArmy to help accomplish this mission http:// usfreedomarmy.com pic.twitter.com/QZgBb4VNZe A"			#USFreedomArmy	"750012429786943489"	https://twitter.com/Taking_Back_USA/status/750012429786943489
	2016-07-04 17:04	0	1	"Affordable Care Act policies projected to rise in 2017 http:// bit.ly/292saZS #ACA"			#ACA	"750012297108652032"	https://twitter.com/Americanized_BC/status/750012297108652032
	2016-07-04 17:01	0	0	"ObamaCare enrollment drops to 11.1M http:// thehill.com/policy/healthc are/286208-obamacare-enrollment-drops-to-111m#.V3aH61dps7E.twitter …"			#	"750011761093468162"	https://twitter.com/BCMEthics/status/750011761093468162
	2016-07-04 17:01	0	1	"Yes, she is. She knows we fix ACA and move to Single Payer. $15 is NOT a living wage, and she has supported $15 at STATE LVL"				"750011700888293377"	https://twitter.com/GenX4Hill/status/750011700888293377
	2016-07-04 17:01	1	0	"#aca #acca Audit Manager reqd nr #Slough to £65k E: admin@mcginnisloy.com r 0845 862 6202 #jobs http:// tinyurl.com/zm9ku3d"		@mcginnisloy	#aca #acca #Slough #jobs	"750011569615011840"	https://twitter.com/McGinnisLoy/status/750011569615011840
	2016-07-04 17:00	0	1	"Obama reduced war deaths & war debts. #ACA reduced future debt projections. #FactsMatter @NelsonForTruth @BratFrye pic.twitter.com/it8Q1iC0ev"		@NelsonForTruth @BratFrye	#ACA #FactsMatter	"750011426299752453"	https://twitter.com/peaceisactive/status/750011426299752453
	2016-07-04 17:00	0	0	"#jobs #healthcare Nurse Practitioners to Become More Independent Under Obamacare http:// wp.me/p2JFkk-8m"			#jobs #healthcare	"750011298864398337"	https://twitter.com/topmedcareers1/status/750011298864398337
	2016-07-04 17:00	0	0	"California Reps Urge Obama To Stop California From Giving Illegals #Obamacare http:// bit.ly/29avSk3 via @DailyCaller #hcr #aca #healthcare"		@DailyCaller	#Obamacare #hcr #aca #healthcare	"750011293424168960"	https://twitter.com/RepealPledge/status/750011293424168960
	2016-07-04 16:57	0	0	"No, he did his own spending such as the trillion dollar failed stimulus, Obamacare and his own wars in ME"				"750010648885592064"	https://twitter.com/NelsonForTruth/status/750010648885592064
	2016-07-04 16:56	3	2	"i.e. the value of what aca twitter can provide is greater when it can be repackaged as compensated page views. (2/n)"				"750010450071457796"	https://twitter.com/KathTX/status/750010450071457796
	2016-07-04 16:56	0	1	"The ACA will probably save your life and not pass your bankruptcy to us."				"750010401157505024"	https://twitter.com/BratFrye/status/750010401157505024
	2016-07-04 16:56	0	0	"ACA decreased the number of uninsured Americans http:// bit.ly/28OtESU"				"750010307813277701"	https://twitter.com/matthewmacari/status/750010307813277701
	2016-07-04 16:55	0	1	"BREAKING: Blue Cross Blue Shield Arizona dumps 44,000 Obamacare insurance exchange enrollees http://www. bizjournals.com/phoenix/blog/h ealth-care-daily/2016/06/breaking-blue-cross-blue-shield-arizona-dumps-44.html?ana=twt … via @phxbizjournal"		@phxbizjournal		"750010104984899584"	https://twitter.com/54Doggie/status/750010104984899584
	2016-07-04 16:55	0	0	"Obamacare is failing in VT"				"750010074882576384"	https://twitter.com/weblollipop1/status/750010074882576384
	2016-07-04 16:55	0	0	"Interim Group Statutory Accountant - England, London, West London - Vitae Financial Recruitment #ACA #ACAjobs http://www. gaapweb.com/job/3722917/in terim-group-statutory-accountant-/?TrackID=49858 …"			#ACA #ACAjobs	"750010072600834048"	https://twitter.com/GAAPwebjobs/status/750010072600834048
	2016-07-04 16:54	0	0	"Agree he's a terrible POTUS. ACA is a massive success as blowjob to insurance ind."				"750009892191080448"	https://twitter.com/BigMouth1122/status/750009892191080448
	2016-07-04 16:54	0	2	"Maybe because they're stupid? @DENVERSMKC @eryourlife Female doctor against ACA -vs- female Ocare supporter...hmm http://www. bizjournals.com/phoenix/blog/h ealth-care-daily/2016/06/breaking-blue-cross-blue-shield-arizona-dumps-44.html …"		@DENVERSMKC @eryourlife		"750009876001153024"	https://twitter.com/noprezzie2012/status/750009876001153024
	2016-07-04 16:52	0	0	"Congress is not passing them other than Obamacare which is an expensive burden"				"750009293152354304"	https://twitter.com/NelsonForTruth/status/750009293152354304
	2016-07-04 16:51	0	0	"Yeah. The architect of Obamacare and a liberal governor, what's not to like?"				"750009183064330240"	https://twitter.com/DreadCrash/status/750009183064330240
	2016-07-04 16:51	0	1	"Really? What laws have congress passed of his? Just ACA , wasted million$ opposing it"				"750009110968537088"	https://twitter.com/BratFrye/status/750009110968537088
	2016-07-04 16:50	0	0	"Juan Williams: The GOP's pointless ObamaCare war | TheHill http:// thehill.com/opinion/juan-w illiams/286425-juan-williams-the-gops-pointless-obamacare-war …"				"750008985437163520"	https://twitter.com/botopdawg/status/750008985437163520
	2016-07-04 16:49	1	1	"voting 72 times 2 overturn ACA has been an expensive publicity stunt by House GOP"				"750008714766147584"	https://twitter.com/devilsporkchop/status/750008714766147584
	2016-07-04 16:49	0	0	"Keep at it marvellous writer, your lectures are totally valid! x"				"750008623615574017"	https://twitter.com/aca_affirmation/status/750008623615574017
	2016-07-04 16:48	1	1	"the truth is in the middle. ACA was Romneycare-but GOP opposed."				"750008329192165376"	https://twitter.com/devilsporkchop/status/750008329192165376
	2016-07-04 16:47	0	1	"The House voted 40+ times to repeal Obamacare but "it wasn't enough!" Lol"				"750008266831306752"	https://twitter.com/WaynesterAtl/status/750008266831306752
	2016-07-04 16:47	0	0	"#Obamacare has failed, like everything else your idiot president has touched. @JamesScolari @AprilDeming @soc_list @wavesofeuphoria @cspanwj"		@JamesScolari @AprilDeming @soc_list @wavesofeuphoria @cspanwj	#Obamacare	"750008216357134338"	https://twitter.com/VaTxn/status/750008216357134338
	2016-07-04 16:47	0	0	"New report on ACA drop-out rates reveal 1.6 million individuals are no longer signed up: http:// xerox.bz/29qApOJ"				"750008030050344962"	https://twitter.com/ConduentHealth/status/750008030050344962
	2016-07-04 16:45	1	1	""What ever happened to the "affordable" part of the ACA " https:// lnkd.in/dfshmnJ by @healthscandal on @LinkedIn"		@healthscandal @LinkedIn		"750007603472642048"	https://twitter.com/healthscandal/status/750007603472642048
	2016-07-04 16:45	0	0	"#FTSE250 - Top Risers Today Acacia Mining ( ACA ) 482.90p 4.10% AO World (AO.) 147.20p 3.30% Hochschild Mining (HOC) 202.90p 3.26%"			#FTSE250	"750007548049231872"	https://twitter.com/RDLInvestments/status/750007548049231872
	2016-07-04 16:44	0	0	"This State May Ditch Obamacare for Single-Payer Healthcare This November -- The Motley Fool http://www. fool.com/investing/2016 /07/03/this-state-may-ditch-obamacare-for-single-payer-he.aspx#.V3qSdfgpbzU.twitter …"			#	"750007463542263808"	https://twitter.com/hobbitj/status/750007463542263808
	2016-07-04 16:44	0	1	"EBT, Housing, Obamacare , Medicaid, SNAP, Affirmative action, ect? Yet you still bitch and moan. #AfricaWasNeverGreat"			#AfricaWasNeverGreat	"750007267672502272"	https://twitter.com/GenPhilSheridan/status/750007267672502272
	2016-07-04 16:43	0	0	"50% off tonight at the Patheion!!! We goin in!!!! #Cancers join me!!! https://www. instagram.com/p/BHclp8ehbyP/"			#Cancers	"750007211682779136"	https://twitter.com/DEESTATE_ACA/status/750007211682779136
	2016-07-04 16:43	0	0	"To fail you first have to try-so called politicians all bs no action. "Kate's law", VA, immigration, Obamacare - https:// twitter.com/w4djt/status/7 49986747690414080 …"				"750007102261821440"	https://twitter.com/WilliamMarrale/status/750007102261821440
	2016-07-04 16:43	0	0	"RT abowersock: The whole goal of her student loan plan is same as her "expand ACA " plan: create more customers and… https:// twitter.com/Salon/status/7 49468982986571776 …"				"750007021072687107"	https://twitter.com/Kymmi600/status/750007021072687107
	2016-07-04 16:42	1	2	"seeing you happy and getting to spend your time with the Aca babies makes me happy!"				"750007007223029760"	https://twitter.com/jen_melhiser/status/750007007223029760
	2016-07-04 16:42	1	0	"Obamacare enrollment falls to 11.1 million. http://www. thehill.com/policy/healthc are/286208-obamacare-enrollment-drops-to-111m …"				"750006884652814336"	https://twitter.com/mundyspeaks/status/750006884652814336
	2016-07-04 16:42	0	0	"Let's go Wade!!!! https://www. instagram.com/p/BHclfLghxJ0/"				"750006841883578369"	https://twitter.com/DEESTATE_ACA/status/750006841883578369
	2016-07-04 16:42	0	1	"if you were an #American you would be learning how #Obamacare is nothing more than a scam"			#American #Obamacare	"750006777756782592"	https://twitter.com/jcdwms/status/750006777756782592
	2016-07-04 16:40	0	0	"@ann_kirkpatrick continues to be proud of her vote for Obamacare despite 53% of Arizonans opposing it. #azsen pic.twitter.com/Qo1nairjej"		@ann_kirkpatrick	#azsen	"750006284217380868"	https://twitter.com/FoxworthyEdward/status/750006284217380868
	2016-07-04 16:39	0	0	"New Job! Forensic Accountant - NQ to 3 PQE - International Litigation Boutique in London, United Kingdom http:// bull.hn/l/2R6G3/21 #job"			#job	"750006150553272320"	https://twitter.com/4rensic_and_ACA/status/750006150553272320
	2016-07-04 16:38	0	0	"No OBAMACARE -- just another Government takeover. #TRUMP 2016 #PJNET"			#TRUMP #PJNET	"750005955333541888"	https://twitter.com/uniquelady12455/status/750005955333541888
	2016-07-04 16:36	0	2	"The ACA , a law based on lies. Less pple get care today due to exorbitant copays, after paying outrageous premiums. pic.twitter.com/VBAwjFrMaQ"				"750005433809506304"	https://twitter.com/bayareahausfrau/status/750005433809506304
	2016-07-04 16:36	1	5	"Hey Libs, the way you feel about #Brexit is the way we felt when Obamacare passed. Now I'm going to eat red meat and set off fireworks."			#Brexit	"750005403744739328"	https://twitter.com/GOPcomedy/status/750005403744739328
	2016-07-04 16:36	1	0	"@drginareghetti Another "Fun Fact"- IBM offered to do the #Obamacare Website for FREE, but this was REFUSED."		@drginareghetti	#Obamacare	"750005263436877824"	https://twitter.com/Tazatator/status/750005263436877824
	2016-07-04 16:30	0	0	"BTW, any info on the NFB talent show?"				"750003833871433728"	https://twitter.com/solsticesinger/status/750003833871433728
	2016-07-04 16:30	0	0	"I’m doing my best. Thank you for the good wishes."				"750003785896955907"	https://twitter.com/solsticesinger/status/750003785896955907
	2016-07-04 16:30	0	0	"Obamacare kicks in in time we arrived."				"750003750220234756"	https://twitter.com/TrumpErowid/status/750003750220234756
	2016-07-04 16:29	0	0	"I don't think it has a number pad, but I'm trying to help my partner who doesn't live here, so I haven't seen the computer."				"750003733443076101"	https://twitter.com/JaffaStar/status/750003733443076101
	2016-07-04 16:28	0	0	"Have seen how obamacare erodes hippa laws"				"750003452026257408"	https://twitter.com/2Biblez/status/750003452026257408
	2016-07-04 16:28	0	0	"Let's give a very happy birthday to the talented book loving person we know as @solsticesinger make it a fabulous day!"		@solsticesinger		"750003422519263233"	https://twitter.com/aca_fan1980/status/750003422519263233
