username;date;retweets;favorites;text;geo;mentions;hashtags;id;permalink
	2016-12-19 21:51	0	0	"#ACASignups COLORADO: 139.5K #ACA enrollments thru 12/18: http:// ow.ly/Oc9x307hgqF #Obamacare #OE4"			#ACASignups #ACA #Obamacare #OE4	"810965871875260416"	https://twitter.com/acasignups/status/810965871875260416
	2016-12-19 21:51	0	1	"#ACASignups COLORADO: 139.5K #ACA enrollments thru 12/18: http:// ow.ly/Oc9x307hgqF #Obamacare #OE4"			#ACASignups #ACA #Obamacare #OE4	"810965871606820864"	https://twitter.com/charles_gaba/status/810965871606820864
	2016-12-19 21:51	68	65	"The people most likely to lose in Obamacare repeal live in Trump country http://www. dailykos.com/story/2016/12/ 19/1612698/-The-people-most-likely-to-lose-in-Obamacare-repeal-live-in-Trump-country …"				"810965786768576513"	https://twitter.com/dailykos/status/810965786768576513
	2016-12-19 21:51	1	1	"she must get her meds thru Obamacare"				"810965765746724864"	https://twitter.com/Imjustreiled/status/810965765746724864
	2016-12-19 21:51	0	0	"GOP lawmaker’s Obamacare alternative: Make kids sleep on broken arms to avoid costly ER visits http://www. rawstory.com/2016/12/gop-la wmakers-obamacare-alternative-make-kids-sleep-on-broken-arms-to-avoid-costly-er-visits/#.WFhWSLvBg-o.twitter …"			#	"810965731911368704"	https://twitter.com/J__A__G/status/810965731911368704
	2016-12-19 21:51	0	0	"You cannot support both Teump and ACA . Incompatible positions. And Trump support trumps anything else. https:// twitter.com/haroldpollack/ status/810961646722183169 …"				"810965703847133184"	https://twitter.com/wynnsworld/status/810965703847133184
	2016-12-19 21:50	0	0	"The people most likely to lose in Obamacare repeal live in Trump country http://www. dailykos.com/story/2016/12/ 19/1612698/-The-people-most-likely-to-lose-in-Obamacare-repeal-live-in-Trump-country …"				"810965666161393664"	https://twitter.com/IPOmaven/status/810965666161393664
	2016-12-19 21:50	0	2	"People who depend on Obamacare , people whose spouses are undocumented. They just didn't care. Smashy smashy. https:// twitter.com/nxthompson/sta tus/810959220258566145 …"				"810965656199798784"	https://twitter.com/DavidOAtkins/status/810965656199798784
	2016-12-19 21:50	0	1	"http:// talkingpointsmemo.com/livewire/huize nga-son-broken-arm?utm_content=bufferf5bfb&utm_medium=social&utm_source=twitter.com&utm_campaign=buffer … @RepHuizenga the difference between having ACA or not, is not wasteful med care, but whether we can afford ANY care"		@RepHuizenga		"810965520136699905"	https://twitter.com/AmyJParrent/status/810965520136699905
	2016-12-19 21:50	0	0	"#ACA Reporting: What You Need to Know to Meet 2017 Deadlines - #HR #smallbiz http:// bit.ly/2gVaSLY pic.twitter.com/Pt01Fh4KLo"			#ACA #HR #smallbiz	"810965505158746112"	https://twitter.com/ChrisDHedleyADP/status/810965505158746112
	2016-12-19 21:50	0	0	"You're a good person, glad you appreciate those who care about you"				"810965465472335872"	https://twitter.com/aca_fan1980/status/810965465472335872
	2016-12-19 21:50	0	0	"Obamacare sign-up deadline extended to midnight Monday - http:// STLtoday.com http:// dlvr.it/MwSG1S"				"810965459633729538"	https://twitter.com/TeaPartywatchs/status/810965459633729538
	2016-12-19 21:50	0	0	"Want to Get Rid of Obamacare ? Be Careful What You Wish For - http:// NYTimes.com http:// mobile.nytimes.com/2016/12/16/ups hot/obamacare-donald-trump.html …"				"810965453719957505"	https://twitter.com/gnarlygale/status/810965453719957505
	2016-12-19 21:50	0	0	"Real people rely on Obamacare : Column http:// usat.ly/2hIijey via @USATODAY"		@USATODAY		"810965448518991878"	https://twitter.com/JTLatinoHealth/status/810965448518991878
	2016-12-19 21:50	0	1	"Really fascinating scale of information. #GetCovered #OpenEnrollment #ACA"			#GetCovered #OpenEnrollment #ACA	"810965436380626949"	https://twitter.com/Softheon/status/810965436380626949
	2016-12-19 21:49	0	0	"So easy for these clowns to opine abt the ACA when they have insurance #GOP #ACA @RepHuizenga #Obamacare Fuck these assholes https:// twitter.com/tpm/status/810 945741380288513 …"		@RepHuizenga	#GOP #ACA #Obamacare	"810965420354236416"	https://twitter.com/TrayLo21/status/810965420354236416
	2016-12-19 21:49	0	0	"Before ACA , name one insurance that voluntarily decreased its premiums and increased its care?"				"810965407213453312"	https://twitter.com/MickeyVicious1/status/810965407213453312
	2016-12-19 21:49	0	0	"Special Team BIM Webinar - ACA : Post Election and Future - http:// eepurl.com/cudKxv"				"810965370479738881"	https://twitter.com/TEAMBIMLEX/status/810965370479738881
	2016-12-19 21:49	0	1	"look up the qualifications for "mass health". that on top of their commitment to the aca makes a bigger safety net."				"810965324887707648"	https://twitter.com/generallyokyo/status/810965324887707648
	2016-12-19 21:49	0	0	"Aww what's wrong with being mushy sometimes lol"				"810965309549060096"	https://twitter.com/aca_fan1980/status/810965309549060096
	2016-12-19 21:49	0	0	"Hey there excellent writer, your writing is so valuable"				"810965284311932928"	https://twitter.com/aca_affirmation/status/810965284311932928
	2016-12-19 21:49	0	0	"Cato is a conservative think tank. and Obamacare is market driven. it was designed by the fucking Heritage Foundation."				"810965236647923712"	https://twitter.com/BeaAnneD/status/810965236647923712
	2016-12-19 21:49	0	0	"Liberal @GregHammerRock is the reason I happily left the Demonrats PS don't slip on your tears Greg -- Obamacare isn't cheap #270 pic.twitter.com/Nb2dtHvHSs"		@GregHammerRock	#270	"810965186064617472"	https://twitter.com/JJQ1201/status/810965186064617472
	2016-12-19 21:48	0	0	"What will be happening to The Affordable Care Act ( Obamacare )? -------------------------------- The word seems... http:// fb.me/5oTsnoteB"				"810965144268214273"	https://twitter.com/breichmn1/status/810965144268214273
	2016-12-19 21:48	0	0	"Could a provision in the Cures Act help stabilize the ACA exchanges? http:// pharmaleaders.com/could-a-provis ion-in-the-cures-act-help-stabilize-the-aca-exchanges/ …"				"810965139428098048"	https://twitter.com/Pharma_Leaders/status/810965139428098048
	2016-12-19 21:48	0	1	"#GOP has no shame (in addition to being stupid). @RepHuizenga #ACA #Obamacare https:// twitter.com/graye63/status /810948048234967041 …"		@RepHuizenga	#GOP #ACA #Obamacare	"810965120658657280"	https://twitter.com/TrayLo21/status/810965120658657280
	2016-12-19 21:48	0	0	"@IWV With Obamacare , my monthly insurance premium went from $300+ to $20, so I am actually a fan of it. But thanks for the follow, I guess?"		@IWV		"810965118628544512"	https://twitter.com/ffarryyyaaal/status/810965118628544512
	2016-12-19 21:48	0	0	"- huh??? ACA has YET to work... have you ventured the website???"				"810965108285468673"	https://twitter.com/Hardin_USAF/status/810965108285468673
	2016-12-19 21:48	0	0	"Been there before too, ITunes screwed up muy playlists"				"810965099301244928"	https://twitter.com/aca_fan1980/status/810965099301244928
	2016-12-19 21:48	0	0	"Obama announces record sign-ups for a single day in ACA marketplaces http:// wapo.st/2hAs9ya"				"810965096541421569"	https://twitter.com/CodeSixFour/status/810965096541421569
	2016-12-19 21:48	1	0	""Universal access" means millions are uninsured. #ACA #CoverageMatters https:// twitter.com/sarahl202/stat us/810850937392787457 …"			#ACA #CoverageMatters	"810965058956197888"	https://twitter.com/MaryBakerArt/status/810965058956197888
	2016-12-19 21:48	2	5	"Bill probably doesn't want to admit that HE had a hand in this, too. Going on the road and calling ObamaCare the craziest thing ever?!? https:// twitter.com/KIR_bigg50/sta tus/810962172373254145 …"				"810964940311986176"	https://twitter.com/FrantzRadio/status/810964940311986176
	2016-12-19 21:48	0	1	"CO is keeping the ACA here too, but it's far away and rent has been spiking from folks coming in. :/"				"810964927179583488"	https://twitter.com/bonesnail/status/810964927179583488
	2016-12-19 21:47	0	0	"@CMSGov reported as of December 10th over 4 million people elected plans using http:// HealthCare.gov - http:// ow.ly/AyXF307hfA3 #obamacare"		@CMSGov	#obamacare	"810964913007063040"	https://twitter.com/INSXCloud/status/810964913007063040
	2016-12-19 21:47	0	0	"America's Biggest Police Union Wants Trump To Go After Immigrants, Assata, and Your Obamacare http://www. complex.com/life/2016/12/f raternal-order-police-union-trump-obamacare-assata … via @ComplexMagLife"		@ComplexMagLife		"810964897299365888"	https://twitter.com/Stagger_Lee__/status/810964897299365888
	2016-12-19 21:47	0	0	"Obamacare is. Miserable failure. Two trolls extolling its "virtues" won't change that."				"810964895948767233"	https://twitter.com/Skonialo/status/810964895948767233
	2016-12-19 21:47	0	5	"they want to repeal Obamacare but will be cool with a socialist? Sure."				"810964855704256512"	https://twitter.com/RadMacawesome/status/810964855704256512
	2016-12-19 21:47	0	0	"If Trump succeeds in undoing the careful balancing act that underlies Obamacare , either costs will rise or services https:// apple.news/AIa4Tqm3sQee2M xbDaXt26g …"				"810964793058131968"	https://twitter.com/Criticalanglez/status/810964793058131968
	2016-12-19 21:47	12	10	"Republican contradictions abound in age of Trump http:// wpo.st/VybN2 Obamacare cannot be ripped out unless 60 votes for a replacement"				"810964762028896257"	https://twitter.com/JRubinBlogger/status/810964762028896257
	2016-12-19 21:46	0	0	"Cato, etc. said obamacare would be a disaster, explode costs. Did just that. It's a terrible law forced through on Christmas eve"				"810964561767571458"	https://twitter.com/_RobertHoover/status/810964561767571458
	2016-12-19 21:46	0	0	"I have friend w/type 1 diabetes. Lost job & insurance. Thank you Dems. She finally got ins. with ACA . Improve but don't repeal"				"810964481132085248"	https://twitter.com/RKYMTMOM/status/810964481132085248
	2016-12-19 21:46	0	0	"This awful man, @RepHuizenga , waited 24 hrs. to have his kid's BROKEN ARM treated, and uses it as an example of why we DON'T need the ACA ?"		@RepHuizenga		"810964451944005632"	https://twitter.com/AmyJParrent/status/810964451944005632
	2016-12-19 21:46	0	0	"do you speak spanish?"				"810964426924978176"	https://twitter.com/ven_aca_paca/status/810964426924978176
	2016-12-19 21:45	0	0	"#GOP lawmaker’s Obamacare alternative: Make kids sleep on broken arms to avoid costly ER visits #MAGA #trump http://www. rawstory.com/2016/12/gop-la wmakers-obamacare-alternative-make-kids-sleep-on-broken-arms-to-avoid-costly-er-visits/#.WFhU0_As1XE.twitter …"			#GOP #MAGA #trump #	"810964414811795456"	https://twitter.com/SeriousOne1975/status/810964414811795456
	2016-12-19 21:45	1	2	"Found a silver #ACA plan with copay assistance that costs less than old bronze plan & also less than bronze plan from same insurer. Weird."			#ACA	"810964401805148160"	https://twitter.com/Sasha_CA/status/810964401805148160
	2016-12-19 21:45	0	1	"A statistic I did not know thanks for the update #CoverageMatters esp to 65M women with a pre-existing condition @GetCoveredUS @HHSGov #ACA https:// twitter.com/HHSGov/status/ 810944185025040385 …"		@GetCoveredUS @HHSGov	#CoverageMatters #ACA	"810964387057893376"	https://twitter.com/WillyTHawkins1/status/810964387057893376
	2016-12-19 21:45	0	0	"We need to get back to a market and patient centered healthcare system, not the gov't mandate disaster of obamacare ."				"810964359824416768"	https://twitter.com/_RobertHoover/status/810964359824416768
	2016-12-19 21:45	0	2	"Repeal & replace Obamacare will "prevent this in the future." ;-)"				"810964293302816768"	https://twitter.com/Congrats_USA/status/810964293302816768
	2016-12-19 21:45	0	5	"A new administration, an uncertain future for the #ACA https:// chronicdiseasecoalition.com/a-new-administ ration-an-uncertain-future-for-the-affordable-care-act/ …"			#ACA	"810964250948575232"	https://twitter.com/ChronicRights/status/810964250948575232
	2016-12-19 21:45	1	1	"Obamacare deadline extension! But hurry... details ahead on @wsbtv at 4p"		@wsbtv		"810964200478638080"	https://twitter.com/WendyCoronaWSB/status/810964200478638080
	2016-12-19 21:45	1	1	"Obamacare sign-up deadline is today, Dec.19 http:// bit.ly/2i8uIo5 pic.twitter.com/amtrWWqTsM"				"810964195487387652"	https://twitter.com/abcactionnews/status/810964195487387652
	2016-12-19 21:45	0	1	"I don't know how correct this statistic is, but the ACA has been monumental for non-white Americans."				"810964188134776834"	https://twitter.com/vlamers/status/810964188134776834
	2016-12-19 21:44	0	0	"The obamacare enrollment #'s are a fraud. Millions had insurance, got it cancelled because of obamacare , then needed to sign up"			#	"810964146070188032"	https://twitter.com/_RobertHoover/status/810964146070188032
	2016-12-19 21:44	0	0	"Why Republicans will have trouble repealing Obamacare http:// washex.am/2h50x5f via @DCExaminer"		@DCExaminer		"810964140131057664"	https://twitter.com/pablomckay/status/810964140131057664
	2016-12-19 21:44	0	0	"has nothing to do w Obamacare ! Addiction didn't exist b4 ACA Really?"				"810964128877727744"	https://twitter.com/b_mullaney/status/810964128877727744
	2016-12-19 21:44	0	0	"Hillary's influence on Obamacare was forcing me into shitty insurance I can't afford. I'm good with Bernie's effectiveness."				"810964117326626817"	https://twitter.com/willinois/status/810964117326626817
	2016-12-19 21:44	0	1	"report on IRS travel practices uncovers regular trips to DC for critical employees involved in implementing ACA and FATCA (who, btw ... 2/"				"810964109701300224"	https://twitter.com/clintwallace/status/810964109701300224
	2016-12-19 21:44	0	1	"GOP lawmaker’s Obamacare alternative: Make kids sleep on broken arms to avoid costly ER visits http://www. rawstory.com/2016/12/gop-la wmakers-obamacare-alternative-make-kids-sleep-on-broken-arms-to-avoid-costly-er-visits/#.WFhUxgAf-CU.twitter …"			#	"810964098833727488"	https://twitter.com/Kragar_LGF/status/810964098833727488
	2016-12-19 21:44	0	0	"Glad to hear some Trump counties will suffer if the ACA is repealed. It would serve them right for believing his promises."				"810964077388460033"	https://twitter.com/Dems4Future/status/810964077388460033
	2016-12-19 21:44	0	0	"Obamacare was the reason why my former employer threw off spouses, so there is that."				"810964070681677824"	https://twitter.com/hmna_hmna/status/810964070681677824
	2016-12-19 21:44	0	1	"It has been for a very long time. When more people resort to emergency care, as they had before ACA , that rises costs on all"				"810963966310621184"	https://twitter.com/gol_mia/status/810963966310621184
	2016-12-19 21:44	0	0	"Obamacare demand so high, administration extends the deadline to meet it http://www. dailykos.com/story/2016/12/ 16/1611717/-Obamacare-demand-so-high-administration-extends-the-deadline-to-meet-it …"				"810963934589100034"	https://twitter.com/Katuwah_CompSci/status/810963934589100034
	2016-12-19 21:43	1	6	"I guess his constantly saying REPEAL OBAMACARE just added to the support you threw him? SEE how stupid you look? Glad you're not my doctor! https:// twitter.com/ramakrishnanx/ status/810937029605396482 …"				"810963811364638720"	https://twitter.com/PirateWench/status/810963811364638720
	2016-12-19 21:43	0	0	"Life in Obamacare ’s Dead Zone http:// fb.me/7ChUDDGYC"				"810963773175562241"	https://twitter.com/johncecilprice/status/810963773175562241
	2016-12-19 21:43	0	0	"The only part of Obamacare I personally used was a community health center funded thanks to a Sanders amendment."				"810963762702323712"	https://twitter.com/willinois/status/810963762702323712
	2016-12-19 21:43	0	2	"Join @Action_NC & others who want to keep the #ACA and access to affordable quality health care: http:// ow.ly/VE4G307hfpI 12.20.16 Raleigh"		@Action_NC	#ACA	"810963716208525317"	https://twitter.com/ncwu/status/810963716208525317
	2016-12-19 21:43	0	0	"ACA has had greatest effect in pro-Trump communities http:// dlvr.it/MwS8qp pic.twitter.com/zRvfCRcCLc"				"810963707312209920"	https://twitter.com/benesnap/status/810963707312209920
	2016-12-19 21:43	0	0	"Tomorrow@1pm CT: #Healthcare payers this #ACA expert webinar is for you! http:// okt.to/3CQhzd pic.twitter.com/8PE81ix1Up"		@1pm	#Healthcare #ACA	"810963680951205888"	https://twitter.com/Infogix/status/810963680951205888
	2016-12-19 21:43	2	0	"The latest The Minnesota Labor Twitter Digest! http:// paper.li/MNAFLCIO/minne sota-labor?edition_id=1cefdea0-c634-11e6-95ce-0cc47a0d164b … Thanks to @mndli @MSCFMN @AFSCMEMN5 #1u #obamacare"		@mndli @MSCFMN @AFSCMEMN5	#1u #obamacare	"810963679772573697"	https://twitter.com/MNAFLCIO/status/810963679772573697
	2016-12-19 21:42	6	10	"75% of Americans did not agree with Obamacare when it was rammed down our throats. It will go away, just like Obama on January 20th https:// twitter.com/ELIZA_PBK/stat us/810963033086251008 …"				"810963630720241665"	https://twitter.com/realistic_view/status/810963630720241665
	2016-12-19 21:42	0	1	"In other news, I pay a whopping $0.27 a month for health insurance. Thanks, Obama. #butseriously #Obamacare"			#butseriously #Obamacare	"810963592208150530"	https://twitter.com/afrojo103/status/810963592208150530
	2016-12-19 21:42	0	2	"I enjoy your show, was more referring to network. No SORTA about those lies with Obamacare or Benghazi attack, etc..."				"810963499631382528"	https://twitter.com/JohnKincade/status/810963499631382528
	2016-12-19 21:42	0	0	"Except this is completely false. More people were uninsured, and in turn had less access to adequate healthcare before ACA ."				"810963466454503424"	https://twitter.com/gol_mia/status/810963466454503424
	2016-12-19 21:42	0	0	"Want to Get Rid of Obamacare ? Be Careful What You Wish For - The New York Times http://www. nytimes.com/2016/12/16/ups hot/obamacare-donald-trump.html?mabReward=CTM&recp=1&moduleDetail=recommendations-1&action=click&contentCollection=Well&region=Footer&module=WhatsNext&version=WhatsNext&contentID=WhatsNext&src=recg&pgtype=article …"				"810963447013867528"	https://twitter.com/No2Rezone/status/810963447013867528
	2016-12-19 21:42	0	0	"#NEW Deadline: #ut residents have until Monday, December 19 to sign up for #aca health insurance (90k so far) @SenOrrinHatch @SenMikeLee pic.twitter.com/N0fyGzXUEX"		@SenOrrinHatch @SenMikeLee	#NEW #ut #aca	"810963420946243584"	https://twitter.com/UHPP/status/810963420946243584
	2016-12-19 21:41	0	3	"Wait till the day they repeal Obamacare . This is child's play."				"810963415426617344"	https://twitter.com/JesseKellyDC/status/810963415426617344
	2016-12-19 21:41	0	1	"Too bad he doesn't have to depend on ACA , Social Security, Medicare or Medicaid like other people."				"810963325177696259"	https://twitter.com/lastrega/status/810963325177696259
	2016-12-19 21:41	0	0	"we were making huge leaps in prevention before ACA . Insurers were offering preventative incentives and those were growing quickly"				"810963272824475648"	https://twitter.com/JermaineLogan5/status/810963272824475648
	2016-12-19 21:41	0	1	"when reps repeal Obamacare with nothing to replace it #Idiocy"			#Idiocy	"810963180696535041"	https://twitter.com/Cmonkey29/status/810963180696535041
	2016-12-19 21:40	0	0	"GOP lawmaker's Obamacare alternative: Make kids sleep on broken arms to avoid costly ER visit - RawStory http:// nzzl.us/JjBgBAE via @nuzzel"		@nuzzel		"810963137881112576"	https://twitter.com/g_mccray/status/810963137881112576
	2016-12-19 21:40	0	0	"If Obamacare is repealed, these factors will be credited with its failure http://www. davidrossandassociates.com/1/post/2016/12 /if-obamacare-is-repealed-these-factors-will-be-credited-with-its-failure.html …"				"810963088316862464"	https://twitter.com/DrDavidRoss/status/810963088316862464
	2016-12-19 21:40	11	5	"Few ppl know that #ACA helps seniors & ppl w/disabilities receive care at home instead of institutions http:// bit.ly/2i8inAu via @NCOAging"		@NCOAging	#ACA	"810962998370058240"	https://twitter.com/justiceinaging/status/810962998370058240
	2016-12-19 21:40	0	1	"Few ppl know that #ACA helps seniors & ppl w/disabilities receive care at home instead of institutions http:// bit.ly/2i8inAu via @NCOAging"		@NCOAging	#ACA	"810962998227406848"	https://twitter.com/veebee22/status/810962998227406848
	2016-12-19 21:40	0	0	"#ACASignups MINNESOTA: 54.6K #ACA enrollments thru 12/15 deadline; 14K MNcare, 43.3K Medicaid: http:// ow.ly/kRPo307hf3Z #Obamacare #OE4"			#ACASignups #ACA #Obamacare #OE4	"810962991961243653"	https://twitter.com/acasignups/status/810962991961243653
	2016-12-19 21:40	2	1	"#ACASignups MINNESOTA: 54.6K #ACA enrollments thru 12/15 deadline; 14K MNcare, 43.3K Medicaid: http:// ow.ly/kRPo307hf3Z #Obamacare #OE4"			#ACASignups #ACA #Obamacare #OE4	"810962991961243648"	https://twitter.com/charles_gaba/status/810962991961243648
	2016-12-19 21:40	0	0	"Patching #Obamacare at the state level - http:// theincidentaleconomist.com/wordpress/patc hing-obamacare-at-the-state-level/ …"			#Obamacare	"810962949091098624"	https://twitter.com/DowneyInsSvc/status/810962949091098624
	2016-12-19 21:40	0	0	"Obamacare already doing this- my premiums have risen 44%, 37% & 76% so we in 50's can pay for maternity coverage"				"810962935925342212"	https://twitter.com/mcbob/status/810962935925342212
	2016-12-19 21:39	142	135	"Obamacare : An “Antisocial” Form of Socialized Medicine - http:// conservativeread.com/obamacare-an-a ntisocial-form-of-socialized-medicine/ …"				"810962869898526720"	https://twitter.com/keichri/status/810962869898526720
	2016-12-19 21:39	0	0	"Not as long as we still have the ACA . @Warlord_Ralts"		@Warlord_Ralts		"810962788164112384"	https://twitter.com/AYRFKM1/status/810962788164112384
	2016-12-19 21:39	0	0	"the ACA repeal bill from last Congress that is template for what they will do this year didn't repeal Medicare savings"				"810962753112391681"	https://twitter.com/CaptainPAYGO/status/810962753112391681
	2016-12-19 21:39	1	1	"I look forward to how you can improve the ACA to make it affordable for all."				"810962743297773568"	https://twitter.com/chrystaldoylern/status/810962743297773568
	2016-12-19 21:39	0	0	"Remember this pile of lies from @BarackObama on ObamaCare ? https://www. youtube.com/watch?v=wm1mx8 VS65k …"		@BarackObama		"810962709877575680"	https://twitter.com/csmatteson/status/810962709877575680
	2016-12-19 21:39	0	0	"GOP Douchebag lawmaker’s Obamacare alternative: Make kids sleep on broken arms to avoid costly ER visits http://www. rawstory.com/2016/12/gop-la wmakers-obamacare-alternative-make-kids-sleep-on-broken-arms-to-avoid-costly-er-visits/#.WFhTas7ezVo.twitter …"			#	"810962706870087680"	https://twitter.com/MadameRamotswe/status/810962706870087680
	2016-12-19 21:39	0	0	"As Jon Gruber, one of the econ architects of #Obamacare suggested, cherry-picking the good parts doesn't work."			#Obamacare	"810962699236610048"	https://twitter.com/itsaykay/status/810962699236610048
	2016-12-19 21:39	0	0	"White House economists warn that Obamacare appeal would have “profound implications” for the majority of Americans: http:// bit.ly/2hLSOpS"				"810962667020177410"	https://twitter.com/PennWhartonPPI/status/810962667020177410
	2016-12-19 21:38	0	0	"Republicans Promise “Universal Access” Will Replace Obamacare | Fix This Nation .com http://www. fixthisnation.com/conservative-b reaking-news/republicans-promise-universal-access-will-replace-obamacare/ … via @ThinkDevGrow"		@ThinkDevGrow		"810962603711328260"	https://twitter.com/mommalaurat/status/810962603711328260
	2016-12-19 21:38	0	0	"i know it's imperfect, also know my wife had no insurance for 4 years before we got " obamacare " & she is now insured. Period."				"810962506776768513"	https://twitter.com/jfkenney/status/810962506776768513
	2016-12-19 21:37	0	0	"Lose healthcare? ObamaCare premiums are skyrocketing...where have you been?"				"810962340531212292"	https://twitter.com/pinouye50/status/810962340531212292
	2016-12-19 21:37	0	0	"2. Does privatizing Medicare and SS benefit all Iowans? Does repealing Obamacare ? Don't all citizens have rights as individuals?"				"810962232871944192"	https://twitter.com/RachelAzzara/status/810962232871944192
	2016-12-19 21:37	0	0	"@realDonaldTrump why the change of heart? You do know Obamacare also covers prescriptions, and existing conditions https:// twitter.com/FinalFacts/sta tus/810515097290412032 …"		@realDonaldTrump		"810962199304777728"	https://twitter.com/theReal_KPHILL/status/810962199304777728
	2016-12-19 21:36	0	0	"Obamacare was more important. He focused on what would help more people."				"810962156870979584"	https://twitter.com/GoFastVeloster/status/810962156870979584
	2016-12-19 21:36	0	1	"Pretty excited for @KellyannePolls and @SpeakerRyan to quote "Are there no workhouses?" to justify dumping Obamacare in the upcoming weeks."		@KellyannePolls @SpeakerRyan		"810962115934752768"	https://twitter.com/JHGraas/status/810962115934752768
	2016-12-19 21:36	0	0	"@SheWhoVotes How about time to shut down the House when it votes on eliminating Obamacare ? That would be nonviolent action."		@SheWhoVotes		"810962108368109568"	https://twitter.com/clengeland1/status/810962108368109568
	2016-12-19 21:36	0	1	"That is so True! ACA also increased the care physicians give. Insurance companies will raise premiums if left alone."				"810962093302288384"	https://twitter.com/MickeyVicious1/status/810962093302288384
	2016-12-19 21:36	0	0	"at this point I'd be *FUCKING DELIGHTED* if their plan for the ACA was to replace it. With anything."				"810962093075759105"	https://twitter.com/brianvan/status/810962093075759105
