username;date;retweets;favorites;text;geo;mentions;hashtags;id;permalink
	2016-08-29 23:24	0	0	"Interestingly enough, TN & MS not expanding Medicaid & KYians WANT to keep their Obamacare , @MattBevin #littleguy https:// twitter.com/realdonaldtrum p/status/770381482229657602 …"		@MattBevin	#littleguy	"770401824251731968"	https://twitter.com/darren_steptoe/status/770401824251731968
	2016-08-29 23:24	0	0	"@CBSThisMorning Thank Obamacare for doing nothing for health care"		@CBSThisMorning		"770401802088964096"	https://twitter.com/SethSethabcde/status/770401802088964096
	2016-08-29 23:24	0	0	"The personal is political. ACA isn't perfect. THATS WHY WE NEED SINGLE PAYER. ️"				"770401799253716993"	https://twitter.com/hippiegrandmom/status/770401799253716993
	2016-08-29 23:24	1	1	"@ThomasPaine5 my students have gotten health care options they never would have without ACA . I have healthier students. STHU."		@ThomasPaine5		"770401704055414784"	https://twitter.com/MOVEprofPHD/status/770401704055414784
	2016-08-29 23:24	0	0	"YOU HAVE OUR VOTE!! WE DONT NEED A LIER DISHONEST CORRUPT CLINTON AND U ALSO WILL GET RID OF OBAMACARE AND SECURE border!"				"770401685550223360"	https://twitter.com/ZoZoy54/status/770401685550223360
	2016-08-29 23:24	0	0	"Obamacare problems turn critical... http:// goo.gl/fb/zpmDwC"				"770401676729745408"	https://twitter.com/drudgereported/status/770401676729745408
	2016-08-29 23:24	0	0	"Can we still call this the ACA at this point? What a disaster this is at this point https:// twitter.com/realdonaldtrum p/status/770381482229657602 …"				"770401658962665473"	https://twitter.com/mdcoletti/status/770401658962665473
	2016-08-29 23:23	0	0	"Obamacare Marketplaces Are in Trouble. What Can Be Done? http:// nyti.ms/2bUe38u"				"770401503014031360"	https://twitter.com/TheKilguard/status/770401503014031360
	2016-08-29 23:23	0	0	"ObamaCare coverage options disappearing across country, report finds - 'Fiscal crisis' warning as… http:// goo.gl/fb/DRqT7I #IHateTimWaterman"			#IHateTimWaterman	"770401482373865472"	https://twitter.com/FoxNewsBreaks/status/770401482373865472
	2016-08-29 23:23	0	1	"Byron York: Obamacare is failing. Why isn't Donald Trump talking about it? http:// washex.am/2bxDRCR via @DCExaminer"		@DCExaminer		"770401480683687936"	https://twitter.com/davidjones720/status/770401480683687936
	2016-08-29 23:23	0	0	"NY Times Lib Crank Krugman Blames White People’s Inherent Racism For Opposition To Obamacare , Medicare Expansion… http://www. weaselzippers.us/292135-ny-time s-lib-crank-paul-krugman-blames-white-peoples-inherent-racism-for-opposition-to-obamacare-medicare-expansion/ …"				"770401466687197186"	https://twitter.com/Aslans_Girl/status/770401466687197186
	2016-08-29 23:23	0	0	"@jacko2323 Wilder dies the same day Obamacare goes on death watch. I feel a Wonka meme coming on...."		@jacko2323		"770401394549456897"	https://twitter.com/PhilKeidel/status/770401394549456897
	2016-08-29 23:22	0	0	"Remember, it was bad when the GOP promised to overturn ACA . But it’s totally fine for Trump to say he can stop violence in Chicago in a week"				"770401344708612096"	https://twitter.com/kbaxter/status/770401344708612096
	2016-08-29 23:22	2	1	"Obamacare problems turn critical... http:// goo.gl/fb/zpmDwC"				"770401327239139328"	https://twitter.com/drudgefeed/status/770401327239139328
	2016-08-29 23:22	0	0	"ObamaCare exchange enrollments fall short of projections https:// youtu.be/qqXrsT7QTT4 via @YouTube"		@YouTube		"770401233504993280"	https://twitter.com/HoustonianMan/status/770401233504993280
	2016-08-29 23:22	0	1	"#YouWantToAvoid spending $3500 on #Obamacare premiums when your max out of pocket expenses are $6500; cuz you'll never cash in on the plan"			#YouWantToAvoid #Obamacare	"770401225992876034"	https://twitter.com/NunnyFB/status/770401225992876034
	2016-08-29 23:22	1	1	"#Obamacare law was passed overthe objections ofa majority of Americans,its still opposed bya majority of Americans tat benefit Only the Rich"			#Obamacare	"770401225107869696"	https://twitter.com/Jaikrishnashree/status/770401225107869696
	2016-08-29 23:22	0	0	"@realDonaldTrump Focus jobs, jobs, jobs, economy, lmmigration build the wall, Military, Veterans, repeal Obamacare , save Social Security!"		@realDonaldTrump		"770401205470175232"	https://twitter.com/anne_brownin/status/770401205470175232
	2016-08-29 23:22	0	0	"@HillaryClinton considering this plan involves obamacare clearly it doesn't have any chance of working"		@HillaryClinton		"770401158695387136"	https://twitter.com/SnazzyBBQ/status/770401158695387136
	2016-08-29 23:21	0	0	""I was on obamacare , but had to drop my insurance bc the premium was too high, it was that or pay the rent and bills." So tired of this"				"770401115431067649"	https://twitter.com/alisonlaflan/status/770401115431067649
	2016-08-29 23:21	3	1	"#Obamacare #problems turn #critical ... https://www. google.com/url?sa=t&rct=j &q=&esrc=s&source=web&cd=1&cad=rja&uact=8&ved=0ahUKEwin2vze4efOAhUW7WMKHYPeDAEQqQIIHzAA&url=http%3A%2F%2Fwww.ft.com%2Fcms%2Fs%2F0%2Fa23dc4b6-6b9c-11e6-ae5b-a7cc5dd5a28c.html&usg=AFQjCNGap1samWfE08ExWDMNMPwAkxL_6g …"			#Obamacare #problems #critical	"770401109957603328"	https://twitter.com/drudgeheadlines/status/770401109957603328
	2016-08-29 23:21	2	2	"Ohhh is this what @realBenCarson meant when he said MEDICAID EXPANSION via Obamacare was worst thing since slavery? https:// twitter.com/CarmenDeVito/s tatus/766813213669326848 …"		@realBenCarson		"770400995968815105"	https://twitter.com/Njeanous/status/770400995968815105
	2016-08-29 23:20	0	0	"Dr. Ben Carson to Congress: " Obamacare Can Be Undone!" #RT http:// conscores.org/eel4 #TCOT #CCOT #MakeDCListen #TeaParty #Conservatives"			#RT #TCOT #CCOT #MakeDCListen #TeaParty #Conservatives	"770400855715565568"	https://twitter.com/365USA/status/770400855715565568
	2016-08-29 23:20	0	0	"@ciresiforpa EMS squads are DIEING under Obamacare . What's your plan to keep local ambulance emergency squads open to serve???"		@ciresiforpa		"770400817153249280"	https://twitter.com/PAmicrobrewguy/status/770400817153249280
	2016-08-29 23:20	0	0	"ObamaCare GUTS Medicare - and refuses certain "care" to those over a certain "age" Republicans TRIED TO WARN!!! https:// twitter.com/Heritage/statu s/770400136501469185 …"				"770400798651973633"	https://twitter.com/pskalive/status/770400798651973633
	2016-08-29 23:20	0	1	"#ACA marketplace problems in context & why they don't mean #Obamacare is failing by @DrewAltman - http:// on.wsj.com/2bwdBfv via @WSJPolitics"		@DrewAltman @WSJPolitics	#ACA #Obamacare	"770400795929874432"	https://twitter.com/DowneyInsSvc/status/770400795929874432
	2016-08-29 23:20	0	0	"Replace Obamacare with WHAT exactly? Be specific. Just this once. Then... show us your taxes."				"770400771288334336"	https://twitter.com/PinierTyro/status/770400771288334336
	2016-08-29 23:20	0	0	"We will repeal and replace the horrible disaster known as #Obamacare ! http:// bit.ly/2bEpHlD"			#Obamacare	"770400749113208833"	https://twitter.com/apayaolivier/status/770400749113208833
	2016-08-29 23:20	0	0	"Modesty Could Have Averted the Anguish of Obamacare via @BV by @asymmetricinfo - https://www. bloomberg.com/view/articles/ 2016-08-29/modesty-could-have-averted-the-anguish-of-obamacare …"		@BV @asymmetricinfo		"770400696596168704"	https://twitter.com/GS_Watson/status/770400696596168704
	2016-08-29 23:20	0	0	"" @realDonaldTrump : Hey, all sick African Americans - Forget about that HORRIBLE OBAMACARE ! Just eat some poison! WHAT DO YOU HAVE TO LOSE?""		@realDonaldTrump		"770400675607949313"	https://twitter.com/justanotherbobu/status/770400675607949313
	2016-08-29 23:20	0	0	"OBAMACARE had destroyed healthcare!!!"				"770400662085509120"	https://twitter.com/Nanaking3704/status/770400662085509120
	2016-08-29 23:20	0	0	"#RonPaul : The Right Lessons from Obamacare 's Meltdown http:// dlvr.it/M85r9b | RPForums"			#RonPaul	"770400661930254336"	https://twitter.com/azureblade7v2/status/770400661930254336
	2016-08-29 23:20	0	0	"Thank U 4 the alternative to ObamaCare ! Would appreciate patients being able to keep their doctors and affordable premiums!"				"770400638970818560"	https://twitter.com/KellyWicker6/status/770400638970818560
	2016-08-29 23:19	0	0	"Aetna, UnitedHealth pulling out of Obamacare , leaving customers with fewer options http:// bit.ly/2c5AWU1"				"770400613653880832"	https://twitter.com/praxisdotink/status/770400613653880832
	2016-08-29 23:19	0	0	"Aetna, UnitedHealth pulling out of Obamacare , leaving customers with fewer options: Nearly a third of the cou... http:// bit.ly/2c5AULT"				"770400603583283201"	https://twitter.com/BlackConsrvConf/status/770400603583283201
	2016-08-29 23:19	0	0	"Aetna, UnitedHealth pulling out of Obamacare , leaving customers with fewer options http:// bit.ly/2c5AVzy"				"770400594078990337"	https://twitter.com/PoliticalFeed_/status/770400594078990337
	2016-08-29 23:19	0	0	"Four states with massive Obamacare hikes http:// washex.am/2bxExIu via @DCExaminer"		@DCExaminer		"770400577343856644"	https://twitter.com/davidjones720/status/770400577343856644
	2016-08-29 23:19	3	6	"how can the same people who were gifted Obamacare not have valid ID? I can't see a Dr. without showing ID so how can they?"				"770400526815072256"	https://twitter.com/jayhup/status/770400526815072256
	2016-08-29 23:19	0	0	"Health insurers’ pullback threatens to create monopoly zones - http:// on.wsj.com/2bYkk13 via @WSJ #HealthReform #Obamacare"		@WSJ	#HealthReform #Obamacare	"770400515045720064"	https://twitter.com/DowneyInsSvc/status/770400515045720064
	2016-08-29 23:19	0	0	"Go go go inspiring academic, your ideas are really well-constructed xx"				"770400496758566912"	https://twitter.com/aca_affirmation/status/770400496758566912
	2016-08-29 23:19	0	0	"#PaulGeorge Hillary's self-inflicted wound, Trump passes on ObamaCare , and other notable commentary"			#PaulGeorge	"770400475015294977"	https://twitter.com/NBAthisWeek1/status/770400475015294977
	2016-08-29 23:19	3	1	"Good from @KaiserFamFound CEO @DrewAltman on why ACA needs fixes, but isn't in dire straits http:// on.wsj.com/2cn61XD pic.twitter.com/Lf1CA3Up8w"		@KaiserFamFound @DrewAltman		"770400470586327041"	https://twitter.com/RobertBryan4/status/770400470586327041
	2016-08-29 23:19	0	0	"The Right Lessons from Obamacare 's Meltdown » Alex Jones' Infowars: There's a war on for your mind! http:// fb.me/3433WA40O"				"770400458569580545"	https://twitter.com/johnjones111142/status/770400458569580545
	2016-08-29 23:19	0	0	"The Right Lessons from Obamacare ’s Meltdown http:// goo.gl/fb/ydhd8G"				"770400451401359360"	https://twitter.com/ChrisInMaryvill/status/770400451401359360
	2016-08-29 23:19	0	0	"ObamaCare coverage options disappearing across country, report finds http:// fb.me/4IsAwlSps"				"770400405582864384"	https://twitter.com/VickieHando/status/770400405582864384
	2016-08-29 23:18	0	0	"There has been as many people loose coverage as gain Obamacare . The difference ... many jobs cut or lost."				"770400256441712640"	https://twitter.com/soldotnaguy/status/770400256441712640
	2016-08-29 23:18	0	0	"ObamaCare exchange enrollments fall short of projections https:// youtu.be/qqXrsT7QTT4 via @YouTube"		@YouTube		"770400222350602240"	https://twitter.com/rondawson4/status/770400222350602240
	2016-08-29 23:18	2	1	"@BarackObama @jturnershow @BernieSanders @CarmineZozzora @steph93065 @ChristiChat @HillaryClinton When r Dems going to admit ACA =DISASTER?"		@BarackObama @jturnershow @BernieSanders @CarmineZozzora @steph93065 @ChristiChat @HillaryClinton		"770400209566363649"	https://twitter.com/edseyger/status/770400209566363649
	2016-08-29 23:18	0	0	"@SpeakerRyan @HouseGOP Just more talk sir, just. Talk. Ryan voted to fund Obamacare & PP in Dec. bet you did too. Cowards"		@SpeakerRyan @HouseGOP		"770400188414431232"	https://twitter.com/jkbrewjr/status/770400188414431232
	2016-08-29 23:18	1	2	"Obamacare Is Making Mental-Health Care Better for Some - The Atlantic https:// apple.news/AdEqpwdhzQuWDY XsTqhW-sQ …"				"770400143355043840"	https://twitter.com/GFeskoe/status/770400143355043840
	2016-08-29 23:17	0	0	"@realdonaldtrump repeal the law . Obamacare Marketplaces Are in Trouble. What Can Be Done? http:// nyti.ms/2bwiff3 via @UpshotNYT"		@realdonaldtrump @UpshotNYT		"770400132223209472"	https://twitter.com/sobing/status/770400132223209472
	2016-08-29 23:17	0	0	"@JamesMurphy You are a real nut case for sure Maybe you should go get some help Use your free Obamacare call first on your free Obamaphone"		@JamesMurphy		"770400130914672640"	https://twitter.com/UnojoeArd/status/770400130914672640
	2016-08-29 23:17	0	0	"knew it was a joke to begin with Obamacare actually the wrong name. Obamadontcare"				"770400077093273600"	https://twitter.com/KarlaWelbern/status/770400077093273600
	2016-08-29 23:17	0	0	"#Obamacare : Designed to fail https:// pjmedia.com/trending/2016/ 08/29/brace-yourself-bridget-single-payer-health-care-is-on-its-way/ …"			#Obamacare	"770400067781996544"	https://twitter.com/NortonLoverPNW/status/770400067781996544
	2016-08-29 23:17	0	4	"Love you but Obamacare is failing. If you come up with an alternate system, you'll be everyone's hero."				"770400064221118465"	https://twitter.com/HollyASwanson/status/770400064221118465
	2016-08-29 23:17	0	0	"Obamacare 's faltering for one simple reason: profit http:// interc.pt/2bWtWJO by @tinyrevolution"		@tinyrevolution		"770399986584465413"	https://twitter.com/GolfGalSue/status/770399986584465413
	2016-08-29 23:17	0	0	"Aetna, UnitedHealth pulling out of Obamacare , leaving customers with fewer options http:// ow.ly/4H0g503YrYf"				"770399962454695936"	https://twitter.com/wtimespolitics/status/770399962454695936
	2016-08-29 23:17	2	4	"May be just 1 option for #Obamacare coverage in 31% of counties in 2017 | New study by nonpartisan @KaiserFamFound pic.twitter.com/TbA4dzXZCN"		@KaiserFamFound	#Obamacare	"770399925976834048"	https://twitter.com/SenateRPC/status/770399925976834048
	2016-08-29 23:17	0	0	"Comic Sans Navy Blue por aca . (?"				"770399920146685952"	https://twitter.com/Jatokun/status/770399920146685952
	2016-08-29 23:16	8	5	"Retweeted Kaiser Family Found ( @KaiserFamFound ): . @DrewAltman examines #Obamacare 's recent woes in the bigger... http:// fb.me/3v2FdGADB"		@KaiserFamFound @DrewAltman	#Obamacare	"770399833597280256"	https://twitter.com/Laurie_Garrett/status/770399833597280256
	2016-08-29 23:16	0	0	"The government just announced some big changes to try and fix Obamacare http:// goo.gl/fb/QNWPsb"				"770399780463796225"	https://twitter.com/Mohd_Arif/status/770399780463796225
	2016-08-29 23:16	0	0	"Thankfully we elected a Republican governor who is overhauling the unsustainable wreck of #KYNECT / Obamacare https:// twitter.com/realdonaldtrum p/status/770381482229657602 …"			#KYNECT	"770399778186330112"	https://twitter.com/D_R_Carwile/status/770399778186330112
	2016-08-29 23:16	0	0	"obamacare has nothing to do with Doctor costs, it's only a mandate to get insurance and make it affordable"				"770399774218518528"	https://twitter.com/himynamescorey/status/770399774218518528
	2016-08-29 23:16	0	0	"News Update ObamaCare coverage options disappearing across country, report finds - 'Fiscal crisis' warning as d... http:// ow.ly/GU7r503YryH"				"770399726839664640"	https://twitter.com/sdeanolson/status/770399726839664640
	2016-08-29 23:16	0	0	""OBAMA'S BROKEN PROMISES ObamaCare coverage options disappearing, report finds" http://www. foxnews.com/politics/2016/ 08/29/obamacare-coverage-options-disappearing-across-country-report-finds.html … #news #feedly"			#news #feedly	"770399710905380864"	https://twitter.com/datilcowman/status/770399710905380864
	2016-08-29 23:16	1	1	"Paul Krugman: The economy of race prevents Medicare and Obamacare expansion http://www. salon.com/2016/08/29/pau l-krugman-the-economy-of-race-prevents-medicare-and-obamacare-expansion/ … via @Salon"		@Salon		"770399682484920320"	https://twitter.com/SharonJ44257163/status/770399682484920320
	2016-08-29 23:16	12	8	"Four states with massive Obamacare hikes. http://www. washingtonexaminer.com/4-states-with- massive-obamacare-hikes/article/2600318 … #teaparty"			#teaparty	"770399634543906816"	https://twitter.com/TPPatriots/status/770399634543906816
	2016-08-29 23:15	0	1	"It. Is. Official: Obamacare Is DONE! http:// lsh.re/16DFW"				"770399564389986304"	https://twitter.com/cattinks/status/770399564389986304
	2016-08-29 23:15	2	2	"I just published "1 ( Aca Empieza La Novela jsjs )" of my story "You Complete Me || Rubelangel". http:// my.w.tt/UiNb/J9tfBd6kfw"				"770399555523317760"	https://twitter.com/doblasaddicted/status/770399555523317760
	2016-08-29 23:15	0	0	"here's FACT: the ACA was written by Heritage Foundation(GOP) in 97 as alternative 2 cliton's, GOP had 20 yrs 2 pass DIDN'T"				"770399529937936384"	https://twitter.com/LeeDugas2001/status/770399529937936384
	2016-08-29 23:15	0	0	"!T3/3 eg #Progressives #Boehner & #McConnell didnt defund @Obamacare &fully funded @Obama illegal #immigration .Read #2DOC , then lets organize"		@Obamacare @Obama	#Progressives #Boehner #McConnell #immigration #2DOC	"770399510962900992"	https://twitter.com/DMashak/status/770399510962900992
	2016-08-29 23:15	0	0	"can't blame u.What i don't get is that u don't see that w/o the ACA you'd be WORSE off"				"770399486749343744"	https://twitter.com/BogusPotusTrump/status/770399486749343744
	2016-08-29 23:15	0	0	"Understanding Collective Negotiations, Chapter 78, and ACA #NJLM seminar http:// ow.ly/pvPN303f9pD"			#NJLM	"770399464477560832"	https://twitter.com/NJ_League/status/770399464477560832
	2016-08-29 23:15	0	0	"public option offers people shopping for insurance on ACA exchanges a gov't run Medicare-like plan to compete w private insurers"				"770399454558060544"	https://twitter.com/nxpatel/status/770399454558060544
	2016-08-29 23:15	0	0	"Obamacare is in trouble. Well someone better fix it instead of repealing it. If not, there is going to be some pissed off Americans!"				"770399451735134208"	https://twitter.com/wallacetoni25/status/770399451735134208
	2016-08-29 23:15	0	0	"Jen reads: #VCdarling #healthplan Oscar out of #ACA markets after losses @healthcaredive http:// bit.ly/2bgvrmv pic.twitter.com/dBsXCSFjoC"		@healthcaredive	#VCdarling #healthplan #ACA	"770399427689316352"	https://twitter.com/jsearfoss/status/770399427689316352
	2016-08-29 23:15	0	0	"Obama spent the country in to deep debt with Obamacare . Anybody could have done that. Trump can undebt us."				"770399427479515136"	https://twitter.com/soldotnaguy/status/770399427479515136
	2016-08-29 23:15	23	16	"ObamaCare coverage options disappearing across country, report finds http:// fxn.ws/2c9BmeT"				"770399425592168448"	https://twitter.com/RichardWeaving/status/770399425592168448
	2016-08-29 23:15	1	1	"As Obamacare choices dwindle, feds face consumer, political backlash http:// usat.ly/2bMvtAE pic.twitter.com/B2vVqQhoM7"				"770399421553147904"	https://twitter.com/courierjournal/status/770399421553147904
	2016-08-29 23:14	0	0	"Here in OK Aetna and Untd Healthcare dropped out of the #ACA and now BC/BS has the monopoly and are asking for 50% prem inc"			#ACA	"770399376598441985"	https://twitter.com/talalachris/status/770399376598441985
	2016-08-29 23:14	0	0	"Kaiser: 20 percent of ACA users will have only one insurer choice in 2017 http://www. lifehealthpro.com/2016/08/29/kai ser-20-percent-of-aca-users-will-have-only-one/ …"				"770399323658092544"	https://twitter.com/TomKlug1/status/770399323658092544
	2016-08-29 23:14	0	0	"Kaiser: 20 percent of ACA users will have only one insurer choice in 2017 https:// lnkd.in/dfSkKtx"				"770399296646746112"	https://twitter.com/TomKlug1/status/770399296646746112
	2016-08-29 23:14	0	0	"Kaiser: 20 percent of ACA users will have only one insurer choice in 2017 http:// fb.me/38i1qeYMm"				"770399169710321664"	https://twitter.com/TomKlug1/status/770399169710321664
	2016-08-29 23:14	0	0	"Ron Paul: The Right Lessons From Obamacare 's Meltdown | Zero Hedge http://www. zerohedge.com/news/2016-08-2 9/ron-paul-right-lessons-obamacares-meltdown …"				"770399157550878720"	https://twitter.com/scarlett2112/status/770399157550878720
	2016-08-29 23:13	0	0	"#Obamacare Obama + many pols & journos don't truly think or work. So Gruber & Zeke Emanuel put a bowl of shit before them & they lap it up."			#Obamacare	"770399114852872192"	https://twitter.com/k__douglas/status/770399114852872192
	2016-08-29 23:13	3	6	"Obamacare critics have been wrong about everything...except maybe that death spiral thing: pic.twitter.com/4sqNkUFl8s"				"770398992148463616"	https://twitter.com/verumserum/status/770398992148463616
	2016-08-29 23:13	0	0	"The government just announced some big changes to try and fix Obamacare : The government is offering some idea... http:// bit.ly/2bNetgp"				"770398991347441664"	https://twitter.com/uirealestate/status/770398991347441664
	2016-08-29 23:13	0	0	"#Obamacare is the worst Trump shares startling Obamacare statistics http:// redstatewatcher.com/article.asp?id =35031 …"			#Obamacare	"770398928269369344"	https://twitter.com/Shoeqwn28Bonner/status/770398928269369344
	2016-08-29 23:13	0	0	"The #ACA has changed the #healthcare landscape. These 3 steps will help improve the member experience: http:// hubs.ly/H03NBKw0 by @Infogix"		@Infogix	#ACA #healthcare	"770398882966728704"	https://twitter.com/Infogix/status/770398882966728704
	2016-08-29 23:12	0	0	"Aetna, UnitedHealth pulling out of Obamacare , leaving customers with fewer options - http:// go.shr.lc/2cn5q8i - @washtimes"		@washtimes		"770398811176914945"	https://twitter.com/itsec75/status/770398811176914945
	2016-08-29 23:12	0	0	"WHAT A BIG SURPRISE!!! ObamaCare coverage options disappearing across country, report finds | Fox News | http:// fxn.ws/2c9BmeT"				"770398699835064328"	https://twitter.com/grmartin7/status/770398699835064328
	2016-08-29 23:12	0	0	"Paul Krugman: The economy of race prevents Medicare and Obamacare expansion http:// ln.is/www.salon.com/ 2016/0/1fFLJ … via @Salon"		@Salon		"770398653613744128"	https://twitter.com/sweetgreatmom/status/770398653613744128
	2016-08-29 23:12	0	0	"HILLARY NEEDS SOME " OBAMACARE " QUICK: https://www. youtube.com/watch?v=fDpiYf dYb-w …"				"770398642347859968"	https://twitter.com/BarrySoetoroESQ/status/770398642347859968
	2016-08-29 23:12	0	0	"Health-care exchange sign-ups fall far short of forecasts - http:// wpo.st/i3Mv1 #Obamacare #HealthReform"			#Obamacare #HealthReform	"770398624421335041"	https://twitter.com/DowneyInsSvc/status/770398624421335041
	2016-08-29 23:11	0	0	"it is not only Obamacare causing insurance premiums and deductible to go sky high but hospitals charging enormous fees"				"770398593958219777"	https://twitter.com/barbra2074/status/770398593958219777
	2016-08-29 23:11	0	0	"Whatta legacy he's leaving behind... ObamaCare Failures Are Piling Up https:// gop.com/obamacare-fail ures-are-piling-up …"				"770398555555110912"	https://twitter.com/Cobblezz/status/770398555555110912
	2016-08-29 23:11	0	0	"have you called the ACA to get an advocate? damn republicans don't care about people!!!"				"770398525817577472"	https://twitter.com/BogusPotusTrump/status/770398525817577472
	2016-08-29 23:11	0	1	"hmmm...you got it backwards, that's exactly what is happening with obamacare . Research... research... speak"				"770398516015304704"	https://twitter.com/Pglov13/status/770398516015304704
	2016-08-29 23:11	0	0	"you really need Obamacare because you need psychiatric treatment Waco"				"770398373211807744"	https://twitter.com/jacquel96025268/status/770398373211807744
	2016-08-29 23:10	0	0	"ACA premium rates up 63% in Tennessee according to the @WSJ https:// twitter.com/king_stephenv/ status/758503859023073280 …"		@WSJ		"770398333777182722"	https://twitter.com/King_StephenV/status/770398333777182722
	2016-08-29 23:10	0	0	"New video added: ObamaCare exchange enrollments fall short of projections - https://www. xaniatube.com/obamacare-exch ange-enrollments-fall-short-of-projections_6e8f0a12b.html … #XaniaTube"			#XaniaTube	"770398203518877696"	https://twitter.com/Xaniatube/status/770398203518877696
	2016-08-29 23:10	0	0	"Hillary's self-inflicted wound, Trump passes on ObamaCare , and other notable commentary via @NYPost http:// nyp.st/2bwpbY1"		@NYPost		"770398179955212289"	https://twitter.com/LifeisGreat_45/status/770398179955212289
	2016-08-29 23:10	0	0	"Obamacare Carriers 2016 vs 2017 http:// buff.ly/2bV4VQP pic.twitter.com/qoz8RcpDWp"				"770398128633708544"	https://twitter.com/icantbrain/status/770398128633708544
	2016-08-29 23:09	0	0	"have you been on obamacare ? Try it you will change your tune"				"770398096652021760"	https://twitter.com/Pglov13/status/770398096652021760
	2016-08-29 23:09	0	0	"The government just announced some big changes to try and fix Obamacare http:// dlvr.it/M85h9h"				"770398067325411328"	https://twitter.com/GAJARAJRNAIK/status/770398067325411328
	2016-08-29 23:09	0	0	"Appropriate Thresholds And Unambiguous Metrics’: ACA Files with FCC on Network Outage Reporting Requirements - CED http:// ow.ly/AMOY303HqIZ"				"770398059108900864"	https://twitter.com/TedatACA/status/770398059108900864
	2016-08-29 23:09	0	0	"The #Obamacare agenda is even more bizarre than you think it is, but there is way out. http:// yourpersonalaffordablecareact.com / #PJNET"			#Obamacare #PJNET	"770398041966727168"	https://twitter.com/KhannaOnHealth/status/770398041966727168
	2016-08-29 23:09	0	0	"Illinois emergency room visits increased after Obamacare , study says - Chicago Tribune http:// goo.gl/fb/0UjDzV"				"770397880314015744"	https://twitter.com/kickdown2010/status/770397880314015744
	2016-08-29 23:08	0	0	"RelNews: ObamaCare exchange enrollments fall short of projections -Fox News- http://www. usa-news.net/q/12-192308"				"770397827616874496"	https://twitter.com/usarelatednews/status/770397827616874496
