username;date;retweets;favorites;text;geo;mentions;hashtags;id;permalink
	2016-09-26 22:54	0	0	"@GovBillWeld spot on with Obamacare . Too much gov involved. Not enough decision power with patients and doctors."		@GovBillWeld		"780541010652884992"	https://twitter.com/serooj255/status/780541010652884992
	2016-09-26 22:54	0	0	"Report: Obamacare Adds to Medicaid’s Unsustainable Spending Trajectory -WFB http:// freebeacon.com/issues/report- obamacare-adds-medicaids-unsustainable-spending-trajectory/ …"				"780540976272060416"	https://twitter.com/Caring4You2/status/780540976272060416
	2016-09-26 22:53	0	0	"Before you vote for or contribute to a candidate, know what they think on #Agenda21 #CommonCore #PatriotAct #NDAA #ObamaCare . #CCOT #PJNET"			#Agenda21 #CommonCore #PatriotAct #NDAA #ObamaCare #CCOT #PJNET	"780540949764055040"	https://twitter.com/Frances_D/status/780540949764055040
	2016-09-26 22:53	0	1	"The more I look into what Obamacare is, the less I like it. They require you, by law, to get health insurance."				"780540931829268480"	https://twitter.com/AutophobicLoner/status/780540931829268480
	2016-09-26 22:53	0	0	"Does Obamacare cover liver transplants? https:// twitter.com/steph93065/sta tus/780527064935915521 …"				"780540879182278656"	https://twitter.com/AltimusHastings/status/780540879182278656
	2016-09-26 22:53	0	0	"Trump wants to kill Obamacare , his doesn't believe in minimum wage plan to fix the economy by Trickle Down economics He is gaining in polls?"				"780540816603410432"	https://twitter.com/vealej/status/780540816603410432
	2016-09-26 22:53	0	0	"I am one of the millions of people who have gotten insurance since Obamacare . We should bail out the taxpayers with #SinglePayer"			#SinglePayer	"780540781354446848"	https://twitter.com/TWYoung2/status/780540781354446848
	2016-09-26 22:53	1	0	"IRS to Target 20 million Americans Who Didn't Buy Obamacare - http:// go.shr.lc/2dbP8fH"				"780540755517534209"	https://twitter.com/davidjones720/status/780540755517534209
	2016-09-26 22:52	0	0	"BlueCross eliminates Obamacare coverage in Tennessee's biggest markets http://www. timesfreepress.com/news/business/ aroundregion/story/2016/sep/26/bluecross-slashes-statewide-coverage-obamacare-half/388673/ … via @timesfreepress"		@timesfreepress		"780540695245447168"	https://twitter.com/dflessner1/status/780540695245447168
	2016-09-26 22:51	0	1	"#DebatesAsk Ask Hillary about Blue Cross pulling out of the Obamacare SCAM. That makes 3 now with Aetna and Humana"			#DebatesAsk	"780540439371710464"	https://twitter.com/AMJ6251/status/780540439371710464
	2016-09-26 22:51	0	0	"Yahoo! News - Make the Transition From Obamacare Coverage to Medicare http:// bit.ly/2cYhRoi"				"780540434795761664"	https://twitter.com/TandMProdCo/status/780540434795761664
	2016-09-26 22:51	1	0	"@michael_scooter Plz RT to followers & ask they 2 theirs. Read @StikNtheMud testimonials of obamacare . Prime voting issue. Say NO to Hillary"		@michael_scooter @StikNtheMud		"780540379544162304"	https://twitter.com/dkcombs55/status/780540379544162304
	2016-09-26 22:51	0	0	"IMAGE: Reid: More money to fix Obamacare ! WTH?? http:// rightwingart.com/e06309b4-ea57- 4b72-a2b6-a461f372d6fd/artupload.aspx … #tcot #tea #tax #obamacare #fail #socialist #nannystate"			#tcot #tea #tax #obamacare #fail #socialist #nannystate	"780540372162256896"	https://twitter.com/RightWingArt/status/780540372162256896
	2016-09-26 22:51	0	0	"The market place scam insurance is Obamacare .And Benghazi happened. You are willfully ignorant. Now shoo snowflake"				"780540362016247808"	https://twitter.com/Rosechristenbe1/status/780540362016247808
	2016-09-26 22:51	0	0	"lots of doctors won't take it and ins companies are getting out of obamacare"				"780540294727032832"	https://twitter.com/georgiegirl1216/status/780540294727032832
	2016-09-26 22:51	0	0	"BlueCross BlueShield Drops Obamacare Coverage in 3 Tennessee Markets - http:// go.shr.lc/2dn9t4U"				"780540229027586048"	https://twitter.com/NCHornet/status/780540229027586048
	2016-09-26 22:50	0	1	"Obamacare must be ended immediately !!!!"				"780540164971999232"	https://twitter.com/jmpav2011/status/780540164971999232
	2016-09-26 22:50	0	0	"I THOUGHT OBAMACARE WAS GOING TO FIX THIS: “The reaction to opening a medical bill these days is of… https:// pjmedia.com/instapundit/24 4725/ …"				"780540071313305600"	https://twitter.com/RepubPhillyDoc/status/780540071313305600
	2016-09-26 22:50	2	2	"We need to stop saying #Obamacare is a failure. http:// 2076project.com/stop-saying-ob amacare-is-a-failure/ …"			#Obamacare	"780540012039286785"	https://twitter.com/2076Project/status/780540012039286785
	2016-09-26 22:50	0	0	"Yeah. The difference between the care I got w/ Obamacare & private insurance was incredible."				"780539979130896384"	https://twitter.com/RiotSquirrrl/status/780539979130896384
	2016-09-26 22:50	0	1	"Well they rejected obamacare didnt want it mandated on them. Shame on them right? XD"				"780539948902383616"	https://twitter.com/CommentDropping/status/780539948902383616
	2016-09-26 22:49	0	0	"Obamacare Website Admits It Just Recently Started Asking Insurers Which Docs They Covered http:// tws.io/2cQRyyw via @WeeklyStandard"		@WeeklyStandard		"780539851015729152"	https://twitter.com/Caring4You2/status/780539851015729152
	2016-09-26 22:49	0	0	"Hey there lovely you, your draft is wonderful (but not your whole worth)"				"780539803431501824"	https://twitter.com/aca_affirmation/status/780539803431501824
	2016-09-26 22:48	0	0	"#trumptalkshealthcare I want to hear Donald Trump talk about getting rid of Obamacare and working towards something that doesn't rape us!"			#trumptalkshealthcare	"780539679712030720"	https://twitter.com/jmpav2011/status/780539679712030720
	2016-09-26 22:48	0	0	"McCain, Gowdy, Issi, Ryann, Rubio could share the same retirement pasture, named Cow Plop Conspiracy Acres? Covered by ObamaCare"				"780539657809436673"	https://twitter.com/halibut_ter/status/780539657809436673
	2016-09-26 22:48	0	0	"Obamacare Website No Longer Addresses 'You Can Keep Your Doctor' http:// tws.io/2cz1oJ5 via @WeeklyStandard"		@WeeklyStandard		"780539625446125568"	https://twitter.com/Caring4You2/status/780539625446125568
	2016-09-26 22:48	0	0	"BlueCross BlueShield dropping ACA healthcare access to 100K Tenn - WSMV Channel 4 http://www. wsmv.com/story/33193831 /bluecross-blueshield-dropping-aca-healthcare-access-to-100k-tennesseans …"				"780539618613755904"	https://twitter.com/KDMDoc06/status/780539618613755904
	2016-09-26 22:47	1	0	"Mixed News For Obamacare In North Carolina As Blues Plan Opts To Remain In Obamacare Exchange via @forbes http://www. forbes.com/sites/theapoth ecary/2016/09/25/mixed-news-for-obamacare-in-north-carolina-as-blues-plan-opts-to-remain-in-obamacare-exchange/#36ad342c6df4 … #astute"		@forbes	#36ad342c6df4 #astute	"780539315667374082"	https://twitter.com/acasethchandler/status/780539315667374082
	2016-09-26 22:47	0	1	"Stuart Varney Grills Obamacare Architect Zeke Emanual https:// youtu.be/_Wa2ia6mICc via @YouTube"		@YouTube		"780539240719319041"	https://twitter.com/Caring4You2/status/780539240719319041
	2016-09-26 22:46	0	0	"Don't Bail Out ObamaCare With Taxpayer Money via @forbes http://www. forbes.com/sites/andykoen ig/2016/09/26/dont-bail-out-obamacare-with-taxpayer-money/#6c1b5be575bf …"		@forbes	#6c1b5be575bf	"780539133919793152"	https://twitter.com/kgouverneur/status/780539133919793152
	2016-09-26 22:46	3	1	"#BlueCrossBlueShield drops Obamacare coverage in Tennessee Markets after losses of nearly $500 million http:// freebeacon.com/issues/bluecro ss-blueshield-drops-coverage-3-obamacare-markets-tennessee/ …"			#BlueCrossBlueShield	"780539069633798144"	https://twitter.com/ThreatcoreNews/status/780539069633798144
	2016-09-26 22:46	0	0	"Majority of Americans oppose allowing illegal immigrants onto Obamacare exchanges http:// fb.me/2GEXpc09M"				"780538947407446017"	https://twitter.com/tamaraj86611162/status/780538947407446017
	2016-09-26 22:46	0	0	"Washington (DC) Examiner: House to vote on Obamacare co-op bill Tuesday . More #Obama #news - http:// tinyurl.com/ltvgvk"			#Obama #news	"780538944307933184"	https://twitter.com/ObamaInTheNews/status/780538944307933184
	2016-09-26 22:45	0	0	"lol yeah no #mentalillness #healthcare for #schizophrenic Mark due to #liberaldemocrats #Obamacare #Bubba lol"			#mentalillness #healthcare #schizophrenic #liberaldemocrats #Obamacare #Bubba	"780538880491675648"	https://twitter.com/mystic_layton/status/780538880491675648
	2016-09-26 22:45	8	45	". @Ann_Kirkpatrick supports Obamacare a program that has devastated the state of AZ. #McCain will push affordable + QUALITY healthcare for AZ"		@Ann_Kirkpatrick	#McCain	"780538854575136768"	https://twitter.com/ConorTeamMcCain/status/780538854575136768
	2016-09-26 22:45	1	3	"#ACA #HealthInsurance #compliance : What employers need to know http:// e.nbbj.news/YFxUzd #employment @EPIC_Insurance @WoodruffSawyer"		@EPIC_Insurance @WoodruffSawyer	#ACA #HealthInsurance #compliance #employment	"780538764091326464"	https://twitter.com/NBBJ/status/780538764091326464
	2016-09-26 22:45	0	0	"House to vote on Obamacare co-op bill Tuesday: Robert King The House will vote on a bill to shield Obamacare … http:// m.tbnn.it/MLMK3n"				"780538728750026752"	https://twitter.com/POLSDC/status/780538728750026752
	2016-09-26 22:45	0	0	"Who says Obamacare is bad for business? Definitely not Molina... http:// ow.ly/EVBZ304Ay26 pic.twitter.com/UBH1RNR5kv"				"780538727080857604"	https://twitter.com/Benefits_PRO/status/780538727080857604
	2016-09-26 22:44	0	1	"Another bright Trump supporter who thinks " Obamacare " is actual health insurance. https:// twitter.com/rosechristenbe 1/status/780536028104826881 …"				"780538666594684928"	https://twitter.com/Rosie909294/status/780538666594684928
	2016-09-26 22:44	0	0	"YOU can defeat Obamacare Refuse to Enroll! PLEASE RETWEET http:// bit.ly/1dVHMuU #PJNET #USA"			#PJNET #USA	"780538624756502528"	https://twitter.com/TreeTreeTweeTs/status/780538624756502528
	2016-09-26 22:44	1	3	"Hoping they ask #Trump if/how he'll keep people w/ pre-existing conditions from being denied #healthinsurance absent the #ACA . #debatenight"			#Trump #healthinsurance #ACA #debatenight	"780538536688746497"	https://twitter.com/mirandayaver/status/780538536688746497
	2016-09-26 22:44	0	0	"Hey, genius, Obamacare isn't health insurance. It's health insurance regulation. It's not something to be accepted."				"780538454752894976"	https://twitter.com/Rosie909294/status/780538454752894976
	2016-09-26 22:43	0	0	"Videos Regarding The Topic: Obamacare http:// crappycare.com/index.php?topi c=743 …"				"780538328261079041"	https://twitter.com/Caring4You2/status/780538328261079041
	2016-09-26 22:43	0	0	"How to Respond When ACA Electronic Reporting Triggers Notification of an Incorrect TIN https:// goo.gl/5GpPnb | by @OgletreeDeakins"		@OgletreeDeakins		"780538309219127296"	https://twitter.com/Legal_Alerts/status/780538309219127296
	2016-09-26 22:43	0	0	"BlueCross BlueShield drops #Obamacare in #Memphis , #Nashville , Knox http:// jenke.rs/Gt0l6W pic.twitter.com/3FtX6XbjbC"			#Obamacare #Memphis #Nashville	"780538301195362304"	https://twitter.com/berserk_news/status/780538301195362304
	2016-09-26 22:42	5	4	"Tomorrow, WH holds Summit to discuss "best practices for enrolling millennials" in ObamaCare . Enrollment period begins Nov. 1."				"780538143502106624"	https://twitter.com/markknoller/status/780538143502106624
	2016-09-26 22:42	0	0	"FUCK OBAMACARE I SWEAR TO GOD https:// twitter.com/worldstarc0med y/status/730231633299701760 …"				"780538141266423808"	https://twitter.com/dogsrbettrthnu/status/780538141266423808
	2016-09-26 22:42	1	0	"How often will regulation come up in tonight's debate? Watch for Obamacare , immigration, Wall Street, trade rules... #DebateNight @RegBlog"		@RegBlog	#DebateNight	"780538088296546305"	https://twitter.com/TheRegReview/status/780538088296546305
	2016-09-26 22:42	1	1	"IRS Warns of Bogus Obamacare Notices http:// bit.ly/2cMRHop"				"780538076271489024"	https://twitter.com/allied_fp/status/780538076271489024
	2016-09-26 22:42	0	0	"HRC w say trumps replacement of ACA w cost jobs & money. 5 trillion in debt when trickle down fails. Both false but said."				"780538067329351680"	https://twitter.com/RogerLHerman/status/780538067329351680
	2016-09-26 22:42	0	0	"Her Health Plan Was $257 a Month. Now Her Obamacare Plan Could Be $650 a Month. http:// dailysign.al/2bBFVvw via @MelissaQuinn97 @DailySignal"		@MelissaQuinn97 @DailySignal		"780538054389866496"	https://twitter.com/Caring4You2/status/780538054389866496
	2016-09-26 22:42	3	1	"BlueCross BlueShield drops Obamacare in Memphis, Nashville, Knoxville http:// bit.ly/2dbOsXo #NBC12"			#NBC12	"780538040947208192"	https://twitter.com/NBC12/status/780538040947208192
	2016-09-26 22:42	14	10	"My whole family had health insurance for the last 20 yrs until Obamacare ! Now none of us do. https:// twitter.com/rosechristenbe 1/status/780536028104826881 …"				"780537988384120833"	https://twitter.com/Eliz_Hightower/status/780537988384120833
	2016-09-26 22:41	0	0	"@realDonaldTrump I'm sooo excited. Maybe the tramp will explain his secret plan for ISIS,or Obamacare https:// youtu.be/g5rjvb4zEbs #debate"		@realDonaldTrump	#debate	"780537837221400576"	https://twitter.com/humptrump2016/status/780537837221400576
	2016-09-26 22:41	6	6	"One of the Obama Administration’s biggest priorities before leaving office: a taxpayer funded bailout of Obamacare . http:// bit.ly/2d11XwA"				"780537688877182976"	https://twitter.com/FreedomPartners/status/780537688877182976
	2016-09-26 22:40	0	0	"And another Obamacare insurer bites the dust. All is going to the Liberal Left plan to take over health care. http:// fb.me/Rab52jsg"				"780537452394086401"	https://twitter.com/RodEccles/status/780537452394086401
	2016-09-26 22:39	0	0	"Debate Night Reminder: At end of last GOP presidency, economy was losing 800K jobs/month. Since Obamacare , our businesses have created 15M. pic.twitter.com/WX3f3defA6"				"780537336140402688"	https://twitter.com/comebackdecade/status/780537336140402688
	2016-09-26 22:39	0	0	"Have you heard of Health Sharing?A great way to Beat the Obamacare fiasco. Lower costs,Free 2 choose your own Doc's http://www. HealthShareAlliance.com"				"780537327768641537"	https://twitter.com/WoolieBees/status/780537327768641537
	2016-09-26 22:38	3	0	"ObamaCare Threw This Burn Victim Out Of The Hospital After 3 Days! http:// tinyurl.com/hs76ps4 Via @RealJTP @RBJazzy #TCOT #CCOT"		@RealJTP @RBJazzy	#TCOT #CCOT	"780537084763185152"	https://twitter.com/C4TRadio/status/780537084763185152
	2016-09-26 22:38	0	0	"Debate Night Reminder: After a decade of stagnation and then collapse before Obamacare , middle class incomes are back on the rise. pic.twitter.com/oiw6gtLUeB"				"780537073811886081"	https://twitter.com/comebackdecade/status/780537073811886081
	2016-09-26 22:36	0	0	"Debate Night Reminder: When GOP complains about GDP growth, they neglect to mention that it has risen since Obamacare passed. pic.twitter.com/HMsSzwygDX"				"780536626761965568"	https://twitter.com/comebackdecade/status/780536626761965568
	2016-09-26 22:36	0	1	"Health insurance premium inflation is down 40% under Obamacare . #ActualFacts #Debates2016"			#ActualFacts #Debates2016	"780536617014595584"	https://twitter.com/realpetergriffn/status/780536617014595584
	2016-09-26 22:36	0	0	"Economic View: Football Team at the Buffet: Why Obamacare Markets Are in Crisis - http:// wp.me/p7ekkL-fbv pic.twitter.com/dAqge1AUeM"				"780536544260136960"	https://twitter.com/jessicajames942/status/780536544260136960
	2016-09-26 22:36	1	0	"We now have at least 2 BXs exiting. Nebraska and now Tennessee. BXs generally very supportive of Obamacare . Something to watch. https:// twitter.com/brian_blase/st atus/780450946790920192 …"				"780536509212397568"	https://twitter.com/acasethchandler/status/780536509212397568
	2016-09-26 22:35	0	0	"20M ppl insured under ACA and Hillary vows to protect and expand on it-Trump promises to repeal it and let ppl die w/o insurance #Debate2016 pic.twitter.com/CAztn1uKep"			#Debate2016	"780536207898009600"	https://twitter.com/SouthForHillary/status/780536207898009600
	2016-09-26 22:35	7	10	"20M ppl insured under ACA and Hillary vows to protect and expand on it-Trump promises to repeal it and let ppl die w/o insurance #Debate2016 pic.twitter.com/tqpID4PjMl"			#Debate2016	"780536206442586114"	https://twitter.com/sheenA_8886/status/780536206442586114
	2016-09-26 22:34	0	5	"Obamacare is giving us higher costs, worse care, and fewer choices. #INSen https:// twitter.com/IBJnews/status /780519346439348224 …"			#INSen	"780536156148600832"	https://twitter.com/ToddYoungIN/status/780536156148600832
	2016-09-26 22:34	0	2	"this ACA conference is playing lil dicky over the intercom. its lit."				"780536133243502592"	https://twitter.com/ceattaway/status/780536133243502592
	2016-09-26 22:34	0	0	"IU Health Plans leaves Indiana's ACA exchange - Indiana University Health Plans, the insurance arm of the IU He... http:// ow.ly/AHHR504RRg6"				"780536092726550528"	https://twitter.com/MRIGlobalHCF/status/780536092726550528
	2016-09-26 22:34	0	0	"@GovAbbott Tales from the Crypt. Molina HC ( Obamacare ) is a no return/option money pit. Boxed in health care corner. Grade F pic.twitter.com/IS0IWNlgZf"		@GovAbbott		"780536046945603584"	https://twitter.com/earthcityblues/status/780536046945603584
	2016-09-26 22:34	3	3	"@Eliz_Hightower No dr I know or worked for will accept Obamacare . It's a hoax that's really another tax on our citizens."		@Eliz_Hightower		"780536028104826881"	https://twitter.com/Rosechristenbe1/status/780536028104826881
	2016-09-26 22:34	0	0	"Debate Night Reminder: Uninsured rate for young adults cut in half since Obamacare became law. pic.twitter.com/ck2fUQGf11"				"780536019724546048"	https://twitter.com/comebackdecade/status/780536019724546048
	2016-09-26 22:34	0	0	"(The ONLY insurance 4 TN!) #BlueCrossBlueShield dropping ACA healthcare access to 100K #Tennessee http://www. wsmv.com/story/33193831 /bluecross-blueshield-dropping-aca-healthcare-access-to-100k-tennesseans …"			#BlueCrossBlueShield #Tennessee	"780535950904406016"	https://twitter.com/tmack894/status/780535950904406016
	2016-09-26 22:33	0	0	"You can keep your doctor they said... #Obamacare is @POTUS legacy of failure! #MAGA and #repeal and replace #AffordableCareAct https:// twitter.com/tedcruz/status /780522312965558272 …"		@POTUS	#Obamacare #MAGA #repeal #AffordableCareAct	"780535760428695552"	https://twitter.com/MarioTrenta/status/780535760428695552
	2016-09-26 22:33	2	7	"First thought: I'm done for. Then I realized I don't owe $472,509.03. I owe $912.55. THANKS @BarackObama ! #Obamacare @POTUS pic.twitter.com/ULEaIlkkDK"		@BarackObama @POTUS	#Obamacare	"780535741659041793"	https://twitter.com/shagsss/status/780535741659041793
	2016-09-26 22:33	44	35	"Debate Night Reminder: GOP says Obamacare is causing "skyrocketing premiums." In reality, premium inflation has come down under Obamacare . pic.twitter.com/xH0IMMlJrQ"				"780535738660065281"	https://twitter.com/comebackdecade/status/780535738660065281
	2016-09-26 22:32	3	3	"Btw, thanks to Obamacare I've now LOST my health insurance."				"780535649438801920"	https://twitter.com/acitrep/status/780535649438801920
	2016-09-26 22:32	0	1	"Obamacare covers Trump related intoxication."				"780535614571630593"	https://twitter.com/DoodyGiuliani1/status/780535614571630593
	2016-09-26 22:32	0	0	"Voters Say No to Obamacare Health Insurance for Illegal Immigrants - Rasmussen Reports™ http:// ln.is/rasmussenrepor ts.com/msZiI … Who pays? #GuessWho"			#GuessWho	"780535477719994368"	https://twitter.com/joemo23/status/780535477719994368
	2016-09-26 22:32	0	1	"NO Public Option and 181 #GOP amendments for #Obamacare = pic.twitter.com/CUXefmhYkf https:// twitter.com/BarackObama/st atus/775429955253481473 …"			#GOP #Obamacare	"780535458795167744"	https://twitter.com/polandmary21/status/780535458795167744
	2016-09-26 22:32	1	1	"Chairman: ' Obamacare falling apart,' another 131,000 lose coverage http://www. washingtonexaminer.com/chairman-obama care-falling-apart-another-131000-lose-coverage/article/2602855?utm_campaign=crowdfire&utm_content=crowdfire&utm_medium=social&utm_source=twitter … pic.twitter.com/DIxtzbmJo3"				"780535456136040448"	https://twitter.com/pgray41/status/780535456136040448
	2016-09-26 22:31	0	0	"House to vote on Obamacare co-op bill Tuesday http:// liber8r.com/2016/09/house- to-vote-on-obamacare-co-op-bill-tuesday/ …"				"780535374904832001"	https://twitter.com/Liber8R2/status/780535374904832001
	2016-09-26 22:31	1	1	"#ObamaAdmin #ObamaClinton #Obamacare May use executive order to ban guns and to ban sales of certain firearms making it easier for Hillary"			#ObamaAdmin #ObamaClinton #Obamacare	"780535357259583488"	https://twitter.com/signess226/status/780535357259583488
	2016-09-26 22:31	4	3	"Debate Night Reminder: GOP predicted Obamacare would "blow up the deficit." Precisely the opposite has happened. pic.twitter.com/m7AeNTAdP6"				"780535350628196352"	https://twitter.com/comebackdecade/status/780535350628196352
	2016-09-26 22:31	0	0	"Obamacare is on the brink of collapse. Just wait until 2017 when all other mandates kick in. Of course, strategically after the election https:// twitter.com/tedcruz/status /780522312965558272 …"				"780535318315401216"	https://twitter.com/maximillian_t/status/780535318315401216
	2016-09-26 22:31	0	0	"Economic View: Football Team at the Buffet: Why Obamacare Markets Are in Crisis - http:// wp.me/p7ekkL-fbv pic.twitter.com/xrUwwGlKcu"				"780535251630170112"	https://twitter.com/wallacebrennan3/status/780535251630170112
	2016-09-26 22:31	0	0	"With Obamacare ?"				"780535217421324289"	https://twitter.com/briancoswald/status/780535217421324289
	2016-09-26 22:31	5	3	"Trump has said #Obamacare premium increases will be concealed until after the election. Fact check by @DrewAltman http:// kaiserf.am/2dmFz0x"		@DrewAltman	#Obamacare	"780535167282733056"	https://twitter.com/KaiserFamFound/status/780535167282733056
	2016-09-26 22:30	1	0	"Self-insured employers still struggle to gather #SSN info for ACA form. #compliance http:// bit.ly/2cyQgvE pic.twitter.com/EzjXVkrD4N"			#SSN #compliance	"780534985547624448"	https://twitter.com/hrdive/status/780534985547624448
	2016-09-26 22:30	1	1	"Big Brother: 20M Americans soon will be getting a letter from the #IRS “suggesting” they sign up for #Obamacare http:// buff.ly/2d0mAZZ pic.twitter.com/UanaLAaJKa"			#IRS #Obamacare	"780534950902759425"	https://twitter.com/GovWaste/status/780534950902759425
	2016-09-26 22:30	0	0	"3 giant new 2017 ACA exchange menu announcements http://www. lifehealthpro.com/2016/09/26/3-g iant-new-2017-aca-exchange-menu-announcements?t=individual-health&ref=channel …"				"780534924059086848"	https://twitter.com/CAChoice/status/780534924059086848
	2016-09-26 22:29	4	4	"Debate Night Reminder: American businesses have created 15 million jobs since Obamacare passed, compared to 3.5 million lost in prior decade pic.twitter.com/QFZPKV6m9y"				"780534906472402944"	https://twitter.com/comebackdecade/status/780534906472402944
	2016-09-26 22:29	0	0	"Good to see #Obamacare really got costs under control! Ugh. https:// twitter.com/stevepohlit/st atus/780534277633089537 …"			#Obamacare	"780534810561290240"	https://twitter.com/JeremyKossen/status/780534810561290240
	2016-09-26 22:29	0	0	"Chairman: ' Obamacare falling apart,' another 131,000 lose coverage http:// washex.am/2cyYCDA via @DCExaminer"		@DCExaminer		"780534754072522752"	https://twitter.com/namusca/status/780534754072522752
	2016-09-26 22:28	0	0	""Football Team at the Buffet: Why #Obamacare Markets Are in Crisis" arguing insurers do bait & switch charging more http:// nyti.ms/2cIuEt2"			#Obamacare	"780534645725261824"	https://twitter.com/CiteShare/status/780534645725261824
	2016-09-26 22:28	0	0	"Economic View: Football Team at the Buffet: Why Obamacare Markets Are in Crisis - http:// wp.me/p7ekkL-fbv pic.twitter.com/9sRh2YFY3v"				"780534503668326401"	https://twitter.com/jonesmason94/status/780534503668326401
	2016-09-26 22:27	0	0	"BCBS to pull out of @obamacare exchange in @KnoxvilleTNRR , @visitmusiccity & @VisitMemphis http://www. wbir.com/news/local/blu ecross-blue-shield-to-pull-out-of-obamacare-exchange-in-knoxville-nashville-and-memphis/326209483 … via @@WBIRNews #BREAKING"		@obamacare @KnoxvilleTNRR @visitmusiccity @VisitMemphis @ @WBIRNews	#BREAKING	"780534355923918848"	https://twitter.com/J_D_McLovin/status/780534355923918848
	2016-09-26 22:27	0	4	"Yo @AdamHillLVRJ your co-worker is getting killed by Obamacare . Don't you feel for him? http://www. reviewjournal.com/opinion/column s-blogs/wayne-allyn-root/root-obamacare-crippling-the-us-economy …"		@AdamHillLVRJ		"780534237711638528"	https://twitter.com/stevecofield/status/780534237711638528
	2016-09-26 22:27	0	0	"FWD: Obamacare Medicare for Seniors for 2017 will greatly reduce Seniors access to Health care by increasing premiums etc Check it out..."				"780534207185424384"	https://twitter.com/ThePlusSizeMod1/status/780534207185424384
	2016-09-26 22:26	0	0	"Economic View: Football Team at the Buffet: Why Obamacare Markets Are in Crisis - http:// wp.me/p7ekkL-fbv pic.twitter.com/2B2dWcqaV7"				"780534055804821504"	https://twitter.com/dianabrown7851/status/780534055804821504
	2016-09-26 22:26	0	0	"@bpolitics @MarkHalperin @professor if you think nobody likes Obamacare U obviously don't know any blacks you hypocrite"		@bpolitics @MarkHalperin @professor		"780534046577176576"	https://twitter.com/dkbruni/status/780534046577176576
	2016-09-26 22:26	0	0	"Free birth control under Obamacare . Woo hoo!"				"780533989698306048"	https://twitter.com/realDonoldTrunp/status/780533989698306048
