username;date;retweets;favorites;text;geo;mentions;hashtags;id;permalink
	2016-12-19 22:42	0	1	"I am ending #Obamacare bc I'm starting Medicare #chroniclife https:// twitter.com/texasspoonie/s tatus/810978074888179712 …"			#Obamacare #chroniclife	"810978640754253825"	https://twitter.com/texasspoonie/status/810978640754253825
	2016-12-19 22:42	1	2	"Obama came up with Obamacare and put me into Obamapoverty after paying more then my fair share of taxes since 1962"				"810978617270345729"	https://twitter.com/FriendsofJimmys/status/810978617270345729
	2016-12-19 22:42	0	0	"para los que no me siguen en tumblr, aca esta la obra de arte furry de ayer. #phan what am i doing. at least is kawaii. pic.twitter.com/fYXMQXVoKM"			#phan	"810978554536140800"	https://twitter.com/magicblend/status/810978554536140800
	2016-12-19 22:41	0	0	"@TheFive Russia had nothing to do with Clinton's loss. Clinton was unfit to be President & ObamaCare was a big hindrance, as well!"		@TheFive		"810978467957403648"	https://twitter.com/Janae_Brooklynn/status/810978467957403648
	2016-12-19 22:41	0	0	"Why repealing the ACA before replacing it won’t work, and what might http:// brook.gs/2hvJbOL via @BrookingsInst"		@BrookingsInst		"810978333924139008"	https://twitter.com/jonmello1/status/810978333924139008
	2016-12-19 22:41	0	0	"Republicans promise access, "adequate transition period," after ACA repeal http:// sbne.ws/r/vYZu"				"810978293436547072"	https://twitter.com/PattersonNatali/status/810978293436547072
	2016-12-19 22:40	0	0	"Obamacare revisions good or bad? http:// ow.ly/r1xCm #rebrandObamacare #obamacare #aca #healthcare #obama"			#rebrandObamacare #obamacare #aca #healthcare #obama	"810978141372026882"	https://twitter.com/KingToilet1/status/810978141372026882
	2016-12-19 22:40	0	0	"CMS also released its annual letter to issuers in the #ACA federally-facilitated marketplaces. https://www. cms.gov/CCIIO/Resource s/Regulations-and-Guidance/Downloads/Final-2018-Letter-to-Issuers-in-the-Federally-facilitated-Marketplaces.pdf …"			#ACA	"810978090566504452"	https://twitter.com/ERISABryanCave/status/810978090566504452
	2016-12-19 22:40	0	1	"Does anyone know if Obamacare auto-enrolls applicants? I want to end Marketplace coverage & don't want to be auto-enrolled. #chroniclife"			#chroniclife	"810978074888179712"	https://twitter.com/texasspoonie/status/810978074888179712
	2016-12-19 22:40	0	0	"GOP lawmaker’s Obamacare alternative: Make kids sleep on broken arms to avoid costly ER visits Another #RWNJ http://www. rawstory.com/2016/12/gop-la wmakers-obamacare-alternative-make-kids-sleep-on-broken-arms-to-avoid-costly-er-visits/ …"			#RWNJ	"810978069519339520"	https://twitter.com/ESRDguy/status/810978069519339520
	2016-12-19 22:40	0	0	"Feds extend ACA enrollment deadline amid high demand http:// sbne.ws/r/vYZt"				"810978064029155328"	https://twitter.com/PattersonNatali/status/810978064029155328
	2016-12-19 22:39	6	8	"Liberals, Trump is the President. Conservatives, Trump is not going to jail Hillary, build a wall or a full repeal of Obamacare . Let it go!"				"810977987164274689"	https://twitter.com/dewforpolitics/status/810977987164274689
	2016-12-19 22:39	0	0	"@BarackObama your ObamaCare is awful! Forcing me to buy or penalizing me? Like making one buy alcohol who don't drink!!"		@BarackObama		"810977982453927936"	https://twitter.com/DougswomanLinda/status/810977982453927936
	2016-12-19 22:39	0	0	"#Obamacare fucking RETARDS "Extend" a "DEADLINE" Lets Dummy Down for losers to keep up with winners. No one gets left behind! pic.twitter.com/SIuDKbzRIn"			#Obamacare	"810977973906116608"	https://twitter.com/RealDazz/status/810977973906116608
	2016-12-19 22:39	0	0	"It's obvious to everyone that destroying Obamacare will be a disaster, and hurt the GOP come 2018. Their only hope is if...."				"810977894092505088"	https://twitter.com/PhoenixWomanMN/status/810977894092505088
	2016-12-19 22:39	0	0	"I thought Obamacare was supposed to fix that, or so people like you said it would"				"810977838920777737"	https://twitter.com/realist800/status/810977838920777737
	2016-12-19 22:38	0	0	"Sorry Obama Ur Obamacare is total failure ur legacy, jobs r not better way worst, u vacationed to much Michael/Michelle spent to much money https:// twitter.com/OFA/status/794 938896991797248 …"				"810977716094779393"	https://twitter.com/Diane31159980/status/810977716094779393
	2016-12-19 22:38	1	3	"Obama announces record sign-ups for a single day in ACA marketplaces http:// wpo.st/ENcN2"				"810977637527130112"	https://twitter.com/CitizenActionWI/status/810977637527130112
	2016-12-19 22:37	0	0	"The people most likely to lose in Obamacare repeal live in Trump country http:// seriouslypolitics.com/2016/12/19/11/ 56/48/the-people-most-likely-to-lose-in-obamacare-repeal-live-in-trump-country/ …"				"810977471063539712"	https://twitter.com/seriouspolitics/status/810977471063539712
	2016-12-19 22:37	0	1	"thought it wasn't the ACA bc it was under the state name. Stupidity."				"810977447453884416"	https://twitter.com/shutterbutter68/status/810977447453884416
	2016-12-19 22:37	0	0	"this 65 yr old granny is furious with social security/ Obamacare they took my money against my wishes can YOU help please?"				"810977438238998528"	https://twitter.com/PamelaEvonne/status/810977438238998528
	2016-12-19 22:37	0	1	". @thejuanwilliams - I'm sure u agree 70%+ of country wanted Obamacare repealed ...&Trump said REPEAL and Hillary said DON"T_REPEAL"		@thejuanwilliams		"810977402012762116"	https://twitter.com/Dark_Red_Hair/status/810977402012762116
	2016-12-19 22:37	0	0	"@EleanorScott1 over 50 you're OK. Under? Prepare for US style expensive inefficient health care. Trump will junk Obamacare"		@EleanorScott1		"810977316360876032"	https://twitter.com/Mattmcnulty7/status/810977316360876032
	2016-12-19 22:37	0	0	"The pain of the opioid epidemic is a big reason for opposition to ACA & rise of Trump."				"810977305405206529"	https://twitter.com/GussRuralWA/status/810977305405206529
	2016-12-19 22:36	0	0	"GET IN WHERE YOU FIT IN. Before we get a new president. #ACA #healthinsurance #openenrollment https:// twitter.com/npwf/status/81 0976755381129217 …"			#ACA #healthinsurance #openenrollment	"810977238141136897"	https://twitter.com/el_oregonio/status/810977238141136897
	2016-12-19 22:36	0	0	"Obama new about hacking when he had both house but pushed OBAMACARE but now it's a priority\ for whom not the people 4 talking head"				"810977171426648064"	https://twitter.com/toefinger/status/810977171426648064
	2016-12-19 22:36	0	0	"If Obamacare is so great, why are you and your family exempt? pic.twitter.com/wVcGZDfGvh"				"810977108277297152"	https://twitter.com/Ozetty/status/810977108277297152
	2016-12-19 22:36	0	0	"Then it must be a relief that they're going to replace Obamacare with something much better."				"810977075528134656"	https://twitter.com/JackOfSomeTales/status/810977075528134656
	2016-12-19 22:36	0	0	"Any Repubs say to my face to unite or come together I will punch them in the face several times, allowing them to use Obamacare before gone. https:// twitter.com/pam_cee/status /810976454481588224 …"				"810977043185737732"	https://twitter.com/egg509/status/810977043185737732
	2016-12-19 22:36	0	0	"Theoretically that's what it's supposed to be but in reality it's NOT. That's why Americans voted to dump ObamaCare ."				"810977015318937600"	https://twitter.com/J0yful5/status/810977015318937600
	2016-12-19 22:36	0	0	"@realDonaldTrump : Overturn The #Affordable Care Act( Obamacare ) immediately. Please and Thank You"		@realDonaldTrump	#Affordable	"810977011040665600"	https://twitter.com/1Makhario/status/810977011040665600
	2016-12-19 22:36	0	0	"Obamacare Has Its Biggest Day as Republicans Promise Repeal http:// ln.is/ilelO by #amjoyshow via @c0nvey"		@c0nvey	#amjoyshow	"810977006565392385"	https://twitter.com/mylesdb/status/810977006565392385
	2016-12-19 22:35	0	0	"New post: MD Evergreen Health Cooperative Inc. Withdrawing From Obamacare http://www. neopatriotnews.com/index.php/2016 /12/19/md-evergreen-health-cooperative-inc-withdrawing-from-obamacare/ …"				"810976933693399040"	https://twitter.com/neopatriotnews/status/810976933693399040
	2016-12-19 22:35	0	0	"& corporate insurance loses money bcuz of Obamacare , that's why they raised everyone's premiums to the outrages prices they are"				"810976881411522565"	https://twitter.com/Cmonkey29/status/810976881411522565
	2016-12-19 22:35	0	0	"Rep. Tiberi: Obamacare must be repealed, replaced http:// usat.ly/2hWW1ps via @usatoday"		@usatoday		"810976874117664768"	https://twitter.com/Anchoveebrother/status/810976874117664768
	2016-12-19 22:35	0	0	"Chance the Rapper Pays Tribute to Obamacare on SNL & Other News http:// shirting.life/obchDvp via @highsnobiety pic.twitter.com/N1Dig3k0oc"		@highsnobiety		"810976826604552192"	https://twitter.com/hurryupnbuy/status/810976826604552192
	2016-12-19 22:34	0	0	"ADPVoice: Employers' Top 4 ACA Compliance Concerns http:// bit.ly/2gUVqPV"				"810976753351098369"	https://twitter.com/Kiihnl/status/810976753351098369
	2016-12-19 22:34	0	0	"Today is last day to sign up for #ObamaCare and I want to be on the record: I did it under protest. Didn't want to honor Obama."			#ObamaCare	"810976720916533250"	https://twitter.com/nativejeweler1/status/810976720916533250
	2016-12-19 22:34	6	4	"Rick Scott: "Day One Would Be Nice For Me" On Death Sentence For Floridians Thanks To ACA Repeal http://www. beachpeanuts.com/2016/12/rick-s cott-day-one-would-be-nice-for-me-on-death-sentence-for-floridians-thanks-to-aca-repeal.html …"				"810976691577376768"	https://twitter.com/BeachPeanuts/status/810976691577376768
	2016-12-19 22:34	0	0	"My mom has NO INCOME... No pension, no social security, yet ObamaCare quoted her with a premium of >$600 per month."				"810976691371778048"	https://twitter.com/J0yful5/status/810976691371778048
	2016-12-19 22:34	7	7	"Moving oral contraceptives OTC would be a great addition to the ACA birth control benefit, but it can’t replace it. https:// rewire.news/article/2016/1 2/09/no-sean-hannity-uteruses-may-not-fine-trump/ …"				"810976589836128256"	https://twitter.com/lornaphillipson/status/810976589836128256
	2016-12-19 22:34	0	0	"#ElectoralCollege After all Obama did 4 auto industry & Obamacare how MI Electors can applaud themselves for #trump votes dont get it"			#ElectoralCollege #trump	"810976564158533632"	https://twitter.com/8thGradeWasBest/status/810976564158533632
	2016-12-19 22:34	1	1	"Beyond Obamacare : What the ACA has meant for Michigan http://www. freep.com/story/opinion/ contributors/2016/12/17/end-obamacare/95527664/ … Gr8 piece by Marianne Udow_Phillips at @CHRTumich"		@CHRTumich		"810976540334952448"	https://twitter.com/Altarum_CSHS/status/810976540334952448
	2016-12-19 22:34	0	0	"#CrookedTrump blames ObamaCare for high healthcare Costs instead of the Greedy Health Insurance Companies who gouge ALL Americans."			#CrookedTrump	"810976539332358145"	https://twitter.com/Bfragrancefree/status/810976539332358145
	2016-12-19 22:34	0	0	"I can't wait for his welfare, non educated supporters to lose everything. Tell granny bye bye after aca is repealed."				"810976506658910208"	https://twitter.com/ericlamens19801/status/810976506658910208
	2016-12-19 22:34	0	0	"#GOP eager to gut #HealthInsurance for millions of Americans, but they still don't have a Step 2. http://www. philly.com/philly/news/20 161219_GOP_eager_to_roll_back_health_law__Then_comes_hard_part_.html … #ACA"			#GOP #HealthInsurance #ACA	"810976506373619713"	https://twitter.com/MHerz67/status/810976506373619713
	2016-12-19 22:33	0	2	"I want to see her brain explode when she realizes that is Obamacare"				"810976430213525504"	https://twitter.com/ladyleeah/status/810976430213525504
	2016-12-19 22:33	3	1	"On Tues 12/20, rallies across the US https:// twitter.com/DoloresHuerta/ status/809850827300945920 … will say, #Resist repeal of ACA -- #ProtectOurCare ."			#Resist #ProtectOurCare	"810976361456275456"	https://twitter.com/UHCANnatl/status/810976361456275456
	2016-12-19 22:33	0	0	"That is one of the reason ACA will not be immediately repealed as long promised. Just watch and see."				"810976335942352896"	https://twitter.com/MedicareMonday/status/810976335942352896
	2016-12-19 22:33	0	0	"God help us all "GOP lawmaker’s Obamacare alternative: Make kids sleep on broken arms to avoid costly ER visits" http://www. rawstory.com/2016/12/gop-la wmakers-obamacare-alternative-make-kids-sleep-on-broken-arms-to-avoid-costly-er-visits/ …"				"810976259694067714"	https://twitter.com/JeffreyGSmith/status/810976259694067714
	2016-12-19 22:32	3	3	"On Tues 12/20, rallies across the US will say, #Resist repeal of ACA : https:// twitter.com/Shcherbenko/st atus/809748602872623104 … #ProtectOurCare ."			#Resist #ProtectOurCare	"810976186197278720"	https://twitter.com/UHCANnatl/status/810976186197278720
	2016-12-19 22:32	2	4	"Tarjetita de Salud: PR used $1.7B of ACA /CHIP Funds in FY16 (+114 million from previous year)...money runs out in Dec 2017 pic.twitter.com/UKUAfDFNL4"				"810976175535325184"	https://twitter.com/DDRioo/status/810976175535325184
	2016-12-19 22:32	0	0	"Medicare will be solvent longer because of ACA . ACA improved Medicare's financial position."				"810976151799730176"	https://twitter.com/MedicareMonday/status/810976151799730176
	2016-12-19 22:32	1	2	"Sign the petition to urge Congress and President-elect Trump to repeal #Obamacare in the first 100 days http:// bit.ly/2gWwL1Q"			#Obamacare	"810976003271041025"	https://twitter.com/taxreformer/status/810976003271041025
	2016-12-19 22:31	0	1	"It's not the right to your money, Obamacare and $500m/year to Planned Parenthood took care of that. @Thelrik"		@Thelrik		"810975997659086848"	https://twitter.com/waelse1/status/810975997659086848
	2016-12-19 22:31	0	0	"@oreillyfactor I went to the doctor today. A very successful practice. He's closing in two weeks because of Obamacare . Another perspective"		@oreillyfactor		"810975906403676161"	https://twitter.com/Eiblack34/status/810975906403676161
	2016-12-19 22:31	0	0	"I like it. My premium are half of what they were before ACA . Plus I get to cover my son til he is 26."				"810975897104842752"	https://twitter.com/MedicareMonday/status/810975897104842752
	2016-12-19 22:31	2	1	"GOP chairmen question ObamaCare 's Medicaid spending http:// thehill.com/policy/healthc are/311100-gop-chairmen-question-obamacares-medicaid-spending#.WFhfwwzi5-w.twitter …"			#	"810975889924165633"	https://twitter.com/mch7576/status/810975889924165633
	2016-12-19 22:31	0	0	"Trump's conservative pick for budget director will help guide ACA repeal http:// ow.ly/zn62507Jdbh"				"810975885465624576"	https://twitter.com/MRIGlobalHCF/status/810975885465624576
	2016-12-19 22:31	4	3	"State-by-state look at impressive gains in health insurance coverage under the ACA , that the GOP wants to get rid of http://www. cbpp.org/blog/interacti ve-learn-how-health-reform-repeal-would-undo-coverage-gains …"				"810975881254543360"	https://twitter.com/Rob_Coh/status/810975881254543360
	2016-12-19 22:30	0	0	"- the writer of ACA stated this. Then the "gov" libs/repubs could have full health care control. i.e. 1 more piece to ......."				"810975658197348357"	https://twitter.com/Hardin_USAF/status/810975658197348357
	2016-12-19 22:30	0	0	"@RepHuizenga GOP lawmaker’s Obamacare alternative: Make kids sleep on broken arms to avoid costly ER visits http://www. rawstory.com/2016/12/gop-la wmakers-obamacare-alternative-make-kids-sleep-on-broken-arms-to-avoid-costly-er-visits/#.WFhfexTYxKw.twitter …"		@RepHuizenga	#	"810975625959866372"	https://twitter.com/stpatty3172000/status/810975625959866372
	2016-12-19 22:30	0	0	"5 things for #pharma #marketers to know: Mon,Dec 19 #FDA $ PFE #drugprices $ AZN #oncology #digitalhealth #Obama #ACA http:// bit.ly/2hLTQSE pic.twitter.com/YHZVa15t4v"			#pharma #marketers #FDA #drugprices #oncology #digitalhealth #Obama #ACA	"810975505646317569"	https://twitter.com/MMMnews/status/810975505646317569
	2016-12-19 22:30	15	8	"Some 24 million people in working families would lose their health insurance from a partial repeal of Obamacare . http://www. urban.org/research/publi cation/implications-partial-repeal-aca-through-reconciliation …"				"810975503150481409"	https://twitter.com/TalkPoverty/status/810975503150481409
	2016-12-19 22:29	0	0	"The people most likely to lose in Obamacare repeal live in Trump country http://www. dailykos.com/story/2016/12/ 19/1612698/-The-people-most-likely-to-lose-in-Obamacare-repeal-live-in-Trump-country …"				"810975489103785985"	https://twitter.com/bobbygoode/status/810975489103785985
	2016-12-19 22:29	1	1	"UPDATE: Adjusted ACA Fees for 2017 http:// buff.ly/2i726LW #ACA #compliance pic.twitter.com/W6ATEYurON"			#ACA #compliance	"810975484272066560"	https://twitter.com/FBSbenefits/status/810975484272066560
	2016-12-19 22:29	0	2	"#WhiteHouse economists detail 'historic progress' under #ACA : http://www. fiercehealthcare.com/payer/white-ho use-economists-report-touts-historic-progress-tied-to-aca … via @FierceHealth"		@FierceHealth	#WhiteHouse #ACA	"810975388528582656"	https://twitter.com/symedcorp/status/810975388528582656
	2016-12-19 22:29	0	0	"DallasBizNews: Dallas investors trade substance abuse clinic amid Obamacare uncertainty: http:// bizj.us/1ozlzo"				"810975353707622400"	https://twitter.com/AlexCena_TX/status/810975353707622400
	2016-12-19 22:29	0	0	"ACA made my insurance so expensive/deductible so great I have choose between healthcare and insurance."				"810975328843730944"	https://twitter.com/Annabel_Hunt/status/810975328843730944
	2016-12-19 22:28	0	0	"time to import medicines, doxycycline generic cost outrageous, it's a robbery. Yes, we need ACA Law, 40 million insured now."				"810975209641639936"	https://twitter.com/EagleseeC/status/810975209641639936
	2016-12-19 22:28	0	0	"since the only goal of Rs was repeal ACA & coal is being beat by market forces, you can understand the confusion."				"810975181304922114"	https://twitter.com/anthrodiva/status/810975181304922114
	2016-12-19 22:28	0	0	"- agreed. Why didn't Obamacare pickup the 40mill w/o private care, why reinvent the wheel. ACA will be unsustainable in 2018."				"810975171171545088"	https://twitter.com/Hardin_USAF/status/810975171171545088
	2016-12-19 22:28	0	0	"If you have employer-provided health insurance, an Obamacare repeal would affect you too http:// fw.to/QsacNhR"				"810975091399933953"	https://twitter.com/clos16751/status/810975091399933953
	2016-12-19 22:28	2	0	"This isn't the least bit surprising, sadly | Millionaires Big Winners From Repealing the ACA , New Data Show http:// ow.ly/OUOx307ho9a"				"810975086282964992"	https://twitter.com/SRBWI/status/810975086282964992
	2016-12-19 22:28	0	3	"Obamacare caused generic drug prices to skyrocket. https:// twitter.com/BernieSanders/ status/810972985599393792 …"				"810974997053403136"	https://twitter.com/TheAmishDude/status/810974997053403136
	2016-12-19 22:26	2	2	"Opiate addiction, stupid and Fox News is a deadly combination. ACA can't even help that."				"810974724125786112"	https://twitter.com/LiberalUSA1/status/810974724125786112
	2016-12-19 22:26	11	2	"Trump counties would see big impact from Obamacare repeal http:// on.wsj.com/2hN1coM"				"810974697013837824"	https://twitter.com/WSJPolitics/status/810974697013837824
	2016-12-19 22:26	0	0	"Benghazi, billions to a terrorist nation, socialist Obamacare , Isis JV team. Hmm is that what u call intelligent?"				"810974659214802945"	https://twitter.com/Blockaderunner5/status/810974659214802945
	2016-12-19 22:26	0	0	"Bill Clinton Thinks Obamacare is the Craziest Thing in the World https:// youtu.be/-YIIqWzfei4 via @YouTube"		@YouTube		"810974651472023552"	https://twitter.com/JDowFamily/status/810974651472023552
	2016-12-19 22:26	1	6	": Maybe the GOP will replace the ACA w/something that'll pay for a hole in the ground for me after I get cancer."				"810974598325882880"	https://twitter.com/mikesterling/status/810974598325882880
	2016-12-19 22:26	0	0	"If you have employer-provided health insurance, an Obamacare repeal would affect you too - LA Times http://www. latimes.com/business/la-fi -obamacare-employer-insurance-20161219-story.html …"				"810974507250765824"	https://twitter.com/CrisNapolitano/status/810974507250765824
	2016-12-19 22:26	0	0	"Dallas investors trade substance abuse clinic amid Obamacare uncertainty: http:// bizj.us/1ozlzo"				"810974494043099136"	https://twitter.com/DallasBizNews/status/810974494043099136
	2016-12-19 22:25	5	3	"Apparently, because of the ACA my family has not taken enough responsibility for my son's incurable disease. SIGH. http:// s.mlive.com/mHOaZqO"				"810974477752287233"	https://twitter.com/chasingray/status/810974477752287233
	2016-12-19 22:25	0	0	"Rally in support of #ACA in #ColoradoSprings tomorrow, Dec 20th. http:// cohealth.co/2gVhbzr #ProtectOurCare"			#ACA #ColoradoSprings #ProtectOurCare	"810974477265866752"	https://twitter.com/COHealthAccess/status/810974477265866752
	2016-12-19 22:25	0	1	"Were it not for the impending repeal of Obamacare , I could consider it. Too young 4 Medicare; 2 old 4 affordable HC in old system https:// twitter.com/madtruthbomber /status/809952438987784192 …"				"810974325943713793"	https://twitter.com/Alzcookin/status/810974325943713793
	2016-12-19 22:25	0	0	"Obama's had no idea about who he really was. From the get go he operated like Republicans had elected him, save for Obamacare . https:// twitter.com/BreitbartNews/ status/810871288139022336 …"				"810974316628156416"	https://twitter.com/bilding1/status/810974316628156416
	2016-12-19 22:24	0	0	"Trump counties would see big impact from Obamacare repeal http:// blogs.wsj.com/washwire/2016/ 12/19/trump-counties-would-see-big-impact-from-obamacare-repeal/ … via @WSJPolitics"		@WSJPolitics		"810974236596576260"	https://twitter.com/latinosready/status/810974236596576260
	2016-12-19 22:24	0	0	"Today Monday, 12/19 is the Obamacare Health Insurance Deadline that has been extended and this will allow... http:// fb.me/6j7no2tE4"				"810974216476573696"	https://twitter.com/CatalystForFun/status/810974216476573696
	2016-12-19 22:24	0	0	"@RepDaveBrat Repeal Obamacare and be prepared for the deaths of approximately 27,000 Americans on your hands. https:// thinkprogress.org/heres-how-many -people-could-die-every-year-if-obamacare-is-repealed-ae4bf3e100a2#.734356oqh …"		@RepDaveBrat	#	"810974202757058561"	https://twitter.com/AlysseDL/status/810974202757058561
	2016-12-19 22:24	2	5	"GOP Congressman channels @ChrisRock re. #ACA repeal: “ROBITUSSIN!!” http://www. dailykos.com/stories/2016/1 2/19/1612758/--ROBITUSSIN …"		@ChrisRock	#ACA	"810974171656286208"	https://twitter.com/charles_gaba/status/810974171656286208
	2016-12-19 22:24	0	0	"They got close with Obamacare and they did briefly outlaw assault rifles, but in the whole you aren't wrong."				"810974156233773057"	https://twitter.com/unStunned/status/810974156233773057
	2016-12-19 22:24	0	0	"Trump counties would see big impact from Obamacare repeal http:// blogs.wsj.com/washwire/2016/ 12/19/trump-counties-would-see-big-impact-from-obamacare-repeal/ … via @WSJPolitics"		@WSJPolitics		"810974058233741316"	https://twitter.com/AlexGonzTXCA/status/810974058233741316
	2016-12-19 22:24	69	156	"Hey, Barack, take ur unite the nation, global tranquility, Obamacare is working & Russian hack narratives and shove them up your ass. #MAGA"			#MAGA	"810974025782415360"	https://twitter.com/CarmineZozzora/status/810974025782415360
	2016-12-19 22:24	28	57	"To @NPRInskeep , @POTUS talks about leaving an open door to the @GOP to collaborate on Obamacare : https:// n.pr/2gJybsi pic.twitter.com/1H05rupeDQ"		@NPRInskeep @POTUS @GOP		"810973989975658496"	https://twitter.com/nprpolitics/status/810973989975658496
	2016-12-19 22:23	0	2	"They will soon, esp if ACA causes healthcare loss. We need to be ready to engage them."				"810973936204836869"	https://twitter.com/OverUnderClover/status/810973936204836869
	2016-12-19 22:23	0	1	"Experts suggest it's still a good idea. #Obamacare #Health http://www. huffingtonpost.com/entry/you-can- still-sign-up-for-health-insurance-today_us_58581974e4b0b3ddfd8db5dd …"			#Obamacare #Health	"810973926092394497"	https://twitter.com/CaroleMyers/status/810973926092394497
	2016-12-19 22:23	0	0	"And yet GOP still insists that ACA is responsible for higher out of pocket costs. @ericgarland @Chris_arnade"		@ericgarland @Chris_arnade		"810973881968128000"	https://twitter.com/NamirYedid/status/810973881968128000
	2016-12-19 22:23	0	0	"Trump's conservative pick for budget director will help guide ACA repeal http:// ln.is/modernhealthca re.com/5s5ku … via @modrnhealthcr"		@modrnhealthcr		"810973840679518208"	https://twitter.com/MikeGordonRyan/status/810973840679518208
	2016-12-19 22:23	0	0	"God I wish that worked. I can point to econ analysis that premiums would be higher w/out ACA . @ericgarland @Chris_arnade"		@ericgarland @Chris_arnade		"810973819657539584"	https://twitter.com/NamirYedid/status/810973819657539584
	2016-12-19 22:23	0	0	"do you even know how much an 'average' family of 5 earning 60k pays for the ACA ? $850/Mo! With taxpayer subsidies! #Obamacare #bs"			#Obamacare #bs	"810973807905153026"	https://twitter.com/intheMinorityOR/status/810973807905153026
	2016-12-19 22:23	0	0	"GOP lawmaker’s Obamacare alternative: Make kids sleep on broken arms to avoid costly ER visits http://www. rawstory.com/2016/12/gop-la wmakers-obamacare-alternative-make-kids-sleep-on-broken-arms-to-avoid-costly-er-visits/#.WFhdyPaNT3g.twitter …"			#	"810973763189649408"	https://twitter.com/Vyan1/status/810973763189649408
