username;date;retweets;favorites;text;geo;mentions;hashtags;id;permalink
	2016-12-19 23:59	1	1	"@GeorgeWill You asked @foxnews panel #Obamamemorablequotes . Only 1 comes 2 mind. "You will get to keep your doctor & insurance w/ Obamacare ""		@GeorgeWill @foxnews	#Obamamemorablequotes	"810998050118397952"	https://twitter.com/sbeckwilliams/status/810998050118397952
	2016-12-19 23:59	0	0	"RT: How a repeal of Obamacare could affect you even if you have employer health insurance http:// hrld.us/2h3ZEIA http:// ift.tt/2h3WWTa"				"810997982707519489"	https://twitter.com/TAKEBACKOCH/status/810997982707519489
	2016-12-19 23:59	0	0	"Republicans Promise "Universal Access" Will Replace Obamacare ."				"810997980291547137"	https://twitter.com/Bryan700/status/810997980291547137
	2016-12-19 23:58	6	5	"I hope to God, #Americans will #Never again #Vote for another #Potus such as the #ObamaLegacy #Obamacare = #Hoax #MAGA"			#Americans #Never #Vote #Potus #ObamaLegacy #Obamacare #Hoax #MAGA	"810997875740053504"	https://twitter.com/Filterlbc/status/810997875740053504
	2016-12-19 23:58	0	0	"this woman needs help! Help she can get after Trump repeals Obamacare !"				"810997856899334144"	https://twitter.com/DoustouDennis/status/810997856899334144
	2016-12-19 23:58	0	1	"If you have employer-provided health insurance, an Obamacare repeal would affect you too - Los Angeles Times https:// apple.news/AjUrKMzCnQHis6 H4IfW_u4Q …"				"810997849894907904"	https://twitter.com/drfourny/status/810997849894907904
	2016-12-19 23:58	0	0	"The First Victims of Repealing Obamacare Will Be the Sick and the Poor - The New Yorker https:// lnkd.in/ggXaAXi"				"810997780000870400"	https://twitter.com/delinjerosin/status/810997780000870400
	2016-12-19 23:58	2	3	"OBAMACARE https:// youtu.be/uF9p2B7ES5A OBAMACARESUCKS U'LL B HEARINGFROMUS WERTHEPEOPLEFROMTHEUSA"				"810997760807800832"	https://twitter.com/Counselor70/status/810997760807800832
	2016-12-19 23:58	0	1	"I know for real she's a nurse too she knows how the ACA has helped people the gun love is some serious shit"				"810997673272770560"	https://twitter.com/RS_Benedict/status/810997673272770560
	2016-12-19 23:58	0	0	"They don't need reform. Repealing and replacing Obamacare will drop welfare applications."				"810997661075652609"	https://twitter.com/electro_chino/status/810997661075652609
	2016-12-19 23:57	0	0	"The harm is ObamaCare !! Its being repealed for a market solution that will cost else & provide better insurance"				"810997608135045120"	https://twitter.com/airforce2100/status/810997608135045120
	2016-12-19 23:57	0	0	"Did Obamacare Really Insure 20 Million? http:// dailysign.al/2gge6y7 via @AlyeneSenger @DailySignal"		@AlyeneSenger @DailySignal		"810997575427862528"	https://twitter.com/scottp9563/status/810997575427862528
	2016-12-19 23:57	0	0	"-use a communication format more suited for nuance. Much has been writ re: Romney/ Obamacare differences, for example. But eh."				"810997555471482880"	https://twitter.com/JohnDCP/status/810997555471482880
	2016-12-19 23:57	3	5	"I went to RiverStone Health today to discuss #WhatsAtRisk for Community Health Centers if we repeal the ACA . #mtpol https:// sen.gov/MZV3 pic.twitter.com/QlhBwuWDjs"			#WhatsAtRisk #mtpol	"810997495539101697"	https://twitter.com/SenatorTester/status/810997495539101697
	2016-12-19 23:57	0	0	"And for shutting down the government and for attacking Obamacare and for... https:// twitter.com/SteveSGoddard/ status/810995321501270016 …"				"810997495287390208"	https://twitter.com/PatriotTrumpet/status/810997495287390208
	2016-12-19 23:57	0	1	"Important take here from @DrewAltman http:// ow.ly/fbx3307hvLO on #ACA"		@DrewAltman	#ACA	"810997475905519616"	https://twitter.com/bfrist/status/810997475905519616
	2016-12-19 23:56	2	0	"ANOTHER OBAMACARE Co-Op EXITS Exchanges Leaving Only 5 Co-Ops in 2017➜TRUMP MUST DELETE OBAMACARE IMMEDIATELY http:// bit.ly/2i2XTgx"				"810997356300615680"	https://twitter.com/undergroundexp/status/810997356300615680
	2016-12-19 23:56	0	0	"I can George, " The ACA IS working!"."				"810997285983256576"	https://twitter.com/danmcmahonpgh/status/810997285983256576
	2016-12-19 23:56	22	19	""Trump Counties Would See Big Impact From Obamacare Repeal" - http:// blogs.wsj.com/washwire/2016/ 12/19/trump-counties-would-see-big-impact-from-obamacare-repeal/ …"				"810997262600077312"	https://twitter.com/CraigRozniecki/status/810997262600077312
	2016-12-19 23:56	2	1	"Trained my students forever in Photoshop they sat for their Adobe Cert Exam today. I had to make sure I got my ACA too! @PGCareerAcademy pic.twitter.com/FqYrfSKYD2"		@PGCareerAcademy		"810997152033992704"	https://twitter.com/TheREALFotoBoss/status/810997152033992704
	2016-12-19 23:55	0	0	"But isn't today's immigration different than 1850 growth b/c of welfare, Medicaid, food stamps, HUD housing, Obamacare etc? Yes"				"810997126746533888"	https://twitter.com/TradTX/status/810997126746533888
	2016-12-19 23:55	0	3	"Obamacare , Iran Deal, Cuba Deal, increasing the cap for overtime pay. That's just off the top"				"810996924081983492"	https://twitter.com/Desolate_Dude/status/810996924081983492
	2016-12-19 23:54	1	1	"Sadly it is going before same Congress that gave Obama a 100% pass on overuse of exec orders, Obamacare , mega vacations, & everything else. https:// twitter.com/POTUSTRUMP6/st atus/810983448898740224 …"				"810996885867479040"	https://twitter.com/RetakingUS/status/810996885867479040
	2016-12-19 23:54	5	3	"Women have everything to lose when the GOP kills Obamacare http://www. huffingtonpost.com/entry/women-ha ve-everything-to-lose-when-the-gop-kills-the_us_58542900e4b0630a25423235?ncid=engmodushpmg00000004 … via @HuffPostPol"		@HuffPostPol		"810996865583853568"	https://twitter.com/dunnclan/status/810996865583853568
	2016-12-19 23:54	0	0	"Only know to kill Obamacare and presidential executive orders."				"810996819459276800"	https://twitter.com/WggjJay/status/810996819459276800
	2016-12-19 23:54	0	0	"can you refollow me again?"				"810996814354796544"	https://twitter.com/bradleyfrenette/status/810996814354796544
	2016-12-19 23:54	0	0	"RT: How a repeal of Obamacare could affect you even if you have employer health insurance http:// hrld.us/2h3ZEIA pic.twitter.com/nR7TpW4gnB …"				"810996798907105280"	https://twitter.com/TAKEBACKOCH/status/810996798907105280
	2016-12-19 23:54	0	0	"GOP lawmaker’s Obamacare alternative: Make kids sleep on broken arms to avoid costly ER visits http://www. rawstory.com/2016/12/gop-la wmakers-obamacare-alternative-make-kids-sleep-on-broken-arms-to-avoid-costly-er-visits/#.WFhzKTC43KM.twitter …"			#	"810996730552524800"	https://twitter.com/lacadri34/status/810996730552524800
	2016-12-19 23:54	0	0	"Hey @realDonaldTrump , replace Obamacare with single payer healthcare and you will do one thing better than him. Good way to start office!"		@realDonaldTrump		"810996707131555841"	https://twitter.com/PBZtheSeries/status/810996707131555841
	2016-12-19 23:54	0	1	"This is true American have lost on #Education #Free College Raising the #minimumwage #ClimateChange #Obamacare : #Health #ElectoralCollege https:// twitter.com/imfabulous13/s tatus/810931537369853953 …"			#Education #Free #minimumwage #ClimateChange #Obamacare #Health #ElectoralCollege	"810996684935217152"	https://twitter.com/Yolibeans/status/810996684935217152
	2016-12-19 23:53	0	1	"Worth noting: Coalition to protest McCarthy's stance on ACA http://www. bakersfield.com/news/worth-not ing-coalition-to-protest-mccarthy-s-stance-on-aca/article_c1ae8e29-cb86-5fd3-875d-d84f4acd5c3e.html?utm_medium=social&utm_source=twitter&utm_campaign=user-share … via @Bakersfieldcali"		@Bakersfieldcali		"810996570900434944"	https://twitter.com/Bakersfieldcali/status/810996570900434944
	2016-12-19 23:53	0	0	"2017 prediction: population control. Opioid and alcohol rates will skyrocket to cope with trump. Republicans blame Obamacare #unpresidented"			#unpresidented	"810996534099595264"	https://twitter.com/vodblu/status/810996534099595264
	2016-12-19 23:53	0	0	"..in any event ACA was bad law by dems &some RINOs; and, ins Monopolies stock went to 3X & 4X @CoolCzech1 @WayneRoot @politico"		@CoolCzech1 @WayneRoot @politico		"810996513073721344"	https://twitter.com/DToddH/status/810996513073721344
	2016-12-19 23:53	0	0	"Are Libs crazy? No-one cares about an #ObamaCare sign-up deadline. That #ACA Failure being repealed!! Didn't want THEN - Don't want NOW."			#ObamaCare #ACA	"810996481847164928"	https://twitter.com/easydoesitdav/status/810996481847164928
	2016-12-19 23:53	0	0	"GOP lawmaker’s Obamacare alternative: Make kids sleep on broken arms to avoid costly ER visits http://www. rawstory.com/2016/12/gop-la wmakers-obamacare-alternative-make-kids-sleep-on-broken-arms-to-avoid-costly-er-visits/#.WFhy47BWHPQ.twitter …"			#	"810996435164471297"	https://twitter.com/DerchinOlson/status/810996435164471297
	2016-12-19 23:52	0	0	"The only thing I can hope for at this point is the slow US court processes to keep from overturning #RoevWade #LGBTQ #ACA"			#RoevWade #LGBTQ #ACA	"810996361629839360"	https://twitter.com/persistenthuman/status/810996361629839360
	2016-12-19 23:52	0	0	"ACA - I see it daily = failure 2x national debt 92,898,000 Americans jobless Syria/ISIS/ISIL/Terrorist Atks rise Iran deal"				"810996347516190720"	https://twitter.com/SkipHadaway/status/810996347516190720
	2016-12-19 23:52	0	1	"Or why blacks was given freedom or Obamacare was made AFFORDABLE for Americans before republicans messed it up"				"810996263277723649"	https://twitter.com/BarcadiB/status/810996263277723649
	2016-12-19 23:52	0	0	"BSer Harry Reid: ‘People Are Going to Die’ If GOP Repeals Obamacare http://www. infowars.com/harry-reid-peo ple-are-going-to-die-if-gop-repeals-obamacare/ … via @realalexjones"		@realalexjones		"810996196479291392"	https://twitter.com/Jo3Gr33n/status/810996196479291392
	2016-12-19 23:52	0	0	"GOP lawmaker’s Obamacare alternative: Make kids sleep on broken arms to avoid costly ER visits http://www. rawstory.com/2016/12/gop-la wmakers-obamacare-alternative-make-kids-sleep-on-broken-arms-to-avoid-costly-er-visits/#.WFhyjdmHyTU.twitter …"			#	"810996143916273664"	https://twitter.com/lacadri34/status/810996143916273664
	2016-12-19 23:51	0	0	"Trump Counties Would See Big Impact From Obamacare Repeal http:// politicsinformer.com/530802/trump-c ounties-would-see-big-impact-from-obamacare-repeal/ … pic.twitter.com/VHunkwgJPJ"				"810996128602800128"	https://twitter.com/Politics_Info/status/810996128602800128
	2016-12-19 23:51	0	0	"that's better than nothing at least. Call the obamacare hotline right now, the deadline is extended until tonight at 11:59"				"810996028602204160"	https://twitter.com/lyricallynick/status/810996028602204160
	2016-12-19 23:51	0	0	"SHOCKING! Millions Already RFID Chipped Under OBAMACARE Without Consent! https://www. youtube.com/watch?v=5IW6T5 6Rua4&feature=share …"				"810995993433047040"	https://twitter.com/NiceGuy504/status/810995993433047040
	2016-12-19 23:51	0	1	"keep up the great tweets - so important that we share the human story behind the aca"				"810995989259710464"	https://twitter.com/NicoleGergen/status/810995989259710464
	2016-12-19 23:50	0	0	"Dem Governors Make 11th-Hour Plea To Save Obamacare http://www. huffingtonpost.com/entry/democrat s-obamacare-repeal_us_58582dfce4b08debb78a4f40 …"				"810995806849343488"	https://twitter.com/Peggyt/status/810995806849343488
	2016-12-19 23:50	0	1	"Obamacare : What patients need to know about "repeal and replace" https:// patientsrising.org/daily-rise/oba macare-what-patients-need-know-about-repeal-and-replace … #patients #ACA"			#patients #ACA	"810995805746143232"	https://twitter.com/Terrilox/status/810995805746143232
	2016-12-19 23:50	2	2	"The people most likely to lose in #Obamacare repeal live in PIECE OF SHIT #REPUBLICAN #Trump country ROGLOL http://www. dailykos.com/story/2016/12/ 19/1612698/-The-people-most-likely-to-lose-in-Obamacare-repeal-live-in-Trump-country … …"			#Obamacare #REPUBLICAN #Trump	"810995767741652992"	https://twitter.com/crazylary51/status/810995767741652992
	2016-12-19 23:50	0	0	"#UpsideOf2016 No #NuclearWar . No more #ObamaLegacy or #Obamacare (as of 1/20/17). No more (successful) #msm lies. #Trump #Electors #MAGA"			#UpsideOf2016 #NuclearWar #ObamaLegacy #Obamacare #msm #Trump #Electors #MAGA	"810995690411151360"	https://twitter.com/1776_2017/status/810995690411151360
	2016-12-19 23:50	0	0	"Really? When you poll " Obamacare " is does poorly. When you poll the actual Ocare policies, they do great."				"810995674749673472"	https://twitter.com/PseudonymousRex/status/810995674749673472
	2016-12-19 23:50	7	4	"How a repeal of Obamacare could affect you even if you have employer health insurance http:// hrld.us/2h3ZEIA pic.twitter.com/PnC5MG1h3V"				"810995634723504130"	https://twitter.com/MiamiHerald/status/810995634723504130
	2016-12-19 23:49	1	0	"The people most likely to lose in #Obamacare repeal live in PIECEOF SHIT #REPUBLICAN #Trump country ROGLOL http://www. dailykos.com/story/2016/12/ 19/1612698/-The-people-most-likely-to-lose-in-Obamacare-repeal-live-in-Trump-country …"			#Obamacare #REPUBLICAN #Trump	"810995625466667009"	https://twitter.com/crazylary51/status/810995625466667009
	2016-12-19 23:49	0	0	"OMG lovely friend, your idea is much-needed"				"810995482575208448"	https://twitter.com/aca_affirmation/status/810995482575208448
	2016-12-19 23:49	0	0	"('16 plan cancelled, bcbsnc created new '17 #BCBSNC plan not avail on #Obamacare …OCare called daily, I didn't know not to go there)"			#BCBSNC #Obamacare	"810995467010146305"	https://twitter.com/wxmel/status/810995467010146305
	2016-12-19 23:48	7	5	"#Obamacare is illegal if only just 4 it's socialist part that it is enforced @gunpoint,it is not freedom of any kind @reason @nickgillespie pic.twitter.com/i73SjihqDi"		@gunpoint @reason @nickgillespie	#Obamacare	"810995376257925120"	https://twitter.com/wjappe/status/810995376257925120
	2016-12-19 23:48	0	0	"The people most likely to lose in Obamacare repeal live in Trump country http://www. dailykos.com/story/2016/12/ 19/1612698/-The-people-most-likely-to-lose-in-Obamacare-repeal-live-in-Trump-country …"				"810995318963585024"	https://twitter.com/Dorofcalif/status/810995318963585024
	2016-12-19 23:48	1	0	"GOP lawmaker’s Obamacare alternative: Make kids sleep on broken arms to avoid costly ER visits http://www. rawstory.com/2016/12/gop-la wmakers-obamacare-alternative-make-kids-sleep-on-broken-arms-to-avoid-costly-er-visits/ …"				"810995236755210240"	https://twitter.com/dunnclan/status/810995236755210240
	2016-12-19 23:48	0	0	"Ha! Now, here's something I never expected... along w/ the sun coming up and Obamacare premiums doubling. #Really #CheckListForHillary https:// twitter.com/ShannonBream/s tatus/810937855153422340 …"			#Really #CheckListForHillary	"810995199493230592"	https://twitter.com/Melny/status/810995199493230592
	2016-12-19 23:47	0	0	"Health Insurance Obama administration adjusts ACA exchange program for 2018 http:// ift.tt/2i8vTUv"				"810995022313168896"	https://twitter.com/zinzin8x/status/810995022313168896
	2016-12-19 23:47	0	0	"Are Republicans Setting a Trap for Themselves on Obamacare 'Repeal'? http:// fb.me/1FADArhdg"				"810995019125522432"	https://twitter.com/The_Gnu_JGH/status/810995019125522432
	2016-12-19 23:47	3	2	"A great day indeed! Next: Thank God Take care of our #vets Protect our borders Replace #Obamacare Course correct #SCOTUS Crush #ISIS"			#vets #Obamacare #SCOTUS #ISIS	"810995019108810752"	https://twitter.com/oracle_ed/status/810995019108810752
	2016-12-19 23:47	0	0	"Your awesome"				"810995014276784128"	https://twitter.com/rosa_aca/status/810995014276784128
	2016-12-19 23:47	0	1	"" Obamacare isn't perfect, but definitely a success" SP: You only live once, so why not YOLO, that's the motto... " #SarahPalinMusicTweets"			#SarahPalinMusicTweets	"810994946048040960"	https://twitter.com/ThatDudeTre/status/810994946048040960
	2016-12-19 23:47	0	0	"Hillary was going to raise our taxes, where you complaining then?? I don't count on SS, and goodbye Obamacare"				"810994912548311045"	https://twitter.com/PaulineCMiranda/status/810994912548311045
	2016-12-19 23:46	0	0	"Obamacare was Romneycare. His signature legislation was concocted by the Heritage Foundation. What more do you want?"				"810994750673342464"	https://twitter.com/ABCBTom/status/810994750673342464
	2016-12-19 23:46	0	0	"Pushing Obamacare repeal, ready or not http:// bit.ly/2h42ptt #USnews pic.twitter.com/iY1ioSyBYk"			#USnews	"810994745547726848"	https://twitter.com/TopStories24x7/status/810994745547726848
	2016-12-19 23:46	1	2	"Obamacare is the same as forcing you to buy Lamborghini insurance when you only need Chevy truck insurance!"				"810994728946827264"	https://twitter.com/gperky1/status/810994728946827264
	2016-12-19 23:46	1	1	"Obama was worried about ACA ,turning country over 2 Russia another thing dems didn't see!"				"810994691428806657"	https://twitter.com/TCastilonia/status/810994691428806657
	2016-12-19 23:46	3	3	"Why does the #ACA matter for women? Let’s talk on December 20 at 1 p.m. ET. #GetCovered #ACAWorks4Women pic.twitter.com/9IncEfMGjr"			#ACA #GetCovered #ACAWorks4Women	"810994650433654784"	https://twitter.com/blkwomenshealth/status/810994650433654784
	2016-12-19 23:45	0	0	"Talk all you want. You have never read the ACA , nor do you understand it. And if you think you pay for me, CLUELESS."				"810994597300150272"	https://twitter.com/MatMatsunaga/status/810994597300150272
	2016-12-19 23:45	1	0	"ACA webinar, this Thurs. at 2p ET: Find out what the healthcare law means for your #SmallBiz & how to navigate http:// ow.ly/3zVT305Pfsm pic.twitter.com/POOwgddgsV"			#SmallBiz	"810994464059695104"	https://twitter.com/SBAgreatlakes/status/810994464059695104
	2016-12-19 23:45	1	0	"The @GOP will dismantle Medicare, Social Security & ACA , then kick @realDonaldTrump to the curb when he gets out of line. #YouGotConned"		@GOP @realDonaldTrump	#YouGotConned	"810994451485224960"	https://twitter.com/rvaughanw/status/810994451485224960
	2016-12-19 23:45	0	0	"Your complaining about a conservative healthcare plan. I'm not for obamacare lol."				"810994427938373632"	https://twitter.com/GreenLigase/status/810994427938373632
	2016-12-19 23:45	0	0	"If you have employer health insurance, an Obamacare repeal will affect you too http:// fw.to/ij5HYGj"				"810994370996355072"	https://twitter.com/TheRealMsMurphy/status/810994370996355072
	2016-12-19 23:44	0	0	". You must have great medical from work or you're getting the free end of Obamacare ."				"810994330567589888"	https://twitter.com/millie_eestep/status/810994330567589888
	2016-12-19 23:44	0	0	"@lolosallu4ever@DumpADemMAGA@lingling23I'm happy that they're taking Obamacare away as it's premiums are going up as much as car or mortgage"		@lolosallu4ever @DumpADemMAGA @lingling23I		"810994162640121856"	https://twitter.com/EzekielScott6/status/810994162640121856
	2016-12-19 23:44	0	0	"@j_smithcameron @justinhendrix @chrislhayes So, when they repeal Obamacare & these folks realize that means them too."		@j_smithcameron @justinhendrix @chrislhayes		"810994137507905536"	https://twitter.com/sericite/status/810994137507905536
	2016-12-19 23:44	1	0	"for last 10 years I've paid cash for all my medical care and medicine. And Obamacare taxes !"				"810994125713657861"	https://twitter.com/JTS_1957/status/810994125713657861
	2016-12-19 23:43	0	0	"@sumifecital Thanks for the follow, Interested in learning Fine Art Techniques from your home? Join the Pastel Aca … http:// bit.ly/2eQI5ZV"		@sumifecital		"810993996961026050"	https://twitter.com/PastelAcademy/status/810993996961026050
	2016-12-19 23:43	0	0	"GOP Rep's Vision Of Post-ACA World: You Wait To Treat Your Kid's Broken Arm http:// talkingpointsmemo.com/livewire/huize nga-son-broken-arm … via @TPM #MAGA #P2 #ACA"		@TPM	#MAGA #P2 #ACA	"810993870926323712"	https://twitter.com/KirklandReader/status/810993870926323712
	2016-12-19 23:42	0	0	"7. ACA ????? Best con????"				"810993848390328321"	https://twitter.com/fizzyshotapop/status/810993848390328321
	2016-12-19 23:42	0	0	"The data are unambiguous. ACA repeal will be lethal. https:// twitter.com/ASlavitt/statu s/810930700073500672 …"				"810993827431546880"	https://twitter.com/Doc_RPS/status/810993827431546880
	2016-12-19 23:42	0	2	"2) It's a claim for a false mandate- DJT for his kleptocracy, Ryan for gutting Ss and MC, McConnell for killing ACA"				"810993763426258944"	https://twitter.com/TonyCava/status/810993763426258944
	2016-12-19 23:42	0	0	"Let's hope they extend the deadline again. Servers are overloaded and they're not answering calls. #obamacare"			#obamacare	"810993738025574400"	https://twitter.com/jeanneringe/status/810993738025574400
	2016-12-19 23:42	0	0	"Wasn't the basis of Obamacare YOUR PLAN? Including the coverage MANDATE! #Hypocrites You loved it until Democrats did!"			#Hypocrites	"810993673039179776"	https://twitter.com/JimmB/status/810993673039179776
	2016-12-19 23:42	0	0	"So I assume Congress will have total Obamacare repeal ready for Deficits-&-Debt Donny to sign on 20 Jan right? ROTFLMFAO #DupedAgin @cspanwj"		@cspanwj	#DupedAgin	"810993646459764737"	https://twitter.com/EnragedApostate/status/810993646459764737
	2016-12-19 23:41	0	0	"Obamacare !"				"810993613559787520"	https://twitter.com/rick_rrowland/status/810993613559787520
	2016-12-19 23:41	0	0	"Obamacare 850.00 monthly premium. Family of 3 10,000 deductible for each person. Who has 30,000 extra dollars? https:// twitter.com/repcicilline/s tatus/809862597117968389 …"				"810993540478025728"	https://twitter.com/Knikview/status/810993540478025728
	2016-12-19 23:41	0	0	"@MManningIEI @KiahCollier @ProPublica This is analogout to ObamaCare . Government would cause the price of energy to soar."		@MManningIEI @KiahCollier @ProPublica		"810993409947222016"	https://twitter.com/pegalios/status/810993409947222016
	2016-12-19 23:41	0	0	"*my nice and nephew running around trying to wake up the baby* my mom to my niece: "pinche langara vente para acá !"				"810993371384717312"	https://twitter.com/_piercetheval/status/810993371384717312
	2016-12-19 23:40	0	1	"mind you, he defended the ACA segment on Nauru when I took the piss out of the ACA /Daily Tele person who "reported" it"				"810993329567469568"	https://twitter.com/InflatablePlant/status/810993329567469568
	2016-12-19 23:40	0	1	". I seem to remember voting at least twice against Obamacare"				"810993318351884289"	https://twitter.com/Pritzieee/status/810993318351884289
	2016-12-19 23:40	0	0	"companies have been canceling their employees insurance and paying less into while blaming Obamacare . Look it up"				"810993193026195456"	https://twitter.com/mrscorie/status/810993193026195456
	2016-12-19 23:40	1	1	"Theyll just say it's " Obamacare " business as usual. Medicaid? Not expanded in NC bc GOP would sell you to the DEVIL HIMSELF rather than HELP https:// twitter.com/JaneTarney/sta tus/810978864080031745 …"				"810993153985675264"	https://twitter.com/DaniScotchIrish/status/810993153985675264
	2016-12-19 23:39	0	0	"cursing my government for not using my taxes to fill holes with more cement, VIVE ACA EL WACHO"				"810993102269739008"	https://twitter.com/WeAreTheKids_/status/810993102269739008
	2016-12-19 23:39	0	3	"It was so depressing signing up for the ACA today knowing the GOP bastards trying to kill it."				"810993092056809472"	https://twitter.com/LesaPamplin/status/810993092056809472
	2016-12-19 23:39	1	1	"@ElisabethCarey @scalzi Just as it has done for decades. Before Obamacare World Health Org. rated US just above Bangladesh!"		@ElisabethCarey @scalzi		"810993090747957248"	https://twitter.com/miguel_nan/status/810993090747957248
	2016-12-19 23:39	0	0	"@donghae861015 [D-206] gm! Have a good day :) pic.twitter.com/yTV2LjGeVv"		@donghae861015		"810993018564005888"	https://twitter.com/aca_hae/status/810993018564005888
	2016-12-19 23:39	0	0	"How to create open enrollment communications that motivate employees to enroll #OpenEnrollment #ACA https:// f.ptsm.us/25xvrO"			#OpenEnrollment #ACA	"810993016118898688"	https://twitter.com/TheLaughtonCo/status/810993016118898688
	2016-12-19 23:39	0	0	"http:// MedSupplyChain.com : Commentary: Repeal of ACA without adequate replacement will drive severe disruptions… http:// dlvr.it/MwTkng pic.twitter.com/cXlgUEXHoq"				"810992884199473152"	https://twitter.com/MedSupplyChain/status/810992884199473152
	2016-12-19 23:39	0	0	"ACA repeal-and-delay without replace would cause 1,025,000 NCians to lose insurance. #keepNCcovered #ProtectOurCare"			#keepNCcovered #ProtectOurCare	"810992864670846976"	https://twitter.com/Felicia_Willems/status/810992864670846976
	2016-12-19 23:38	0	0	"Yeah. $5 is about as much as I can afford to donate lately...It'll go to zero if the ACA is repealed and I lose healthcare..."				"810992752355905540"	https://twitter.com/Aleks_S/status/810992752355905540
	2016-12-19 23:38	19	12	"Commentary: Repeal of ACA without adequate replacement will drive severe disruptions beyond insurance http:// bit.ly/2i2SuG3"				"810992691639185408"	https://twitter.com/modrnhealthcr/status/810992691639185408
	2016-12-19 23:37	3	1	"Trump and the GOP are charging forward with Obamacare repeal, but few are eager to follow http:// fw.to/MKKQPqk #OurRevolution #Resist"			#OurRevolution #Resist	"810992599255265280"	https://twitter.com/Living4Earth/status/810992599255265280
	2016-12-19 23:37	1	0	"Obamacare & Medicaid should also be defended - unless vows to care about the poor & income-inequality are hollow"				"810992537171349504"	https://twitter.com/globalcitizenln/status/810992537171349504
