username;date;retweets;favorites;text;geo;mentions;hashtags;id;permalink
	2016-09-26 22:00	0	1	"no tengo el fuck you aca"				"780527470512603137"	https://twitter.com/Sooofi_romero/status/780527470512603137
	2016-09-26 22:00	0	1	"“An open letter to Donald Trump” by @kendallybrown https:// medium.com/@kendallybrown /an-open-letter-to-donald-trump-42b932f02362#.oyqutyewu … Obamacare saves lives Donald Trump does not!"		@kendallybrown @kendallybrown	#	"780527457199804416"	https://twitter.com/masopl65/status/780527457199804416
	2016-09-26 22:00	0	0	"The get down: La voz del guetto http:// acapasancosas.com.ar/2016/09/26/the -get-down-la-voz-del-guetto/ … pic.twitter.com/Jps8syMJtz"				"780527439696900098"	https://twitter.com/Aca_Pasan_Cosas/status/780527439696900098
	2016-09-26 22:00	1	0	"DEMS saved auto industry & are pro-unions, labor, min wage, ACA ! GOP hates all those! TRUMP is an unhinged MADMAN! #akron #cleveland #toledo"			#akron #cleveland #toledo	"780527398416551936"	https://twitter.com/WYVeteran/status/780527398416551936
	2016-09-26 21:59	0	0	"well Teddy, what happens to 20mil americans lose coverage b/c obamacare repealed. do you give a fuck about any of them dying?"				"780527297711345664"	https://twitter.com/JaysClef/status/780527297711345664
	2016-09-26 21:59	0	1	"Did you know? States are able to opt-out of #ObamaCare and replace it with #singlepayer #universalhealthcare is it time #kansas #missouri ?"			#ObamaCare #singlepayer #universalhealthcare #kansas #missouri	"780527268707708928"	https://twitter.com/TalkYngPolitics/status/780527268707708928
	2016-09-26 21:59	1	0	"VA Scandal: A Preview of ObamaCare http:// bit.ly/1sPnCD2 #tcot #teaparty #pjnet #gop #tlot #ccot #nra #p2 pic.twitter.com/5dMhruzjqq"			#tcot #teaparty #pjnet #gop #tlot #ccot #nra #p2	"780527263334830080"	https://twitter.com/petefrt/status/780527263334830080
	2016-09-26 21:58	0	1	"Brace yourself: Donald Trump is lying about Obamacare http://www. dailykos.com/story/2016/9/2 6/1574430/-Brace-yourself-Donald-Trump-is-lying-about-Obamacare …"				"780527030504792064"	https://twitter.com/DeborahPeifer/status/780527030504792064
	2016-09-26 21:58	1	2	"Brace yourself: Donald Trump is lying about Obamacare http://www. dailykos.com/story/2016/9/2 6/1574430/-Brace-yourself-Donald-Trump-is-lying-about-Obamacare …"				"780526973634224128"	https://twitter.com/TheDemCoalition/status/780526973634224128
	2016-09-26 21:58	0	0	"From the appearance on the map. It would appear everyone except Mexico dropped out of Obamacare . Maybe Obama should move South this winter? https:// twitter.com/jjauthor/statu s/780526157468868608 …"				"780526917267042304"	https://twitter.com/KingChristianX/status/780526917267042304
	2016-09-26 21:58	0	1	"Funny how the people who voted for Obamacare want nothing to do with it. Just like its namesake Obamacare is an utter failure!"				"780526890964623360"	https://twitter.com/ElderLansing/status/780526890964623360
	2016-09-26 21:57	1	1	"@marstraveler @sizzlesride @SenFeinstein &.If you like your Dr. You can keep.. ObamaCare -Iran's nuke-Bergdahl-Benghazi-on&on&."		@marstraveler @sizzlesride @SenFeinstein		"780526695312830465"	https://twitter.com/JkbentonJudith/status/780526695312830465
	2016-09-26 21:56	0	1	"@tedcruz GarbageIn/GarbageOut CitizensBeingDuped By(Non)"Science" ACA isAllAboutThe “AttackOfThe KillerAlgorithms”… http:// ducknetweb.blogspot.com/2014/03/obamac are-one-big-attack-of-killer.html?m=1 …"		@tedcruz		"780526581479596032"	https://twitter.com/Faithgirlee/status/780526581479596032
	2016-09-26 21:56	0	0	"Premiums pay off for executives at @HCSC regardless of #ACA challenges. @modrnhealthcr #salaries #healthcare http://www. modernhealthcare.com/article/201609 26/NEWS/160929921?utm_campaign=socialflow&utm_source=twitter&utm_medium=social …"		@HCSC @modrnhealthcr	#ACA #salaries #healthcare	"780526479864135680"	https://twitter.com/kimberlyanngeo/status/780526479864135680
	2016-09-26 21:56	0	0	"@realDonaldTrump DJT, please keep your composure. Hit her hard on jobs, immigration, Benghazi, Obamacare , inner city poverty. #Trump2016"		@realDonaldTrump	#Trump2016	"780526389594173440"	https://twitter.com/DSM2/status/780526389594173440
	2016-09-26 21:55	4	4	"@h1llary4prez @thehill 20 million people who have insurance through the ACA will make the same choice."		@h1llary4prez @thehill		"780526352994885633"	https://twitter.com/DoodyGiuliani1/status/780526352994885633
	2016-09-26 21:55	3	1	"Oct 2nd my BCBS deductible going up ((another)) $2,200 making it now 5k yr thanks to #Obamacare can't afford my own insurance soon"			#Obamacare	"780526293767090176"	https://twitter.com/YaniAlexander11/status/780526293767090176
	2016-09-26 21:55	0	0	"Obamacare alright? Not even possible and u know it. 4.8 Peddle that to the dumb. Bush left it was 5.1 its now over 9%."				"780526231296942080"	https://twitter.com/Williamwvaughn/status/780526231296942080
	2016-09-26 21:55	0	0	"8.1 Million Taxpayers Paid $1.7 Billion in Obamacare Penalties in 2014 #TCOT #WakeUpAmerica #MAGA #PJNET http:// freebeacon.com/issues/8-1-mil lion-taxpayers-paid-1-7-billion-obamacare-penalties-2014/ …"			#TCOT #WakeUpAmerica #MAGA #PJNET	"780526211642560512"	https://twitter.com/Joe_America1776/status/780526211642560512
	2016-09-26 21:55	0	1	"With the advent of obamacare and restrictions on end of life care, social security solvency increases while longevity decreases. . @AARP https:// twitter.com/aarpadvocates/ status/779403770547564544 …"		@AARP		"780526181095354368"	https://twitter.com/TonyFmTampa/status/780526181095354368
	2016-09-26 21:54	0	0	"@MisOdios 22pm aca por twitter."		@MisOdios		"780526091022770180"	https://twitter.com/yablonovich/status/780526091022770180
	2016-09-26 21:54	0	0	"Today a coworker told me she agrees with Trump on Obamacare & thinks HRC is a liar. I wonder if she could see the light fade from my eyes."				"780525880623923200"	https://twitter.com/heymolly/status/780525880623923200
	2016-09-26 21:53	14	8	"No matter what liberals say about #Obamacare , it’s still based on bribes, lies, coercion & price controls! #debates pic.twitter.com/vN6AoCYYDe"			#Obamacare #debates	"780525792555958272"	https://twitter.com/jjauthor/status/780525792555958272
	2016-09-26 21:53	0	0	"2 Obamacare Outcomes That are Nothing Short of Shocking -- The Motley Fool https://www. yahoo.com/finance/m/212b af38-d213-348d-a5b7-be50d3fa0577/2-obamacare-outcomes-that-are.html …"				"780525746338934784"	https://twitter.com/GlenMcCarty/status/780525746338934784
	2016-09-26 21:53	1	1	"BlueCross BlueShield Drops Obamacare Coverage in 3 Tennessee Markets #TCOT #WakeUpAmerica #MAGA #PJNET http:// freebeacon.com/issues/bluecro ss-blueshield-drops-coverage-3-obamacare-markets-tennessee/ …"			#TCOT #WakeUpAmerica #MAGA #PJNET	"780525693423812608"	https://twitter.com/Joe_America1776/status/780525693423812608
	2016-09-26 21:52	0	0	"It’s Easy for Obamacare Critics to Overlook the Merits of Medicaid Expansion http:// nyti.ms/2cxVyrf via @UpshotNYT"		@UpshotNYT		"780525569595183104"	https://twitter.com/bohemiotx/status/780525569595183104
	2016-09-26 21:52	0	2	"i think obamacare has hurt more than helped.."				"780525405212020736"	https://twitter.com/tracytracy52641/status/780525405212020736
	2016-09-26 21:51	0	0	"A Millennials Obamacare Lament http://www. realclearpolitics.com/2016/09/26/a_m illennial039s_obamacare_lament_392177.html … Obama/Democrats FAILED the Middle Class, and Failed Millennials too."				"780525329182027776"	https://twitter.com/kjfkugkujvj/status/780525329182027776
	2016-09-26 21:51	0	0	"The biggest stars of 2016's Digital Health Innovation Summit are key architects of the ACA http:// buff.ly/2dmg6E9 via @healthegy"		@healthegy		"780525326355034113"	https://twitter.com/Steve_Krupa/status/780525326355034113
	2016-09-26 21:51	3	2	"ACA must be repealed No alternative Join #USFreedomArmy to help accomplish this mission http:// usfreedomarmy.com pic.twitter.com/QZgBb4VNZe C"			#USFreedomArmy	"780525158188453895"	https://twitter.com/Taking_Back_USA/status/780525158188453895
	2016-09-26 21:51	0	0	"BlueCross BlueShield Drops #Obamacare Coverage in 3 Tenn. Markets http:// bitly.com/2cYabSX"			#Obamacare	"780525138013986816"	https://twitter.com/RipAnderson/status/780525138013986816
	2016-09-26 21:50	0	1	"Lots of medical people not happy with ACA ."				"780525095341158405"	https://twitter.com/NewParisite/status/780525095341158405
	2016-09-26 21:50	0	0	"@GOPLeader Do not bail out insurance companies in ACA Big fight in lame duck. Stop ICANN Stop Syrian Refugees. No more room"		@GOPLeader		"780525027527622656"	https://twitter.com/robtdfischl/status/780525027527622656
	2016-09-26 21:50	0	0	"#FFRNN #CLASSROOM GUEST LECTURER Neil Cavuto; Apple vs.Government (A Company that Cares vs #Obamacare ) http://www. youtube.com/watch?v=mqyVye wQ0lQ …"			#FFRNN #CLASSROOM #Obamacare	"780525009911504896"	https://twitter.com/FFRNNU/status/780525009911504896
	2016-09-26 21:50	0	0	"Tenn. Blues withdrawing from ACA exchanges in Nashville, Memphis and Knoxville http:// buff.ly/2cGgMlx"				"780524850079293441"	https://twitter.com/dchou1107/status/780524850079293441
	2016-09-26 21:49	0	0	"OMG inspiring friend, your personal statement is wonderful (but not your whole worth)"				"780524707716083712"	https://twitter.com/aca_affirmation/status/780524707716083712
	2016-09-26 21:49	0	0	"Meet the people who aren't getting subsidies to help with #Obamacare costs http:// washex.am/2cZRAsT via @dcexaminer #hcr #aca #healthcare"		@dcexaminer	#Obamacare #hcr #aca #healthcare	"780524606868238336"	https://twitter.com/ABridgeToBetter/status/780524606868238336
	2016-09-26 21:49	2	2	"#Obamacare sign comes down as policy choices dwindle http:// bit.ly/2d3kwwf via @startelegram #hcr #aca #healthcare"		@startelegram	#Obamacare #hcr #aca #healthcare	"780524606834683904"	https://twitter.com/IWV/status/780524606834683904
	2016-09-26 21:49	0	0	"Ugh, this will be a major pain! BCBST to pull out of Obamacare exchange in Nashville http://www. tennessean.com/story/money/20 16/09/26/bcbst-pull-out-obamacare-exchange-nashville-knoxville-and-memphis/90742822/ …"				"780524604972498945"	https://twitter.com/gregaudio/status/780524604972498945
	2016-09-26 21:48	0	1	"Obamacare is all about the “Attack of the Killer Algorithms”…probably some of the biggest created so far. BD http:// ducknetweb.blogspot.com/2014/03/obamac are-one-big-attack-of-killer.html?m=1 …"				"780524440559968256"	https://twitter.com/Faithgirlee/status/780524440559968256
	2016-09-26 21:47	0	1	"Obamacare is imploding. #VoteTrump to fix this mess. #Obamacare #Exchange #TrumpPence2016 #NationalReview #Debates2016 https:// twitter.com/tedcruz/status /780522312965558272 …"			#VoteTrump #Obamacare #Exchange #TrumpPence2016 #NationalReview #Debates2016	"780524308581879808"	https://twitter.com/JustBreath2017/status/780524308581879808
	2016-09-26 21:47	0	0	"Hey @POTUS @TheDemocrats @HillaryClinton #Obamacare success stories https:// twitter.com/tedcruz/status /780522312965558272 …"		@POTUS @TheDemocrats @HillaryClinton	#Obamacare	"780524275748917249"	https://twitter.com/jusleanica/status/780524275748917249
	2016-09-26 21:47	0	0	"Down Spiral of ObamaCare http:// thejacksonpress.org/?p=55570 via @fneudecker"		@fneudecker		"780524272963969024"	https://twitter.com/LeighBravo/status/780524272963969024
	2016-09-26 21:47	0	0	"Blue Cross pulls out of Tenn. Obamacare markets - http:// klou.tt/gjyi4zfalgcm"				"780524264415911936"	https://twitter.com/NoHookerNoPeace/status/780524264415911936
	2016-09-26 21:47	0	0	"3 giant new 2017 ACA exchange menu announcements: http:// ift.tt/2d4MYxM"				"780524210045251584"	https://twitter.com/mikewatts502/status/780524210045251584
	2016-09-26 21:46	0	0	"ObamaCare 's Death Spiral Has Begun https:// lnkd.in/eZjxhfQ"				"780523930968739840"	https://twitter.com/KWayneDay/status/780523930968739840
	2016-09-26 21:46	0	0	"@YouTube No, she won't: #Democrats like #Obamacare and #HillaryClinton do not apologize unless it helps them politically."		@YouTube	#Democrats #Obamacare #HillaryClinton	"780523874681233409"	https://twitter.com/PaisaAmericano/status/780523874681233409
	2016-09-26 21:45	0	0	""You know it's complicated Leo because even though Shuler voted against ACA him and the Blue Dogs gave us the majority to bring it to vote' https:// twitter.com/jakebeckman/st atus/780215455680172032 …"				"780523831119060992"	https://twitter.com/BertClere/status/780523831119060992
	2016-09-26 21:45	0	0	"3 giant new 2017 ACA exchange menu announcements - Big insurers in Nebraska, Tennessee and Pittsburgh are takin... http:// ow.ly/Xj8L504RMRy"				"780523804124643332"	https://twitter.com/annuitycampus/status/780523804124643332
	2016-09-26 21:45	0	0	"What's he going to replace Obamacare with?"				"780523797178937344"	https://twitter.com/pinko_snob/status/780523797178937344
	2016-09-26 21:45	0	0	"Obama regime hits a new low: Obamacare penalizing 200,000 of Americas most needy http:// shar.es/PGzFf #TeaPartyToldYouSo #tcot #PJNet"			#TeaPartyToldYouSo #tcot #PJNet	"780523796247613440"	https://twitter.com/WSCP1/status/780523796247613440
	2016-09-26 21:45	0	0	"dcexaminer: White House looks to millennials to boost Obamacare numbers http:// washex.am/2cY5RmT pic.twitter.com/ozncswicjY"				"780523744771047425"	https://twitter.com/AliEesq/status/780523744771047425
	2016-09-26 21:45	0	0	"4. Changes to personal taxes and end of Obamacare increases personal income which means higher consumption and growth."				"780523645034762241"	https://twitter.com/JeffAronson25/status/780523645034762241
	2016-09-26 21:45	0	0	"BlueCross pulls out of Obamacare exchange in Nashville https:// lnkd.in/bbcDDpr"				"780523590894559232"	https://twitter.com/MaryBrownReMax/status/780523590894559232
	2016-09-26 21:44	1	3	"I have a lot riding on this election too. I use my state's ACA health insurance exchange since I quit my job and started writing full-time."				"780523541229805568"	https://twitter.com/Jody_Houser/status/780523541229805568
	2016-09-26 21:44	0	0	"BlueCross pulls out of Obamacare exchange in Nashville http://www. bizjournals.com/nashville/news /2016/09/26/bluecross-pulls-out-of-obamacare-exchange-in.html?ana=twt … via @nashvillebiz"		@nashvillebiz		"780523511655825412"	https://twitter.com/MaryBrownReMax/status/780523511655825412
	2016-09-26 21:44	0	0	"Biggest Liar: Trump Lies About His Support for Obamacare https:// youtu.be/UCXIha1ajMw #hillary #HillaryClinton #Trump #TrumpTrain #Trump2016"			#hillary #HillaryClinton #Trump #TrumpTrain #Trump2016	"780523396660596737"	https://twitter.com/supapasu55/status/780523396660596737
	2016-09-26 21:43	0	0	"blue cross pulled out of loser obamacare"				"780523326334574592"	https://twitter.com/Teri473/status/780523326334574592
	2016-09-26 21:43	0	1	"@NoamLevey @aaronecarroll @nytimes #ObamaCare => #ObamaCaid Needs its own budget & providers not #PiggyBackCare on pvt insurance."		@NoamLevey @aaronecarroll @nytimes	#ObamaCare #ObamaCaid #PiggyBackCare	"780523313382555648"	https://twitter.com/ImagesMD/status/780523313382555648
	2016-09-26 21:43	6	6	"Darryl Glenn Closing Gap to Defeat Senator Who Supported Obamacare & Iran Deal. http:// ow.ly/ovHX304wQ5E pic.twitter.com/uoQ48ZUtGZ"				"780523231371419648"	https://twitter.com/PolitixGal/status/780523231371419648
	2016-09-26 21:43	0	0	"ACA has improved health coverage, but the medical insurance/pharma industries still has the country's balls... http:// fb.me/7cXE2SZ2a"				"780523214661353472"	https://twitter.com/WBBBPB/status/780523214661353472
	2016-09-26 21:43	0	2	"Obamacare is tanking. Rates will be up 30-70 per cent after the election Dems trying to hide this"				"780523213994520576"	https://twitter.com/Bskwp/status/780523213994520576
	2016-09-26 21:43	0	0	"Here are some facts, Obamacare is a failure, he never put AMERICA first, let terrorists go free from Gitmo!!!"				"780523128980025344"	https://twitter.com/papadc53/status/780523128980025344
	2016-09-26 21:43	5	3	"Blue Cross Blue Shield out of Nebraska's Obamacare marketplace; may return if changes to law are made http:// bit.ly/2d8xefi"				"780523098781081601"	https://twitter.com/OWHmoney/status/780523098781081601
	2016-09-26 21:42	0	0	"State Says ConnectiCare Ending Sale Of Obamacare Policies http://www. courant.com/business/hc-co nnecticare-obamacare-20160912-story.html?utm_campaign=crowdfire&utm_content=crowdfire&utm_medium=social&utm_source=twitter … pic.twitter.com/NZmywHpjon"				"780523052207632385"	https://twitter.com/Selfman999/status/780523052207632385
	2016-09-26 21:42	0	0	"@KellyannePolls yeah like the healthcare genius was joking when Grubered us on obamacare"		@KellyannePolls		"780523010071621636"	https://twitter.com/DexWest/status/780523010071621636
	2016-09-26 21:42	0	0	"[Tenn. Blues withdrawing from ACA exchanges in Nashville, Memphis and Knoxville https:// lnkd.in/bPcdhd9"				"780522978563923968"	https://twitter.com/stephen_howley1/status/780522978563923968
	2016-09-26 21:42	0	0	"#Connecticut #Hartford #NewHaven More Hispanics treated at breast cancer center after Obamacare http:// ift.tt/2dmeSJ3"			#Connecticut #Hartford #NewHaven	"780522934507036672"	https://twitter.com/TLVRP_USA/status/780522934507036672
	2016-09-26 21:42	5	2	"Interviewer: What is Trumps replacement for Obamacare ? Trump economic adviser: ¯\_(ツ)_/¯ pic.twitter.com/ZiqQPeWWQy"				"780522901992771584"	https://twitter.com/ndrew_lawrence/status/780522901992771584
	2016-09-26 21:42	34	22	"#Obamacare in a nut shell: Fewer Choices, Less Coverage, Higher Prices. And now insurers want a taxpayer bailout. http:// bit.ly/2cSrWqj pic.twitter.com/lzFjYkQ0KP"			#Obamacare	"780522851627470848"	https://twitter.com/AFPhq/status/780522851627470848
	2016-09-26 21:41	0	0	"tedcruz: #FullRepeal of Obamacare : https://www. tedcruz.org/l/full-repeal- obamacare/ … https:// twitter.com/tedcruz/status /780522312965558272 …"			#FullRepeal	"780522761039056896"	https://twitter.com/4presidentsite/status/780522761039056896
	2016-09-26 21:41	0	0	"A millennial’s ObamaCare lament http:// on.wsj.com/2dkESVD via @WSJ The White House and Democrats are fk'ing tone-deaf."		@WSJ		"780522658140225537"	https://twitter.com/kjfkugkujvj/status/780522658140225537
	2016-09-26 21:40	419	606	"#FullRepeal of Obamacare : https://www. tedcruz.org/l/full-repeal- obamacare/ … https:// twitter.com/tedcruz/status /780522312965558272 …"			#FullRepeal	"780522482868428800"	https://twitter.com/tedcruz/status/780522482868428800
	2016-09-26 21:40	0	0	"White House looks to millennials to boost Obamacare numbers: Robert King Knowing that it must boost enrollment for… http:// m.tbnn.it/MLLcJy"				"780522404418236416"	https://twitter.com/POLSDC/status/780522404418236416
	2016-09-26 21:40	0	0	"See how ACA premiums may actually be relatively affordable compared to other options: http:// bit.ly/2dx1Bg6 pic.twitter.com/KA6isquAAf"				"780522344599195648"	https://twitter.com/TangoHealth/status/780522344599195648
	2016-09-26 21:39	0	0	"White House looks to millennials to boost Obamacare numbers http:// liber8r.com/2016/09/white- house-looks-to-millennials-to-boost-obamacare-numbers/ …"				"780522259018502144"	https://twitter.com/Liber8R2/status/780522259018502144
	2016-09-26 21:39	0	0	"@HillaryClinton done nothing for dev dis. ' ACA let my brother die. $ given to families who take in illegals. I went broke taking care of bro"		@HillaryClinton		"780522253746221056"	https://twitter.com/Garlicnosedho/status/780522253746221056
	2016-09-26 21:39	0	0	"THR: White House looks to millennials to boost Obamacare numbers http:// ift.tt/2cGpfF9 (WASHEX)"				"780522139103457280"	https://twitter.com/HWDRepublican/status/780522139103457280
	2016-09-26 21:38	0	0	"BlueCross BlueShield Drops Obamacare Coverage in 3 Tennessee Markets http:// politicallyofftarget.com/bluecross-blue shield-drops-obamacare-coverage-in-3-tennessee-markets/ …"				"780522019838242817"	https://twitter.com/PolOffTarget/status/780522019838242817
	2016-09-26 21:38	0	0	"Even Reagan would have come around on #ACA , had Massachusetts been up and running in his term. @RifleRun"		@RifleRun	#ACA	"780522001815392257"	https://twitter.com/EdDarrell/status/780522001815392257
	2016-09-26 21:38	0	0	"King vs. Burwell: Supreme Court Upholds Obamacare Tax Subsidies http:// nationalhealthpolicyreview.com/2015/06/king-v s-burwell-supreme-court-upholds-obamacare-tax-subsidies-3 …"				"780521972287418368"	https://twitter.com/doctorkoren/status/780521972287418368
	2016-09-26 21:38	0	0	"Oy. Did you hear that BCBS is leaving Memphis, Nashville, and Knoxville Obamacare networks? Shame on them."				"780521967065718784"	https://twitter.com/ProfOrganizer/status/780521967065718784
	2016-09-26 21:38	1	0	"BlueCross BlueShield Drops Obamacare Coverage in 3 Tennessee Markets http:// freebeacon.com/issues/bluecro ss-blueshield-drops-coverage-3-obamacare-markets-tennessee/ …"				"780521958073044992"	https://twitter.com/ACSpollen/status/780521958073044992
	2016-09-26 21:38	0	0	"@AndyWise5 : BlueCross BlueShield drops Obamacare in Memphis, Nashville, Knoxville http://www. wmcactionnews5.com//story/3319643 0/bluecross-blueshield-drops-obamacare-in-memphis-nashville-knoxville#.V-mUFB4rCSM.twitter … "TN refused to expand Medicare.""		@AndyWise5	#	"780521872383365121"	https://twitter.com/IAmMBM84/status/780521872383365121
	2016-09-26 21:38	0	0	"@CNNSitRoom Sen Reed calling @realDonaldTrump a racist is like calling HRC honest and Obamacare a raving success. Not a credible voice."		@CNNSitRoom @realDonaldTrump		"780521862971424768"	https://twitter.com/Abbygosh/status/780521862971424768
	2016-09-26 21:38	0	0	"Florida’s Obamacare premiums to rise average 19 percent in 2017, state says http://www. miamiherald.com/news/health-ca re/article99562272.html?utm_campaign=crowdfire&utm_content=crowdfire&utm_medium=social&utm_source=twitter …"				"780521836480258053"	https://twitter.com/Selfman999/status/780521836480258053
	2016-09-26 21:37	0	0	"Reagan doesn't get any credit for #ACA . Sadly. He got smart on Home Health Care, but we had to beat him a bit into that. @RifleRun"		@RifleRun	#ACA	"780521706213343232"	https://twitter.com/EdDarrell/status/780521706213343232
	2016-09-26 21:37	0	0	"Root: Obamacare is crippling the U.S. economy http:// fb.me/7KVmglPZ6"				"780521627368902656"	https://twitter.com/klpotter2/status/780521627368902656
	2016-09-26 21:36	0	0	"8.1 Million Taxpayers Paid $1.7 Billion in Obamacare Penalties http:// freebeacon.com/issues/8-1-mil lion-taxpayers-paid-1-7-billion-obamacare-penalties-2014/ …"				"780521532242006016"	https://twitter.com/SnewsHound/status/780521532242006016
	2016-09-26 21:36	0	0	"Rep. Alcee Hastings wants the law to be called Hastings/ ObamaCare . Less of a ring to it"				"780521525728411648"	https://twitter.com/PeterSullivan4/status/780521525728411648
	2016-09-26 21:36	0	0	"BCBST to pull out of Obamacare exchange in Nashville, Knoxville and Memphis http:// tnne.ws/2ddhLaj via @tennessean #debatenight #MAGA"		@tennessean	#debatenight #MAGA	"780521524457418754"	https://twitter.com/cokey318/status/780521524457418754
	2016-09-26 21:36	0	0	"Goodbye 2 Ocare Mrktplace Bl Cross Bl Shield cites ACA 's 'incrsing instability' ...'decresd choice, ncresed costs' http://www. lifezette.com/healthzette/sa ying-goodbye-to-obamacare-marketplace/ …"				"780521504899555329"	https://twitter.com/songbirdcd/status/780521504899555329
	2016-09-26 21:36	0	0	"Asshat Peter Navarro: Trump will repeal ACA , WE'LL BE BACK TO WHERE WE WERE. OMG! So no health insurance is good?"				"780521490726817792"	https://twitter.com/CydCarlson/status/780521490726817792
	2016-09-26 21:36	3	7	"INSTANT FACT CHECK for #TNLeg Democrats: Your Party unanimously saddled us with #ObamaCare . Now that it's failing, you own it. #TNGOP"			#TNLeg #ObamaCare #TNGOP	"780521437593567232"	https://twitter.com/TNGOP/status/780521437593567232
	2016-09-26 21:36	0	0	"Despite not enough young people signing up, #ACA STILL cuts federal expenses, and STILL lowers costs for everyone else. @RifleRun"		@RifleRun	#ACA	"780521429469007872"	https://twitter.com/EdDarrell/status/780521429469007872
	2016-09-26 21:36	0	1	"Don't waste your time kids. This time next year it Obamacare will have collapsed or been recinded. http:// washex.am/2cY7O2G"				"780521395088261120"	https://twitter.com/groupwbench77/status/780521395088261120
	2016-09-26 21:36	0	0	"No. We work for free. Me? I need the ACA . Disabled son needs insurance beyond Medicaid. Need min wg. &repro rights as a woman. #work4free https:// twitter.com/magicmetalninj a/status/780511160164503552 …"			#work4free	"780521392001454080"	https://twitter.com/artemis1954/status/780521392001454080
	2016-09-26 21:36	0	2	"I argued a case to the 7th Cir., knowing that, the same day, another lawyer was defending ACA at the S.Ct. That relaxed me."				"780521388037857281"	https://twitter.com/DougMasson/status/780521388037857281
	2016-09-26 21:36	0	0	"3 giant new 2017 ACA exchange menu announcements: Big insurers in Nebraska, Tennessee and Pittsburgh are taki... http:// bit.ly/2dxs8cU"				"780521359839420416"	https://twitter.com/EdwinLucian/status/780521359839420416
	2016-09-26 21:36	0	0	"8.1 Million Taxpayers Paid $1.7 Billion in Obamacare Penalties in 2014 http:// freebeacon.com/issues/8-1-mil lion-taxpayers-paid-1-7-billion-obamacare-penalties-2014/ …"				"780521353933881344"	https://twitter.com/ACSpollen/status/780521353933881344
	2016-09-26 21:36	0	0	"3 giant new 2017 ACA exchange menu announcements: Big insurers in Nebraska, Tennessee and Pittsburgh are taki... http:// bit.ly/2dxs8cU"				"780521346572791808"	https://twitter.com/MichaelZons/status/780521346572791808
	2016-09-26 21:36	0	0	"3 giant new 2017 ACA exchange menu announcements: Big insurers in Nebraska, Tennessee and Pittsburgh are taki... http:// bit.ly/2dxs8cU"				"780521342730850304"	https://twitter.com/LucianoSingson/status/780521342730850304
