username;date;retweets;favorites;text;geo;mentions;hashtags;id;permalink
	2013-12-30 23:45	0	0	"Plz clk n ad f u lk: Rand Paul On Obamacare Rollout New Updat Global Market Economic 2014 – Video - ... http:// j.mp/1d8fR6w #RandPaul"			#RandPaul	"417803623968411649"	https://twitter.com/RonPaulTeam/status/417803623968411649
	2013-12-30 23:45	0	0	"The 2013 #tax hikes on the rich--in 6 easy pieces. http:// onforb.es/1chF5OS #39.6% #capgains #Obamacare #PEP #Pease"			#tax #39 #capgains #Obamacare #PEP #Pease	"417803593551343616"	https://twitter.com/janetnovack/status/417803593551343616
	2013-12-30 23:45	0	0	"@CapitaLiszt @hwb120240 ACA is not designed to compete or replace employer provided healthcare. I kept my employer's offer."		@CapitaLiszt @hwb120240		"417803578925785088"	https://twitter.com/Drew4484/status/417803578925785088
	2013-12-30 23:45	0	1	"The President Gets a Taste of His Own Obamacare Medicine - DailyFinance http:// dlvr.it/4c7hvL"				"417803576568582144"	https://twitter.com/MedicineWorld1/status/417803576568582144
	2013-12-30 23:45	0	0	"" @HuffingtonPost : roadblock to better healthcare #Obamacare http:// huff.to/1ggEmiv ""		@HuffingtonPost	#Obamacare	"417803562211901440"	https://twitter.com/KristinaBClark/status/417803562211901440
	2013-12-30 23:45	0	0	"Be afraid, very afraid, in 2014 #obamacare will reach enrollment goals, access to care will decline! policies will be cancelled! #tcot"			#obamacare #tcot	"417803554200748032"	https://twitter.com/jamesgroove/status/417803554200748032
	2013-12-30 23:45	4	2	"FL: Alan Meeks (preex conds) now has great cvg w/ $0 deductible & same docs. Says ACA means "more freedom" for him. http:// money.cnn.com/gallery/news/e conomy/2013/12/29/obamacare-insurance/ …"				"417803554049388545"	https://twitter.com/ACAstories/status/417803554049388545
	2013-12-30 23:45	0	0	"@RonFutrell Really? Gov manage something well? Let see #NSA #IRS ObamaCare -less. I'm gonna want to see the pudding were that proof exists."		@RonFutrell	#NSA #IRS	"417803550735867905"	https://twitter.com/KCHunt/status/417803550735867905
	2013-12-30 23:45	0	0	"@EleanorNorton Just like economy isn't supposed to be propt-up by UI. Continued implementation of #obamacare will destroy economy in 2014"		@EleanorNorton	#obamacare	"417803550236749824"	https://twitter.com/InalienableVET/status/417803550236749824
	2013-12-30 23:44	0	0	"@BarackObama Try being user friendly. Be social occasionally. Don't make it all about #Obamacare . You'll get more support that way. js bro."		@BarackObama	#Obamacare	"417803532319068160"	https://twitter.com/Wat_AJ_Says/status/417803532319068160
	2013-12-30 23:44	0	0	"Federal Obamacare Enrollments Soar Past One Million Mark Through Christmas Eve | Alternet http://www. alternet.org/news-amp-polit ics/federal-obamacare-enrollments-soar-past-one-million-mark-through-christmas-eve …"				"417803518183866369"	https://twitter.com/quarterflash14/status/417803518183866369
	2013-12-30 23:44	0	0	"@BarackObama Must keep ACA moving forward. #TakeCare pic.twitter.com/bypeAVaC5Y"		@BarackObama	#TakeCare	"417803510260834304"	https://twitter.com/jmarlies/status/417803510260834304
	2013-12-30 23:44	0	0	"Would you believe the new WH numbers on Obamacare ! http:// po.st/k0aSbQ via @Theblacksphere"		@Theblacksphere		"417803501805121536"	https://twitter.com/photografs/status/417803501805121536
	2013-12-30 23:44	0	0	"Steps to improving ObamaCare &#039;s http:// HealthCare.Gov http:// firsthomebusiness.org/steps-to-impro ving-obamacares-healthcare-gov/ …"			#039	"417803467340914688"	https://twitter.com/Clickbankplus/status/417803467340914688
	2013-12-30 23:44	3	1	"More Than 9 Million Americans Have Health Insurance Through Obamacare http:// bit.ly/19APp15 #hcr #p2 #tcot #pjnet"			#hcr #p2 #tcot #pjnet	"417803428903936000"	https://twitter.com/HDGregg/status/417803428903936000
	2013-12-30 23:44	0	0	"#Obama #47% #AARP #ACA WI 1848 Forward: #NPR : #Oregon 's #Medicaid Experiment Represents A 'Defining Moment' vs #1% http:// wi1848forward.blogspot.com/2012/05/npr-or egons-medicaid-experiment.html?spref=tw …"			#Obama #47 #AARP #ACA #NPR #Oregon #Medicaid #1	"417803428878766080"	https://twitter.com/wmagates/status/417803428878766080
	2013-12-30 23:44	0	0	"The more I listen to Obama conjure up lies about Obamacare , the more I think the guy is seriously delusional. #GetCovered"			#GetCovered	"417803423070048256"	https://twitter.com/LibertySeeds/status/417803423070048256
	2013-12-30 23:44	1	3	"Bob Simpson to be inducted into the @CricketICC Hall of Fame: http:// bit.ly/KhFoiY #cricket pic.twitter.com/IUzgq1P9jN"		@CricketICC	#cricket	"417803395911536640"	https://twitter.com/ACA_Players/status/417803395911536640
	2013-12-30 23:44	0	0	"Obamacare working out for some people - don't hear that every day http:// money.cnn.com/gallery/news/e conomy/2013/12/29/obamacare-insurance/index.html?hpt=hp_t3 …"				"417803391524298752"	https://twitter.com/Sabritree/status/417803391524298752
	2013-12-30 23:44	0	0	"If there's no room for government in abortion decision with woman & doctor, how comes ObamaCare puts government in medical care? #pjnet"			#pjnet	"417803380023521280"	https://twitter.com/RhymesWithRight/status/417803380023521280
	2013-12-30 23:44	0	0	"@RedNationRising @citrussage @PAMsLOvE Also, its mostly the politicians against obamacare the ones keeping the poor paying more taxes."		@RedNationRising @citrussage @PAMsLOvE		"417803377813110785"	https://twitter.com/IllIlIIllIIlIII/status/417803377813110785
	2013-12-30 23:44	0	0	"Michelle Obama, CGI and the $678 million connection http:// po.st/ufgLq9 via @AllenWest #obamacare"		@AllenWest	#obamacare	"417803300059115520"	https://twitter.com/colopeach/status/417803300059115520
	2013-12-30 23:44	0	1	"me and my queen @dinahxsaur aca camila pic.twitter.com/WyHT8hxMiV"		@dinahxsaur		"417803293004677122"	https://twitter.com/lifeofharmony/status/417803293004677122
	2013-12-30 23:44	0	0	"Health official who oversaw ObamaCare rollout to retire http:// fxn.ws/1cRxCbS"				"417803288554131456"	https://twitter.com/BIOPHYSIX/status/417803288554131456
	2013-12-30 23:43	0	0	"Democrats Try to Keep Emphasis Off Obamacare for 2014 Elections. http://www. newsmax.com/Politics/house -elections-democrats-obamacare/2013/12/30/id/544413 … … … via @newsmax_media #nhpolitics #nh"		@newsmax_media	#nhpolitics #nh	"417803269507776512"	https://twitter.com/MrBlog1/status/417803269507776512
	2013-12-30 23:43	0	0	"http:// bit.ly/VIcco6 : It looks like the massive battleship of CNN’s negative Obamacare coverage is starting to... http:// bit.ly/JG71S3"				"417803267494920192"	https://twitter.com/USA_Closer/status/417803267494920192
	2013-12-30 23:43	2	1	"GOP/NRA Christian republicans said JOBS were important to them; but they never vote for JOBS; - well that 1 time #CIR #TimeIsNow #ObamaCare"			#CIR #TimeIsNow #ObamaCare	"417803265237983234"	https://twitter.com/dwaynecobb/status/417803265237983234
	2013-12-30 23:43	0	0	"After Months of Promoting Obamacare , Obama Admin Quietly Announces a Net Loss of 3 Million Insurance Plans - http://www. tpnn.com/2013/12/30/aft er-months-of-promoting-obamacare-obama-admin-quietly-announces-a-net-loss-of-3-million-insurance-plans/ …"				"417803259743440896"	https://twitter.com/BobMathis2/status/417803259743440896
	2013-12-30 23:43	0	0	"Auto workers pissed off over obamacare : http:// breitbart.com.feedsportal.com/c/35151/f/6511 14/s/355947b0/sc/1/l/0L0Sbreitbart0N0CBig0EGovernment0C20A130C120C30A0CAuto0EWorkers0EOn0EObamacare0EWe0Ere0EPissed0EOff/story01.htm …"				"417803250457260032"	https://twitter.com/leeway63/status/417803250457260032
	2013-12-30 23:43	0	4	"SHOCKED! @CBSEveningNews just did a positive story on the ACA featuring a 27-yr old happy to get healthcare. @JanCBS is now the anti-Logan."		@CBSEveningNews @JanCBS		"417803209848008704"	https://twitter.com/AVD911/status/417803209848008704
	2013-12-30 23:43	0	0	"After Months of Promoting Obamacare , Obama Admin Quietly Announces a Net Loss of 3 Million Insurance Plans http://www. tpnn.com/2013/12/30/aft er-months-of-promoting-obamacare-obama-admin-quietly-announces-a-net-loss-of-3-million-insurance-plans/#.UsIFKCefq-4.twitter …"			#	"417803208115769344"	https://twitter.com/slht1961/status/417803208115769344
	2013-12-30 23:43	1	0	"NSA, Benghazi, ACA --crazy obsessions of the Tea Party and GOP because they have no agenda of their own and Obama Derangement Syndrome."				"417803193762852864"	https://twitter.com/calatayud7/status/417803193762852864
	2013-12-30 23:43	0	0	"More Than 9 Million Americans Have Health Insurance Through Obamacare : http://www. nationalmemo.com/call-it-a-come back-more-than-9-million-americans-have-health-insurance-through-obamacare/#.UsIE7JhddBw.twitter … #tcot #uniteblue #p2"			# #tcot #uniteblue #p2	"417803186825465856"	https://twitter.com/pyrophore/status/417803186825465856
	2013-12-30 23:43	0	1	"Im a pro fisherman #obamacare"			#obamacare	"417803184107945984"	https://twitter.com/jordan_zaroff/status/417803184107945984
	2013-12-30 23:43	0	0	"Zack Langford: 3 year-old Denied Obamacare - Patriot UpdatePatriot Update http:// po.st/39CnvK via @patriotupdate"		@patriotupdate		"417803152474124288"	https://twitter.com/FranMontgomery1/status/417803152474124288
	2013-12-30 23:43	0	0	"Stories investigate ObamaCare ’s higher costs, lower benefits http:// nrlc.cc/1dlDY1L #prolife"			#prolife	"417803135520735232"	https://twitter.com/DaveHA/status/417803135520735232
	2013-12-30 23:43	0	0	"Obamacare , Impeachment, Iran, and More Political Predictions for 2014 http:// fb.me/TwgMPWyu"				"417803134774562816"	https://twitter.com/810WGY/status/417803134774562816
	2013-12-30 23:43	0	0	"Looks like Obamacare is working just as it was planned and right on schedule."				"417803118509060097"	https://twitter.com/5061304072/status/417803118509060097
	2013-12-30 23:43	1	0	"DD214____Can we also finally get a look at GOP/NRA (R) McConnell's discharge papers? #StopRush #ObamaCare #UniteBlue #ShutdownTheGOP"			#StopRush #ObamaCare #UniteBlue #ShutdownTheGOP	"417803094613704704"	https://twitter.com/dwaynecobb/status/417803094613704704
	2013-12-30 23:43	0	2	"Health official who oversaw ObamaCare rollout to retire http:// fxn.ws/1cRxCbS"				"417803094408167425"	https://twitter.com/LIGHTWorkersi/status/417803094408167425
	2013-12-30 23:43	0	0	"After Months Promoting #Obamacare , Obama Admin Quietly Announces Net #Loss of 3M Insurance Plans http://www. tpnn.com/2013/12/30/aft er-months-of-promoting-obamacare-obama-admin-quietly-announces-a-net-loss-of-3-million-insurance-plans/ … #wiright #wiunion"			#Obamacare #Loss #wiright #wiunion	"417803087772782592"	https://twitter.com/jrios68/status/417803087772782592
	2013-12-30 23:43	0	0	"After Months of Promoting Obamacare , Obama Admin Quietly Announces a Net Loss of 3 Million... http:// fb.me/16krdu4AH"				"417803078583484416"	https://twitter.com/ScotsPrincess2/status/417803078583484416
	2013-12-30 23:43	0	0	"Obamacare Website Official Retires, Sebelius Stays http:// shar.es/9ocaF via @BreitbartNews"		@BreitbartNews		"417803070144122880"	https://twitter.com/907AlaskanFern/status/417803070144122880
	2013-12-30 23:43	0	0	"New Song: A Day In The Life Under Obamacare http:// fb.me/Ymh0F2pO"				"417803059582881792"	https://twitter.com/jeff_cox/status/417803059582881792
	2013-12-30 23:43	0	0	"The Big Three Obamacare Abortion Lies of the Year http:// b1t.it/eiRs"				"417803052448747520"	https://twitter.com/christendom/status/417803052448747520
	2013-12-30 23:43	1	0	"Seeing the positive changes brought by the #ACA http:// lat.ms/1cCw4AM"			#ACA	"417803035079753728"	https://twitter.com/CADMHC/status/417803035079753728
	2013-12-30 23:43	0	0	"Why I signed up for Obamacare http://www. cnn.com/2013/12/24/opi nion/salam-i-signed-up-for-obamacare/index.html?sr=sharebar_twitter …"				"417803034492538880"	https://twitter.com/Dr_Odo/status/417803034492538880
	2013-12-30 23:43	0	0	"Stories investigate ObamaCare ’s higher costs, lower benefits http:// nrlc.cc/1dlDTev #prollife"			#prollife	"417803033683034112"	https://twitter.com/DaveHA/status/417803033683034112
	2013-12-30 23:42	0	0	"Democratic lawmaker: ObamaCare enrollment is low because millions think it was repealed http://www. headnine.com/politics/2013/ 12/30/democratic-lawmaker--obamacare-enrollment-is-low-because_s_64866572.html … #politics"			#politics	"417803029904379904"	https://twitter.com/HotBeakPol/status/417803029904379904
	2013-12-30 23:42	0	0	"Doctor forces Howard Dean to retract rosy Obamacare prognosis http:// dailycaller.com/2013/12/29/doc tor-forces-howard-dean-to-retract-rosy-obamacare-prognosis/ … via @dailycaller . Howard Dean not a convincing liar..."		@dailycaller		"417803006139039744"	https://twitter.com/RICKSCHLECHT/status/417803006139039744
	2013-12-30 23:42	0	0	"@LIGHTWorkersi Obamacare 's greatest flaw is that it still lets the Big Health Insurance monopoly belly up to the trough. Need single-payer!"		@LIGHTWorkersi		"417803002188017666"	https://twitter.com/bleusharque/status/417803002188017666
	2013-12-30 23:42	0	0	"Ha! A perfect job for you I think RT @dnmendelson : @JohnHCochrane Avik - maybe you should be the obamacare CEO? That could be fun."		@dnmendelson @JohnHCochrane		"417802995644903424"	https://twitter.com/Avik/status/417802995644903424
	2013-12-30 23:42	0	0	"RT @1phalaenopsis4u : here is Nathan Auldridge organizing ACA support 2009: Looks pretty healthy to me! http:// bit.ly/1k1CYoO #remission"		@1phalaenopsis4u	#remission	"417802986560032768"	https://twitter.com/ValerieInRke/status/417802986560032768
	2013-12-30 23:42	0	0	"3+ hours on hold w/ BCBS & call was dropped! Dying inside. Nevermind 3 days my husband dealt w/ http:// healthcare.gov . #Obamacare #sadtweet"			#Obamacare #sadtweet	"417802986140614657"	https://twitter.com/Leuqar2/status/417802986140614657
	2013-12-30 23:42	5	0	"RT @EyeOnInsurance : Supporters, opponents gear up for Obamacare election fight in 2014 http:// buff.ly/19VoK2C"		@EyeOnInsurance		"417802967543451648"	https://twitter.com/MedicareMonitor/status/417802967543451648
	2013-12-30 23:42	0	0	"NBC figures out that employees aren't going to like what #ObamaCare does in 2014 #BlameTheDems http://www. caintv.com/nbc-figures-ou t-that-employees …"			#ObamaCare #BlameTheDems	"417802955819986944"	https://twitter.com/jusjane6060/status/417802955819986944
	2013-12-30 23:42	0	0	"Thousands Scramble to Get Medical Procedures Before Obamacare Begins http:// shar.es/9o5Ng via @BreitbartNews"		@BreitbartNews		"417802941714952192"	https://twitter.com/loman920/status/417802941714952192
	2013-12-30 23:42	2	0	"BOYCOTTS WORK.. #PapaJohn 's, #Applebee 's And Others Pay Huge Price For Anti- Obamacare Politicking http:// onforb.es/RzVl6W"			#PapaJohn #Applebee	"417802883195609088"	https://twitter.com/NancyWonderful/status/417802883195609088
	2013-12-30 23:42	0	0	"We Don't Know if Obamacare Is Working Well. But We Know It's Working http://www. newrepublic.com/article/116061 /obamacare-enrollment-surges-more-1m-sign-thru-healthcaregov …"				"417802857077694464"	https://twitter.com/21law/status/417802857077694464
	2013-12-30 23:42	0	0	"Parting Company by Walter Williams http://www. creators.com/conservative/w alter-williams/parting-company-fc2c6f2022.html … #tcot #Teaparty #p2 #uniteblue #Obamacare #tax #spending"			#tcot #Teaparty #p2 #uniteblue #Obamacare #tax #spending	"417802853109862400"	https://twitter.com/thebighoot/status/417802853109862400
	2013-12-30 23:42	0	0	"Is this a joke? Democratic lawmaker: ObamaCare enrollment is low because millions think it was repealed: http:// fxn.ws/1emFRd3"				"417802823649460225"	https://twitter.com/fkmoussa/status/417802823649460225
	2013-12-30 23:42	0	0	"Vending machines to display calories as part of Obamacare http:// goo.gl/fb/XN4TP"				"417802805802717184"	https://twitter.com/invending/status/417802805802717184
	2013-12-30 23:42	0	0	"Obamacare Inc: Allies push White House to name CEO http:// fw.to/8kBvoJS"				"417802797036220416"	https://twitter.com/saintluciewes/status/417802797036220416
	2013-12-30 23:42	0	1	"@majp523 This what you'll have to look forward to #socializedmedicine #obamacare"		@majp523	#socializedmedicine #obamacare	"417802795400437760"	https://twitter.com/GatorBearCA/status/417802795400437760
	2013-12-30 23:42	0	0	"Health Insurers Are Being Battered By Obamacare , And They Deserve It - Forbes http:// onforb.es/1cRxCbP"				"417802784335872001"	https://twitter.com/BIOPHYSIX/status/417802784335872001
	2013-12-30 23:41	1	0	"Our glorious future: Obamacare ! http:// ift.tt/19xN9xg"				"417802770180481024"	https://twitter.com/MEAN_MARINE/status/417802770180481024
	2013-12-30 23:41	1	0	"Doctor Forces Howard Dean to Retract Rosy Obamacare Prognosis - http:// ConservativeVideos.com http:// conservativevideos.com/2013/12/doctor -forces-howard-dean-retract-rosy-obamacare-prognosis/ …"				"417802764559724544"	https://twitter.com/sokeijarhead/status/417802764559724544
	2013-12-30 23:41	0	0	"@Crossfire @GovHowardDean #Crossfire Let me guess. SE is going to blame the ACA for all the world problems?"		@Crossfire @GovHowardDean	#Crossfire	"417802724453777409"	https://twitter.com/mag_mur/status/417802724453777409
	2013-12-30 23:41	0	0	"New Year, new laws: Obamacare , pot, guns and drones http:// ift.tt/18UAmEl #breaking #news #popular"			#breaking #news #popular	"417802714610167808"	https://twitter.com/_ArthurDent_/status/417802714610167808
	2013-12-30 23:41	5	4	"ObamaCare Revealed Obama For What He Was, But What Will GOP Do? http:// invst.rs/4c7gVB #tcot #tlot"			#tcot #tlot	"417802676248649728"	https://twitter.com/IBDeditorials/status/417802676248649728
	2013-12-30 23:41	5	1	"A Large New ObamaCare Tax on Small Business Takes Effect Jan. 1 http:// on.wsj.com/Kfctfq"				"417802674621272064"	https://twitter.com/Lrihendry/status/417802674621272064
	2013-12-30 23:41	0	0	"Whether you're for ACA ( Obamacare ) or not, face the facts: our heath care system sucks. As a member of the... http:// fb.me/2xjp8P57a"				"417802659719290880"	https://twitter.com/drolivas257/status/417802659719290880
	2013-12-30 23:41	0	0	"ObamaCare Revealed Obama For What He Was, But What Will GOP Do?: Whenever we stand on the threshold of a new y... http:// bit.ly/1d4tQql"				"417802652445982720"	https://twitter.com/PatrioticGeek/status/417802652445982720
	2013-12-30 23:41	0	0	"ObamaCare takes another hit –Baptist universities win injunction against HHS mandate… http:// fb.me/2WanBX7Pt"				"417802640899047425"	https://twitter.com/LeftfootLeeds/status/417802640899047425
	2013-12-30 23:41	2	0	"#ACA #OBAMACARE SCORECARD ENROLLED: 1,100,000 CANCELLED: 6,000,000 Tell me some more how well it's going. #ACA @hale_razor @vmpcott"		@hale_razor @vmpcott	#ACA #OBAMACARE #ACA	"417802640610037760"	https://twitter.com/IP4PI/status/417802640610037760
	2013-12-30 23:41	0	0	"Tell the truth you know u support Obama but you know u ain't signed up for obamacare be honest have u"				"417802629855838208"	https://twitter.com/RawDawgBuffalo/status/417802629855838208
	2013-12-30 23:41	0	0	"@repkinzinger #pjnet #noamnesty #securetheborder #nosharialaw #orpuw a vote for amnesty is a vote for obamacare . reagan rued amnesty"		@repkinzinger	#pjnet #noamnesty #securetheborder #nosharialaw #orpuw	"417802626638413824"	https://twitter.com/chickenman246/status/417802626638413824
	2013-12-30 23:41	2	1	"@Marble300 @SenateFloor @HouseFloor @BarackObama Defund ObamaCare ; downsize "non-essential" government workers & programs; NO socialism;"		@Marble300 @SenateFloor @HouseFloor @BarackObama		"417802625149448192"	https://twitter.com/JkbentonJudith/status/417802625149448192
	2013-12-30 23:41	0	0	"Tis the Season to Debate Obamacare http:// po.st/v9CHPO via @phillydotcom"		@phillydotcom		"417802583584292864"	https://twitter.com/libertybelle211/status/417802583584292864
	2013-12-30 23:41	0	0	"@CBSEveningNews fails to mention that 6 million people have lost their insurance due to Obamacare . Net loss of 4 million! Report the FACTS!"		@CBSEveningNews		"417802579079221250"	https://twitter.com/R0am3r/status/417802579079221250
	2013-12-30 23:41	0	0	"Obamacare making up lost ground; sign-ups top 1.1 million | from @gzornick @ThePlumLineGS http:// ow.ly/sa3Hy"		@gzornick @ThePlumLineGS		"417802554127679488"	https://twitter.com/EyeOnInsurance/status/417802554127679488
	2013-12-30 23:41	5	4	"House Democrat blames GOP repeal attempts for low Obamacare enrollment numbers http:// huff.to/1gh4rxQ"				"417802548721233921"	https://twitter.com/HuffPostPol/status/417802548721233921
	2013-12-30 23:41	3	0	"Why @nhgop is so scared. “ @ezraklein : Obamacare just might net its 7 million sign-ups http:// wapo.st/KfqJ8t ” #nhpolitics"		@nhgop @ezraklein	#nhpolitics	"417802537333706752"	https://twitter.com/BrooklineDems/status/417802537333706752
	2013-12-30 23:41	0	0	"Small firms with young workers are hit hardest by #Obamacare http:// politi.co/1bYge3g"			#Obamacare	"417802531461267456"	https://twitter.com/ProsperOrg/status/417802531461267456
	2013-12-30 23:40	0	0	"After ObamaCare ,NSA, Benghazi scandals could 2014 bring course correction for Team Obama?-BEST U S CORRECTION IS IMPEACHMENT OF OBAMA/HOLDER"				"417802515472592897"	https://twitter.com/JJJFLYER/status/417802515472592897
	2013-12-30 23:40	0	0	"Grandpa don't ask dad about obamacare . Actually let's not talk about politics. EVER."				"417802508686610432"	https://twitter.com/ColorPrinter_/status/417802508686610432
	2013-12-30 23:40	0	0	"#News ABC News asks Ted Cruz about Obamacare claims made in coloring book he had nothing to do with [VID... http:// bit.ly/1cRyQE2 #TCOT"			#News #TCOT	"417802500738015232"	https://twitter.com/Briefing__Room/status/417802500738015232
	2013-12-30 23:40	0	1	"A baby seal walked into a club #positivethinking #Obamacare"			#positivethinking #Obamacare	"417802490500120577"	https://twitter.com/Donttellchase/status/417802490500120577
	2013-12-30 23:40	0	0	"Politics: NBC figures out that employees aren't going to like what ObamaCare does in 2014 | Best of Cain http:// ow.ly/sa3NK #tyranny ..."			#tyranny	"417802485890568192"	https://twitter.com/saynoobama/status/417802485890568192
	2013-12-30 23:40	0	0	"@TPM you're a bunch of stupid mother fuckers. Obamacare is a sham."		@TPM		"417802480332722176"	https://twitter.com/TC_HATES_BOATS/status/417802480332722176
	2013-12-30 23:40	0	0	"Eleanor Holmes Norton Blames GOP Repeal Attempts For Low Obamacare Enrollment http:// wp.me/p391Sa-7Cd"				"417802465669414912"	https://twitter.com/ANCHM_USA/status/417802465669414912
	2013-12-30 23:40	0	0	"Ladies...cover yourself. Birth control is covered under the ACA (and I'm not talking abortion), I'm talking BC pill, IUD, diaphragm+"				"417802448867442688"	https://twitter.com/mcgirlnextdoor/status/417802448867442688
	2013-12-30 23:40	1	0	"1.1 MILLION ppl signed up for #obamacare .. #ACA .. winning @BarackObama another 865 signed up on State run sites"		@BarackObama	#obamacare #ACA	"417802447520665601"	https://twitter.com/NancyWonderful/status/417802447520665601
	2013-12-30 23:40	0	0	"Here comes biased slew of reports showing 'success' of #Obamacare @CBSNews propaganda for Obama"		@CBSNews	#Obamacare	"417802441179271168"	https://twitter.com/eRtwngr/status/417802441179271168
	2013-12-30 23:40	0	0	"NBC figures out that employees aren't going to like what ObamaCare does in 2014 http:// fb.me/2dYOaA6Jn"				"417802438716829697"	https://twitter.com/JCReynolds89/status/417802438716829697
	2013-12-30 23:40	0	0	"Thousands scramble to get medical procedures before ObamaCare kicks in http://www. breitbart.com/Big-Government /2013/12/30/Thousands-Scramble-To-Get-Medical-Procedures-Before-Obamacare-Begins …"				"417802368021831680"	https://twitter.com/bandlersbanter/status/417802368021831680
	2013-12-30 23:40	0	0	"Yay #Obamacare ! RT @jimgeraghty : We’re still ending 2013 with more people having lost their insurance than gained it. http:// natl.re/1jZPWn5"		@jimgeraghty	#Obamacare	"417802363295240192"	https://twitter.com/CentennialCCU/status/417802363295240192
	2013-12-30 23:40	0	0	"Obamacare enrollment tops 1 million http:// bit.ly/1inSSrT#.UsIEV BInft4.twitter … via @DCExaminer"		@DCExaminer	#	"417802355602493440"	https://twitter.com/donidoll/status/417802355602493440
	2013-12-30 23:40	1	0	"Surprised? Another #Texas Judge Rules Against #Contraceptive Requirements Under #Obamacare - See more at: http:// ow.ly/s9WuU"			#Texas #Contraceptive #Obamacare	"417802354709528576"	https://twitter.com/AgainstTeaParty/status/417802354709528576
	2013-12-30 23:40	0	0	"You'll C @ACMESalesRep Only 1 hospital takes obamacare in Georgia but ppl can't drive that far 2 get a voter ID... #liberallogic #justsayin"		@ACMESalesRep	#liberallogic #justsayin	"417802338850447360"	https://twitter.com/tony30088/status/417802338850447360
	2013-12-30 23:40	1	1	"After Months of Promoting Obamacare , Obama Admin Quietly Announces a Net Loss of 3 Million Insurance Plans: http://www. tpnn.com/2013/12/30/aft er-months-of-promoting-obamacare-obama-admin-quietly-announces-a-net-loss-of-3-million-insurance-plans/#.UsIDzaGsJQ8.twitter …"			#	"417802284458704897"	https://twitter.com/redarcher171/status/417802284458704897
	2013-12-30 23:40	0	0	"They're trying to tell us how good obamacare is lmao"				"417802277659762688"	https://twitter.com/tim_tinkle/status/417802277659762688
	2013-12-30 23:39	1	0	"Democrat Eleanor Holmes Norton: Obamacare Sign-Ups Low Because Millions of People Think Republicans Repealed the Law http:// shar.es/9o5JL"				"417802271859023872"	https://twitter.com/10thAmendment/status/417802271859023872
	2013-12-30 23:39	0	0	"@gopleader #pjnet #noamnesty #securetheborder #nosharialaw #orpuw a vote for amnesty is a vote for obamacare ."		@gopleader	#pjnet #noamnesty #securetheborder #nosharialaw #orpuw	"417802198823616512"	https://twitter.com/chickenman246/status/417802198823616512
