username;date;retweets;favorites;text;geo;mentions;hashtags;id;permalink
	2013-10-21 23:57	0	0	"Retweet if you want @Sebelius to stop running and start testifying in front of Congress about #Obamacare !"		@Sebelius	#Obamacare	"392439407350800385"	https://twitter.com/AmFutureFund/status/392439407350800385
	2013-10-21 23:57	1	0	"I wrote this: How Obamacare sets us up to get singlepayer later: http:// ow.ly/q2s3U"				"392439406776172544"	https://twitter.com/msbellows/status/392439406776172544
	2013-10-21 23:56	2	2	"Obamacare Will Meet Enrollment Targets Despite Website Glitches http:// thkpr.gs/1i9q2qM #UniteBlue #P2 #TGDN #ccot #tpp #ACA #tcot #mob #CTL"			#UniteBlue #P2 #TGDN #ccot #tpp #ACA #tcot #mob #CTL	"392439393631215616"	https://twitter.com/rjoseph7777/status/392439393631215616
	2013-10-21 23:56	0	0	"PRICELESS! Sean Hannity calls Obamacare hotline, Operator says nobody happy with Obamacare so far http:// fb.me/YmcDJq8x"				"392439390611324928"	https://twitter.com/wgriff/status/392439390611324928
	2013-10-21 23:56	15	6	"RT @consumerreports Obamacare opponents have misrepresented Consumer Reports' position #ACA @healthlawhelper http:// bit.ly/1dcfrgT"		@consumerreports @healthlawhelper	#ACA	"392439388505767936"	https://twitter.com/Racusen44/status/392439388505767936
	2013-10-21 23:56	2	3	"Unable to register at http:// healthcare.gov ? No problem! Just use the dedicated #Obamacare pneumatic tube system pic.twitter.com/SAMfs9fvgN"			#Obamacare	"392439385989197824"	https://twitter.com/notoserfdom/status/392439385989197824
	2013-10-21 23:56	0	0	""Why do you hate Canada?" ~ Jehmoo Whatsherface #aca"			#aca	"392439384613478400"	https://twitter.com/THE_DAILY_BLEAT/status/392439384613478400
	2013-10-21 23:56	0	0	"Hannity Dials Obamacare Call Center, Operator Says No One Likes It http://www. realclearpolitics.com/video/2013/10/ 21/hannity_calls_obamacare_call_center_operator_says_no_one_likes_it_so_far.html#.UmW_BF9Oc3U.twitter … #ctpolitics #ctgop #ctdems #tpp @AFPConnecticut"		@AFPConnecticut	# #ctpolitics #ctgop #ctdems #tpp	"392439383095119872"	https://twitter.com/MichaelHannan4/status/392439383095119872
	2013-10-21 23:56	0	0	"Obamacare hotline is a joke.. Glitches to many people at one time maybe Obamas people need a lesson from Facebook and Twitter #GretaWire"			#GretaWire	"392439378829934593"	https://twitter.com/Canonlygetbeta/status/392439378829934593
	2013-10-21 23:56	0	0	"The Oprah will not sell Obamacare & Consumer Reports says stay away from govt healthcare website & more! http://www. rushlimbaugh.com/daily/2013/10/ 21/guest_host_mark_steyn …"				"392439377387061248"	https://twitter.com/CharlieStegall/status/392439377387061248
	2013-10-21 23:56	0	0	"Obama on #Obamacare : It's time for folks to stop rooting for its failure, because... (poster) pic.twitter.com/xwbIh7Us6Z"			#Obamacare	"392439373691502594"	https://twitter.com/1ideaatatime/status/392439373691502594
	2013-10-21 23:56	0	0	"@gurvirfox5 Obamacare is working EXACTLY as designed. http://www. foxnews.com/opinion/2013/1 0/21/why-obamacare-is-fantastic-success/ …"		@gurvirfox5		"392439372793917440"	https://twitter.com/rodneyaowen/status/392439372793917440
	2013-10-21 23:56	12	8	"I agree with Obama, it is much more than a website--it's the most invasive govt program ever #tcot #Obamacare"			#tcot #Obamacare	"392439371636289536"	https://twitter.com/josephkerry/status/392439371636289536
	2013-10-21 23:56	0	0	"The website AND Obamacare are disasters. @billyscoggins @BenHowellTV"		@billyscoggins @BenHowellTV		"392439369292079105"	https://twitter.com/Anewhomestar/status/392439369292079105
	2013-10-21 23:56	0	0	"//he has a good pnt,also that the site works gr8,dnt signup>RT @Johnnyvulgar : @littlebytesnews Check out the anti- Obamacare Tweet from..."		@Johnnyvulgar @littlebytesnews		"392439366960033792"	https://twitter.com/littlebytesnews/status/392439366960033792
	2013-10-21 23:56	8	6	"it's real simple don't sign up for #Obamacare . don't bow down to the #Dictatorwannabe #Obama and the #Dems pic.twitter.com/kHqrBxhVJW"			#Obamacare #Dictatorwannabe #Obama #Dems	"392439361209245696"	https://twitter.com/rvanhoose1/status/392439361209245696
	2013-10-21 23:56	0	0	"VP Dick Cheney Rails Against ObamaCare http:// news360.com/article/206220 850 …"				"392439360915660801"	https://twitter.com/stellacotton/status/392439360915660801
	2013-10-21 23:56	0	0	"Articles: ObamaCare a Planned Disaster for Political Reasons http://www. americanthinker.com/2013/10/obamac are_a_planned_disaster_for_political_reasons.html#.UmW_PWSnga4.twitter …"			#	"392439358025785344"	https://twitter.com/FeldmanWorldGrp/status/392439358025785344
	2013-10-21 23:56	0	0	"#nowplaying #video McConnell on ACA website glitches, GOP health care strategy http:// bit.ly/1b8Y6kq http:// bit.ly/151qW1d #socialmedia"			#nowplaying #video #socialmedia	"392439357367259136"	https://twitter.com/Watchinga/status/392439357367259136
	2013-10-21 23:56	0	0	"Shithead Dennis Miller: Fire employees who support Obamacare http:// zite.to/1aytk2D"				"392439340150034432"	https://twitter.com/alaskarebel/status/392439340150034432
	2013-10-21 23:56	0	0	". @RepTomGraves . @Kathy_Amidon . @seanhannity . @Sebelius GOP want #ObamaCare gone by Dec? Read Open Letter 3 - http://www. benghazi-truth.blogspot.com/2013/10/open-l etter-to-congress-iii-after-shut.html …"		@RepTomGraves @Kathy_Amidon @seanhannity @Sebelius	#ObamaCare	"392439338836832257"	https://twitter.com/HoneyGee28/status/392439338836832257
	2013-10-21 23:56	0	0	"@DonFarmerNews Obamacare is working EXACTLY as designed. http://www. foxnews.com/opinion/2013/1 0/21/why-obamacare-is-fantastic-success/ …"		@DonFarmerNews		"392439338492891136"	https://twitter.com/rodneyaowen/status/392439338492891136
	2013-10-21 23:56	0	0	"Hannity Dials #Obamacare Call Center, Operator Says No One Likes It: #PA #TX #UT #WA #WI #WY #OR #FairnessForAll #Tcot http://www. realclearpolitics.com/video/2013/10/ 21/hannity_calls_obamacare_call_center_operator_says_no_one_likes_it_so_far.html#.UmW63EIMheo.twitter …"			#Obamacare #PA #TX #UT #WA #WI #WY #OR #FairnessForAll #Tcot #	"392439334533472257"	https://twitter.com/Croatansound/status/392439334533472257
	2013-10-21 23:56	0	0	"Job Posting: IRS to Hire New Obamacare Agents - http:// civitasreview.com/healthcare/job -posting-irs-to-hire-new-obamacare-agents/ …"				"392439333644271616"	https://twitter.com/mkues65/status/392439333644271616
	2013-10-21 23:56	0	0	"Stay healthy my friend! @hughhewitt : Drinking a New Coke, driving in my Pinto to my Timeshare thinking about my new Obamacare policy"		@hughhewitt		"392439331945594881"	https://twitter.com/snewell4444/status/392439331945594881
	2013-10-21 23:56	0	0	"Video Hannity Dials Obamacare Call Center, Operator Says No One Likes It http:// bit.ly/GYsEfB"				"392439331425513472"	https://twitter.com/karencinderella/status/392439331425513472
	2013-10-21 23:56	0	0	"@AdvisorACA Only 3 of 13 people standing behind @BarackObama actually enrolled in #Obamacare . http:// bit.ly/1cOFgAZ"		@AdvisorACA @BarackObama	#Obamacare	"392439331312254977"	https://twitter.com/mikeliberation/status/392439331312254977
	2013-10-21 23:56	0	0	"#nowplaying #video Inside the ObamaCare numbers http:// bit.ly/16oaU96 http:// bit.ly/151qW1d #socialmedia"			#nowplaying #video #socialmedia	"392439329672265730"	https://twitter.com/Watchinga/status/392439329672265730
	2013-10-21 23:56	0	0	"OBAMACARE SITE WOES White House won't rule out delay of individual mandate: http:// fxn.ws/1gz8oBi"				"392439328854401024"	https://twitter.com/Jim_Peoples_/status/392439328854401024
	2013-10-21 23:56	0	0	"@joesonka . Hey SenRandPaul. Other Than NO ACA Law,Give WE THE PEOPLE 5 Examples Of FRINGE TeaParty/GOP/Libertarian 'Liberty'? Be Specific."		@joesonka		"392439328174927874"	https://twitter.com/RC5251/status/392439328174927874
	2013-10-21 23:56	0	0	"I liked a @YouTube video http:// youtu.be/lBf825uKNI8?a President Obama Catches Fainting Woman During Obamacare Speech"		@YouTube		"392439324232269824"	https://twitter.com/mzaniyah/status/392439324232269824
	2013-10-21 23:56	0	1	"What Obama-Thing is Next After Obamaphones and Obamacare ? http:// warrenwainwright.com/2013/10/whats- after-obamaphones-and-obamacare/ … Conservative Humor. RT if you laugh! #tcot #teaparty"			#tcot #teaparty	"392439318226022400"	https://twitter.com/warrenwainwrigh/status/392439318226022400
	2013-10-21 23:56	8	1	"These "poor" people can't afford an ID but they can afford a computer to get #Obamacare . #Liberals are mentally challenged. @hardball_chris"		@hardball_chris	#Obamacare #Liberals	"392439316087328768"	https://twitter.com/PIRATE1775/status/392439316087328768
	2013-10-21 23:56	1	0	"I worked for a huge telecommunication company. We constantly had tech problems. #ACA will be fixed!"			#ACA	"392439314895757312"	https://twitter.com/sherrilee7/status/392439314895757312
	2013-10-21 23:56	0	0	"Did the Kenyan hire Nigerians to program ObamaCare Website? #BarackObama"			#BarackObama	"392439312639201281"	https://twitter.com/Mulder24/status/392439312639201281
	2013-10-21 23:56	0	0	"#nowplaying #video Chief executive or sales executive? Obama defends ObamaCare http:// bit.ly/1b8Y63G http:// bit.ly/151qW1d #socialmedia"			#nowplaying #video #socialmedia	"392439312391737344"	https://twitter.com/Watchinga/status/392439312391737344
	2013-10-21 23:56	0	0	"New Obamacare Ads Show How ‘Easy’ It Is to Use http:// HealthCare.gov http:// j.mp/16oaTBV #topnews"			#topnews	"392439301918580736"	https://twitter.com/JenniferFoote2/status/392439301918580736
	2013-10-21 23:56	4	2	".@AardvarkBlue You mean deductible? My #obamacare plan is $400/mo, $6350 deductible. Bronze. Terrible. @ABetterBargain @vj44 @JohnKasich"		@AardvarkBlue @ABetterBargain @vj44 @JohnKasich	#obamacare	"392439299217448960"	https://twitter.com/corrcomm/status/392439299217448960
	2013-10-21 23:56	0	0	"Obamacare : Your guide to health insurance terms http://www. cnn.com/2013/09/26/hea lth/obamacare-glossary/index.html?sr=sharebar_twitter …"				"392439293248946176"	https://twitter.com/NoBigGovDuh/status/392439293248946176
	2013-10-21 23:56	0	0	"Military members and families, the Commander in Chief is also in charge of the Obamacare rollout, that can't make you feel good."				"392439288693940224"	https://twitter.com/BillPowers9/status/392439288693940224
	2013-10-21 23:56	0	0	"$300 million price tag for Obamacare site http:// money.cnn.com/2013/10/21/tec hnology/obamacare-website-contracts/index.html …"				"392439286219681792"	https://twitter.com/Joey_Drago_/status/392439286219681792
	2013-10-21 23:56	0	8	"rip thank you for the past 4 years and winning me NCA 2x, CheerSport, ACA , and others i forgot. love you nfinities! pic.twitter.com/A6qbouAEiG"				"392439279705530368"	https://twitter.com/mikayla_lewison/status/392439279705530368
	2013-10-21 23:56	2	0	"#Obamacare The efficiency of Amtrak coupled with the compassion of the #IRS ."			#Obamacare #IRS	"392439279286484992"	https://twitter.com/NJ_Ronin/status/392439279286484992
	2013-10-21 23:56	0	0	"@firstadopter @politico the GOP would destroy anyone who worked on Obamacare ACA no way to shield then . Could be Gates etc then a attack"		@firstadopter @politico		"392439277625569280"	https://twitter.com/mybeachhouse2/status/392439277625569280
	2013-10-21 23:56	0	1	"President Obama Catches Fainting Woman at ObamaCare Speech http:// ezkool.com/2013/10/presid ent-obama-catches-fainting-woman-at-obamacare-speech/ … #BarackObama #ObamaCare #POTUS #P2 #tcot"			#BarackObama #ObamaCare #POTUS #P2 #tcot	"392439271665053696"	https://twitter.com/EzKool/status/392439271665053696
	2013-10-21 23:56	0	0	"SHIT RT @MarvB_ : iCry. RT @Aqua174 : Is the Obamacare website hosted by GeoCities or Angelfire?"		@MarvB_ @Aqua174		"392439270033481729"	https://twitter.com/BrunchGod/status/392439270033481729
	2013-10-21 23:56	0	0	"Embattled Sebelius to testify next week on #ObamaCare rollout - The Hill's Healthwatch http:// thehill.com/blogs/healthwa tch/health-reform-implementation/329707-embattled-sebelius-to-testify-next-week-on-obamacare-rollout …"			#ObamaCare	"392439267944706049"	https://twitter.com/frLarousse2/status/392439267944706049
	2013-10-21 23:56	0	0	"Liberals feel crush of ObamaCare http:// onenewsnow.com//perspectives/ matt-barber/2013/10/21/liberals-feel-crush-of-obamacare …"				"392439257463136256"	https://twitter.com/Yonadav7/status/392439257463136256
	2013-10-21 23:56	0	0	"The #obamacare enrollment disaster, is a typical example of federal run programs. #tcot #MakeDCListen #teaparty #defundobamacare"			#obamacare #tcot #MakeDCListen #teaparty #defundobamacare	"392439256314302464"	https://twitter.com/TrueFreedomUSA/status/392439256314302464
	2013-10-21 23:56	0	0	"While the try to fix ACA website, acorn , illegal aliens are being paid with our $$$$$$."				"392439252753342464"	https://twitter.com/Lisalolaann/status/392439252753342464
	2013-10-21 23:56	0	0	"The GOP will run on being able to better manage Obamacare websites in 2014! LOL #thanksliberals"			#thanksliberals	"392439248097259521"	https://twitter.com/ladyc10/status/392439248097259521
	2013-10-21 23:56	0	0	"Consumer Reports On Obamacare : ‘Stay Away’ - http:// blog.tonyjohnson.net/2013/10/consum er-reports-on-obamacare-stay-away/ …"				"392439237011714048"	https://twitter.com/wtpcnews/status/392439237011714048
	2013-10-21 23:56	0	0	"5 things that have happened since Obamacare launched - CNN http:// news.google.com/news/url?sa=t& fd=R&usg=AFQjCNFjaVTrQmaSoe-oFneAKtPZRQNGZQ&url=http://www.cnn.com/2013/10/19/health/obamacare-enrollment-launch-overview/?hpt%3Dhp_t3 …"				"392439234155409408"	https://twitter.com/gnews_us/status/392439234155409408
	2013-10-21 23:56	0	0	"Troubled Obamacare website wasn't tested until a week before launch http:// bit.ly/16iSKAc#.UmW-U HrEcQ0.twitter … via @DCExaminer"		@DCExaminer	#	"392439228174323712"	https://twitter.com/Busy_CJ/status/392439228174323712
	2013-10-21 23:56	0	0	"New post: Obama: &#039;No excuse&#039; for Obamacare website http:// whatisseox.com/obama-no-excus e-for-obamacare-website/ …"			#039 #039	"392439221337600000"	https://twitter.com/whatisseo1/status/392439221337600000
	2013-10-21 23:56	0	0	"New, Improved Obamacare program released on 35 floppy disks. http:// fb.me/3tkR2x5NX"				"392439218066046976"	https://twitter.com/Flyswatter/status/392439218066046976
	2013-10-21 23:56	0	0	"Consumer Reports Pans Obamacare ; Constitutional Amendment Would End Congressional Exemptions; Army Chief Frets Ove... http:// blog.tonyjohnson.net/2013/10/consum er-reports-pans-obamacare-constitutional-amendment-would-end-congressional-exemptions-army-chief-frets-over-preparedness-and-manpower-gop-stones-ted-cruz-ron-paul-debt-ceiling-deal/ …"				"392439215994068992"	https://twitter.com/wtpcnews/status/392439215994068992
	2013-10-21 23:56	0	0	"@jimmydaleanders INSURANCE, IDONT WANT TO PAY A PENALTY FOR OBAMACARE IF I ALREADY HAVE INSURURANCE It'S CALLED ROBBING PEOPLE !"		@jimmydaleanders		"392439200978436096"	https://twitter.com/jimmydaleanders/status/392439200978436096
	2013-10-21 23:56	0	0	"“ @Forbes : Obamacare 's next shoe to drop: hidden costs http:// onforb.es/182oAkk ” I don't believe it ! @bw_oleary"		@Forbes @bw_oleary		"392439195069071360"	https://twitter.com/TheReal_BNaz/status/392439195069071360
	2013-10-21 23:56	0	0	"Obamacare Raising Premiums, Hurting Middle, Lower Class http:// bit.ly/19YUO2S"				"392439193793994753"	https://twitter.com/MRDIRK49/status/392439193793994753
	2013-10-21 23:56	6	1	"Microsoft @ie offers to help obamacare site. Just what we need Blue Screen of Death Panels."		@ie		"392439180997185536"	https://twitter.com/CurtJester/status/392439180997185536
	2013-10-21 23:56	2	2	"Obamacare website. pic.twitter.com/13fU9xmO0n"				"392439180485468160"	https://twitter.com/Arizona_Blonde/status/392439180485468160
	2013-10-21 23:56	0	0	"Sebelius expected to appear at U.S. House panel on Obamacare rollout http:// bit.ly/1aBf5Kv"				"392439178702512128"	https://twitter.com/CyG_US/status/392439178702512128
	2013-10-21 23:56	0	0	". @Kathy_Amidon . @RepTomGraves . @seanhannity GOP want #ObamaCare gone by Dec? Read Open Letter 3 written by Frank - http://www. benghazi-truth.blogspot.com/2013/10/open-l etter-to-congress-iii-after-shut.html …"		@Kathy_Amidon @RepTomGraves @seanhannity	#ObamaCare	"392439175355437056"	https://twitter.com/HoneyGee28/status/392439175355437056
	2013-10-21 23:56	0	0	". @JakeMillerWis Yes, we Republicans are fighting the horrible piece of crap #ObamaCare . Because unlike you, we love America & Americans."		@JakeMillerWis	#ObamaCare	"392439172486549504"	https://twitter.com/ProtestManager/status/392439172486549504
	2013-10-21 23:56	2	0	"If they don't want Obamacare , can the americans get Obamanime at least?"				"392439170343247872"	https://twitter.com/JolanJoestar/status/392439170343247872
	2013-10-21 23:56	1	0	"@janet_sistare @mmfa This revelation on #Hannity 's fake #Obamacare victims is not a surprise,just extremely sad,the man has no #Honour"		@janet_sistare @mmfa	#Hannity #Obamacare #Honour	"392439167210496000"	https://twitter.com/DanielDanny4755/status/392439167210496000
	2013-10-21 23:56	0	0	"What did y'all think of that #PsyOp today when Obama stopped his #Obamacare speech to tend to the pregnant woman who had passed out?"			#PsyOp #Obamacare	"392439162877399040"	https://twitter.com/AlexLFz/status/392439162877399040
	2013-10-21 23:56	15	4	"Watching "Ishtar" on Betamax while calling ObamaCare 's tech support service on a rotary phone. #ItsReallyGood @hughhewitt"		@hughhewitt	#ItsReallyGood	"392439157584166912"	https://twitter.com/JimDelRey/status/392439157584166912
	2013-10-21 23:56	0	0	"The #IRS will take over #Obamacare signup as part of income verification. GOP establishment only fell into the path of the Trojan Horse."			#IRS #Obamacare	"392439154883047424"	https://twitter.com/DixieRedRocket/status/392439154883047424
	2013-10-21 23:55	0	0	"KSDK: Wentzville family loses health insurance, blames Obamacare : It looks like all of thos... http:// on.ksdk.com/18EaKsQ via @ksdknews #stl"		@ksdknews	#stl	"392439144179171328"	https://twitter.com/stlnews/status/392439144179171328
	2013-10-21 23:55	0	1	"“@RMG1225: Liberals. Doing to your healthcare what they did to Detroit. #Obamacare #Fail https://twitter.com/RMG1225/status/392376700841246721/photo/1 pic.twitter.com/5POietwyE2 ”"		@RMG1225	#Obamacare #Fail	"392439137304715264"	https://twitter.com/LovinLifeBG/status/392439137304715264
	2013-10-21 23:55	0	0	"AP's Julie Pace: White House Lying About Not Having ObamaCare Enrollment Numbers http:// shar.es/EV6Bp via @BreitbartNews"		@BreitbartNews		"392439129411043328"	https://twitter.com/twixiter/status/392439129411043328
	2013-10-21 23:55	0	0	"“ @Toure : CNN poll: Obamacare more popular than Republicans http://www. dailykos.com/story/2013/10/ 21/1249285/-CNN-poll-Obamacare-more-popular-than-Republicans … ” pic.twitter.com/wHqceB7Sbl"		@Toure		"392439116324810752"	https://twitter.com/DerrickWyrms/status/392439116324810752
	2013-10-21 23:55	1	0	"More News You Won't Being Hearing Much Abt in Left Wing Media #ObamaCare #RedSox #UniteBlue #CtL #GOP #tcot #TeaParty http:// bostonherald.com/news_opinion/c olumnists/howie_carr/2013/10/carr_no_tally_on_our_tab_for_the_tsarnaevs …"			#ObamaCare #RedSox #UniteBlue #CtL #GOP #tcot #TeaParty	"392439111279054848"	https://twitter.com/JohnLaraway/status/392439111279054848
	2013-10-21 23:55	0	1	"THANKS OBAMACARE !!! RT @carolynryan : In 1936, you could buy 9 marijuana cigarettes for $1 in NYC. #bloombergruinedev http:// nyti.ms/17OVAfY"		@carolynryan	#bloombergruinedev	"392439109483917312"	https://twitter.com/SconsetCapital/status/392439109483917312
	2013-10-21 23:55	0	0	"How many people onstage with Obama today have successfully enrolled in ObamaCare ? « Hot Air http:// hotair.com/archives/2013/ 10/21/how-many-people-onstage-with-obama-today-have-successfully-enrolled-in-obamacare/ …"				"392439102546513920"	https://twitter.com/kineticamerica/status/392439102546513920
	2013-10-21 23:55	0	0	"Did Oprah turn down an invitation to help promote Obamacare ? – Glenn Beck http://www. glennbeck.com/2013/10/21/did -oprah-turn-down-an-invitation-to-help-promote-obamacare/ … via @glennbeck"		@glennbeck		"392439097509171200"	https://twitter.com/jimaw63/status/392439097509171200
	2013-10-21 23:55	0	0	"" @AdamBaldwin : “ #Obamacare isn’t a trainwreck. It’s purposeful suicide. ” - http://www. foxnews.com/opinion/2013/1 0/21/why-obamacare-is-fantastic-success/ … ~ #GreatSuccess " @AnthonyCumia"		@AdamBaldwin @AnthonyCumia	#Obamacare #GreatSuccess	"392439094007304193"	https://twitter.com/SandDreamr/status/392439094007304193
	2013-10-21 23:55	0	0	"Waiting a month to fix Obamacare website is so much worse than waiting 40 years for Universal Health Care. How?"				"392439084464869376"	https://twitter.com/organicdemocrat/status/392439084464869376
	2013-10-21 23:55	0	0	"@Politicians If it cannot be proven that The ACA is a fraudulent law, then using innocent people's livelihood, as a tool to un-fund it is..."		@Politicians		"392439079859920896"	https://twitter.com/thmissinglink/status/392439079859920896
	2013-10-21 23:55	3	2	"Sebelius's biggest problem isn't ObamaCare ...It's nobody told her the John Adams hairdo went out of style 200 yrs ago http://www. ammunitiondepot.com /"				"392439075913101312"	https://twitter.com/AmmunitionDepot/status/392439075913101312
	2013-10-21 23:55	0	0	"“ @MedSymptoms : If #ObamaCare isn't good enough for them, how could it be good enough for you? #health #medicine #reason @SpeakerBoehner"		@MedSymptoms @SpeakerBoehner	#ObamaCare #health #medicine #reason	"392439075057451008"	https://twitter.com/PKampmeyer/status/392439075057451008
	2013-10-21 23:55	2	0	"At least train wrecks are cool to watch. #Obamacare"			#Obamacare	"392439072620163073"	https://twitter.com/GOPcomedy/status/392439072620163073
	2013-10-21 23:55	0	0	"@jtLOL I wanted to sign up for Obamacare , but I flunked Sanskrit at junior college."		@jtLOL		"392439071689019392"	https://twitter.com/austex63/status/392439071689019392
	2013-10-21 23:55	0	0	"New post: Why is the Obamacare website so bad? http:// lavalordz.com/why-is-the-oba macare-website-so-bad/ …"				"392439068715253760"	https://twitter.com/LAVALORDZ/status/392439068715253760
	2013-10-21 23:55	0	0	"So how much is this new health insurance call center costing us??? #greta #Obamacare #taxdollars"			#greta #Obamacare #taxdollars	"392439043243646976"	https://twitter.com/GerrysPhotos/status/392439043243646976
	2013-10-21 23:55	0	1	"RT @laloalcaraz : @padredog69 but by their logic we have to end the ACA because website. Or be like me and find a licensed broker"		@laloalcaraz @padredog69		"392439037727735808"	https://twitter.com/padredog69/status/392439037727735808
	2013-10-21 23:55	0	0	"Privilege is crazy....especially when you aren't from it & see it happening...(ie " Obamacare " is a baddddd word around these parts)"				"392439035332800512"	https://twitter.com/2Scheme/status/392439035332800512
	2013-10-21 23:55	0	0	"Sign the petition 2Delay, Defund, & Defeat #ObamaCare - Join me in signing this important petition via @ACLJ http:// aclj.us/q3a8"		@ACLJ	#ObamaCare	"392439034066513921"	https://twitter.com/Dying2bRight/status/392439034066513921
	2013-10-21 23:55	0	0	"HAPPY TALK: Obamacare mess is opportunity for Valley hackfest - Breakingviews http:// reut.rs/H6X53t"				"392439032333864960"	https://twitter.com/cbinflux/status/392439032333864960
	2013-10-21 23:55	0	0	"Video: Ted Cruz rejects the “let it burn” approach to ObamaCare « Hot Air http:// hotair.com/archives/2013/ 10/21/video-ted-cruz-rejects-the-let-it-burn-approach-to-obamacare/ … via @hotairblog"		@hotairblog		"392439031767642112"	https://twitter.com/pshill2010/status/392439031767642112
	2013-10-21 23:55	0	0	"Hundreds of millions wasted on ACA website, how many millions more money can they waste "fixing" it? No one spends money like BO #greta"			#greta	"392439030736248832"	https://twitter.com/darylruss/status/392439030736248832
	2013-10-21 23:55	0	0	"Woman Nearly Faints At Speech On Obamacare Problems &amp; The “Fainting Near Obama” Trend Video | International http:// b4in.info/rN1g"				"392439030203559936"	https://twitter.com/NewsNew9/status/392439030203559936
	2013-10-21 23:55	0	0	"Will one of my friends 'splain why ACA website was not built in #Drupal ? Cause, http:// whitehouse.org runs good & stays up, you know?"			#Drupal	"392439027917279232"	https://twitter.com/CharlotteAnne/status/392439027917279232
	2013-10-21 23:55	0	0	"Step up, Blues, Kaiser, Aetna, Humana! http:// health.usnews.com/health-plans/n ational-insurance-companies … You could enroll ACA accounts TODAY! R U Helping or Standing back and hurting?"				"392439018844987392"	https://twitter.com/TerraMarQue/status/392439018844987392
	2013-10-21 23:55	2	0	"Your Guide To Obamacare ’s Bumpy Rollout http:// thkpr.gs/1i8vJoV via @TPHealth"		@TPHealth		"392439015787343875"	https://twitter.com/SayNoToGOP/status/392439015787343875
	2013-10-21 23:55	6	1	"Ohio Controlling Board hands @JohnKasich #Obamacare win http:// mediatrackers.org/ohio/2013/10/2 1/ohio-controlling-board-hands-kasich-obamacare-win … cc @OhioLiberty @BuckeyeNow @OppOhio @bdomenech @philipaklein"		@JohnKasich @OhioLiberty @BuckeyeNow @OppOhio @bdomenech @philipaklein	#Obamacare	"392439012796805121"	https://twitter.com/jasonahart/status/392439012796805121
	2013-10-21 23:55	0	0	"@GlobalGrind <--Rag Tweet Sounds Like A Carnival Barkers Who is Skull Screwed #ACA Speech Was Honest n PBO Helped A Lady Who Became Faint"		@GlobalGrind	#ACA	"392439003921670144"	https://twitter.com/havewhatusay/status/392439003921670144
