username;date;retweets;favorites;text;geo;mentions;hashtags;id;permalink
	2012-06-25 22:56	0	0	"If ObamaCare is struck down, would Americans miss it? http:// dlvr.it/1mPgKt"				"217390733567590400"	https://twitter.com/secondreport/status/217390733567590400
	2012-06-25 22:55	0	0	"RT @lawyersoftware2012While We’re Waiting For Obamacare , It’s All About The Dissents When justices stop being polite … and st #lawyer ..."		@lawyersoftware2012While	#lawyer	"217390710482157573"	https://twitter.com/UCcjs/status/217390710482157573
	2012-06-25 22:55	0	0	"@ShannonBream My question is any thoughts on whether the CJ assigning the case to Kennedy was part of a grand compromise or bargain on ACA ?"		@ShannonBream		"217390680740343808"	https://twitter.com/PokerDad1/status/217390680740343808
	2012-06-25 22:55	9	2	"@KurtSchlichter There was no crisis before...but there is now. My health insurance deductible DOUBLED this year because of Obamacare ."		@KurtSchlichter		"217390497965158400"	https://twitter.com/KneeOhKhan/status/217390497965158400
	2012-06-25 22:54	0	0	"@crescentcomp we need fewer firefighters b/c #obama spent all his money on his #union friends and #obamacare . #p2 #p2b"		@crescentcomp	#obama #union #obamacare #p2 #p2b	"217390377953525760"	https://twitter.com/zypldot/status/217390377953525760
	2012-06-25 22:54	0	0	"Obamacare and the Mandate Hype http:// huff.to/NtsaKy via @HuffPostPol Read this. We need the AHCA"		@HuffPostPol		"217390361918701568"	https://twitter.com/3nanna32/status/217390361918701568
	2012-06-25 22:54	0	0	"So caught up in the #ACA ruling I just realized SCOTIA ruled on the Arizona immigration bill today. #healthcarepolicymentalvaccum"			#ACA #healthcarepolicymentalvaccum	"217390286542864385"	https://twitter.com/jarodkeith/status/217390286542864385
	2012-06-25 22:54	1	0	"On SB1070 #SCOTUS struck it down with a non decision on final part pending future litigation, could they do something similar with #ACA ?"			#SCOTUS #ACA	"217390265214832640"	https://twitter.com/azmoderate/status/217390265214832640
	2012-06-25 22:54	0	0	"CBS's O'Donnell: Court Striking Down ObamaCare 'Might Be Better For The President' | Media Research Centehttp://shar.es/skOrX via @sharethis"		@sharethis		"217390254737465345"	https://twitter.com/chevycap1948/status/217390254737465345
	2012-06-25 22:54	7	0	"Romney Confirms He Will Deny Insurance To Millions With Pre-Existing Conditions If Obamacare Is Struck Down http:// thkpr.gs/LhP1tM via @TP"		@TP		"217390249393922049"	https://twitter.com/WorkingDemocrat/status/217390249393922049
	2012-06-25 22:53	0	0	"ACA Board Election July 12, 2012 "Seat #4 Available Expires 2014" http:// goo.gl/Jajcv"			#4	"217390180666048516"	https://twitter.com/ACAGriffins/status/217390180666048516
	2012-06-25 22:53	0	0	"@speedyredhawk on the other hand, while Kennedy is the linchpin here I'm not so certain that Roberts is completely against ACA ."		@speedyredhawk		"217390166661275648"	https://twitter.com/Bran_InTheArena/status/217390166661275648
	2012-06-25 22:53	1	0	"Healthcare decision expected Thursday. http:// bit.ly/MoE5v9 If #SCOTUS strikes down #ACA #HCR , what should be our next move?"			#SCOTUS #ACA #HCR	"217390091969118208"	https://twitter.com/progBuzz/status/217390091969118208
	2012-06-25 22:53	0	0	"My thought too. RT @dlb703 : #MarkLevin blew a gasket over Chief Justice Roberts AZ vote. Bad indicator for Roberts' #Obamacare position?"		@dlb703	#MarkLevin #Obamacare	"217390060989980672"	https://twitter.com/cchanldy/status/217390060989980672
	2012-06-25 22:52	0	0	"@amaeryllis Is it possible SCOTUS weakens ACA but doesn't spear the i.m.? That would be max frustration, or, uhm, "blue balls.""		@amaeryllis		"217389949656367104"	https://twitter.com/JolIyRoger/status/217389949656367104
	2012-06-25 22:52	0	0	"Cube: CUBA GETS 10% OF OBAMACARE FUNDS http:// bit.ly/MNeZ8l"				"217389896208363520"	https://twitter.com/ThePeoplesTwitt/status/217389896208363520
	2012-06-25 22:52	0	0	"@akgabriel Certainly - But plan B is that opponents of Obamacare will rally if it is allowed to stand, and he gets SWAMPED in Nov."		@akgabriel		"217389853111877632"	https://twitter.com/juanitocabrone/status/217389853111877632
	2012-06-25 22:52	0	0	"Bill Clinton Warns About Supreme Court Ruling Against Obamacare http://www. thedailybeast.com/articles/2012/ 06/25/bill-clinton-warns-about-supreme-court-ruling-against-obamacare.html … via @thedailybeast"		@thedailybeast		"217389782282665984"	https://twitter.com/annagueye/status/217389782282665984
	2012-06-25 22:52	0	0	"Roberts is probably writing the ObamaCare opinion. What does that tell us? « Hot Air http:// hotair.com/archives/2012/ 06/25/roberts-is-probably-writing-the-obamacare-opinion-what-does-that-tell-us/ … via @hotairblog"		@hotairblog		"217389738951315457"	https://twitter.com/starramblings/status/217389738951315457
	2012-06-25 22:52	0	0	"While We’re Waiting For #Obamacare , It’s All About The Dissents http:// dlvr.it/1mPdnl"			#Obamacare	"217389723864416257"	https://twitter.com/AbcMediaNetWork/status/217389723864416257
	2012-06-25 22:52	0	0	"While We’re Waiting For Obamacare , It’s All About The Dissents http:// dlvr.it/1mPdlK"				"217389720827731968"	https://twitter.com/WHATSLEGALTODAY/status/217389720827731968
	2012-06-25 22:51	1	0	"I'm wondering if #SCOTUS won't uphold #ACA in it's entirety with a hold out final decision on the individual mandate til it takes effect 6-3"			#SCOTUS #ACA	"217389638665510912"	https://twitter.com/azmoderate/status/217389638665510912
	2012-06-25 22:51	1	0	"CHCF's Marian Mulkey on the #SCOTUS #ACA decision, Thursday on KQED Radio's The California Report. http://www. californiareport.org /"			#SCOTUS #ACA	"217389574538805250"	https://twitter.com/CHCFNews/status/217389574538805250
	2012-06-25 22:51	0	0	"Obamacare Saves Seniors $3.7 Billion So Republicans Want To Take It Away http:// p.ost.im/p/e3Ujaw via @AddInfoOrg"		@AddInfoOrg		"217389550983581696"	https://twitter.com/WorkingDemocrat/status/217389550983581696
	2012-06-25 22:51	0	0	"Obamacare and the Mandate Hype http:// huff.to/NtsaKy via @HuffPostPol"		@HuffPostPol		"217389546751524864"	https://twitter.com/coedh/status/217389546751524864
	2012-06-25 22:51	0	0	"" @RNCResearch : WATCH: Halperin: No Matter SCOTUS Decision On #ObamaCare , Obama Loses http:// youtu.be/KREEHqflQkI (Video)""		@RNCResearch	#ObamaCare	"217389492506599424"	https://twitter.com/susanmw/status/217389492506599424
	2012-06-25 22:50	0	0	"@ThePlumLineGS @theonlyadult . It's not "most major provisions" tht cause dislike for ACA . It's the circus to pass it, its complexity & cost."		@ThePlumLineGS @theonlyadult		"217389409794920448"	https://twitter.com/AndersHoltz/status/217389409794920448
	2012-06-25 22:50	0	0	"Hopefully obamacare will be able to keep key pieces that actually help men women and children #Obamacare"			#Obamacare	"217389307491663872"	https://twitter.com/Lo_income/status/217389307491663872
	2012-06-25 22:50	0	0	"Did #SCOTUS conservatives pairing with the liberals today on SB 1070 give SCOTUS cover to strike down #Obamacare in its entirety?"			#SCOTUS #Obamacare	"217389304169766913"	https://twitter.com/appleacolyte/status/217389304169766913
	2012-06-25 22:50	0	0	"CBS's O'Donnell: Court Striking Down ObamaCare 'Might Be Better For The President' http:// shar.es/skDzP Ha! Thats some major spin."				"217389303213457409"	https://twitter.com/txchick4mitt/status/217389303213457409
	2012-06-25 22:50	0	0	"While We’re Waiting For Obamacare , It’s All About The Dissents When justices stop being polite … and st #lawyers http:// goo.gl/8Esam"			#lawyers	"217389283500232704"	https://twitter.com/lawyersoftware/status/217389283500232704
	2012-06-25 22:50	0	0	"I think we're all prepared for this ueber-politicized SCOTUS to vote GOP on ACA tomorrow, eh? #ScaliaDreamTeam"			#ScaliaDreamTeam	"217389277372350464"	https://twitter.com/expatina/status/217389277372350464
	2012-06-25 22:50	2	0	"Palin: “Death Panel” Three Years Later http:// bit.ly/MwMnQ7 #tcot #tsot #LNYHBT @seanhannity #iamthemob #twisters #Obamacare #SCOTUS"		@seanhannity	#tcot #tsot #LNYHBT #iamthemob #twisters #Obamacare #SCOTUS	"217389275795296257"	https://twitter.com/jackiesic/status/217389275795296257
	2012-06-25 22:50	1	0	"#JusticeScalia is a partisan hack disguised as SC magistrate. His dissent on AZ & Q?'s on recent ACA over the top. http:// abcn.ws/MMxAmH"			#JusticeScalia	"217389265263411202"	https://twitter.com/DrGianRico/status/217389265263411202
	2012-06-25 22:49	0	0	"Protecting Religious Liberty from Obamacare http:// blog.heritage.org/2012/06/25/mor ning-bell-protecting-religious-liberty-from-obamacare/ …"				"217389181721255937"	https://twitter.com/dontspeakforme/status/217389181721255937
	2012-06-25 22:49	0	0	"Paul: Obamacare 's defenders lack 'constitutional principles' | The Daily Caller http:// thedc.com/Ml33Oo"				"217389177241731072"	https://twitter.com/johnbeatle/status/217389177241731072
	2012-06-25 22:49	0	0	"@gottahavej Hopefully ObamaCare will be ruled Unconstitutional.Holder will be held in contempt and DEBBY gone :)"		@gottahavej		"217389148691116033"	https://twitter.com/101PCHCruzGirl/status/217389148691116033
	2012-06-25 22:49	0	0	"RT @TheAtlanticPOL : Memo to Congress: You're in the Hot Seat If Obamacare Is Overturned http://www. theatlantic.com/politics/archi ve/2012/06/memo-to-congress-youre-in-the-hot-seat-if-obamacare-is-overturned/258944/ … #SCOTUS #Obamacare"		@TheAtlanticPOL	#SCOTUS #Obamacare	"217389148582064128"	https://twitter.com/YDofSC/status/217389148582064128
	2012-06-25 22:49	0	0	"@CliftonCrawley Obamacare is a TAX that is why the IRS is poised to enforce it, just like it enforces other taxes"		@CliftonCrawley		"217389107117174784"	https://twitter.com/realfernyvette/status/217389107117174784
	2012-06-25 22:49	0	0	"Obamacare is a very gray-area issue: on one hand, millions of lives could be saved; on the other: "OBAMA HATES FREEDOM! GACK!""				"217389100121079809"	https://twitter.com/gregstevens/status/217389100121079809
	2012-06-25 22:49	0	0	"Read: Morning Bell: Protecting Religious Liberty from Obamacare http:// bit.ly/Ns80k5 #TeaParty #TCOT"			#TeaParty #TCOT	"217389070752563200"	https://twitter.com/NorEastTeaParty/status/217389070752563200
	2012-06-25 22:49	0	0	"#Obama ’s court victory today sets up bigger defeat later http:// wp.me/p2uVH4-3f #Immigration #ObamaCare #HealthCare #GOP #SCOTUS"			#Obama #Immigration #ObamaCare #HealthCare #GOP #SCOTUS	"217389062103908352"	https://twitter.com/GOPME2/status/217389062103908352
	2012-06-25 22:49	0	0	"@JoeKleinTIME How can you look at the 235M the Rights used to trash the ACA but still blame Obama? That's absurd. #hardball"		@JoeKleinTIME	#hardball	"217389058471624704"	https://twitter.com/exaltedroots/status/217389058471624704
	2012-06-25 22:49	0	0	"Thanks to the #ACA , nearly 114K Michigan families will receive an average health insurance rebate of $214: http:// OFA.BO/pqBT91 via @freep"		@freep	#ACA	"217389050812829697"	https://twitter.com/TeamRomulusOFA/status/217389050812829697
	2012-06-25 22:48	5	1	"POLL: Americans Support Obamacare Provisions, Oppose Obamacare http:// thkpr.gs/ND9g7D via @thinkprogress"		@thinkprogress		"217388923637346304"	https://twitter.com/sweetnonnie/status/217388923637346304
	2012-06-25 22:48	0	0	"Prediction: Wailing/gnashing of teeth on left if Obamacare is overturned will make it impossible for conservatives to resist gloating."				"217388918599979008"	https://twitter.com/NickBaumann/status/217388918599979008
	2012-06-25 22:48	0	0	"@CliftonCrawley Not in all circumstances. So you admit that Obamacare is a TAX, not universal health insurance."		@CliftonCrawley		"217388896080773123"	https://twitter.com/realfernyvette/status/217388896080773123
	2012-06-25 22:48	0	0	"Y TU VIENE PA ACA :O ? RT @FabianaRomanM : You're never too old for disney -2"		@FabianaRomanM		"217388895652950016"	https://twitter.com/ArleneYasmin/status/217388895652950016
	2012-06-25 22:48	0	0	"@DavidLimbaugh After #SB1070 ruling today, I have no confidence that the Court will strike #Obamacare ."		@DavidLimbaugh	#SB1070 #Obamacare	"217388894105247746"	https://twitter.com/pf2adr/status/217388894105247746
	2012-06-25 22:48	0	0	"#OK Dr #AmiSiems http:// ow.ly/1O8unA & #ConcernedWomenForAmerica http:// ow.ly/1O8unz #Lying about the #AffordableCareAct #Obamacare #HCR"			#OK #AmiSiems #ConcernedWomenForAmerica #Lying #AffordableCareAct #Obamacare #HCR	"217388847758188545"	https://twitter.com/LiberalMunky/status/217388847758188545
	2012-06-25 22:48	0	0	"Appeals-Court Decision Gives Roberts A Way To Uphold #Obamacare http:// shar.es/skDvw #ACA #SCOTUS #p2 #tpot"			#Obamacare #ACA #SCOTUS #p2 #tpot	"217388785237884928"	https://twitter.com/NatefromUSA/status/217388785237884928
	2012-06-25 22:48	0	0	"Ron Paul: ' Obamacare 's legal apologists wholly ignorant of ... http:// bit.ly/NtOC6q"				"217388734134489088"	https://twitter.com/acowan4/status/217388734134489088
	2012-06-25 22:48	0	0	"@ashleyskidmore me too! I'm counting down the days. #Obamacare"		@ashleyskidmore	#Obamacare	"217388706951213056"	https://twitter.com/NickFondacaro/status/217388706951213056
	2012-06-25 22:47	0	0	"Old ppl should have to pay more for meds they shouldve been wealthy if they cant afford it strike down obamacare now!"				"217388681491787776"	https://twitter.com/crazypeople2/status/217388681491787776
	2012-06-25 22:47	0	0	"Top Five Reasons #Obamacare Is Bad for Doctors http:// blog.heritage.org/2012/06/22/top -five-reasons-obamacare-is-bad-for-doctors/ … via @heritage #medicine #sgp"		@heritage	#Obamacare #medicine #sgp	"217388669747732480"	https://twitter.com/FloridaGOPWomen/status/217388669747732480
	2012-06-25 22:47	0	0	"Our Virtual Townhall Has Been Moved to Thursday http:// bit.ly/LwH0TF #teaparty #ObamaCare #SCOTUS #Congress #tcot"			#teaparty #ObamaCare #SCOTUS #Congress #tcot	"217388654295908353"	https://twitter.com/nonsumdignus/status/217388654295908353
	2012-06-25 22:47	0	0	"CHCF's Marian Mulkey on the #SCOTUS #ACA decision. Friday on KQED's This Week in Northern California, 7:30 p.m. http://www. kqed.org/tv/programs/th isweek/ …"			#SCOTUS #ACA	"217388641641701377"	https://twitter.com/CHCFNews/status/217388641641701377
	2012-06-25 22:47	0	0	"@ThePlumLineGS TELL that to nerdy little @GOP typist: just 'relayed' Indies Oppose #Obamacare LOL"		@ThePlumLineGS @GOP	#Obamacare	"217388626387017728"	https://twitter.com/daVinely/status/217388626387017728
	2012-06-25 22:47	0	0	"Leave it to Americans to want to kill " Obamacare " but KEEP everything it does for them. http:// yhoo.it/KJjqUc #votenotes #obama"			#votenotes #obama	"217388612801671168"	https://twitter.com/1mansperspectiv/status/217388612801671168
	2012-06-25 22:47	0	0	"@richirich1963 News driven & EURO. Wait until Sup. Court rules against ObamaCare . Mkt. will take a hit. Have positioned accordingly."		@richirich1963		"217388580509724672"	https://twitter.com/FibLine/status/217388580509724672
	2012-06-25 22:47	0	0	"@realDonaldTrump specifically, Obama's 2.7 billion spent advertising Obamacare was just a 2.7 billion tax payer paid campaign stunt."		@realDonaldTrump		"217388561194946560"	https://twitter.com/Schaeffler219/status/217388561194946560
	2012-06-25 22:47	0	0	"I really didn't want ObamaCare to go through..."				"217388558720315393"	https://twitter.com/Live_4Fashion/status/217388558720315393
	2012-06-25 22:46	2	1	"@TheStevenWeber Wouldn't it be great if after killing Obamacare , Thomas quit the court, took 1/2 her $ & started a strip club world tour?"		@TheStevenWeber		"217388441695031297"	https://twitter.com/phillamarr/status/217388441695031297
	2012-06-25 22:46	0	1	"Luc hurry up! I will leave a little child behind! This isn't #obamacare"			#obamacare	"217388366965121024"	https://twitter.com/jonnyringstad/status/217388366965121024
	2012-06-25 22:46	4	0	"Healthcare decision expected Thursday. If #SCOTUS strikes down #ACA #HCR , what should be our next move?"			#SCOTUS #ACA #HCR	"217388355409813505"	https://twitter.com/BoldProgressive/status/217388355409813505
	2012-06-25 22:46	4	0	"In case anyone was wondering, the majority of Americans, by double digits, oppose Obamacare : http:// awe.sm/mcgc #majority #tcot"			#majority #tcot	"217388304771973121"	https://twitter.com/AM_National/status/217388304771973121
	2012-06-25 22:46	0	0	"Interesting. RT Solid majorities of indys & *Republicans* favor most major provisions in Obamacare , new poll finds: http:// wapo.st/MkbAky ""				"217388277651603456"	https://twitter.com/DJNYC1/status/217388277651603456
	2012-06-25 22:46	0	0	"“ @preciousliberty : Obamacare Will Sever Coverage for Veterans http:// goo.gl/j9l26 #tlot #citizensunited #fail #economy ”"		@preciousliberty	#tlot #citizensunited #fail #economy	"217388255421800449"	https://twitter.com/VFW91/status/217388255421800449
	2012-06-25 22:46	5	1	"Obamacare is a portmanteau of two words that Republicans don't understand at all."				"217388216259579904"	https://twitter.com/bilald/status/217388216259579904
	2012-06-25 22:45	4	0	"#MarkLevin blew a gasket over Chief Justice Roberts AZ vote. Bad indicator for Roberts' #Obamacare position?"			#MarkLevin #Obamacare	"217388118100291584"	https://twitter.com/dlb703/status/217388118100291584
	2012-06-25 22:45	0	0	"Nice informational for upcoming #ACA health ruling: RT @politico : A viewer's guide to the #SCOTUS ruling by @jenhab http:// politi.co/LLWTCn"		@politico @jenhab	#ACA #SCOTUS	"217388029705338881"	https://twitter.com/RonaldOnTheRoad/status/217388029705338881
	2012-06-25 22:45	5	1	"CBS's O'Donnell: Court Striking Down ObamaCare 'Might Be Better For The President' | http:// NewsBusters.org - http:// ow.ly/bOGub"				"217388016195473408"	https://twitter.com/newsbusters/status/217388016195473408
	2012-06-25 22:45	3	0	"Lobbyists prep for Obamacare ruling. http:// bit.ly/LLXu7j via @kackleyz"		@kackleyz		"217387998269014016"	https://twitter.com/rollcall/status/217387998269014016
	2012-06-25 22:45	2	0	"Lobbyists prep for Obamacare ruling. http:// bit.ly/LLXu7j via @kackleyz"		@kackleyz		"217387996440301569"	https://twitter.com/rollcallpols/status/217387996440301569
	2012-06-25 22:45	1	0	"Lobbyists prep for Obamacare ruling. http:// bit.ly/LLXu7j via @kackleyz"		@kackleyz		"217387994653523970"	https://twitter.com/ryanbeckwith/status/217387994653523970
	2012-06-25 22:44	0	0	"BAM: SUPREME COURT TO RULE OBAMACARE ON THURSDAY… http:// bit.ly/NtOaFp #tcot"			#tcot	"217387943650791425"	https://twitter.com/Bred_Red/status/217387943650791425
	2012-06-25 22:44	0	0	"The group trying to kill Obamacare - http:// Salon.com http://www. salon.com/2012/06/25/nfi b_the_group_trying_to_kill_obamacare/singleton// … via @Salon"		@Salon		"217387938105933824"	https://twitter.com/renaijane/status/217387938105933824
	2012-06-25 22:44	0	0	"@jaketapper FYI, the Obamacare ruling is supposed to come out on Thursday."		@jaketapper		"217387902777294848"	https://twitter.com/2CisMe/status/217387902777294848
	2012-06-25 22:44	1	1	"I support NFIB as the voice of small businesses against Obamacare . http:// on.wsj.com/OkLEag"				"217387872238583809"	https://twitter.com/jmeyers/status/217387872238583809
	2012-06-25 22:44	0	0	"Morning Bell: Protecting Religious Liberty from Obamacare http:// blog.heritage.org/2012/06/25/mor ning-bell-protecting-religious-liberty-from-obamacare/ … via @heritage"		@heritage		"217387809273688064"	https://twitter.com/Clay8191/status/217387809273688064
	2012-06-25 22:44	0	0	"Ron Paul: ‘ Obamacare ’s legal apologists wholly ignorant of constitutional principles’"				"217387793519886336"	https://twitter.com/Smith4Liberty/status/217387793519886336
	2012-06-25 22:44	0	0	"ObamaCare decision to drop Thursday. Will Independence Day come early this year?"				"217387769566216195"	https://twitter.com/JosephAshbyShow/status/217387769566216195
	2012-06-25 22:43	0	0	"Friends from Blue Cross are telling me if any part of #Obamacare gets passed, costs will skyrocket for business as they have for last 3 yrs."			#Obamacare	"217387676033228800"	https://twitter.com/managedautoserv/status/217387676033228800
	2012-06-25 22:43	0	0	"Most approve of Obamacare components not O-care law. Death Panel & Kill Granny lies worked. GOP thrives on lies/fear. http:// maddowblog.msnbc.msn.com/_news/2012/06/ 25/12402286-the-enduring-popularity-of-obamacare-at-least-whats-in-it?lite …"				"217387671956365314"	https://twitter.com/MsJoanne/status/217387671956365314
	2012-06-25 22:43	0	0	"@stefcutter @BarackObama @NancyPelosi How about using GOP's ignorance on ACA against them in TV ads?"		@stefcutter @BarackObama @NancyPelosi		"217387647692308480"	https://twitter.com/OnePiano/status/217387647692308480
	2012-06-25 22:43	0	0	"Thursday #SCOTUS #OBAMACARE #ACA http://www. cnn.com/2012/06/25/pol itics/health-care-ruling/index.html … #TCOT"			#SCOTUS #OBAMACARE #ACA #TCOT	"217387646471770112"	https://twitter.com/march23rd2010/status/217387646471770112
	2012-06-25 22:43	0	0	"Liberals who defend #obamacare as "constitutional" are liars, merely defending their own selfish wants and needs. Mandates are not freedom."			#obamacare	"217387599264886784"	https://twitter.com/WhirChunk/status/217387599264886784
	2012-06-25 22:43	0	0	"#SarahPalin Doubles Down on #Obamacare Death Panels Charge | http:// LifeNews.com http:// shar.es/sk8kO #deathpanels #prolife #tcot"			#SarahPalin #Obamacare #deathpanels #prolife #tcot	"217387582890323969"	https://twitter.com/smulrich/status/217387582890323969
	2012-06-25 22:43	1	0	"MonTV: Seven#1 21.7% #TheBlock 1.54m 9News/7News 1.37m #Revenge 1.31m ACA 1.23m TT 1.15m #MasterChefAU 1.15m AustStory 1.09m 4Corners 1.04m"			#1 #TheBlock #Revenge #MasterChefAU	"217387516368666624"	https://twitter.com/MediaweekAUS/status/217387516368666624
	2012-06-25 22:43	2	0	"RT @bnwomeh : However #SCOTUS rules on #ACA , all Justices will reluctantly endure the tyranny of receiving lifetime government-run healthcare"		@bnwomeh	#SCOTUS #ACA	"217387500497408003"	https://twitter.com/NationalNurses/status/217387500497408003
	2012-06-25 22:42	0	0	"@realDonaldTrump @obamacare Mr. Trump, the inequality article you referenced is much appreciated. Thanks for posting it."		@realDonaldTrump @obamacare		"217387381496627200"	https://twitter.com/ThisManTweets/status/217387381496627200
	2012-06-25 22:42	0	0	"The Future of Health IT Post-ACA Decision: ACA Provisions Related to HIT http:// bit.ly/O4Oct6 #MeaningfulUse"			#MeaningfulUse	"217387378258612224"	https://twitter.com/InterbitData/status/217387378258612224
	2012-06-25 22:42	0	0	"Here's what breast cancer is, and what it is NOT. (my second post for @Upworthy !) http:// upwr.me/Q61nXV #healthcare #ACA"		@Upworthy	#healthcare #ACA	"217387330523246592"	https://twitter.com/ryeisenberg/status/217387330523246592
	2012-06-25 22:42	0	0	"@mikescarcella how do you think #scotus will come down on #aca ?"		@mikescarcella	#scotus #aca	"217387325796265984"	https://twitter.com/DelWilber/status/217387325796265984
	2012-06-25 22:42	0	0	"Can't wait for the on #Obamacare !"			#Obamacare	"217387296796852225"	https://twitter.com/ashleythetexan/status/217387296796852225
	2012-06-25 22:42	0	0	"Kilili: Obamacare Health Insurance Rebates on the Way to CNMI http:// bit.ly/LXRnBm"				"217387264307757057"	https://twitter.com/RonBohning/status/217387264307757057
	2012-06-25 22:42	0	0	"Who else is looking forward to the reversal of ObamaCare on Thursday?"				"217387227196563457"	https://twitter.com/FauquierYRs/status/217387227196563457
	2012-06-25 22:41	0	0	"ObamaCare , Mainstream Medicine, FDA: Americans denied fundamental right to choose their own health care. http:// tinyurl.com/6tlxxfv @SenJohnMcCain"		@SenJohnMcCain		"217387130375254017"	https://twitter.com/EFeuer/status/217387130375254017
	2012-06-25 22:41	1	0	"Obamacare and the Mandate Hype http:// huff.to/NtsaKy via @HuffPostPol #HealthInsReform"		@HuffPostPol	#HealthInsReform	"217387122380914688"	https://twitter.com/jpeery59/status/217387122380914688
	2012-06-25 22:41	0	0	"Home Policy U.S. ObamaCare : Good for expensive insurance, bad for your health: Information ... http:// bit.ly/NERYad http:// bit.ly/mcGiWl"				"217387107675672576"	https://twitter.com/X_Log/status/217387107675672576
	2012-06-25 22:41	0	0	"Home Glory ObamaCare : Good for expensive insurance, bad for your health: Information on Wha... http:// bit.ly/NERYad http:// bit.ly/jnfJqh"				"217387105335255040"	https://twitter.com/X_Log/status/217387105335255040
	2012-06-25 22:41	0	0	"SCOTUS limits Ariz. crackdown; Obamacare ruling expected Thursday; NYT reporter blamed editors for... http:// shrtn.in/1mPZMH #News #Reports"			#News #Reports	"217387103879835649"	https://twitter.com/AsiaPacNews/status/217387103879835649
	2012-06-25 22:41	0	0	"from antiobama TIME’s Joe Klein on Obamacare : "I Blame The President" For Failing To Communicate "The Things He ... http:// bit.ly/NERKQh"				"217387087538831360"	https://twitter.com/rightwingnut/status/217387087538831360
	2012-06-25 22:41	0	0	"RT @ThePlumLineGS : Wow...majorities of indys & *Republicans* favor most major provisions in Obamacare , new poll finds: http:// wapo.st/MkbAky"		@ThePlumLineGS		"217387084011421696"	https://twitter.com/ormark/status/217387084011421696
	2012-06-25 22:41	0	0	"@Afterseven The same reason the Trayvon Martin case got legs- acted on the same day the ObamaCare debates started in the SCOTUS #LNYHBT"		@Afterseven	#LNYHBT	"217387052415717376"	https://twitter.com/FuriousCStyles/status/217387052415717376
	2012-06-25 22:41	0	0	"Morning Examiner: Obama’s arrogance sunk Obamacare | http:// WashingtonExaminer.com : http:// bit.ly/Mwiq5C"				"217387046984097792"	https://twitter.com/BettinaVLA/status/217387046984097792
	2012-06-25 22:41	0	0	"Strassel: Axelrod's ObamaCare Dollars - http:// WSJ.com http:// on.wsj.com/LJBvCo via @WSJ"		@WSJ		"217386963731353601"	https://twitter.com/tonytezak/status/217386963731353601
