username;date;retweets;favorites;text;geo;mentions;hashtags;id;permalink
	2012-04-23 21:17	0	0	"GOP Message To The Middle Class-If Obamacare Goes Down, You're Going With It!: At the heart of the GOP healthcar... http:// bit.ly/JwAVGh"				"194535558465327105"	https://twitter.com/Annette2947/status/194535558465327105
	2012-04-23 21:17	0	0	"Mandame un pinche beso aca bien sexy :P ( @elfinisho live on http:// twitcam.livestream.com/9om3c )"		@elfinisho		"194535514286723074"	https://twitter.com/Danyhelaa/status/194535514286723074
	2012-04-23 21:16	1	0	"Every time I hear Romney or one of his staffers tread on " ObamaCare ", I want to slap his hypocritical face."				"194535296501690368"	https://twitter.com/Jared_84/status/194535296501690368
	2012-04-23 21:15	0	0	"BHO about to get BitchSlapped by SCOTUS on 4 counts: Voter ID, AZ immig law, Obamacare , illegal recess appointments. A painful rebuke awaits"				"194535104071217153"	https://twitter.com/PiereChangstein/status/194535104071217153
	2012-04-23 21:15	0	0	"@xoxoJazziebaby lol don't say that"		@xoxoJazziebaby		"194534944624746499"	https://twitter.com/DEESTATE_ACA/status/194534944624746499
	2012-04-23 21:15	3	4	"Republicans talk like they have a replacement for Obamacare . But they don't: http:// ow.ly/asUdJ"				"194534893986918401"	https://twitter.com/NewRepublic/status/194534893986918401
	2012-04-23 21:14	0	0	"Is Obamacare good for small business? Short answer: No. #healthcare @TimesDaily @GalenInstitute http:// bit.ly/I1bPub"		@TimesDaily @GalenInstitute	#healthcare	"194534851297284096"	https://twitter.com/KenFeltman/status/194534851297284096
	2012-04-23 21:14	1	1	". @alexblum to Don Berwick: when I get depressed about health reform, I watch videos of you on YouTube. :) #Dr4A2012 #ACA"		@alexblum	#Dr4A2012 #ACA	"194534770716319744"	https://twitter.com/Drsforamerica/status/194534770716319744
	2012-04-23 21:12	0	0	"Look what I found on @eBay ! ACA Certified-Genuine 2.12 ctw Ruby & Diamond Ring http:// r.ebay.com/QHgNpj"		@eBay		"194534127238791168"	https://twitter.com/rayofglamou/status/194534127238791168
	2012-04-23 21:12	2	0	". @wendellpotter / iWatch News | Shareholders raising ruckus about CEO pay - starting with CIGNA http:// bit.ly/J4ykO8 #hcr #Obamacare #CEOpay"		@wendellpotter	#hcr #Obamacare #CEOpay	"194534108666404864"	https://twitter.com/HCAN/status/194534108666404864
	2012-04-23 21:11	0	0	"Democratic Tricks http:// shar.es/rRReB via @sharethis If ObamaCare were popular, there would be no need for skullduggery."		@sharethis		"194533887517532161"	https://twitter.com/tumult101/status/194533887517532161
	2012-04-23 21:10	0	0	"Lmao shut up! RT @Ced_ ACA : @iDream_ofJaz Well get off twitter and get to gettin"		@Ced_ @iDream_ofJaz		"194533741836767233"	https://twitter.com/JazmenAlesha_/status/194533741836767233
	2012-04-23 21:10	0	0	"What happens when the "Wicked Witch of the West" is the Speaker of the House? Obamacare & the complete destruction of our healthcare system"				"194533676015554560"	https://twitter.com/kgarrison/status/194533676015554560
	2012-04-23 21:10	0	0	"“ @PsychologyCare : Veterans' mental health treatment not as timely as contended http:// sns.mx/iIg4y6 ” @dosomething @ACA _CTOnline"		@PsychologyCare @dosomething @ACA		"194533665236193280"	https://twitter.com/CreateGrow/status/194533665236193280
	2012-04-23 21:09	0	0	"#GSA scandal is a distraction. Investigated by the same bunch that gave us bailouts, TARP and Obamacare ."			#GSA	"194533558717652992"	https://twitter.com/aa7ya/status/194533558717652992
	2012-04-23 21:09	0	0	"State lawmakers will face "moment of truth" if SCOTUS upholds ACA http:// ow.ly/asHbu (via @politico ) h/t @RWJF_Coverage"		@politico @RWJF_Coverage		"194533554624020481"	https://twitter.com/SHADAC/status/194533554624020481
	2012-04-23 21:09	1	0	"Democrat Opposition to Obamacare and St. Thomas Aquinas? There may be a link spelled F.R.E.E.D.O.M. http:// shar.es/rRRt0 @yimcatholic"		@yimcatholic		"194533385677438976"	https://twitter.com/TheAnchoress/status/194533385677438976
	2012-04-23 21:09	0	0	"GOP Health Care Alternative Plan-If Obamacare Goes Down, Middle Class Is Going With It! - Forbes http:// onforb.es/Ib9TzJ"				"194533380170334209"	https://twitter.com/michaelscally/status/194533380170334209
	2012-04-23 21:09	0	0	"#mitt2012 RT @NewtGingrich : Without Romneycare there would be no Obamacare ."		@NewtGingrich	#mitt2012	"194533361572786179"	https://twitter.com/dumbGOP/status/194533361572786179
	2012-04-23 21:08	0	0	"Clive James and Leanne Edelsten. Does anyone really care? ACA are consistent in their journalistic standards at least. Low and lower."				"194533239933775873"	https://twitter.com/BrissieDeb/status/194533239933775873
	2012-04-23 21:08	0	0	"You wish asshole! RT @RichardGrenell : RT @andreamsaul : . @MittRomney will #recall Obamacare if SCOTUS doesn't get to it 1st"		@RichardGrenell @andreamsaul @MittRomney	#recall	"194533237006155777"	https://twitter.com/GRYKING/status/194533237006155777
	2012-04-23 21:08	0	0	"$$ #CreditAgricole ADR Report: Shares Lower As French Political Uncertainty Weighs http:// on.wsj.com/IuR0t0 $ ACA"			#CreditAgricole	"194533186364116993"	https://twitter.com/CAC40feed/status/194533186364116993
	2012-04-23 21:08	0	0	"@SmallBizGOP All you guys say you support small biz, at the same time install gov't regulations, and obamacare , small biz cannot survive."		@SmallBizGOP		"194533158555885569"	https://twitter.com/rebelrant/status/194533158555885569
	2012-04-23 21:08	3	0	"HHS diverting funds to IRS to implement Obamacare http:// dailycaller.com/2012/04/19/hhs -diverting-funds-to-irs-to-implement-obamacare/ …"				"194533124523311106"	https://twitter.com/NCHornet/status/194533124523311106
	2012-04-23 21:08	2	0	"#mitt2012 RT @NewtGingrich : We ran against #Obamacare in 2010 and won. We can’t defend #Romneycare and win in 2012."		@NewtGingrich	#mitt2012 #Obamacare #Romneycare	"194533109704818690"	https://twitter.com/dumbGOP/status/194533109704818690
	2012-04-23 21:07	0	0	"A comedian & writer in LA likes Obamacare , shocking... RT @robdelaney : Free boring idea for Obama campaign. http:// bit.ly/JriLH7"		@robdelaney		"194533063403905026"	https://twitter.com/StuJames/status/194533063403905026
	2012-04-23 21:07	0	1	"Are those wrinkles I see sitting in? My eyesight isn't the greatest in the world, you know. Thanks mostly to ObamaCare , I'm sure of it."				"194533041845190656"	https://twitter.com/ivyleague53/status/194533041845190656
	2012-04-23 21:07	0	0	"Obama sets up $8 Billion slush fund to cover ObamaCare gutting of Medicare before election! http://www. nypost.com/p/news/opinion /opedcolumnists/an_billion_trick_ImTBFfz7MeuZLJY7JzXEIJ …"				"194533026879913984"	https://twitter.com/HausofFred/status/194533026879913984
	2012-04-23 21:07	0	0	"OBAMA'S MEDICARE SLUSH FUND MASKS OBAMACARE BEFORE ELECTION -Admin. refuses to cancel spending - http:// nyti.ms/Jp7mrj"				"194532983095570433"	https://twitter.com/KurtSchemers/status/194532983095570433
	2012-04-23 21:07	0	0	"GOP Message To The Middle Class-If Obamacare Goes Down, You're Going With It! http:// bit.ly/JwwdrW"				"194532956004552704"	https://twitter.com/2012_GOP/status/194532956004552704
	2012-04-23 21:06	0	0	"@2CC @JorianCanberra did u c Pauline Hanson last nite pleading/showing motorists how badly they were driving on either Today Tonight or ACA ?"		@2CC @JorianCanberra		"194532835493814273"	https://twitter.com/Martin_Ross84/status/194532835493814273
	2012-04-23 21:06	0	0	"Medicare's Chief Actuary: Sorry, ObamaCare 's Medicare Reforms Probably Aren't Viable in the Long Term - http:// bit.ly/Ik8Akv"				"194532798726545408"	https://twitter.com/davidmckeen/status/194532798726545408
	2012-04-23 21:06	0	0	"@butterflybesos9 @HZ4FREEDOM hot mic to russia. crazy debt but pushes obamacare . SOLYNDRA. keystone. COAL. oil drilling."		@butterflybesos9 @HZ4FREEDOM		"194532749753851904"	https://twitter.com/keithbarry1959/status/194532749753851904
	2012-04-23 21:06	0	0	"Republicans Developing Replacement to ACA : Plan would be less... http:// bit.ly/JO8qiY #healthcare"			#healthcare	"194532745865732097"	https://twitter.com/BusOfGovernment/status/194532745865732097
	2012-04-23 21:05	2	0	"Is ObamaCare good for small businesses? @JimBlasingame 's answer in the http:// TimesDaily.com : http:// bit.ly/Jx0vcy"		@JimBlasingame		"194532531494850560"	https://twitter.com/galeninstitute/status/194532531494850560
	2012-04-23 21:05	0	0	"Exposing the Left's Media Spin on Obamacare - National Review Online (blog)"				"194532465841422336"	https://twitter.com/alllut/status/194532465841422336
	2012-04-23 21:04	0	0	"Brain Flushings: Fluke, Rev Al, Obamacare as an Oxymoron, and Kagan's Recusexcuse http:// shar.es/rRFkC via @sharethis"		@sharethis		"194532324875055105"	https://twitter.com/RobHoey/status/194532324875055105
	2012-04-23 21:04	0	0	"Republicans Advance Proposal To Undermine Obamacare By Penalizing People Who Get Married http:// thkpr.gs/HTIaDJ via @thinkprogress Paul Ryan!"		@thinkprogress		"194532315639201794"	https://twitter.com/Ross_7_7/status/194532315639201794
	2012-04-23 21:04	0	0	"Dreamweaver CS5: Basic ACA Edition and CertBlaster Student Manual http:// amzn.to/JriaVU"				"194532194704822273"	https://twitter.com/kopitubrux/status/194532194704822273
	2012-04-23 21:04	0	0	"Dreamweaver CS5: Basic ACA Edition and CertBlaster Student Manual http:// amzn.to/JriaVU"				"194532189336121344"	https://twitter.com/FamilyHealthinc/status/194532189336121344
	2012-04-23 21:04	0	0	"' Obamacare ' vs. 'Romneycare' - http:// MPNnow.com http:// bit.ly/Im5o8S"				"194532158138875905"	https://twitter.com/RomneyCare/status/194532158138875905
	2012-04-23 21:02	0	0	"$8.3 billion transferred from Medicare to cover up #Obamacare problem until election. #MadYet ? http:// fb.me/1B1PieIBC"			#Obamacare #MadYet	"194531785940545538"	https://twitter.com/Mad_Yet/status/194531785940545538
	2012-04-23 21:02	1	0	"Not all medical device folks eager to drink the industry Kool-Aid on tax. http:// bit.ly/JvTOce #medicaldevice #Obamacare"			#medicaldevice #Obamacare	"194531709943939073"	https://twitter.com/chrisseper/status/194531709943939073
	2012-04-23 21:02	0	0	"$8 Billion Slush Fund to Shield Medicare Advantage from Obamacare Cuts http:// bit.ly/Iiyfa1"				"194531654516211712"	https://twitter.com/pahaysaz/status/194531654516211712
	2012-04-23 21:02	0	0	"Lol good RT @NowKissMyASH : “ @DEESTATE_ ACA : #Random I don't like kissin during sex lol” that's cool me neither lol"		@NowKissMyASH @DEESTATE_	#Random	"194531598782304256"	https://twitter.com/DEESTATE_ACA/status/194531598782304256
	2012-04-23 21:01	0	0	"Set Of 8 Corn Hole Toss Bags 17+ Colors Aca /aco Reg. Triple Stitched Duck Cloth http:// bit.ly/JO6kjc"				"194531507564589057"	https://twitter.com/cornholegames/status/194531507564589057
	2012-04-23 21:01	0	0	"House Republicans Use Budget Cuts To Target Obamacare http:// thkpr.gs/IlLkDt via @thinkprogress"		@thinkprogress		"194531476010831872"	https://twitter.com/Eddypeps/status/194531476010831872
	2012-04-23 21:01	0	0	"An inconvenient truth GOP Scum: RT @RayBeckerman : Obamacare will save Medicare $200 billion by 2016 ~ #DailyKos http:// bit.ly/IkYZux"		@RayBeckerman	#DailyKos	"194531376127684609"	https://twitter.com/sellitman/status/194531376127684609
	2012-04-23 21:01	0	0	"Lol ok RT @IlovcokeNpenis: Dont have sex then RT @DEESTATE_ ACA : #Random I don't like kissin during sex lol"		@IlovcokeNpenis @DEESTATE_	#Random	"194531374458339328"	https://twitter.com/DEESTATE_ACA/status/194531374458339328
	2012-04-23 21:01	0	0	"jcatskill Wow, ACCA gets one over on ACA . First time for everything! accountancygagsw0Urc"				"194531345421185024"	https://twitter.com/hegedusnznh3/status/194531345421185024
	2012-04-23 21:00	0	0	"Is #Obamacare evil incarnate? Read today's Denver Post story by BoomerCafe founder and network journalist Greg Dobbs: http:// bit.ly/Jm5aw6"			#Obamacare	"194531316983808000"	https://twitter.com/BoomerMarketing/status/194531316983808000
	2012-04-23 21:00	0	0	"Yo solo trato de unirlos :D I wanna see RT @Will5858 : Pero ven aca coco u a hater too SMH @CarolinaLaCoco @Noelly07 ""		@Will5858 @CarolinaLaCoco @Noelly07		"194531308834275328"	https://twitter.com/CarolinaLaCoco/status/194531308834275328
	2012-04-23 21:00	0	0	"MT @andreamsaul ,. @MittRomney will #recall Obamacare if SCOTUS doesn't get to it 1st/ Mitts Platform> #WarOnWomen #Vets #students #poor #ACA"		@andreamsaul @MittRomney	#recall #WarOnWomen #Vets #students #poor #ACA	"194531305487208448"	https://twitter.com/HnstyNgov/status/194531305487208448
	2012-04-23 21:00	0	0	"Backlog: Krauthammer on the cost, the (un)constitutionality, and the coerciveness of ObamaCare . http:// wapo.st/J5yrsM"				"194531184854835205"	https://twitter.com/LocalCommentary/status/194531184854835205
	2012-04-23 20:59	0	0	"Yehiii!"				"194531086393544705"	https://twitter.com/ven_aca_brona/status/194531086393544705
	2012-04-23 20:59	0	0	"@KipPiper @NCPA If Hussein gets re elected, Republicans allow medicare reimbursements to be cut contained in Obamacare , they get the blame."		@KipPiper @NCPA		"194531067078774784"	https://twitter.com/CraigJCasey/status/194531067078774784
	2012-04-23 20:59	0	0	"Pero ven aca coco u a hater too SMH @CarolinaLaCoco @Noelly07"		@CarolinaLaCoco @Noelly07		"194530992277565442"	https://twitter.com/Will5858/status/194530992277565442
	2012-04-23 20:59	0	0	"Don Berwick: Do we have confidence and optimism to achieve the care we want. Focus on need. #Dr4A2012 #ACA #hcr"			#Dr4A2012 #ACA #hcr	"194530874937716737"	https://twitter.com/DrChaya/status/194530874937716737
	2012-04-23 20:58	0	0	"hace mucho frio aca , verano COME BACK!!!!"				"194530738064982017"	https://twitter.com/DeniseCariaga/status/194530738064982017
	2012-04-23 20:57	0	0	"Obama admin to use $8.3 billion “slush fund” to fake out seniors? http:// hotair.com/archives/2012/ 04/23/obama-admin-to-use-8-3-billion-slush-fund-to-fake-out-seniors/ … via @hotairblog #Obamacare #tcot #twisters #sgp"		@hotairblog	#Obamacare #tcot #twisters #sgp	"194530569453973505"	https://twitter.com/vmpcott/status/194530569453973505
	2012-04-23 20:57	1	0	"@RepPaulRyan Is it true Obamacare will kill Medicare Advantage but not till after the election?"		@RepPaulRyan		"194530539234009089"	https://twitter.com/kgarrison/status/194530539234009089
	2012-04-23 20:57	0	0	"@redwillroll @elyse4design @CSPANJNKY @cspanwj Ride my motorcycle without a helmet, smoke cigars indoors, not carry Obamacare , how's that?"		@redwillroll @elyse4design @CSPANJNKY @cspanwj		"194530377610690561"	https://twitter.com/Cigarvolante/status/194530377610690561
	2012-04-23 20:56	2	0	"Jim Martin: “Buying off #seniors with temporary #Obamacare waivers is truly despicable.” http:// bit.ly/Jrg7kP"			#seniors #Obamacare	"194530248770068483"	https://twitter.com/60PlusAssoc/status/194530248770068483
	2012-04-23 20:56	2	1	"RT @NewtGingrich : We ran against Obamacare in 2010 and won. We can’t run if we have to defend Romneycare. Watch & RT: http:// bit.ly/AdExqO"		@NewtGingrich		"194530086903488516"	https://twitter.com/dumbGOP/status/194530086903488516
	2012-04-23 20:55	8	1	"Obamacare will save Medicare $200 billion by 2016 ~ #DailyKos http:// bit.ly/IkYZux"			#DailyKos	"194530078078672896"	https://twitter.com/RayBeckerman/status/194530078078672896
	2012-04-23 20:55	1	0	">>>>>>>RomneyCare is a WAY over Budget, Job Killing Disaster, AND Tax Hike, just like ObamaCare !!! Where do you think ObamaCare came from???"				"194530060986880000"	https://twitter.com/tradethecycles/status/194530060986880000
	2012-04-23 20:55	18	2	". @MittRomney will #recall Obamacare if SCOTUS doesn't get to it 1st"		@MittRomney	#recall	"194529898428243970"	https://twitter.com/andreamsaul/status/194529898428243970
	2012-04-23 20:54	0	0	"Dont have sex then RT @DEESTATE_ ACA : #Random I don't like kissin during sex lol"		@DEESTATE_	#Random	"194529765338775553"	https://twitter.com/ILoveCokeNPenis/status/194529765338775553
	2012-04-23 20:54	0	0	"http:// reason.com : Sorry, ObamaCare 's Medicare Reforms Probably Aren't Viable in the Long Term http:// reason.com/blog/2012/04/2 3/medicares-chief-actuary-sorry-obamacares …"				"194529751514365952"	https://twitter.com/MinehahaCebrian/status/194529751514365952
	2012-04-23 20:54	0	0	"Why Kurt Bahr wants to criminalize Obamacare http:// dlvr.it/1TCMgL #missouri #KurtBahr #50 #p2"			#missouri #KurtBahr #50 #p2	"194529680035024896"	https://twitter.com/TeaPartyUSA1/status/194529680035024896
	2012-04-23 20:53	0	0	"Funny how people get Mexican bribes and Columbian prostitution but clueless with things that matter: #MFG #TB2T #Obamacare #ZIRP"			#MFG #TB2T #Obamacare #ZIRP	"194529526368313344"	https://twitter.com/FedPorn/status/194529526368313344
	2012-04-23 20:53	0	0	"Obama HHS Spending $8.3 billion “slush fund” ObamaCare Money 2 fake out seniors, GAO auditors demand end to slush fund http:// hotair.com/archives/2012/ 04/23/obama-admin-to-use-8-3-billion-slush-fund-to-fake-out-seniors/ …"				"194529499629617152"	https://twitter.com/mathewsjw/status/194529499629617152
	2012-04-23 20:53	0	0	"ACA is "majestic" movement towards health care as right. D Berwick at DFA Conf #dr4a2012"			#dr4a2012	"194529352266940417"	https://twitter.com/alexblum/status/194529352266940417
	2012-04-23 20:52	0	0	"@ForbesWorldsMPP Which branch of the #BigGovernment Party do U support: #RightWing or #LeftWing ? #NannyState #Neocons #ACA #XLPipeline #NDAA"		@ForbesWorldsMPP	#BigGovernment #RightWing #LeftWing #NannyState #Neocons #ACA #XLPipeline #NDAA	"194529291260796928"	https://twitter.com/ThinkAboutGovt/status/194529291260796928
	2012-04-23 20:52	0	0	"@RepPaulRyan Is it true POTUS funneled $8B into Medicare to conceal cuts by #Obamacare from seniors til after election? How scummy"		@RepPaulRyan	#Obamacare	"194529170469027841"	https://twitter.com/nationalistpig/status/194529170469027841
	2012-04-23 20:52	0	0	"Tranki aca con my friend Latarjet"				"194529153326915586"	https://twitter.com/gisela_juarez/status/194529153326915586
	2012-04-23 20:51	8	0	">>>Newt; "Someone who *created* RomneyCare debating someone who *has* ObamaCare --- it's going to be pretty hard to make out the difference""				"194529067830214656"	https://twitter.com/tradethecycles/status/194529067830214656
	2012-04-23 20:51	0	0	"“ @DEESTATE_ ACA : #Random I don't like kissin during sex lol”that's bc if u do... U prolly can't hang in there lol"		@DEESTATE_	#Random	"194529062843191297"	https://twitter.com/Jazzeemarie/status/194529062843191297
	2012-04-23 20:51	0	0	". @truthteam2012 Medicare Trustees Confirm @TheDemocrats plan would bankrupt Medicare by 2024! http:// ow.ly/asZE8 #ObamaCare #Obama #tcot"		@truthteam2012 @TheDemocrats	#ObamaCare #Obama #tcot	"194529031041978368"	https://twitter.com/_Alec_P/status/194529031041978368
	2012-04-23 20:51	0	0	"Obama Scandal of Week: Auditors call on Obama 2 cancel Medicare bonuses from HHS Supporting ObamaCare Bankruptcy http://www. washingtonpost.com/business/audit ors-call-on-obama-administration-to-cancel-medicare-bonuses-gop-sees-as-political/2012/04/22/gIQAvoFuaT_story.html …"				"194529019838988292"	https://twitter.com/mathewsjw/status/194529019838988292
	2012-04-23 20:51	0	0	"Show Me Prog. (MO): Why Kurt Bahr wants to criminalize Obamacare http:// bit.ly/Jrf2cA"				"194528946635800577"	https://twitter.com/50StateBlogs/status/194528946635800577
	2012-04-23 20:51	0	0	"Texas prom queen arrested for faking cancer, raising $17,000. Obamacare to blame for making it affordable to fake a disease."				"194528865371172864"	https://twitter.com/BrentPiaskoski/status/194528865371172864
	2012-04-23 20:50	0	0	"Would Romney's counter to Obamacare be regarded as more revolutionary? Would it be a campaign weakness? http://www. latimes.com/health/la-na-r omney-healthcare-20120423,0,3526510,print.story …"				"194528718390181888"	https://twitter.com/josephlawler/status/194528718390181888
	2012-04-23 20:49	0	0	"House Republicans Use Budget Cuts To Target Obamacare http:// thkpr.gs/IlLkDt via @thinkprogress"		@thinkprogress		"194528562219462656"	https://twitter.com/Ross_7_7/status/194528562219462656
	2012-04-23 20:49	0	0	"@truthteam2012 a better question would b what is Obama not telling us about Obamacare ??"		@truthteam2012		"194528538844602368"	https://twitter.com/robin012009/status/194528538844602368
	2012-04-23 20:49	0	0	"Look what I found on @eBay ! ACA Certified-Genuine 2.48 ctw Ruby & Diamond Ring http:// r.ebay.com/8rBNgZ"		@eBay		"194528442061037568"	https://twitter.com/rayofglamou/status/194528442061037568
	2012-04-23 20:48	0	0	"illegal? Slush Fund Found @HHS 2 support ObamaCare by preventing Medicare bankruptcy before Nov 2012 http:// nyp.st/I4Ux35"		@HHS		"194528187412262914"	https://twitter.com/mathewsjw/status/194528187412262914
	2012-04-23 20:48	0	0	"Say goodbye to children's health coverage RT @1TrueTeacher “My first bill in the Senate will be to repeal every word of ObamaCare ” @TedCruz"		@1TrueTeacher @TedCruz		"194528164129677313"	https://twitter.com/EPPolitico/status/194528164129677313
	2012-04-23 20:48	0	0	"White House Scrambles to Keep #Obamacare From Gutting Medicare Before Election http://www. weeklystandard.com/blogs/white-ho use-scrambles-keep-obamacare-gutting-medicare-election_640591.html … #teaparty #twisters #tcot #sgp #ocra"			#Obamacare #teaparty #twisters #tcot #sgp #ocra	"194528103681368064"	https://twitter.com/StopNMarxist57/status/194528103681368064
	2012-04-23 20:46	2	0	"Obama admin to use $8.3 billion “slush fund” to fake out seniors? http:// hotair.com/archives/2012/ 04/23/obama-admin-to-use-8-3-billion-slush-fund-to-fake-out-seniors/ … via @hotairblog #Obamacare"		@hotairblog	#Obamacare	"194527772163575808"	https://twitter.com/vmpcott/status/194527772163575808
	2012-04-23 20:46	0	0	"Infidel Airsoft / Insight Interacive - ACA Trial Games - Infidel vs ... http:// bit.ly/Im0vMU"				"194527657520672768"	https://twitter.com/airsoft_/status/194527657520672768
	2012-04-23 20:46	0	0	"@budmarl @tamarabastaki wi9al lay my aca friends:p"		@budmarl @tamarabastaki		"194527635626393600"	https://twitter.com/SayerBMAS/status/194527635626393600
	2012-04-23 20:46	1	0	"“ @DEESTATE_ ACA : #Random I don't like kissin during sex lol” that's cool me neither lol"		@DEESTATE_	#Random	"194527596480954368"	https://twitter.com/NowKissMyASH/status/194527596480954368
	2012-04-23 20:45	0	0	"@evilgrrl Lee, #Obamacare subsidies get paid from where? And they go to people making up to $92k. Otherwise couldn't afford it?"		@evilgrrl	#Obamacare	"194527522023682048"	https://twitter.com/CraigJCasey/status/194527522023682048
	2012-04-23 20:45	0	0	"@DEESTATE_ ACA aye bum...hit me up"		@DEESTATE_		"194527453648125952"	https://twitter.com/BubbaRayK/status/194527453648125952
	2012-04-23 20:45	2	0	"Opinion: OBAMA'S MEDICARE SLUSH FUND MASKS OBAMACARE BEFORE ELECTION... - Obamacare - Fox Nation http:// nation.foxnews.com/obamacare/2012 /04/23/opinion-obamas-medicare-slush-fund-masks-obamacare-election …"				"194527448594006018"	https://twitter.com/TexanIndiana/status/194527448594006018
	2012-04-23 20:45	2	0	"Obama plans to wait until after the election to inform seniors that their Medicare Advantage is no more.Thanks to Obamacare cuts to Medicare"				"194527390507077632"	https://twitter.com/kgarrison/status/194527390507077632
	2012-04-23 20:45	0	0	"Obama admin caught moving millions from a slush fund to medicare advantage so seniors wouldn't know obamacare impact till after election."				"194527377420853248"	https://twitter.com/nationdivided/status/194527377420853248
	2012-04-23 20:45	0	0	"Off to holla at my auntie"				"194527327621885954"	https://twitter.com/DEESTATE_ACA/status/194527327621885954
	2012-04-23 20:43	0	0	"O aca (@Starbucks w/ 3 others) http:// 4sq.com/JsbVA7"		@Starbucks		"194526960544788480"	https://twitter.com/hrc968/status/194526960544788480
	2012-04-23 20:43	6	2	"@GOP12 @zekejmiller Drudge is on crack. There's as much chance of Mitt picking Rubio as there is of GOP nominating father of Obamacare ."		@GOP12 @zekejmiller		"194526938562445312"	https://twitter.com/TheJedReport/status/194526938562445312
	2012-04-23 20:42	0	0	"@cathymcmorris - I support the ACA and think the ind. board for Medicare levels"		@cathymcmorris		"194526691442438144"	https://twitter.com/crone728/status/194526691442438144
	2012-04-23 20:42	0	0	"esto aca one two y nos vemos rottweilas the bigges"				"194526597339021312"	https://twitter.com/Alex_Rottweilas/status/194526597339021312
	2012-04-23 20:41	0	0	"@truthteam2012 Barry's obamacare willl save $$, right and not disrupt existing arrangements, provide better service and no rationing, right?"		@truthteam2012		"194526403297939457"	https://twitter.com/Schwabcycler/status/194526403297939457
	2012-04-23 20:40	1	0	"#Random I don't like kissin during sex lol"			#Random	"194526183596097537"	https://twitter.com/DEESTATE_ACA/status/194526183596097537
	2012-04-23 20:39	0	0	"GOP Health Care Alternative Plan-If Obamacare Goes Down, Middle Class Is Going With It! http:// onforb.es/JvWzdD"				"194526022555795456"	https://twitter.com/Alltop_Finance/status/194526022555795456
	2012-04-23 20:38	0	0	"3 Martini Lunch w/ @NRO ... Mitt & Keystone, Obamacare fails again, Olbermann returns. http:// ow.ly/asYTQ #tcot"		@NRO	#tcot	"194525724143648768"	https://twitter.com/Dateline_DC/status/194525724143648768
	2012-04-23 20:36	0	0	"#ObamaCare RT @Still_Lee_ : Who broke YouTube?"		@Still_Lee_	#ObamaCare	"194525217404628994"	https://twitter.com/WRIGHT3OUS/status/194525217404628994
	2012-04-23 20:35	0	0	"#ImMadBecause I have to write a 4 page research paper due tomorrow about Obamacare ."			#ImMadBecause	"194524858921648128"	https://twitter.com/monicamae10/status/194524858921648128
	2012-04-23 20:35	0	0	"Obama administration says ACA will save Medicare $200B http:// ow.ly/asM7a"				"194524841523683330"	https://twitter.com/PointRight/status/194524841523683330
