username;date;retweets;favorites;text;geo;mentions;hashtags;id;permalink
	2012-07-09 23:59	0	0	"@DRUDGE : 83% OF DOCTORS 'HAVE CONSIDERED QUITTING' OVER OBAMACARE http:// thedc.com/LJFNpJ . Via @DailyCaller . ... http:// m.tmi.me/taB98"		@DRUDGE @DailyCaller		"222480184937426944"	https://twitter.com/GovernorGreene/status/222480184937426944
	2012-07-09 23:59	0	0	"Had to RT this: @davedias : Report: 83 percent of doctors have considered quitting over Obamacare http:// lnkd.in/P37AVE"		@davedias		"222480177677090816"	https://twitter.com/carrlawohio/status/222480177677090816
	2012-07-09 23:59	0	0	"The Obamacare Decision: A Mixed Bag http:// shar.es/trf8n"				"222480157783506944"	https://twitter.com/cathexchange/status/222480157783506944
	2012-07-09 23:59	0	0	"Report: 83 percent of doctors have considered quitting over Obamacare http:// snd.li/78z"				"222480156978184192"	https://twitter.com/jonithoreau/status/222480156978184192
	2012-07-09 23:59	1	0	"The States Can Still Kill Obamacare > http:// spectator.org/archives/2012/ 07/09/the-states-can-still-kill-obam … #tcot #tlot #ncpol #fl #ny #ca #mi #va #co #nm #nv #ia #oh"			#tcot #tlot #ncpol #fl #ny #ca #mi #va #co #nm #nv #ia #oh	"222480125248274433"	https://twitter.com/Pudingtane/status/222480125248274433
	2012-07-09 23:59	0	0	"@luchadora41 Lilindian says, "PUT OBAMACARE ON THE BALLOT". Let the American people make the choice."		@luchadora41		"222480119590174723"	https://twitter.com/lilindian/status/222480119590174723
	2012-07-09 23:59	0	0	"@NatlWOW @TPM #Texas #perry refuses to implement #ObamaCare does he prefer #RomNeglect ? Want to lose #Medicare vote #republican #Senior #gop"		@NatlWOW @TPM	#Texas #perry #ObamaCare #RomNeglect #Medicare #republican #Senior #gop	"222480102095724544"	https://twitter.com/BardOfEarth/status/222480102095724544
	2012-07-09 23:59	0	0	"ObamaCare more taxing than RomneyCare? Laws' differences debated - Fox News: Washington TimesObamaCare more taxi... http:// adf.ly/AXpx4"				"222480096932528128"	https://twitter.com/petrolone/status/222480096932528128
	2012-07-09 23:59	0	0	"Video: Hilariously Brilliant Protestors Have Unbelievable Reasons For Supporting ObamaCare http:// j.mp/NsOfYV"				"222480069950578688"	https://twitter.com/DamnTrue/status/222480069950578688
	2012-07-09 23:59	2	0	"Do yourself & the State of Texas a favor: Educate yourself Governor Rick #Perry http://www. washingtonpost.com/blogs/ezra-kle in/wp/2012/07/03/the-affordable-care-acts-giveaway-to-stingy-red-states/ … @WHO #health #ACA #Texas"		@WHO	#Perry #health #ACA #Texas	"222480060513394688"	https://twitter.com/StephieGilley/status/222480060513394688
	2012-07-09 23:58	0	0	"amen! No appeal in govt denials MT “ @markwonderful : See how I'm 'fighting' with (evil for-profit) Cigna? What kind of chance w\ ObamaCare ?"		@markwonderful		"222479945492987904"	https://twitter.com/ginaswo/status/222479945492987904
	2012-07-09 23:58	0	0	"Obamacare Negatively Impacts Minorities http:// shar.es/trfIR via @sharethis"		@sharethis		"222479929302978560"	https://twitter.com/GraceMinistry/status/222479929302978560
	2012-07-09 23:58	0	0	"Report: 83 percent of doctors have considered quitting over Obamacare http:// goo.gl/fb/ty56J"				"222479915621167104"	https://twitter.com/hotlisthotlist/status/222479915621167104
	2012-07-09 23:58	0	0	"Obamacare Negatively Impacts Minorities http:// fb.me/1cGiie2Wh"				"222479880531611648"	https://twitter.com/GraceMinistry/status/222479880531611648
	2012-07-09 23:58	0	0	"5 Basics for Defending Obamacare | News & Politics http:// digg.com/!daCMxYh via @Digg"		@Digg		"222479861636284416"	https://twitter.com/ThomasB00001/status/222479861636284416
	2012-07-09 23:58	0	0	"RT @HailGalvatron : Rick Perry Saves Poor Texans from Scourge of Medical Care http:// bit.ly/LbWJIB #obamacare #AmericanTaliban"		@HailGalvatron	#obamacare #AmericanTaliban	"222479822532788225"	https://twitter.com/mampdx/status/222479822532788225
	2012-07-09 23:58	0	0	"How ObamaCare Will Strengthen Small Businesses - International Business Times: http://www. ibtimes.com/articles/36114 1/20120709/obamacare-aca-affordable-healthcare-act-small-businesses.htm#.T_tv0VVTkbo.twitter …"			#	"222479805755572224"	https://twitter.com/amending_us/status/222479805755572224
	2012-07-09 23:58	0	0	"83% OF DOCTORS 'HAVE CONSIDERED QUITTING' OVER OBAMACARE"				"222479794468700163"	https://twitter.com/LisaSan23/status/222479794468700163
	2012-07-09 23:58	0	0	"@JasonBWhitman Docs considered quitting because of Obamacare ; in a sane world Obama would have 0 approval rating"		@JasonBWhitman		"222479781860622336"	https://twitter.com/Pogo407/status/222479781860622336
	2012-07-09 23:58	0	0	"Insanity: doing the same thing more than once & expecting different results.R's vote to repeal #Obamacare 31 times http:// buff.ly/RMXlVm #hcr"			#Obamacare #hcr	"222479777905389568"	https://twitter.com/Action_NC/status/222479777905389568
	2012-07-09 23:58	0	0	"Rick Perry Won't Implement Obamacare In TX http:// freedomoutpost.com/2012/07/rick-p erry-wont-implement-obamacare-in-tx/all … governors should do same!"				"222479774315053056"	https://twitter.com/whamalammading/status/222479774315053056
	2012-07-09 23:58	0	0	"Rep. Blackburn (R-TN) Wants To Repeal Obamacare Every Day: 'We’d Do It Again And Again And Again’ http:// fb.me/23yBjiFvd"				"222479774260543488"	https://twitter.com/snkscoyote/status/222479774260543488
	2012-07-09 23:58	0	0	"American Thinker Articles: ObamaCare Is Shovel-Ready for You: http:// bit.ly/NlpeCw"				"222479760020877315"	https://twitter.com/_4Brooke2_/status/222479760020877315
	2012-07-09 23:57	0	0	"@RightWingAngel @Common_Sense4U Definitely true -so NOW he wants to #TAX those earning < $120k ( #ObamaCare ) AND those earning > $250k! #tcot"		@RightWingAngel @Common_Sense4U	#TAX #ObamaCare #tcot	"222479711668932608"	https://twitter.com/TopInfoBlogs/status/222479711668932608
	2012-07-09 23:57	0	0	"My doc says "I'm done"..what a loss....MT" @nedryun : 83% of doctors considered quitting over ObamaCare . http:// thedc.com/MVynUc #majority #tcot ""		@nedryun	#majority #tcot	"222479669394554885"	https://twitter.com/scwynne/status/222479669394554885
	2012-07-09 23:57	0	0	"Florida don't need no stinkin' Obamacare to kill its citizens with bad public health management. Palm Beach Post http:// bit.ly/NloRrz"				"222479663648354305"	https://twitter.com/MassingsOutbox/status/222479663648354305
	2012-07-09 23:57	1	0	"Tomorrow is the 31st vote to repeal Obamacare . And some crazy lady in the House wants to vote on it literally every day. Children."				"222479648242679808"	https://twitter.com/Hillgod/status/222479648242679808
	2012-07-09 23:57	1	0	"Aca con francho viendo high school musical 1"				"222479627027877888"	https://twitter.com/lilijabif/status/222479627027877888
	2012-07-09 23:57	0	0	"Report: 83 percent of doctors have considered quitting over Obamacare http:// dailycaller.com/2012/07/09/rep ort-83-percent-of-doctors-have-considered-quitting-over-obamacare/ …"				"222479620820312064"	https://twitter.com/jimwisdom/status/222479620820312064
	2012-07-09 23:57	0	0	"Rick Perry Won't Implement Obamacare In TX : Freedom Outpost: http:// freedomoutpost.com/2012/07/rick-p erry-wont-implement-obamacare-in-tx/#.T_nzIa1xuD4.twitter … @theblaze"		@theblaze	#	"222479612507193344"	https://twitter.com/jjcrocket/status/222479612507193344
	2012-07-09 23:57	1	1	"No free market: gov't spends 51% of all #healthcare dollars today. #Obamacare increases that amount dramatically, decr. the quality of care."			#healthcare #Obamacare	"222479586502512640"	https://twitter.com/maxharris9/status/222479586502512640
	2012-07-09 23:57	0	0	"Rick Perry Won't Implement Obamacare In TX : Freedom Outpost http:// freedomoutpost.com/2012/07/rick-p erry-wont-implement-obamacare-in-tx/ …"				"222479576771739648"	https://twitter.com/Docs357/status/222479576771739648
	2012-07-09 23:57	0	0	"It'll be 100% when fully implemented RT @DRUDGE_REPORT : 83% OF DOCTORS 'HAVE CONSIDERED QUITTING' OVER OBAMACARE http:// drudge.tw/NlbwzH"		@DRUDGE_REPORT		"222479570023092225"	https://twitter.com/CPforFREE/status/222479570023092225
	2012-07-09 23:57	1	1	"CADDELL: Taxes and Trust - The Achilles Heels of Obamacare and Obama http:// shar.es/trflb Among other things."				"222479568689299457"	https://twitter.com/TabithaStevens8/status/222479568689299457
	2012-07-09 23:57	0	0	"#Texas says no to #ObamaCare http:// bit.ly/NWRN5Z Time for the states to stand tall and be counted"			#Texas #ObamaCare	"222479565996572674"	https://twitter.com/ThomasArdinger/status/222479565996572674
	2012-07-09 23:57	1	0	"Rick Perry Won't Implement Obamacare In TX : Freedom Outpost: http:// freedomoutpost.com/2012/07/rick-p erry-wont-implement-obamacare-in-tx/#.T_nzIa1xuD4.twitter …"			#	"222479542000955393"	https://twitter.com/jjcrocket/status/222479542000955393
	2012-07-09 23:57	0	0	"Daily Kos: Thanks ACA /Obamacares! My rebate check is here. Updated. http://www. dailykos.com/story/2012/07/ 09/1107904/-Thanks-ACA-Obamacares-My-rebate-check-is-here … via @dailykos"		@dailykos		"222479535969546240"	https://twitter.com/kimroc1/status/222479535969546240
	2012-07-09 23:57	0	0	"Had a long week bout to chill n clean the crib up"				"222479516306653185"	https://twitter.com/DEESTATE_ACA/status/222479516306653185
	2012-07-09 23:57	0	0	"CNN Smacks Republicans for Not Helping Constituents 'Comply' With ObamaCare http:// goo.gl/Zkvxh"				"222479504893947904"	https://twitter.com/GrodenBiker/status/222479504893947904
	2012-07-09 23:56	0	0	"RT @DailyCaller Report: 83 percent of doctors have considered quitting over Obamacare - http:// thedc.com/Nlp4em"		@DailyCaller		"222479460514013187"	https://twitter.com/01kris/status/222479460514013187
	2012-07-09 23:56	0	0	"No tax increase on the middle class? Look again .. - Under ObamaCare , all real estate transactions... http:// fb.me/1P0zZVFjx"				"222479426372382720"	https://twitter.com/agthorn/status/222479426372382720
	2012-07-09 23:56	0	0	"83% of physicians have considered leaving their practices over Obamacare is another reason why it won't end well. http:// ow.ly/c7Noe"				"222479425361555456"	https://twitter.com/keepidahored/status/222479425361555456
	2012-07-09 23:56	0	0	"Rick Perry Won't Implement Obamacare In TX | THANK YOU GOV. Now About that Insane Dewhurst Endorsement... | http:// bit.ly/NloWM8"				"222479418294153216"	https://twitter.com/TheCHISportsFan/status/222479418294153216
	2012-07-09 23:56	2	1	"I can't believe states would reject parts of obamacare what happened to caring about people?"				"222479401131053059"	https://twitter.com/haffalafagus/status/222479401131053059
	2012-07-09 23:56	0	0	"Friend in CA laid off today bc of #Obamacare . Watch for spike in unemployment #NOBama2012 #repealnow"			#Obamacare #NOBama2012 #repealnow	"222479363801751553"	https://twitter.com/twinmommyaj/status/222479363801751553
	2012-07-09 23:56	0	0	"Tell The Governor and Legislature: “NULLIFY Obamacare In FLORIDA Now!!”... http:// fb.me/26rAS0Ssn"				"222479299628904449"	https://twitter.com/TenthVolunteers/status/222479299628904449
	2012-07-09 23:56	10	0	"#LinesFromObamaMovies This is Obamacare . The largest tax increase in American history. So you just have to ask yourself. Do you feel broke?"			#LinesFromObamaMovies	"222479285603155969"	https://twitter.com/critterman76/status/222479285603155969
	2012-07-09 23:56	2	0	"83% OF DOCTORS 'HAVE CONSIDERED QUITTING' OVER OBAMACARE || If this isn't a good enough reason to repeal Obozo and ObozoCare, what is?"				"222479259619438592"	https://twitter.com/TennConserv/status/222479259619438592
	2012-07-09 23:56	2	0	"RT @TheDailyEdge : #Romney vows to repeal Obamacare and replace it with 30 million uninsured Americans"		@TheDailyEdge	#Romney	"222479248533897218"	https://twitter.com/Joy__Hart/status/222479248533897218
	2012-07-09 23:55	0	0	"Texas rejects key provisions of Obama's health law - Why hasn't #CT 's #Dannel Malloy? #Obamacare =bankrupt state & USA! http:// news.yahoo.com/texas-governor -rejects-two-provisions-health-law-141205128.html …"			#CT #Dannel #Obamacare	"222479219232477184"	https://twitter.com/blueskyys2/status/222479219232477184
	2012-07-09 23:55	0	0	"More #Murders in #Chicago in 2012 than #Afganistan . #Obama and former campaign exec #Emanuel cant even clean up own backyard. #Obamacare"			#Murders #Chicago #Afganistan #Obama #Emanuel #Obamacare	"222479215025594368"	https://twitter.com/johnmatthew19/status/222479215025594368
	2012-07-09 23:55	0	0	"Rick Perry joins Republican governors who won’t implement Obamacare | The Ticket - Yahoo! News http:// news.yahoo.com/blogs/ticket/r ick-perry-joins-republican-governors-won-t-implement-165029996.html … via @YahooNews"		@YahooNews		"222479189809430529"	https://twitter.com/armybmed/status/222479189809430529
	2012-07-09 23:55	19	1	"#Romney vows to repeal Obamacare and replace it with 30 million uninsured Americans"			#Romney	"222479171773927425"	https://twitter.com/TheDailyEdge/status/222479171773927425
	2012-07-09 23:55	0	0	"" Will Obamacare Taxes And Subsidies Convince Enough People To Buy Insurance?: Last week, I concluded that the... http:// onforb.es/MTmazQ ""				"222479163821527040"	https://twitter.com/TOPinEntrep/status/222479163821527040
	2012-07-09 23:55	0	0	"Rick Perry Won't Implement Obamacare In TX : Freedom Outpost: http:// freedomoutpost.com/2012/07/rick-p erry-wont-implement-obamacare-in-tx/#.T_tvYWFb-iM.twitter …"			#	"222479141650432001"	https://twitter.com/DewittTim/status/222479141650432001
	2012-07-09 23:55	0	0	"WHY DID OBAMACARE NOT GET READ AND ALL THE TAX IMPLICATIONS NOT DIVULGED?"				"222479132364251137"	https://twitter.com/realspoiled/status/222479132364251137
	2012-07-09 23:55	2	1	"Amy, an @OFA_CA staffer, explains the importance of Obamacare and her livelihood. You don’t want to miss this story. http://www. barackobama.com/news/entry/i-n ever-thought-it-would-happen-to-me-ca-amy?source=tweet_btn …"		@OFA_CA		"222479121807196162"	https://twitter.com/Feminizzzm/status/222479121807196162
	2012-07-09 23:55	0	0	"" @ebrew79 : I don't know what is more pointless, House vote to repeal ACA or Romney going to the NAACP. #Wastesoftime #p2 #tcot ""		@ebrew79	#Wastesoftime #p2 #tcot	"222479110646136833"	https://twitter.com/vrsheely/status/222479110646136833
	2012-07-09 23:55	0	0	"EXCLUSIVE - CADDELL: Taxes and Trust - The Achilles Heels of Obamacare and Obama http:// shar.es/trf7s via @sharethis"		@sharethis		"222479091855667201"	https://twitter.com/jimwisdom/status/222479091855667201
	2012-07-09 23:55	0	0	"Obama's summer blockbuster sequel to ObamaCare - raise taxes and regulations and... http:// dlvr.it/1ql4l9"				"222479064542351361"	https://twitter.com/AngelaHaysMoore/status/222479064542351361
	2012-07-09 23:55	0	0	"ObamaCare IRS Agents The ‘New Gestapo’ http://www. westernjournalism.com/obamacare-irs- agents-the-new-gestapo/ … via @WestJournalism"		@WestJournalism		"222479031147315203"	https://twitter.com/Scrufey21/status/222479031147315203
	2012-07-09 23:55	0	0	"@marklevinshow No kidding! Because of him, a precedent has been set, whether or not Obamacare is repealed."		@marklevinshow		"222479017419341825"	https://twitter.com/SumySchick/status/222479017419341825
	2012-07-09 23:55	0	0	"@marklevinshow you should go to your Cardiologist because we can't lose you! Especially before obamacare starts. Are you crazy?"		@marklevinshow		"222479013522849792"	https://twitter.com/Jenrstokes/status/222479013522849792
	2012-07-09 23:55	0	0	"Rick Perry has claimed that Texas won't implement the ACA . PLEASE tell me this is a step towards secession"				"222479003083214848"	https://twitter.com/jonahloeb/status/222479003083214848
	2012-07-09 23:55	0	0	"Report: 83 percent of doctors have considered quitting over Obamacare http:// dailycaller.com/2012/07/09/rep ort-83-percent-of-doctors-have-considered-quitting-over-obamacare/ …"				"222479002898665472"	https://twitter.com/ptaounly/status/222479002898665472
	2012-07-09 23:55	0	0	"In a 2009 interview by G. Stephanopoulos #Obama said Obamacare will NOT be a #TAX , at 2:00 http:// goo.gl/QP00t #independents #norfolk"			#Obama #TAX #independents #norfolk	"222478993180463108"	https://twitter.com/preciousliberty/status/222478993180463108
	2012-07-09 23:54	0	0	"@edshow Have Republicans EVER worked 4 the middle class?They'll vote against the 98% w/ 1 hand as they vote 2 repeal the ACA w/ the other."		@edshow		"222478932597940226"	https://twitter.com/MalibuBarbaraW/status/222478932597940226
	2012-07-09 23:54	7	1	"83% of doctors considered quitting over ObamaCare . http:// thedc.com/MVynUc #majority #tcot"			#majority #tcot	"222478931238993920"	https://twitter.com/nedryun/status/222478931238993920
	2012-07-09 23:54	0	0	"Daily Beast: &quot;Mitt #romney ’s Empty Obamacare -Repeal Rhetoric&quot; - An article from the Daily... http:// j.mp/N33TxP #DailyBeast"			#romney #DailyBeast	"222478931046043648"	https://twitter.com/RonPaulTeam/status/222478931046043648
	2012-07-09 23:54	0	0	"Daily Kos: Thanks ACA /Obamacares! My rebate check is here. Updated. http://www. dailykos.com/story/2012/07/ 09/1107904/-Thanks-ACA-Obamacares-My-rebate-check-is-here … via @dailykos"		@dailykos		"222478911110524928"	https://twitter.com/b140tweet/status/222478911110524928
	2012-07-09 23:54	0	0	"Obamacare “ @TriciaNC1 : Chicago Abortionist Collects $3.1 Million In Medicaid http:// bit.ly/McoKLs #tcot #p2 #prolife #catholic @SBAList ”"		@TriciaNC1 @SBAList	#tcot #p2 #prolife #catholic	"222478882132074497"	https://twitter.com/mdj17/status/222478882132074497
	2012-07-09 23:54	4	0	"Let's all say it together now...MORON: Perry's Stand Against Obamacare Hurts Uninsured http:// huff.to/Mgt8LO via @HuffPostPol #ACA"		@HuffPostPol	#ACA	"222478873907052545"	https://twitter.com/StephieGilley/status/222478873907052545
	2012-07-09 23:54	0	0	"#Entrepreneurs #News Will Obamacare Taxes And Subsidies Convince Enough People To Buy Insurance? http:// onforb.es/OSI854 #Forbes #London"			#Entrepreneurs #News #Forbes #London	"222478870358663168"	https://twitter.com/connectcontacts/status/222478870358663168
	2012-07-09 23:54	0	0	"Report: 83 percent of doctors have considered quitting over Obamacare | The Daily Caller http:// buff.ly/PHBEZu"				"222478848623771648"	https://twitter.com/FrankProch60/status/222478848623771648
	2012-07-09 23:54	0	0	"Hahaha Rick Perry 'rejected the Obamacare power grab.' go TX. >>>>"				"222478822300327938"	https://twitter.com/dani_anglin/status/222478822300327938
	2012-07-09 23:54	2	0	"Good God I love this Governor! GO TEXAS!! RT @Directorwebber Rick Perry Won’t Implement Obamacare In TX http:// freedomoutpost.com/2012/07/rick-p erry-wont-implement-obamacare-in-tx/ … #TCOT #NoMoBo"		@Directorwebber	#TCOT #NoMoBo	"222478808090030080"	https://twitter.com/Stellasasha1/status/222478808090030080
	2012-07-09 23:54	0	0	"Texas Will Not Take Part in Obamacare , Says Rick Perry. http:// kfyo.com/?p=51231"				"222478791879049216"	https://twitter.com/KFYO/status/222478791879049216
	2012-07-09 23:54	0	0	"Texas Gov. Rick Perry: ObamaCare will “find no foothold here” « Hot Air http:// hotair.com/archives/2012/ 07/09/texas-gov-rick-perry-obamacare-will-find-no-foothold-here/ … 2 Change Motto 2 "Don't F*CK With Texas! BIOTCH"				"222478772828520449"	https://twitter.com/Libertarian52/status/222478772828520449
	2012-07-09 23:53	0	0	"HHS announces 89 new Accountable Care Organizations http:// 1.usa.gov/NkFXmd #HCR #ACA #HITsm #ACOs"			#HCR #ACA #HITsm #ACOs	"222478693564551169"	https://twitter.com/ElinSilveous/status/222478693564551169
	2012-07-09 23:53	0	0	"LeftAction: Tell Rush: " Obamacare Won. Move to Costa Rica" http:// fb.me/22ZvaR8LY"				"222478687663165442"	https://twitter.com/RJA1016/status/222478687663165442
	2012-07-09 23:53	2	0	"Report: 83 percent of doctors have considered quitting over Obamacare | The Daily Caller http:// thedc.com/NktKOf"				"222478680394440704"	https://twitter.com/jddickson/status/222478680394440704
	2012-07-09 23:53	0	0	"Report: 83 percent of doctors have considered quitting over Obamacare http:// lnkd.in/P37AVE"				"222478679316496384"	https://twitter.com/davedias/status/222478679316496384
	2012-07-09 23:53	3	0	"Wednesday (7/11) The House will be voting to #repeal #ObamaCare #ObamaTax . Please call Congress @202-224-3121 & ask your Rep to repeal it!"		@202	#repeal #ObamaCare #ObamaTax	"222478584734953472"	https://twitter.com/gardenofthegods/status/222478584734953472
	2012-07-09 23:53	0	0	"HHS announces 89 new Accountable Care Organizations http://www. hhs.gov/news/press/201 2pres/07/20120709a.html … #HCR #ACA #HITsm #ACOs"			#HCR #ACA #HITsm #ACOs	"222478575041921024"	https://twitter.com/ElinSilveous/status/222478575041921024
	2012-07-09 23:53	0	0	"What do physicians feel about the Affordable Health Care Act (aka Obamacare ). http:// dailycaller.com/2012/07/09/rep ort-83-percent-of-doctors-have-considered-quitting-over-obamacare/ … < impending #healthcare crisis?"			#healthcare	"222478572558884864"	https://twitter.com/cepheuskb/status/222478572558884864
	2012-07-09 23:53	0	0	"Rick Perry Won't Implement Obamacare In TX : Freedom Outpost: http:// freedomoutpost.com/2012/07/rick-p erry-wont-implement-obamacare-in-tx/#.T_tu23OJdu0.twitter …"			#	"222478562979086336"	https://twitter.com/PICKYPUTT/status/222478562979086336
	2012-07-09 23:53	0	0	"Napolitano: Obamacare #ruling Will Drive Libertarians To Romney – Has the Judge lost his mind? - ... http:// j.mp/N33Vpx #SupremeCourt"			#ruling #SupremeCourt	"222478555492253696"	https://twitter.com/RonPaulTeam/status/222478555492253696
	2012-07-09 23:53	0	0	"Hope @MittRomney sees EXCLUSIVE - CADDELL: Taxes and Trust - The Achilles Heels of Obamacare and Obama http:// shar.es/trW8y via @sharethis"		@MittRomney @sharethis		"222478552652718080"	https://twitter.com/southwest_dude/status/222478552652718080
	2012-07-09 23:53	0	0	"Will Obamacare Taxes And Subsidies Convince Enough People To Buy ... - Forbes: ForbesWill Obamacare Taxes An... http:// bit.ly/MTlE4P #fb"			#fb	"222478545711136768"	https://twitter.com/insurance_123/status/222478545711136768
	2012-07-09 23:53	2	0	"83% of doctors have considered quitting over obamacare . That my friends is spelled R-A-T-I-O-N-I-N-G"				"222478545665003520"	https://twitter.com/stinger5150/status/222478545665003520
	2012-07-09 23:53	0	0	"LIKE HIM OR HATE HIM; HE DECIDED RIGHT ON THIS ONE! Rick Perry: No Obamacare for Texas - http://www. infowars.com/rick-perry-no- obamacare-for-texas/ …"				"222478542548631552"	https://twitter.com/thepragmatist/status/222478542548631552
	2012-07-09 23:53	0	0	".RT @CharleneTeglia : For some, 2014 is too long to wait #ACA http:// aaronwinborn.com/blogs/aaron/sp ecial-needs-trust …"		@CharleneTeglia	#ACA	"222478539822346241"	https://twitter.com/esmerel/status/222478539822346241
	2012-07-09 23:53	0	0	"@Forbes : What Obamacare will do to your taxes. http:// bit.ly/PAtBwb"		@Forbes		"222478525737869315"	https://twitter.com/vanityrae/status/222478525737869315
	2012-07-09 23:53	1	0	"Rick Perry won't implement Obamacare http:// huff.to/NalZ1z"				"222478508943872000"	https://twitter.com/HuffPostDenver/status/222478508943872000
	2012-07-09 23:52	0	0	"80% Expect #Obamacare Repeal if @MittRomney Wins http://www. lifenews.com/2012/07/09/eig hty-percent-expect-obamacare-repeal-if-romney-wins/ … #Mitt2012 #Obamatax #tcot #twisters #p2 #teaparty #tlot #lnyhbt"		@MittRomney	#Obamacare #Mitt2012 #Obamatax #tcot #twisters #p2 #teaparty #tlot #lnyhbt	"222478485300584449"	https://twitter.com/Blueberrier0341/status/222478485300584449
	2012-07-09 23:52	0	0	"Obamacare is Roberts' 'Schrodinger's cat' - Washington Times http:// bit.ly/PInN52"				"222478481622175745"	https://twitter.com/Petatreats/status/222478481622175745
	2012-07-09 23:52	0	0	"Daily Kos: Thanks ACA /Obamacares! My rebate check is here. Updated. http://www. dailykos.com/story/2012/07/ 09/1107904/-Thanks-ACA-Obamacares-My-rebate-check-is-here … via @dailykos"		@dailykos		"222478454652809216"	https://twitter.com/ParadigmShiftII/status/222478454652809216
	2012-07-09 23:52	0	0	"RT @povertynews : The Washington Post, Blog: ‘ Obamacare ’ tax hikes vs. tax breaks: Which is greater? http:// wapo.st/Mbjvvi #poverty"		@povertynews	#poverty	"222478435619061761"	https://twitter.com/bobglows/status/222478435619061761
	2012-07-09 23:52	0	0	"Interesting! “ @CarolynMcC : Congress keep lifetime healthcare if ACA repealed, but won't if it is not repealed. http:// thehill.com/blogs/healthwa tch/politics-elections/236823-repealing-health-law-would-mean-more-benefits-for-members-of-congress … #hcr ”"		@CarolynMcC	#hcr	"222478427075248128"	https://twitter.com/MSFFinancial/status/222478427075248128
	2012-07-09 23:52	0	0	"Obamacare : In a medical emergency call what used to be 911 but is now 1-800-MY-GOV-ALL. Press "A" for Lower-Class, "B" for Middle-Class..."				"222478411208208384"	https://twitter.com/Lanettetay/status/222478411208208384
	2012-07-09 23:52	0	0	"Maybe-- @Forbes : The Supreme Court's ObamaCare decision could remove millions from Medicaid, writes @matthewherper . http:// bit.ly/PALI5k"		@Forbes @matthewherper		"222478393311113216"	https://twitter.com/MaureenFischer/status/222478393311113216
	2012-07-09 23:52	0	0	"Sad day for poor people in Texas RT @TPM : Rick Perry refuses to implement ' Obamacare ': http:// tpm.ly/PBClSZ"		@TPM		"222478392593887234"	https://twitter.com/KurtRexCooper/status/222478392593887234
	2012-07-09 23:52	1	0	"Also GOING GALT Report: 83 percent of doctors have considered quitting over Obamacare | The Daily Caller http:// dailycaller.com/2012/07/09/rep ort-83-percent-of-doctors-have-considered-quitting-over-obamacare/ …"				"222478381206339584"	https://twitter.com/MinuteMom/status/222478381206339584
