username;date;retweets;favorites;text;geo;mentions;hashtags;id;permalink
	2012-04-23 19:19	0	0	"Obamacare will save Medicare $ 200 billion by 2016, Medicare patients 208 billion by 2020 http:// feeds.dailykos.com/~r/dailykos/in dex/~3/P6IJ7Zrgz_I/-Obamacare-will-save-Medicare-200-billion-by-nbsp-2016- …"				"194505692391026689"	https://twitter.com/Nickcherryhill/status/194505692391026689
	2012-04-23 19:18	0	0	"NOW FOLLOWING @ACA _PR FB"		@ACA		"194505594932170752"	https://twitter.com/IAMJAIJIN/status/194505594932170752
	2012-04-23 19:18	1	0	"RT @brianbeutler Trustee reports put Obamacare , Medicare privatization front and center again http:// bit.ly/J5mOST"		@brianbeutler		"194505585272684544"	https://twitter.com/sahilkapur/status/194505585272684544
	2012-04-23 19:18	1	0	"@PMQuarterly @hope @aca _info @iacprx it was good meeting you. I was impressed with your presentation and magazine."		@PMQuarterly @hope @aca @iacprx		"194505437880659971"	https://twitter.com/pharmalab/status/194505437880659971
	2012-04-23 19:17	0	0	"Trustee reports put Obamacare , Medicare privatization front and center again http:// bit.ly/J5mOST"				"194505406880559105"	https://twitter.com/brianbeutler/status/194505406880559105
	2012-04-23 19:17	0	0	"Daily Kos: Obamacare will save Medicare $200 billion by 2016 http://www. dailykos.com/story/2012/04/ 23/1084763/-Obamacare-will-save-Medicare-200-billion-by-nbsp-2016- … via @dailykos #OBAMA2012"		@dailykos	#OBAMA2012	"194505357442301952"	https://twitter.com/b140tweet/status/194505357442301952
	2012-04-23 19:17	0	0	"Medicare's Chief Actuary: Sorry, ObamaCare 's Medicare Reforms Probably Aren't Viable in the Long Term: ... http:// bit.ly/JvG1Te #liberty"			#liberty	"194505279306596353"	https://twitter.com/JDMarvin/status/194505279306596353
	2012-04-23 19:17	0	0	"GAO Report Blasts $8.2 Billion #Obamacare Boondoggle http://www. newsmax.com/Newsfront/Medi careBonuses/2012/04/23/id/436741 … #OBAMA IS A CROOK! #tcot #tlot #bcot #lcot #jcot #truthteam #obama"			#Obamacare #OBAMA #tcot #tlot #bcot #lcot #jcot #truthteam #obama	"194505213510561792"	https://twitter.com/PIGWEAR/status/194505213510561792
	2012-04-23 19:17	0	0	"Is Obamacare Good For Small Businesses?: The Patient Protection and Affordable Care Act, aka Obam... http:// brk.bz/JqTHQB #Business #BRK"			#Business #BRK	"194505201485496320"	https://twitter.com/BusinessNewsBRK/status/194505201485496320
	2012-04-23 19:17	6	1	"Obamacare is Great Law; Progressives Should Tell Voters What it Does! http:// bit.ly/HESAWM"				"194505195596677120"	https://twitter.com/MiltShook/status/194505195596677120
	2012-04-23 19:17	0	0	"Obamacare is Great Law; Progressives Should Tell Voters What it Does! http:// bit.ly/HESAWM"				"194505194971738113"	https://twitter.com/PlzCuttheCrap/status/194505194971738113
	2012-04-23 19:17	0	0	"Business News - Is Obamacare Good For Small Businesses?: The Patient Protection and Affordable Care Act, aka Oba... http:// onforb.es/JqTHAa"				"194505192610336768"	https://twitter.com/e24business/status/194505192610336768
	2012-04-23 19:17	0	0	"The ACA wouldn't be the same w/o these awesome cyclists! Roxanne is doing #Armadillo ! http:// ow.ly/a2lcw Are you?"			#Armadillo	"194505186268545024"	https://twitter.com/AustinCycling/status/194505186268545024
	2012-04-23 19:17	0	0	"Is Obamacare Good For Small Businesses?: The Patient Protection and Affordable Care Act, aka Obamacare , was pass... http:// onforb.es/Iu8QfN"				"194505183965872128"	https://twitter.com/eensing/status/194505183965872128
	2012-04-23 19:16	0	0	"#obama and the #Democrats refuse to submitt or pass a budget because they are hiding the cost of OBAMACARE . Why is the media #ABC silent?"			#obama #Democrats #ABC	"194505132501766145"	https://twitter.com/cjjeme/status/194505132501766145
	2012-04-23 19:16	0	0	"Obamacare will save Medicare $200 billion by 2016 http:// fb.me/XePI5fS7"				"194505030324338688"	https://twitter.com/marthajadams/status/194505030324338688
	2012-04-23 19:16	2	0	"JEWISH HEARTS FOR AFRICA | ACA | PHIBETASIGMA PRESENTS: FUNDRAISER AT FIRESTATION WEDNESDAY APR 25TH $5 WRIS http:// instagr.am/p/JxgNHNI9is/"				"194504971167862785"	https://twitter.com/LEVERAGE223/status/194504971167862785
	2012-04-23 19:15	1	0	"RT @kippiper : Medicaid Expansion: ASPE report on wildly differing #Medicaid enrollment projections for 2014. http:// goo.gl/yOlVW #HCR #ACA"		@kippiper	#Medicaid #HCR #ACA	"194504779886632961"	https://twitter.com/NHPForum/status/194504779886632961
	2012-04-23 19:14	0	0	"@Anita1793 Awesome, x lo q escuche aca viene Foo Fighters!"		@Anita1793		"194504619613888512"	https://twitter.com/KaryLowe/status/194504619613888512
	2012-04-23 19:14	1	0	"Weekend Jolt: Seattle Times Calls Cantwell Opponent’s Obamacare Claims Off Base http:// dlvr.it/1TBch3"				"194504569114464256"	https://twitter.com/publicolanews/status/194504569114464256
	2012-04-23 19:13	2	0	"#Share ▬► Democrats are 'pulling-back' on #ObamaCare . Why did they vote on it? Right, to get re-elected. They don't care about its' effects."			#Share #ObamaCare	"194504364482772992"	https://twitter.com/apoetsailor/status/194504364482772992
	2012-04-23 19:13	1	0	"Medicare's Chief Actuary: Sorry, ObamaCare 's Medicare Reforms Probably Aren't Viable in the Long... http:// dlvr.it/1TBcPR #tlot #amagi #tcot"			#tlot #amagi #tcot	"194504352814215168"	https://twitter.com/LibertyIsNow/status/194504352814215168
	2012-04-23 19:13	0	0	"Medicare's Chief Actuary: Sorry, ObamaCare 's Medicare Reforms Probably Aren't Viable in the Long... http:// dlvr.it/1TBcNx #indie #rock #music"			#indie #rock #music	"194504350687703041"	https://twitter.com/HelixtheZombie/status/194504350687703041
	2012-04-23 19:13	0	0	"Medicare's Chief Actuary: Sorry, ObamaCare 's Medicare Reforms Probably Aren't Viable in the Long... http:// dlvr.it/1TBcNz #tlot #hipster #p2"			#tlot #hipster #p2	"194504350326980610"	https://twitter.com/HipsterLiberty/status/194504350326980610
	2012-04-23 19:13	0	0	"My Birthday Plans Are April 28th I'm Partying At Club Elysuim With ACA Babysam JRoc And Many More. (cont) http:// tl.gd/h46c5e"				"194504163739172864"	https://twitter.com/LTC_Kesh/status/194504163739172864
	2012-04-23 19:13	0	0	"WashPost | Sandra Fluke, Georgetown students continue fight for contraception coverage http:// wapo.st/HZbrT7 #waronwomen #hcr #Obamacare"			#waronwomen #hcr #Obamacare	"194504163089063936"	https://twitter.com/HCAN/status/194504163089063936
	2012-04-23 19:12	0	0	"Sitting in the Dr waiting area and it's boring. I wonder what the average wait time will be after Obamacare is in full tilt. Less? More?"				"194503931144052736"	https://twitter.com/KennethWells/status/194503931144052736
	2012-04-23 19:12	0	0	"Please take action on the #RLCNH Report according to your conscience: http:// bit.ly/I9PiQL (Take action: Anti- Obamacare effort this week)."			#RLCNH	"194503918112346113"	https://twitter.com/RLCNH/status/194503918112346113
	2012-04-23 19:11	0	0	"Via @Reason Medicare's Chief Actuary: Sorry, ObamaCare 's Medicare Reforms Probably Aren't Vi... #twisters #tcot #WAR"		@Reason	#twisters #tcot #WAR	"194503850370142208"	https://twitter.com/suzibasterd/status/194503850370142208
	2012-04-23 19:10	0	0	"#ObamaCare " #MedicareAdvantage benefits will be significantly cut back...." Medicare http:// shar.es/rRJbp"			#ObamaCare #MedicareAdvantage	"194503643532238848"	https://twitter.com/boneswagger/status/194503643532238848
	2012-04-23 19:10	0	0	"Trustees: Medicare Will Go Broke in 2016, If You Exclude Obamacare 's Double-Counting - Forbe... http:// j.mp/JqSatI #medical"			#medical	"194503609889726464"	https://twitter.com/internetmedassn/status/194503609889726464
	2012-04-23 19:10	0	0	"@KeithAllGamer Romney's solution is stopping Obamacare , but no alternative provided..."		@KeithAllGamer		"194503508303687680"	https://twitter.com/stevekaw/status/194503508303687680
	2012-04-23 19:09	0	0	"Obamacare beats hell out of "I don't care" http:// fb.me/1kydBn6z6"				"194503203226791938"	https://twitter.com/BartSlawson/status/194503203226791938
	2012-04-23 19:08	0	0	"ACA Seeks Streamlined EAS Waiver For Very Small Systems That Lack Physical Access To Broadband At The Headend http:// bit.ly/JNjVr8"				"194503055922831360"	https://twitter.com/ROSSatACA/status/194503055922831360
	2012-04-23 19:08	0	0	"Repeal #Obamacare Independent Payment Advisory Board: http:// concord-nh.patch.com/articles/op-ed -repeal-obamacare-independent-payment-advisory-board …"			#Obamacare	"194502969734082561"	https://twitter.com/sallypipes/status/194502969734082561
	2012-04-23 19:07	0	0	"@OFA_DA Because she's a shill for #obama . Even a first year law student can see that #obamacare is unconstitutional.."		@OFA_DA	#obama #obamacare	"194502763533713408"	https://twitter.com/Patriot762x51mm/status/194502763533713408
	2012-04-23 19:06	0	0	"@suzy_rice ... and rabidly opposed to RomneyCare-- you can find stuff I wrote on it bashing it from 2006. Obv, I oppose Obamacare , too."		@suzy_rice		"194502648593006592"	https://twitter.com/LizMair/status/194502648593006592
	2012-04-23 19:06	0	0	"American Christian 7 Sand Rock 2: Hannah Burr's 2-run HR paves way for ACA win over Sand Rock. http:// bit.ly/JNiZTy"				"194502627365625856"	https://twitter.com/aldotcomPreps/status/194502627365625856
	2012-04-23 19:06	0	0	"Is Obamacare Good For Small Businesses? http:// dlvr.it/1TBXvT #business"			#business	"194502446230413313"	https://twitter.com/SmallBizCounsel/status/194502446230413313
	2012-04-23 19:06	0	0	"In The News: Is Obamacare Good For Small Businesses? - Forbes: Is Obamacare Good For Small Businesses?ForbesObam... http:// bit.ly/JNiBEB"				"194502431307075585"	https://twitter.com/CorporateKari/status/194502431307075585
	2012-04-23 19:06	0	0	"GOP Cries Foul As #CMS Actuaries Attribute $200B In Medicare Savings To ACA http:// ow.ly/asQih #HealthReform #Budget"			#CMS #HealthReform #Budget	"194502413670031360"	https://twitter.com/InHealthPolicy/status/194502413670031360
	2012-04-23 19:04	3	0	"How Exercise Could Lead to a Better Brain http:// nyti.ms/JrXOuI healthcare hcr ACA /via @winterthur"		@winterthur		"194502071616147456"	https://twitter.com/yagbebi/status/194502071616147456
	2012-04-23 19:04	0	0	"I am totally Homeopathic and do not want to be forced to purchase Healthcare or Obamacare should I be Forced to purchase??? NO @MittRomney"		@MittRomney		"194501898999574528"	https://twitter.com/cirstenw/status/194501898999574528
	2012-04-23 19:03	0	0	"ACAs with 1st Time Passes - Hatfield, Hertfordshire, - Calling all ACAs !!!!. We are now looking for an ACA qual... http:// tinyurl.com/6mj27jf"				"194501875872182272"	https://twitter.com/TonySurridge/status/194501875872182272
	2012-04-23 19:03	0	0	"Ya Me demore muchoo aca (: Seguiree"				"194501755139133440"	https://twitter.com/hisabelaflorez/status/194501755139133440
	2012-04-23 19:03	0	0	"@stylesNcomplete Hack his studio computer!!! Lmao!!! It's the same with me and the triple six "shots after shots" aca :/"		@stylesNcomplete		"194501731554566145"	https://twitter.com/thisisdjtical/status/194501731554566145
	2012-04-23 19:03	0	1	"@Far7ana :D RT @CreativityNews1: The Midas Touch at ACA . pic.twitter.com/Ov6UYgt"		@Far7ana @CreativityNews1		"194501721580511235"	https://twitter.com/aalrefa3i/status/194501721580511235
	2012-04-23 19:03	22	6	"Thanks to @BarackObama & #ObamaCare Medicare will save over $200B by 2016 & reduce premiums. http://www. nationaljournal.com/healthcare/med icare-report-medicare-to-save-200-billion-through-2016-20120423#.T5WK10wCvo8.twitter …"		@BarackObama	#ObamaCare #	"194501720464830464"	https://twitter.com/NerdyWonka/status/194501720464830464
	2012-04-23 19:02	1	0	"How much trouble are Dems in? Ron Barber now distancing himself from ObamaCare , Dems' signature policy. Not a good position to be in. #AZ08"			#AZ08	"194501608426586113"	https://twitter.com/Scarpinato/status/194501608426586113
	2012-04-23 19:02	0	0	"HHS moves create "strongest argument yet that Obamacare will expand the deficit" says @jbarro http:// onforb.es/IhTV67 #hcr #ppaca"		@jbarro	#hcr #ppaca	"194501559449686016"	https://twitter.com/JamesRCopland/status/194501559449686016
	2012-04-23 19:01	2	0	"#Missouri House passes law that makes implementing the Affordable Care Act a crime! http:// ow.ly/asBra #ACA , #hcr , #p2"			#Missouri #ACA #hcr #p2	"194501356999028736"	https://twitter.com/hccompact/status/194501356999028736
	2012-04-23 19:01	4	0	"#Obamacare will save Medicare $200 billion by 2016 http://www. dailykos.com/story/2012/04/ 23/1084763/-Obamacare-will-save-Medicare-200-billion-by-nbsp-2016- … That's inconvenient for Republicans... #politics"			#Obamacare #politics	"194501283279941632"	https://twitter.com/martinsdudek/status/194501283279941632
	2012-04-23 19:00	0	0	"What'll happen to organ donor program w/ Obamacare ? Will death panel render obsolete or will organ farming be the answer~like "Coma"? #tcot"			#tcot	"194501039523770368"	https://twitter.com/mawaltersjahns/status/194501039523770368
	2012-04-23 18:59	0	0	"Atlanta: ACA tiny pomeranian female 1 year old - $450 (Fairburn) http:// bit.ly/JvxvUj #eBC #Pets"			#eBC #Pets	"194500887564136448"	https://twitter.com/eBC_Pets/status/194500887564136448
	2012-04-23 18:59	0	0	"Atlanta: ACA tiny pomeranian female 1 year old - $450 (Fairburn) http:// bit.ly/JvxvUj #eBC #Pets"			#eBC #Pets	"194500882648403968"	https://twitter.com/eBC_Pets_S/status/194500882648403968
	2012-04-23 18:59	0	0	"ICYMI: If you think the Lyme Disease cover-up doesn't effect you, then you have not heard of Obamacare . You're... http:// fb.me/1fAqm7j4C"				"194500850733953025"	https://twitter.com/ZillaStevenson/status/194500850733953025
	2012-04-23 18:59	0	0	"@NewsHour @RonCastle should think of his chidhood and what #Obamacare could have done for his family and will do for others less fortunate."		@NewsHour @RonCastle	#Obamacare	"194500764914302976"	https://twitter.com/seacsi/status/194500764914302976
	2012-04-23 18:59	0	0	""Sometimes pushing people around Sometimes pulling out the rug Sometimes pushing all the buttons Sometimes pulling out the plug." Obamacare ?"				"194500759814025216"	https://twitter.com/TheMaverick21/status/194500759814025216
	2012-04-23 18:58	0	0	"#ObamaOnFallon Why hasn't Elena Kagan recused herself from ruling on #Obamacare ?? since she was your Solicitor General !!!"			#ObamaOnFallon #Obamacare	"194500604691877888"	https://twitter.com/CommonCoreKid/status/194500604691877888
	2012-04-23 18:58	0	0	"' Obamacare ' vs. 'Romneycare' - Waynesboro Record Herald http:// bit.ly/JqPhJm"				"194500508122218496"	https://twitter.com/RomneyCare/status/194500508122218496
	2012-04-23 18:58	0	0	"MT @angelfleming : #tcot #teaparty #fyi OBAMA'S #MEDICARE SLUSH FUND MASKS #OBAMACARE BEFORE ELECTION... http:// ow.ly/1j1mL8"		@angelfleming	#tcot #teaparty #fyi #MEDICARE #OBAMACARE	"194500454690996224"	https://twitter.com/SAMMIESMILES8/status/194500454690996224
	2012-04-23 18:57	3	0	"Democrats distancing themselves from ObamaCare & Obama. Return to better bamboozel as usual after re election"				"194500278425370625"	https://twitter.com/greybeard411/status/194500278425370625
	2012-04-23 18:57	0	0	"" @HuffPostGreen : 7 eco-friendly fast food options http:// huff.to/I6K5rO " @rjalcalde . Cuando llegues aca :)"		@HuffPostGreen @rjalcalde		"194500241184145408"	https://twitter.com/NikkiCallaway/status/194500241184145408
	2012-04-23 18:56	0	0	"Catholics Fight Obamacare : http:// youtu.be/JiWPHPQUXiY via @youtube"		@youtube		"194500036791500800"	https://twitter.com/writerofpoetry/status/194500036791500800
	2012-04-23 18:56	0	0	"The Patient Protection and Affordable Care Act (PPACA), informally referred to as Obamacare (via Wikipedia): http:// en.wikipedia.org/wiki/Obamacare"				"194499937160011777"	https://twitter.com/atired77oldman/status/194499937160011777
	2012-04-23 18:56	0	0	"White House Scrambles to Keep Obamacare From Gutting Medicare Before Election http://www. weeklystandard.com/blogs/white-ho use-scrambles-keep-obamacare-gutting-medicare-election_640591.html?nopager=1 …"				"194499912300376064"	https://twitter.com/jack3win/status/194499912300376064
	2012-04-23 18:56	0	0	"This & #ObamaCare being heard!RT“ @turtleclement : US Supreme Court to Tackle Illegal Immigration http://www. voanews.com/english/news/u sa/US-Supreme-Court-to-Tackle-Illegal-Immigration-148542295.html … via @VOA_News ” #winning"		@turtleclement @VOA_News	#ObamaCare #winning	"194499902762528768"	https://twitter.com/AmyTeaSpeaks/status/194499902762528768
	2012-04-23 18:55	0	0	"@PharmFresh hope you had a great time @ACA _Info conference! We're excited about next year's conference with @IACPRx http:// pmquarterly.com/2012/04/21/tha nk-you-aca-acvp/ …"		@PharmFresh @ACA @IACPRx		"194499824324837376"	https://twitter.com/PMQuarterly/status/194499824324837376
	2012-04-23 18:55	0	0	"U.S. watchdog blasts Medicare quality insurance project http:// yhoo.it/I9MYt4 seniors healthcare hcr ACA"				"194499820596105218"	https://twitter.com/winterthur/status/194499820596105218
	2012-04-23 18:54	0	0	"@raleysstores hope you had a great time @ACA _Info conference! We're excited about next year's conference with @IACPRx http:// pmquarterly.com/2012/04/21/tha nk-you-aca-acvp/ …"		@raleysstores @ACA @IACPRx		"194499610616672258"	https://twitter.com/PMQuarterly/status/194499610616672258
	2012-04-23 18:54	0	0	"Trustees: Medicare Will Go Broke in 2016, If You Exclude Obamacare 's Double ... - Forbes http:// bit.ly/JvvbfS"				"194499582816829440"	https://twitter.com/ElmerAvallone/status/194499582816829440
	2012-04-23 18:54	0	0	"@Go_SocialGO - Trustees: Medicare Will Go Broke in 2016, If You Exclude Obamacare 's Double ...: Human Services S... http:// tinyurl.com/87e2uo5"		@Go_SocialGO		"194499524541157376"	https://twitter.com/Go_SocialGo/status/194499524541157376
	2012-04-23 18:54	0	0	"RT @CSteven : @KLSouth On Sunday I spoke the TRUTH about #Obamacare at @RepJoeWalsh 's town hall http:// youtu.be/C_--FWJuNeA"		@CSteven @KLSouth @RepJoeWalsh	#Obamacare	"194499515250774017"	https://twitter.com/KLSouth/status/194499515250774017
	2012-04-23 18:53	0	0	"VIDEO: Fighting Obamacare http://www. tfpstudentaction.org/what-we-do/str eet-campaigns/video-fighting-obamacare.html … via @http://twitter.com/tfpsa"		@http		"194499172869734401"	https://twitter.com/writerofpoetry/status/194499172869734401
	2012-04-23 18:53	1	0	"#ACA Seeks Streamlined #EAS Waiver For Very Small Systems That Lack Physical Access To Broadband At The Headend http:// bit.ly/JqN7JM"			#ACA #EAS	"194499145980059648"	https://twitter.com/MATTatACA/status/194499145980059648
	2012-04-23 18:52	0	0	"@pharmalab @hope you had a great time @ACA _Info conference! We're excited about next year's conference with @IACPRx http:// pmquarterly.com/2012/04/21/tha nk-you-aca-acvp/ …"		@pharmalab @hope @ACA @IACPRx		"194498994867666944"	https://twitter.com/PMQuarterly/status/194498994867666944
	2012-04-23 18:51	0	0	""Taxpayers should never be forced to fund abortions, as they are in ObamaCare ." Steve Welch is an idiot."				"194498871584501760"	https://twitter.com/lisamkellogg/status/194498871584501760
	2012-04-23 18:51	1	0	"Medicare Trustees: ObamaCare to Gut $150 Billion Through 2016 http:// bit.ly/ItYD2V"				"194498831839268864"	https://twitter.com/JewishPolitical/status/194498831839268864
	2012-04-23 18:51	0	0	"What we're supposed to be learning in class: WWI. What we're actually learning: Obamacare and the NFL draft #seriouslyguys ?"			#seriouslyguys	"194498822368542720"	https://twitter.com/FreelanceBatman/status/194498822368542720
	2012-04-23 18:51	0	0	"ACA Seeks Streamlined EAS Waiver For Very Small Systems That Lack Physical Access To Broadband At The Headend http:// bit.ly/JqN7JM"				"194498756404711424"	https://twitter.com/TedatACA/status/194498756404711424
	2012-04-23 18:50	0	0	"Obamacare will save Medicare $200 billion by 2016 http://www. dailykos.com/story/2012/04/ 23/1084763/-Obamacare-will-save-Medicare-200-billion-by-nbsp-2016- …"				"194498594861101056"	https://twitter.com/heyimchandler/status/194498594861101056
	2012-04-23 18:50	0	0	"@tmims50 Obamacare Slush Fund! http:// news.yahoo.com/obamas-8-3-slu sh-fund-save-election-obamacare-160800635.html …"		@tmims50		"194498519955025921"	https://twitter.com/cmpimental/status/194498519955025921
	2012-04-23 18:50	0	0	"@Obama lied - #ReligiousFreedom died. http:// ow.ly/arHhH #Obamacare #ObamasLawyer #tcot"		@Obama	#ReligiousFreedom #Obamacare #ObamasLawyer #tcot	"194498462455316480"	https://twitter.com/ObamasLawyer/status/194498462455316480
	2012-04-23 18:49	0	0	"Trustees: Medicare Will Go Broke in 2016, If You Exclude Obamacare 's Double-Counting: The Trustees of the Medica... http:// onforb.es/JvqGC5"				"194498258205294592"	https://twitter.com/Real_Staffing/status/194498258205294592
	2012-04-23 18:49	0	0	"Trustees: Medicare Will Go Broke in 2016, If You Exclude Obamacare 's Double-Counting: The Trustees of the Medica... http:// onforb.es/Jvss6c"				"194498257257377796"	https://twitter.com/MEDCareerAgents/status/194498257257377796
	2012-04-23 18:49	3	0	"#tcot #teaparty #fyi OBAMA'S MEDICARE SLUSH FUND MASKS OBAMACARE BEFORE ELECTION... http:// ow.ly/1j1mL8"			#tcot #teaparty #fyi	"194498193671720960"	https://twitter.com/angelfleming/status/194498193671720960
	2012-04-23 18:49	0	0	"Trustees: Medicare Will Go Broke in 2016, If You Exclude Obamacare 's Double-Counting http:// dlvr.it/1TBPwH #business"			#business	"194498156594081792"	https://twitter.com/SmallBizCounsel/status/194498156594081792
	2012-04-23 18:48	0	0	"Moral Hazard, Health Care Coverage and the Individual Mandate: Whether the Affordable Care Act ( ACA ), now before... http:// bit.ly/ItXqZx"				"194498107927568384"	https://twitter.com/TMV/status/194498107927568384
	2012-04-23 18:48	0	0	"Music News Singer Jennifer Hudson testifies at trial of murder of her family: CHICAGO (Reuters) - Grammy and Aca ... http:// yhoo.it/JqN0Op"				"194497965803585536"	https://twitter.com/sororitylifes/status/194497965803585536
	2012-04-23 18:48	0	0	"@LamarPlazaDrug hope you had a great time @ACA _Info conference! We're excited about next year's conference with @IACPRx http:// pmquarterly.com/2012/04/21/tha nk-you-aca-acvp/ …"		@LamarPlazaDrug @ACA @IACPRx		"194497959675699201"	https://twitter.com/PMQuarterly/status/194497959675699201
	2012-04-23 18:48	0	0	"Obamacare Diverts Funds to Secure Election | JD Journal http:// bitly.com/I4mDdd"				"194497955829518336"	https://twitter.com/HomelessPatriot/status/194497955829518336
	2012-04-23 18:48	0	1	"Obamacare Diverts Funds to Secure Election | JD Journal http:// bitly.com/I4mDdd"				"194497955720470528"	https://twitter.com/ChiNewsBench/status/194497955720470528
	2012-04-23 18:48	0	0	"@EmilyMiller alrady cut 500 billion for Obamacare ."		@EmilyMiller		"194497930797916161"	https://twitter.com/DWalkRed14/status/194497930797916161
	2012-04-23 18:48	0	0	"Great speakers event that will share both the pros and cons of the ObamaCare debate - check out the link for details http:// ow.ly/asOm0"				"194497921440428033"	https://twitter.com/RAWMediaTweets/status/194497921440428033
	2012-04-23 18:48	0	0	"Trustees: Medicare Will Go Broke in 2016, If You Exclude Obamacare 's Double-Counting: [at For... http:// brk.bz/Ilwo8m #UNitedHealth #BRK"			#UNitedHealth #BRK	"194497888104099841"	https://twitter.com/UnitedHealthBRK/status/194497888104099841
	2012-04-23 18:47	1	0	"Obama will stop at nothing to get reelected including using $8bil to delay the pain of Obamacare on seniors until 2013. http://www. nypost.com/p/news/opinion /opedcolumnists/an_billion_trick_ImTBFfz7MeuZLJY7JzXEIJ …"				"194497827014057984"	https://twitter.com/5ini5ter/status/194497827014057984
	2012-04-23 18:47	2	0	"What is it with this Admin: HHS Sec. claims Medicare trustee report says Obamacare is saving Medicare. The truth is far from it. #tcot"			#tcot	"194497808731078657"	https://twitter.com/Ron_Christie/status/194497808731078657
	2012-04-23 18:47	0	0	"@exposeliberals @LegInsurrection Lugar is desperate to repeal Obamacare , that's for sure."		@exposeliberals @LegInsurrection		"194497786501283840"	https://twitter.com/BombsAndDollars/status/194497786501283840
	2012-04-23 18:47	0	0	"@BorowitzReport So what was it I had before there was ObamaCare ? I thought it was something called healthcare. Hmmm."		@BorowitzReport		"194497656280719360"	https://twitter.com/JoeBlack057/status/194497656280719360
	2012-04-23 18:47	0	0	"@redwillroll @elyse4design @CSPANJNKY @cspanwj He set the course when he chose to RAM Obamacare and lost any chance of consensus. He pays"		@redwillroll @elyse4design @CSPANJNKY @cspanwj		"194497643420987393"	https://twitter.com/Cigarvolante/status/194497643420987393
	2012-04-23 18:46	0	0	"Obamacare is a war on jobs and families http://www. washingtonpost.com/blogs/right-tu rn/post/obamacares-anti-market-anti-employer-anti-family-impact/2012/04/16/gIQA5eZXLT_blog.html … TruthTeam2012 #AttackWatch Romney repeal"			#AttackWatch	"194497578023403520"	https://twitter.com/truthteamwatch/status/194497578023403520
	2012-04-23 18:46	0	0	"@MittRmoney knows #obamacare is a better solution than the current system. No political points for Mitt."		@MittRmoney	#obamacare	"194497568980475904"	https://twitter.com/firefilmz/status/194497568980475904
	2012-04-23 18:46	0	0	"Trustees: Medicare Will Go Broke in 2016, If You Exclude Obamacare 's Double-Counting: The Trustee... http:// brk.bz/IaWDv2 #Business #BRK"			#Business #BRK	"194497436260106240"	https://twitter.com/BusinessNewsBRK/status/194497436260106240
	2012-04-23 18:46	0	0	"Trustees: Medicare Will Go Broke in 2016, If You Exclude Obamacare 's Double-Counting: The Trustees of the Medica... http:// onforb.es/JvqGC5"				"194497427712118784"	https://twitter.com/forzamonza/status/194497427712118784
